,where,Date,Sample Name,Nucleic Acid(ng/uL),A260/A280,A260/A230,A260,A280,Nucleic Acid Factor,Baseline Correction (nm),Baseline Absorbance,code,length,seq,monoisotopic_mass,e260_mM^-1cm^-1,corrected_molar_concentration_pmol/mkl,corrected_weght_concentration,corrected_Nucleic_Acid_Factor,pM/mkl,score,mkl,quantile,pmol,"final conc, pmol/mkl",target_well
56,I4,6/23/2023 8:47:22 AM,Sample 63,1165.79,1.68,1.53,35.33,20.98,33.0,340,0.28,TDT+SUMO_F0-0,#= 25,CTG CCC ATG GTA TAT CTC CTT CTT A,7533.88,224.3,157.5,1186.58,33.59,154.73965606035668,True,5.0,7,787.5,1.94,1
57,J4,6/23/2023 8:48:05 AM,Sample 64,1889.81,1.98,1.31,57.27,28.97,33.0,340,-0.86,TDT+SUMO_F0-1,#= 53,TAA GAA GGA GAT ATA CCA TGG GCA GCA GCC ATC ATC ATC ATC ATC ACG GCA GC,16312.52,528.0,108.46,1769.26,30.89,115.85027941728194,True,7.0,2,759.2199999999999,1.87,1
58,K4,6/23/2023 8:48:46 AM,Sample 65,1984.0,1.8,1.54,60.12,33.42,33.0,340,-0.31,TDT+SUMO_F0-2,#= 59,GAG TCC GAC ATG CTA GCG CTG CCA CGT GGC ACC AGG CCG CTG CCG TGA TGA TGA TGA TG,18229.65,553.9,108.54,1978.67,32.91,108.83368578113128,True,7.0,2,759.7800000000001,1.88,1
59,L4,6/23/2023 8:49:21 AM,Sample 66,1917.97,2.04,1.3,58.12,28.56,33.0,340,0.24,TDT+SUMO_F0-3,#= 44,GCG CTA GCA TGT CGG ACT CAG AAG TCA ATC AAG AAG CTA AGC CA,13567.76,438.9,132.42,1796.67,30.91,141.36231772967682,True,6.0,5,794.52,1.96,1
60,M4,6/23/2023 8:49:50 AM,Sample 67,2188.92,1.64,1.67,66.33,40.48,33.0,340,-0.03,TDT+SUMO_F0-4,#= 56,TGA GTC TCA GGC TTG ACT TCT GGC TTG ACC TCT GGC TTA GCT TCT TGA TTG ACT TC,17150.96,497.4,133.36,2287.17,34.48,127.62667512489098,True,6.0,5,800.1600000000001,1.98,1
61,N4,6/23/2023 8:50:20 AM,Sample 68,2103.64,1.9,1.37,63.75,33.47,33.0,340,0.23,TDT+SUMO_F0-5,#= 59,CAG AAG TCA AGC CTG AGA CTC ACA TCA ACT TAA AGG TGT CCG ATG GAT CTT CAG AGA TC,18171.7,582.6,109.42,1988.31,31.19,115.76462301270656,True,7.0,2,765.94,1.89,1
62,O4,6/23/2023 8:50:55 AM,Sample 69,2032.72,1.95,1.44,61.6,31.64,33.0,340,0.11,TDT+SUMO_F0-6,#= 54,TTA AAG GAG TGG TCT TCT TGA TCT TGA AGA AGA TCT CTG AAG ATC CAT CGG ACA,16698.75,534.2,115.31,1925.51,31.26,121.72887192155102,True,7.0,3,807.1700000000001,1.99,1
63,P4,6/23/2023 8:51:23 AM,Sample 70,1195.17,1.89,1.45,36.22,19.19,33.0,340,0.26,TDT+SUMO_F0-7,#= 47,CAA GAT CAA GAA GAC CAC TCC TTT AAG AAG GCT GAT GGA AGC GTT CG,14529.38,469.0,77.22,1121.98,30.98,82.25884380475974,True,9.0,1,694.98,1.72,1
64,A5,6/23/2023 8:52:58 AM,Sample 71,2100.45,1.63,1.44,63.65,39.01,33.0,340,-0.5,TDT+SUMO_F0-8,#= 47,GAG TCC ATT TCC TTA CCC TGT CTT TTA GCG AAC GCT TCC ATC AGC CT,14242.14,420.1,151.51,2157.85,33.9,147.48134760646926,True,5.0,7,757.55,1.87,1
65,B5,6/23/2023 8:53:31 AM,Sample 72,2299.43,2.05,1.47,69.68,34.01,33.0,340,0.14,TDT+SUMO_F0-9,#= 56,AGA CAG GGT AAG GAA ATG GAC TCC TTA AGA TTC TTG TAC GAC GGT ATT AGA ATT CA,17374.2,570.9,122.05,2120.57,30.43,132.3473886567439,True,6.0,4,732.3,1.81,1
66,C5,6/23/2023 8:54:06 AM,Sample 73,2129.96,1.94,1.4,64.54,33.3,33.0,340,0.01,TDT+SUMO_F0-10,#= 55,GTC CAA ATC TTC AGG GGT CTG ATC AGC TTG AAT TCT AAT ACC GTC GTA CAA GAA T,16907.89,535.9,120.44,2036.39,31.55,125.97432323016059,True,6.0,4,722.64,1.78,1
67,D5,6/23/2023 8:54:29 AM,Sample 74,2026.3,2.06,1.39,61.4,29.74,33.0,340,0.34,TDT+SUMO_F0-11,#= 55,TCA GAC CCC TGA AGA TTT GGA CAT GGA GGA TAA CGA TAT CAT TGA GGC TCA CAG A,17015.96,552.3,111.18,1891.78,30.81,119.08232036276532,True,7.0,3,778.26,1.92,1
68,E5,6/23/2023 8:55:38 AM,Sample 75,1139.58,1.76,1.49,34.53,19.68,33.0,340,0.22,TDT+SUMO_F0-12,#= 46,CTC GGG CTA CCA CCA ATC TGT TCT CTG TGA GCC TCA ATG ATA TCG T,14027.01,422.2,81.79,1147.31,33.22,81.24183272129983,True,9.0,1,736.11,1.82,1
69,F5,6/23/2023 8:56:13 AM,Sample 76,1436.71,1.83,1.4,43.54,23.81,33.0,340,0.1,TDT+SUMO_F0-13,#= 41,CAG ATT GGT GGT AGC CCG AGC CCG GTT CCA GGC TCT CAA AA,12611.1,389.0,111.92,1411.44,32.42,113.92424134294392,True,7.0,3,783.44,1.93,1
70,G5,6/23/2023 8:56:47 AM,Sample 77,2338.05,1.8,1.58,70.85,39.3,33.0,340,0.37,TDT+SUMO_F0-14,#= 57,GTA CTG TGA AAT TTT CTT AAC CGC CGG TGC TGG AAC GTT TTG AGA GCC TGG AAC CGG,17630.3,540.3,131.13,2311.88,32.63,132.6154404632933,True,6.0,5,786.78,1.94,1
71,H5,6/23/2023 8:57:25 AM,Sample 78,275.88,1.99,1.32,8.36,4.2,33.0,340,0.0,TDT+SUMO_F0-15,#= 50,GGC GGT TAA GAA AAT TTC ACA GTA CGC ATG CCA GCG TCG CAC AAC CCT TA,15347.88,484.6,17.25,264.77,31.67,17.975120993909258,False,45.0,,776.25,1.92,1
72,I5,6/23/2023 8:57:51 AM,Sample 79,2014.28,1.88,1.79,61.04,32.54,33.0,340,0.17,TDT+SUMO_F0-16,#= 43,CGG TGA ACA GTT GGT TAT AGT TGT TAA GGG TTG TGC GAC GCT G,13415.61,418.5,145.85,1956.69,32.06,150.1444958522199,True,5.0,7,729.25,1.8,1
73,J5,6/23/2023 9:00:02 AM,Sample 81,2048.76,1.86,1.33,62.08,33.46,33.0,340,-0.3,TDT+SUMO_F0-17,#= 60,ACA ACT ATA ACC AAC TGT TCA CCG ATG CCC TCG ACA TCC TGG CGG AAA ACG ACG AGT TGC,18366.81,574.3,108.1,1985.52,31.98,111.54686088656659,True,7.0,2,756.6999999999999,1.87,1
74,K5,6/23/2023 9:00:34 AM,Sample 82,1911.42,1.62,1.44,57.92,35.83,33.0,340,0.18,TDT+SUMO_F0-18,#= 43,CCA GAC ACG AGC CTT CAT TCT CGC GCA ACT CGT CGT TTT CCG C,13026.35,381.5,151.83,1977.75,34.15,146.73488736292208,True,5.0,7,759.1500000000001,1.87,1
75,L5,6/23/2023 9:01:13 AM,Sample 83,1903.58,1.65,1.54,57.68,34.88,33.0,340,0.21,TDT+SUMO_F0-19,#= 59,AGA ATG AAG GCT CGT GTC TGG CGT TCA TGC GTG CCT CCT CCG TTC TTA AAT CGC TGC CG,18111.57,537.8,107.26,1942.63,33.68,105.10298113305473,True,7.0,2,750.82,1.85,1
76,M5,6/23/2023 9:01:42 AM,Sample 84,1905.14,1.86,1.42,57.73,31.11,33.0,340,0.27,TDT+SUMO_F0-20,#= 54,TGC CCT CCG TAT CTT TCA TCG AGG TAA TCG GAA ACG GCA GCG ATT TAA GAA CGG,16645.69,521.9,110.62,1841.3,31.89,114.45244985338547,True,7.0,3,774.34,1.91,1
77,N5,6/23/2023 9:02:10 AM,Sample 85,1807.22,2.0,1.48,54.76,27.32,33.0,340,0.23,TDT+SUMO_F0-21,#= 53,CGA TGA AAG ATA CGG AGG GCA TTC CGT GTT TGG GTG ACA AGG TGA AAA GCA TT,16549.65,534.5,102.46,1695.65,30.96,109.19989244485532,True,9.0,1,922.14,2.28,1
78,O5,6/23/2023 9:02:44 AM,Sample 86,2009.62,1.65,1.46,60.9,36.95,33.0,340,-0.1,TDT+SUMO_F0-22,#= 52,GCT TTC ACC GTC CTC GAT GAT ACC TTC GAT AAT GCT TTT CAC CTT GTC ACC C,15742.1,464.0,131.25,2066.08,33.93,127.65895274455123,True,6.0,5,787.5,1.94,1
79,P5,6/23/2023 9:03:08 AM,Sample 87,448.56,1.91,1.46,13.59,7.1,33.0,340,0.5,TDT+SUMO_F0-23,#= 43,TCA TCG AGG ACG GTG AAA GCT CTG AGG CCA AAG CGG TGT TGA A,13381.61,427.0,31.83,425.99,31.34,33.52063017828198,False,24.0,,763.92,1.89,1
80,A6,6/23/2023 9:16:18 AM,Sample 89,2030.02,1.87,1.44,61.52,32.83,33.0,340,-0.04,TDT+SUMO_F0-24,#= 48,ACA GTT TAA ATG ATT TAT AAC GTT CAT CAT TCA ACA CCG CTT TGG CCT,14650.46,458.4,134.2,1966.05,31.96,138.56356728730702,True,6.0,6,805.1999999999999,1.99,1
81,B6,6/23/2023 9:16:54 AM,Sample 90,2252.36,1.94,1.59,68.25,35.25,33.0,340,-0.07,TDT+SUMO_F0-25,#= 58,TGA TGA ACG TTA TAA ATC ATT TAA ACT GTT TAC ATC GGT GTT CGG TGT GGG CCT GAA A,17955.55,569.9,119.76,2150.41,31.51,125.44088039631201,True,6.0,4,718.5600000000001,1.77,1
82,C6,6/23/2023 9:17:22 AM,Sample 91,1820.35,1.82,1.34,55.16,30.37,33.0,340,0.43,TDT+SUMO_F0-26,#= 56,GGG TAC GGA AAC CCA TAC GGA ACC ATT TCT CCG CGG TTT TCA GGC CCA CAC CGA AC,17139.0,528.0,104.47,1790.57,32.46,106.21098080401424,True,7.0,2,731.29,1.81,1
83,D6,6/23/2023 9:17:54 AM,Sample 92,2129.11,1.84,1.36,64.52,35.04,33.0,340,-0.68,TDT+SUMO_F0-27,#= 46,CCG TAT GGG TTT CCG TAC CCT GAG TAA GAT CCA AAG CGA CAA GTC C,14119.08,443.9,145.34,2052.12,31.81,150.79665247310732,True,5.0,7,726.7,1.79,1
84,E6,6/23/2023 9:18:21 AM,Sample 93,1821.63,1.8,1.64,55.2,30.74,33.0,340,0.17,TDT+SUMO_F0-28,#= 43,TGC ATC TGG GTA AAG CGG AGG GAC TTG TCG CTT TGG ATC TTA C,13320.55,407.0,135.63,1806.65,32.73,136.7533622860918,True,6.0,6,813.78,2.01,1
85,F6,6/23/2023 9:18:46 AM,Sample 94,1822.7,1.86,1.42,55.23,29.61,33.0,340,0.23,TDT+SUMO_F0-29,#= 44,CTC CGC TTT ACC CAG ATG CAG AAA GCA GGC TTC CTG TAC TAT GA,13451.66,414.4,133.28,1792.89,32.46,135.50000520381872,True,6.0,5,799.6800000000001,1.97,1
86,G6,6/23/2023 9:19:23 AM,Sample 95,1961.24,1.84,1.43,59.43,32.26,33.0,340,0.2,TDT+SUMO_F0-30,#= 47,CGG TTA ACG CAC GAG ACC AGG TCC TCA TAG TAC AGG AAG CCT GCT TT,14448.29,450.9,131.81,1904.36,32.04,135.74201514504483,True,6.0,5,790.86,1.95,1
87,H6,6/23/2023 9:20:03 AM,Sample 96,1735.72,1.81,1.51,52.6,29.04,33.0,340,0.16,TDT+SUMO_F0-31,#= 40,TGG TCT CGT GCG TTA ACC GTC CGG AAG CAG AGG CAG TCA G,12377.94,384.4,136.83,1693.69,32.2,140.22688751116905,True,6.0,6,820.98,2.03,1
88,I6,6/23/2023 9:20:36 AM,Sample 97,1620.25,1.71,1.43,49.1,28.68,33.0,340,0.19,TDT+SUMO_F0-32,#= 53,CAG AAA TGT AAC CAC GGC TTC TTT GAC CAG CAT ACT GAC TGC CTC TGC TTC CG,16163.38,486.1,101.0,1632.56,33.25,100.24202858560524,True,9.0,1,909.0,2.24,1
89,J6,6/23/2023 9:21:10 AM,Sample 98,2422.97,1.7,1.53,73.42,43.09,33.0,340,0.32,TDT+SUMO_F0-33,#= 60,AAG AAG CCG TGG TTA CAT TTC TGC CAG ACG CCC TCG TTA CCA TGA CCG GTG GCT TTC GTC,18393.77,554.7,132.37,2434.7,33.16,131.72775347305094,True,6.0,5,794.22,1.96,1
90,K6,6/23/2023 9:21:38 AM,Sample 99,2052.17,1.88,1.33,62.19,33.1,33.0,340,-0.11,TDT+SUMO_F0-34,#= 58,TGA TCA GGA AAT CAA CGT CAT GAC CGG TCA TCT TGC CAC GAC GAA AGC CAC CGG TCA T,17804.45,560.6,110.93,1975.04,31.76,115.26163402969482,True,7.0,3,776.51,1.92,1
91,L6,6/23/2023 9:22:02 AM,Sample 100,1837.01,1.98,1.36,55.67,28.13,33.0,340,0.43,TDT+SUMO_F0-35,#= 54,GTC ATG ACG TTG ATT TCC TGA TCA CAA GTC CAG AAG CGA CCG AAG ATG AAG AGC,16687.75,537.0,103.66,1729.9,31.08,110.08134709592366,True,7.0,2,725.62,1.79,1
92,M6,6/23/2023 9:22:33 AM,Sample 101,2011.27,1.62,1.57,60.95,37.66,33.0,340,-0.51,TDT+SUMO_F0-36,#= 54,TTC CAG AAG TCG GTC ACT TTG TGC AAC AGC TGC TGC TCT TCA TCT TCG GTC GCT,16496.55,483.2,126.13,2080.78,34.14,121.92064401344524,True,6.0,4,756.78,1.87,1
93,N6,6/23/2023 9:22:58 AM,Sample 102,1940.27,1.87,1.45,58.8,31.44,33.0,340,-0.71,TDT+SUMO_F0-37,#= 52,ACA AAG TGA CCG ACT TCT GGA AAC AGC AGG GTC TCC TGC TGT ACT GCG ATA T,16012.29,500.2,117.54,1882.16,32.01,121.17379837612233,True,6.0,4,705.24,1.74,1
94,O6,6/23/2023 9:23:20 AM,Sample 103,1643.1,1.93,1.33,49.79,25.83,33.0,340,0.32,TDT+SUMO_F0-38,#= 44,CTT CTC AAA GGT GCT CTC CAG AAT ATC GCA GTA CAG CAG GAG AC,13509.71,427.3,116.52,1574.21,31.62,121.62363218751551,True,7.0,3,815.64,2.01,1
95,P6,6/23/2023 9:23:52 AM,Sample 104,1192.6,2.04,1.31,36.14,17.72,33.0,340,0.32,TDT+SUMO_F0-39,#= 48,TCT GGA GAG CAC CTT TGA GAA GTT CAA ACA ACC AAG CCG CAA AGT GGA,14827.57,478.7,75.49,1119.39,30.97,80.43125070392519,True,9.0,1,679.41,1.68,1
96,A7,6/23/2023 9:25:36 AM,Sample 105,1896.09,1.8,1.51,57.46,31.94,33.0,340,0.25,TDT+SUMO_F0-40,#= 47,AAA GCA TTT CTG GAA ATG ATC AAG CGC ATC CAC TTT GCG GCT TGG TT,14468.31,446.0,128.83,1863.91,32.44,131.05124233583604,True,6.0,5,772.98,1.91,1
97,B7,6/23/2023 9:26:00 AM,Sample 106,2202.95,1.75,1.59,66.76,38.17,33.0,340,-0.17,TDT+SUMO_F0-41,#= 62,GCT TGA TCA TTT CCA GAA ATG CTT TCT CAT TCT TAA ACT GGA TCA CGG TCG TGT TCA TTC TG,18980.18,574.9,116.12,2203.93,33.01,116.06581181000391,True,7.0,3,812.84,2.01,1
98,C7,6/23/2023 9:26:34 AM,Sample 107,2394.16,1.74,1.39,72.55,41.81,33.0,340,-0.37,TDT+SUMO_F0-42,#= 60,CGC TTT CCA ACC TTT ACC TTC CTG CTG ACC CGA TTT CTC AGA ATG AAC ACG ACC GTG ATC,18216.69,544.0,133.36,2429.45,33.49,131.42673010299896,True,6.0,5,800.1600000000001,1.98,1
99,D7,6/23/2023 9:27:17 AM,Sample 108,2335.84,1.85,1.66,70.78,38.18,33.0,340,-0.47,TDT+SUMO_F0-43,#= 52,GGA AGG TAA AGG TTG GAA AGC GAT TCG TGT GGA TCT GGT GAT GTG CCC GTA T,16274.44,517.4,136.81,2226.43,31.45,143.52813368693484,True,6.0,6,820.86,2.03,1
100,E7,6/23/2023 9:27:47 AM,Sample 109,2318.24,1.89,1.28,70.25,37.16,33.0,340,-0.44,TDT+SUMO_F0-44,#= 58,TAC CCG TCC AAC CCA GCA GCG CAA ACG CAC GGC GAT CAT ACG GGC ACA TCA CCA GAT C,17689.37,550.7,127.56,2256.54,32.12,131.0527169707005,True,6.0,4,765.36,1.89,1
101,F7,6/23/2023 9:28:12 AM,Sample 110,1944.44,1.74,1.7,58.92,33.76,33.0,340,0.3,TDT+SUMO_F0-45,#= 42,CTG CTG GGT TGG ACG GGT AGC CGC CAG TTT GAA CGT GAT CTG,13033.34,393.2,149.86,1953.11,33.15,149.18969350910817,True,5.0,7,749.3000000000001,1.85,1
102,G7,6/23/2023 9:28:41 AM,Sample 111,2407.76,1.84,1.56,72.96,39.56,33.0,340,-1.29,TDT+SUMO_F0-46,#= 54,CAT CAT CTT ACG TTC ATG GGT GGC ATA GCG GCG CAG ATC ACG TTC AAA CTG GCG,16637.67,512.5,142.36,2368.62,32.46,144.71737929650007,True,5.0,7,711.8000000000001,1.76,1
103,H7,6/23/2023 9:29:06 AM,Sample 112,742.86,1.95,1.4,22.51,11.54,33.0,340,0.37,TDT+SUMO_F0-47,#= 46,CCA CCC ATG AAC GTA AGA TGA TGC TGG ATA ACC ATG CGC TCT ACG A,14112.1,447.1,50.35,710.53,31.56,52.63993310704998,False,15.0,,755.25,1.86,1
104,I7,6/23/2023 9:30:39 AM,Sample 114,1893.29,1.88,1.52,57.37,30.57,33.0,340,-0.44,TDT+SUMO_F0-48,#= 42,AGG AAC ACA CGT TTG GTA CGA TCG TAG AGC GCA TGG TTA TCC,12978.36,414.2,138.51,1797.67,31.33,145.88052727771458,True,6.0,6,831.06,2.05,1
105,J7,6/23/2023 9:31:11 AM,Sample 115,1846.2,1.87,1.43,55.95,29.92,33.0,340,0.6,TDT+SUMO_F0-49,#= 49,TCG TAC CAA ACG TGT GTT CCT CGA AGC GGA GAG CGA AGA GGA GAT CTT C,15170.75,481.4,116.22,1763.07,31.51,121.6947085674736,True,7.0,3,813.54,2.01,1
106,K7,6/23/2023 9:31:45 AM,Sample 116,2368.4,1.71,1.38,71.77,41.98,33.0,340,-0.54,TDT+SUMO_F0-50,#= 61,ACG TTC CCA CGG TTC AAT GTA ATC AAG GCC CAA ATG TGC GAA GAT CTC CTC TTC GCT CTC C,18594.93,564.9,127.05,2362.47,32.92,127.3680513989566,True,6.0,4,762.3,1.88,1
107,L7,6/23/2023 9:32:16 AM,Sample 117,2023.3,1.97,1.41,61.31,31.08,33.0,340,0.55,TDT+SUMO_F0-51,#= 46,ACA TTG AAC CGT GGG AAC GTA ATG CGT GAT CCG GCT GCT AAC AAA G,14232.17,454.1,135.02,1921.61,31.34,142.16384430483896,True,6.0,6,810.1200000000001,2.0,1
108,M7,6/23/2023 9:32:44 AM,Sample 118,1194.21,1.75,1.52,36.19,20.68,33.0,340,0.37,TDT+SUMO_F0-52,#= 22,CTT TGT TAG CAG CCG GAT CAC G,6726.36,204.9,176.61,1187.96,32.83,177.54179080513086,False,4.0,,706.44,1.74,1
