where	code	length	seq	monoisotopic_mass
A1 	TDT+SUMO_F0-0 	#= 25	CTG CCC ATG GTA TAT CTC CTT CTT A 	7533.88
B1 	TDT+SUMO_F0-1 	#= 53	TAA GAA GGA GAT ATA CCA TGG GCA GCA GCC ATC ATC ATC ATC ATC ACG GCA GC 	16312.52
C1 	TDT+SUMO_F0-2 	#= 59	GAG TCC GAC ATG CTA GCG CTG CCA CGT GGC ACC AGG CCG CTG CCG TGA TGA TGA TGA TG 	18229.65
D1 	TDT+SUMO_F0-3 	#= 44	GCG CTA GCA TGT CGG ACT CAG AAG TCA ATC AAG AAG CTA AGC CA 	13567.76
E1 	TDT+SUMO_F0-4 	#= 56	TGA GTC TCA GGC TTG ACT TCT GGC TTG ACC TCT GGC TTA GCT TCT TGA TTG ACT TC 	17150.96
F1 	TDT+SUMO_F0-5 	#= 59	CAG AAG TCA AGC CTG AGA CTC ACA TCA ACT TAA AGG TGT CCG ATG GAT CTT CAG AGA TC 	18171.70
G1 	TDT+SUMO_F0-6 	#= 54	TTA AAG GAG TGG TCT TCT TGA TCT TGA AGA AGA TCT CTG AAG ATC CAT CGG ACA 	16698.75
H1 	TDT+SUMO_F0-7 	#= 47	CAA GAT CAA GAA GAC CAC TCC TTT AAG AAG GCT GAT GGA AGC GTT CG 	14529.38
I1 	TDT+SUMO_F0-8 	#= 47	GAG TCC ATT TCC TTA CCC TGT CTT TTA GCG AAC GCT TCC ATC AGC CT 	14242.14
J1 	TDT+SUMO_F0-9 	#= 56	AGA CAG GGT AAG GAA ATG GAC TCC TTA AGA TTC TTG TAC GAC GGT ATT AGA ATT CA 	17374.20
K1 	TDT+SUMO_F0-10 	#= 55	GTC CAA ATC TTC AGG GGT CTG ATC AGC TTG AAT TCT AAT ACC GTC GTA CAA GAA T 	16907.89
L1 	TDT+SUMO_F0-11 	#= 55	TCA GAC CCC TGA AGA TTT GGA CAT GGA GGA TAA CGA TAT CAT TGA GGC TCA CAG A 	17015.96
M1 	TDT+SUMO_F0-12 	#= 46	CTC GGG CTA CCA CCA ATC TGT TCT CTG TGA GCC TCA ATG ATA TCG T 	14027.01
N1 	TDT+SUMO_F0-13 	#= 41	CAG ATT GGT GGT AGC CCG AGC CCG GTT CCA GGC TCT CAA AA 	12611.10
O1 	TDT+SUMO_F0-14 	#= 57	GTA CTG TGA AAT TTT CTT AAC CGC CGG TGC TGG AAC GTT TTG AGA GCC TGG AAC CGG 	17630.30
P1 	TDT+SUMO_F0-15 	#= 50	GGC GGT TAA GAA AAT TTC ACA GTA CGC ATG CCA GCG TCG CAC AAC CCT TA 	15347.88
A2 	TDT+SUMO_F0-16 	#= 43	CGG TGA ACA GTT GGT TAT AGT TGT TAA GGG TTG TGC GAC GCT G 	13415.61
B2 	TDT+SUMO_F0-17 	#= 60	ACA ACT ATA ACC AAC TGT TCA CCG ATG CCC TCG ACA TCC TGG CGG AAA ACG ACG AGT TGC 	18366.81
C2 	TDT+SUMO_F0-18 	#= 43	CCA GAC ACG AGC CTT CAT TCT CGC GCA ACT CGT CGT TTT CCG C 	13026.35
D2 	TDT+SUMO_F0-19 	#= 59	AGA ATG AAG GCT CGT GTC TGG CGT TCA TGC GTG CCT CCT CCG TTC TTA AAT CGC TGC CG 	18111.57
E2 	TDT+SUMO_F0-20 	#= 54	TGC CCT CCG TAT CTT TCA TCG AGG TAA TCG GAA ACG GCA GCG ATT TAA GAA CGG 	16645.69
F2 	TDT+SUMO_F0-21 	#= 53	CGA TGA AAG ATA CGG AGG GCA TTC CGT GTT TGG GTG ACA AGG TGA AAA GCA TT 	16549.65
G2 	TDT+SUMO_F0-22 	#= 52	GCT TTC ACC GTC CTC GAT GAT ACC TTC GAT AAT GCT TTT CAC CTT GTC ACC C 	15742.10
H2 	TDT+SUMO_F0-23 	#= 43	TCA TCG AGG ACG GTG AAA GCT CTG AGG CCA AAG CGG TGT TGA A 	13381.61
I2 	TDT+SUMO_F0-24 	#= 48	ACA GTT TAA ATG ATT TAT AAC GTT CAT CAT TCA ACA CCG CTT TGG CCT 	14650.46
J2 	TDT+SUMO_F0-25 	#= 58	TGA TGA ACG TTA TAA ATC ATT TAA ACT GTT TAC ATC GGT GTT CGG TGT GGG CCT GAA A 	17955.55
K2 	TDT+SUMO_F0-26 	#= 56	GGG TAC GGA AAC CCA TAC GGA ACC ATT TCT CCG CGG TTT TCA GGC CCA CAC CGA AC 	17139.00
L2 	TDT+SUMO_F0-27 	#= 46	CCG TAT GGG TTT CCG TAC CCT GAG TAA GAT CCA AAG CGA CAA GTC C 	14119.08
M2 	TDT+SUMO_F0-28 	#= 43	TGC ATC TGG GTA AAG CGG AGG GAC TTG TCG CTT TGG ATC TTA C 	13320.55
N2 	TDT+SUMO_F0-29 	#= 44	CTC CGC TTT ACC CAG ATG CAG AAA GCA GGC TTC CTG TAC TAT GA 	13451.66
O2 	TDT+SUMO_F0-30 	#= 47	CGG TTA ACG CAC GAG ACC AGG TCC TCA TAG TAC AGG AAG CCT GCT TT 	14448.29
P2 	TDT+SUMO_F0-31 	#= 40	TGG TCT CGT GCG TTA ACC GTC CGG AAG CAG AGG CAG TCA G 	12377.94
A3 	TDT+SUMO_F0-32 	#= 53	CAG AAA TGT AAC CAC GGC TTC TTT GAC CAG CAT ACT GAC TGC CTC TGC TTC CG 	16163.38
B3 	TDT+SUMO_F0-33 	#= 60	AAG AAG CCG TGG TTA CAT TTC TGC CAG ACG CCC TCG TTA CCA TGA CCG GTG GCT TTC GTC 	18393.77
C3 	TDT+SUMO_F0-34 	#= 58	TGA TCA GGA AAT CAA CGT CAT GAC CGG TCA TCT TGC CAC GAC GAA AGC CAC CGG TCA T 	17804.45
D3 	TDT+SUMO_F0-35 	#= 54	GTC ATG ACG TTG ATT TCC TGA TCA CAA GTC CAG AAG CGA CCG AAG ATG AAG AGC 	16687.75
E3 	TDT+SUMO_F0-36 	#= 54	TTC CAG AAG TCG GTC ACT TTG TGC AAC AGC TGC TGC TCT TCA TCT TCG GTC GCT 	16496.55
F3 	TDT+SUMO_F0-37 	#= 52	ACA AAG TGA CCG ACT TCT GGA AAC AGC AGG GTC TCC TGC TGT ACT GCG ATA T 	16012.29
G3 	TDT+SUMO_F0-38 	#= 44	CTT CTC AAA GGT GCT CTC CAG AAT ATC GCA GTA CAG CAG GAG AC 	13509.71
H3 	TDT+SUMO_F0-39 	#= 48	TCT GGA GAG CAC CTT TGA GAA GTT CAA ACA ACC AAG CCG CAA AGT GGA 	14827.57
I3 	TDT+SUMO_F0-40 	#= 47	AAA GCA TTT CTG GAA ATG ATC AAG CGC ATC CAC TTT GCG GCT TGG TT 	14468.31
J3 	TDT+SUMO_F0-41 	#= 62	GCT TGA TCA TTT CCA GAA ATG CTT TCT CAT TCT TAA ACT GGA TCA CGG TCG TGT TCA TTC TG 	18980.18
K3 	TDT+SUMO_F0-42 	#= 60	CGC TTT CCA ACC TTT ACC TTC CTG CTG ACC CGA TTT CTC AGA ATG AAC ACG ACC GTG ATC 	18216.69
L3 	TDT+SUMO_F0-43 	#= 52	GGA AGG TAA AGG TTG GAA AGC GAT TCG TGT GGA TCT GGT GAT GTG CCC GTA T 	16274.44
M3 	TDT+SUMO_F0-44 	#= 58	TAC CCG TCC AAC CCA GCA GCG CAA ACG CAC GGC GAT CAT ACG GGC ACA TCA CCA GAT C 	17689.37
N3 	TDT+SUMO_F0-45 	#= 42	CTG CTG GGT TGG ACG GGT AGC CGC CAG TTT GAA CGT GAT CTG 	13033.34
O3 	TDT+SUMO_F0-46 	#= 54	CAT CAT CTT ACG TTC ATG GGT GGC ATA GCG GCG CAG ATC ACG TTC AAA CTG GCG 	16637.67
P3 	TDT+SUMO_F0-47 	#= 46	CCA CCC ATG AAC GTA AGA TGA TGC TGG ATA ACC ATG CGC TCT ACG A 	14112.10
A4 	TDT+SUMO_F0-48 	#= 42	AGG AAC ACA CGT TTG GTA CGA TCG TAG AGC GCA TGG TTA TCC 	12978.36
B4 	TDT+SUMO_F0-49 	#= 49	TCG TAC CAA ACG TGT GTT CCT CGA AGC GGA GAG CGA AGA GGA GAT CTT C 	15170.75
C4 	TDT+SUMO_F0-50 	#= 61	ACG TTC CCA CGG TTC AAT GTA ATC AAG GCC CAA ATG TGC GAA GAT CTC CTC TTC GCT CTC C 	18594.93
D4 	TDT+SUMO_F0-51 	#= 46	ACA TTG AAC CGT GGG AAC GTA ATG CGT GAT CCG GCT GCT AAC AAA G 	14232.17
E4 	TDT+SUMO_F0-52 	#= 22	CTT TGT TAG CAG CCG GAT CAC G 	6726.36
F4 	TDT+SUMO_SHOT_FORWARD 	#= 20	CAG ATT GGT GGT AGC CCG AG 	6198.02
G4 	TDT+SUMO_REVERSE 	#= 21	CTT TGT TAG CAG CCG GAT CAC 	6397.15
H4 	TDT+SUMO_LONG_FORWARD 	#= 25	TAA GAA GGA GAT ATA CCA TGG GCA G 	7788.08
I4 	TDT+SUMO_F0-0 	#= 25	CTG CCC ATG GTA TAT CTC CTT CTT A 	7533.88
J4 	TDT+SUMO_F0-1 	#= 53	TAA GAA GGA GAT ATA CCA TGG GCA GCA GCC ATC ATC ATC ATC ATC ACG GCA GC 	16312.52
K4 	TDT+SUMO_F0-2 	#= 59	GAG TCC GAC ATG CTA GCG CTG CCA CGT GGC ACC AGG CCG CTG CCG TGA TGA TGA TGA TG 	18229.65
L4 	TDT+SUMO_F0-3 	#= 44	GCG CTA GCA TGT CGG ACT CAG AAG TCA ATC AAG AAG CTA AGC CA 	13567.76
M4 	TDT+SUMO_F0-4 	#= 56	TGA GTC TCA GGC TTG ACT TCT GGC TTG ACC TCT GGC TTA GCT TCT TGA TTG ACT TC 	17150.96
N4 	TDT+SUMO_F0-5 	#= 59	CAG AAG TCA AGC CTG AGA CTC ACA TCA ACT TAA AGG TGT CCG ATG GAT CTT CAG AGA TC 	18171.70
O4 	TDT+SUMO_F0-6 	#= 54	TTA AAG GAG TGG TCT TCT TGA TCT TGA AGA AGA TCT CTG AAG ATC CAT CGG ACA 	16698.75
P4 	TDT+SUMO_F0-7 	#= 47	CAA GAT CAA GAA GAC CAC TCC TTT AAG AAG GCT GAT GGA AGC GTT CG 	14529.38
A5 	TDT+SUMO_F0-8 	#= 47	GAG TCC ATT TCC TTA CCC TGT CTT TTA GCG AAC GCT TCC ATC AGC CT 	14242.14
B5 	TDT+SUMO_F0-9 	#= 56	AGA CAG GGT AAG GAA ATG GAC TCC TTA AGA TTC TTG TAC GAC GGT ATT AGA ATT CA 	17374.20
C5 	TDT+SUMO_F0-10 	#= 55	GTC CAA ATC TTC AGG GGT CTG ATC AGC TTG AAT TCT AAT ACC GTC GTA CAA GAA T 	16907.89
D5 	TDT+SUMO_F0-11 	#= 55	TCA GAC CCC TGA AGA TTT GGA CAT GGA GGA TAA CGA TAT CAT TGA GGC TCA CAG A 	17015.96
E5 	TDT+SUMO_F0-12 	#= 46	CTC GGG CTA CCA CCA ATC TGT TCT CTG TGA GCC TCA ATG ATA TCG T 	14027.01
F5 	TDT+SUMO_F0-13 	#= 41	CAG ATT GGT GGT AGC CCG AGC CCG GTT CCA GGC TCT CAA AA 	12611.10
G5 	TDT+SUMO_F0-14 	#= 57	GTA CTG TGA AAT TTT CTT AAC CGC CGG TGC TGG AAC GTT TTG AGA GCC TGG AAC CGG 	17630.30
H5 	TDT+SUMO_F0-15 	#= 50	GGC GGT TAA GAA AAT TTC ACA GTA CGC ATG CCA GCG TCG CAC AAC CCT TA 	15347.88
I5 	TDT+SUMO_F0-16 	#= 43	CGG TGA ACA GTT GGT TAT AGT TGT TAA GGG TTG TGC GAC GCT G 	13415.61
J5 	TDT+SUMO_F0-17 	#= 60	ACA ACT ATA ACC AAC TGT TCA CCG ATG CCC TCG ACA TCC TGG CGG AAA ACG ACG AGT TGC 	18366.81
K5 	TDT+SUMO_F0-18 	#= 43	CCA GAC ACG AGC CTT CAT TCT CGC GCA ACT CGT CGT TTT CCG C 	13026.35
L5 	TDT+SUMO_F0-19 	#= 59	AGA ATG AAG GCT CGT GTC TGG CGT TCA TGC GTG CCT CCT CCG TTC TTA AAT CGC TGC CG 	18111.57
M5 	TDT+SUMO_F0-20 	#= 54	TGC CCT CCG TAT CTT TCA TCG AGG TAA TCG GAA ACG GCA GCG ATT TAA GAA CGG 	16645.69
N5 	TDT+SUMO_F0-21 	#= 53	CGA TGA AAG ATA CGG AGG GCA TTC CGT GTT TGG GTG ACA AGG TGA AAA GCA TT 	16549.65
O5 	TDT+SUMO_F0-22 	#= 52	GCT TTC ACC GTC CTC GAT GAT ACC TTC GAT AAT GCT TTT CAC CTT GTC ACC C 	15742.10
P5 	TDT+SUMO_F0-23 	#= 43	TCA TCG AGG ACG GTG AAA GCT CTG AGG CCA AAG CGG TGT TGA A 	13381.61
A6 	TDT+SUMO_F0-24 	#= 48	ACA GTT TAA ATG ATT TAT AAC GTT CAT CAT TCA ACA CCG CTT TGG CCT 	14650.46
B6 	TDT+SUMO_F0-25 	#= 58	TGA TGA ACG TTA TAA ATC ATT TAA ACT GTT TAC ATC GGT GTT CGG TGT GGG CCT GAA A 	17955.55
C6 	TDT+SUMO_F0-26 	#= 56	GGG TAC GGA AAC CCA TAC GGA ACC ATT TCT CCG CGG TTT TCA GGC CCA CAC CGA AC 	17139.00
D6 	TDT+SUMO_F0-27 	#= 46	CCG TAT GGG TTT CCG TAC CCT GAG TAA GAT CCA AAG CGA CAA GTC C 	14119.08
E6 	TDT+SUMO_F0-28 	#= 43	TGC ATC TGG GTA AAG CGG AGG GAC TTG TCG CTT TGG ATC TTA C 	13320.55
F6 	TDT+SUMO_F0-29 	#= 44	CTC CGC TTT ACC CAG ATG CAG AAA GCA GGC TTC CTG TAC TAT GA 	13451.66
G6 	TDT+SUMO_F0-30 	#= 47	CGG TTA ACG CAC GAG ACC AGG TCC TCA TAG TAC AGG AAG CCT GCT TT 	14448.29
H6 	TDT+SUMO_F0-31 	#= 40	TGG TCT CGT GCG TTA ACC GTC CGG AAG CAG AGG CAG TCA G 	12377.94
I6 	TDT+SUMO_F0-32 	#= 53	CAG AAA TGT AAC CAC GGC TTC TTT GAC CAG CAT ACT GAC TGC CTC TGC TTC CG 	16163.38
J6 	TDT+SUMO_F0-33 	#= 60	AAG AAG CCG TGG TTA CAT TTC TGC CAG ACG CCC TCG TTA CCA TGA CCG GTG GCT TTC GTC 	18393.77
K6 	TDT+SUMO_F0-34 	#= 58	TGA TCA GGA AAT CAA CGT CAT GAC CGG TCA TCT TGC CAC GAC GAA AGC CAC CGG TCA T 	17804.45
L6 	TDT+SUMO_F0-35 	#= 54	GTC ATG ACG TTG ATT TCC TGA TCA CAA GTC CAG AAG CGA CCG AAG ATG AAG AGC 	16687.75
M6 	TDT+SUMO_F0-36 	#= 54	TTC CAG AAG TCG GTC ACT TTG TGC AAC AGC TGC TGC TCT TCA TCT TCG GTC GCT 	16496.55
N6 	TDT+SUMO_F0-37 	#= 52	ACA AAG TGA CCG ACT TCT GGA AAC AGC AGG GTC TCC TGC TGT ACT GCG ATA T 	16012.29
O6 	TDT+SUMO_F0-38 	#= 44	CTT CTC AAA GGT GCT CTC CAG AAT ATC GCA GTA CAG CAG GAG AC 	13509.71
P6 	TDT+SUMO_F0-39 	#= 48	TCT GGA GAG CAC CTT TGA GAA GTT CAA ACA ACC AAG CCG CAA AGT GGA 	14827.57
A7 	TDT+SUMO_F0-40 	#= 47	AAA GCA TTT CTG GAA ATG ATC AAG CGC ATC CAC TTT GCG GCT TGG TT 	14468.31
B7 	TDT+SUMO_F0-41 	#= 62	GCT TGA TCA TTT CCA GAA ATG CTT TCT CAT TCT TAA ACT GGA TCA CGG TCG TGT TCA TTC TG 	18980.18
C7 	TDT+SUMO_F0-42 	#= 60	CGC TTT CCA ACC TTT ACC TTC CTG CTG ACC CGA TTT CTC AGA ATG AAC ACG ACC GTG ATC 	18216.69
D7 	TDT+SUMO_F0-43 	#= 52	GGA AGG TAA AGG TTG GAA AGC GAT TCG TGT GGA TCT GGT GAT GTG CCC GTA T 	16274.44
E7 	TDT+SUMO_F0-44 	#= 58	TAC CCG TCC AAC CCA GCA GCG CAA ACG CAC GGC GAT CAT ACG GGC ACA TCA CCA GAT C 	17689.37
F7 	TDT+SUMO_F0-45 	#= 42	CTG CTG GGT TGG ACG GGT AGC CGC CAG TTT GAA CGT GAT CTG 	13033.34
G7 	TDT+SUMO_F0-46 	#= 54	CAT CAT CTT ACG TTC ATG GGT GGC ATA GCG GCG CAG ATC ACG TTC AAA CTG GCG 	16637.67
H7 	TDT+SUMO_F0-47 	#= 46	CCA CCC ATG AAC GTA AGA TGA TGC TGG ATA ACC ATG CGC TCT ACG A 	14112.10
I7 	TDT+SUMO_F0-48 	#= 42	AGG AAC ACA CGT TTG GTA CGA TCG TAG AGC GCA TGG TTA TCC 	12978.36
J7 	TDT+SUMO_F0-49 	#= 49	TCG TAC CAA ACG TGT GTT CCT CGA AGC GGA GAG CGA AGA GGA GAT CTT C 	15170.75
K7 	TDT+SUMO_F0-50 	#= 61	ACG TTC CCA CGG TTC AAT GTA ATC AAG GCC CAA ATG TGC GAA GAT CTC CTC TTC GCT CTC C 	18594.93
L7 	TDT+SUMO_F0-51 	#= 46	ACA TTG AAC CGT GGG AAC GTA ATG CGT GAT CCG GCT GCT AAC AAA G 	14232.17
M7 	TDT+SUMO_F0-52 	#= 22	CTT TGT TAG CAG CCG GAT CAC G 	6726.36
N7 	TDT+SUMO_SHOT_FORWARD 	#= 20	CAG ATT GGT GGT AGC CCG AG 	6198.02
O7 	TDT+SUMO_REVERSE 	#= 21	CTT TGT TAG CAG CCG GAT CAC 	6397.15
P7 	TDT+SUMO_LONG_FORWARD 	#= 25	TAA GAA GGA GAT ATA CCA TGG GCA G 	7788.08
A8 	For-AceII-NcoI_pET22b 	#= 35	TAC TCC ATG GGT ATG AAG CAC CTG TGG TTC TTT CT 	10718.90
B8 	Rev-AceII-XhoI_pET22b_32 	#= 29	AAC TCT CGA GTC AGT GAT GGT GGT GGT GG 	9044.82
C8 	For-AceII-NdeI-pET32 	#= 30	GAG ACA TAT GAA GCA CCT GTG GTT CTT TCT 	9211.95
D8 	HEDFOR5 	#= 23	ATA ATG ATG TTC TTA ATG GTA TC 	7067.61
E8 	HEDFOR5 	#= 23	ATA ATG ATG TTC TTA ATG GTA TC 	7067.61
F8 	VIBAGA1 	#= 49	CAA TAC ATA TGG CTA ACT ATA CTG CCA GTA ATG CCA GCC AGT TAA GTG C 	15032.70
G8 	VIBAGA2 	#= 42	TGG CTG CAT CTT GCA AAC GTG CAC TTA ACT GGC TGG CAT TAC 	12880.28
H8 	VIBAGA3 	#= 40	ACG TTT GCA AGA TGC AGC CAA TAA CGG CAC CGG CGT AGA T 	12338.96
I8 	VIBAGA4 	#= 45	ATA TGC TGC CTT GAA TGG TAA TAA CAT CTA CGC CGG TGC CGT TAT 	13825.90
J8 	VIBAGA5 	#= 50	GTT ATT ACC ATT CAA GGC AGC ATA TTT ACC GAC CAG CAA ATT GAT ATT CA 	15310.89
K8 	VIBAGA6 	#= 48	CAC CTT GAA TAG TTA CCG GAG TTT GAA TAT CAA TTT GCT GGT CGG TAA 	14811.54
L8 	VIBAGA7 	#= 43	AAC TCC GGT AAC TAT TCA AGG TGC AGC TGG GTT TCG CGT AAG C 	13258.52
M8 	VIBAGA8 	#= 43	TCG TCA GAA GTA CGA ATG ATA CGG CTT ACG CGA AAC CCA GCT G 	13245.54
N8 	VIBAGA9 	#= 50	CGT ATC ATT CGT ACT TCT GAC GAC GGT TTT CAA CCT TTG TTT AAT ATT CA 	15256.82
O8 	VIBAGA10 	#= 48	CGA ATA GTC ACG TTC GAG CTT TGA ATA TTA AAC AAA GGT TGA AAA CCG 	14831.59
P8 	VIBAGA11 	#= 48	AAG CTC GAA CGT GAC TAT TCG TAA TTT GTT GCT AAT TGA TGA GAA AGG 	14884.60
A9 	VIBAGA12 	#= 51	GCC ACT TGG GTA TTA GTA TTT TGG CCT TTC TCA TCA ATT AGC AAC AAA TTA 	15628.07
B9 	VIBAGA13 	#= 44	CCA AAA TAC TAA TAC CCA AGT GGC CAG TGA AGC AGG GAA CGA CC 	13545.76
C9 	VIBAGA14 	#= 42	TTA ATT AAG CGC GCA TTT GAG TGG TCG TTC CCT GCT TCA CTG 	12877.27
D9 	VIBAGA15 	#= 42	ACT CAA ATG CGC GCT TAA TTA ACA TTC CTT ACG AGG ACG CTT 	12832.28
E9 	VIBAGA16 	#= 42	GTG ATG TTA GCA ATT TGC TGG TAA GCG TCC TCG TAA GGA ATG 	13039.39
F9 	VIBAGA17 	#= 49	ACC AGC AAA TTG CTA ACA TCA CCA TCG AAA ACA ATA CCT TTG AAA ACA C 	14931.70
G9 	VIBAGA18 	#= 48	GAA GAC GCC ACG CCA ACA GCG GTG TTT TCA AAG GTA TTG TTT TCG ATG 	14822.53
H9 	VIBAGA19 	#= 46	CGC TGT TGG CGT GGC GTC TTC TGG TTT AAT TCC ACG TAA TTT GTC G 	14151.05
I9 	VIBAGA20 	#= 52	CAC TTT AAT AAA GTC ATT GTT GGT AAT CGA CAA ATT ACG TGG AAT TAA ACC A 	16016.37
J9 	VIBAGA21 	#= 47	ATT ACC AAC AAT GAC TTT ATT AAA GTG AAT CGC AGT GTC GAA CTG CT 	14444.34
K9 	VIBAGA22 	#= 40	ATA CCC GGC CAA CAT CTC GTA GCA GTT CGA CAC TGC GAT T 	12200.86
L9 	VIBAGA23 	#= 42	ACG AGA TGT TGG CCG GGT ATA CAA CGT GTG GAA TGT AAG TGC 	13098.43
M9 	VIBAGA24 	#= 43	CCG TTA AGC ACT ACG TTG TTG GCA CTT ACA TTC CAC ACG TTG T 	13119.44
N9 	VIBAGA25 	#= 48	CAA CAA CGT AGT GCT TAA CGG CGG AAC ACT AAA CAT TTC AAA TAA CCG 	14730.54
O9 	VIBAGA26 	#= 48	CGC ACT CGA TTA CCA CGA ATA CGG TTA TTT GAA ATG TTT AGT GTT CCG 	14747.49
P9 	VIBAGA27 	#= 44	TAT TCG TGG TAA TCG AGT GCG TTT AGG GAT CTC TGT AGA TGC GG 	13679.77
A10 	VIBAGA28 	#= 43	CAC GTA AAC CCC GTC GTT GCC CGC ATC TAC AGA GAT CCC TAA A 	13061.42
B10 	VIBAGA29 	#= 40	GCA ACG ACG GGG TTT ACG TGC CGC CAA GCT TCA CCA ATA T 	12265.90
C10 	VIBAGA30 	#= 40	CTG CTG CAT CAA AAA ACG GAA TAT TGG TGA AGC TTG GCG G 	12409.01
D10 	VIBAGA31 	#= 40	TCC GTT TTT TGA TGC AGC AGC CCG CGC TCA GTT TAG TGA T 	12259.87
E10 	VIBAGA32 	#= 40	TTG GCA AAC ACG ACC GGT TTA TCA CTA AAC TGA GCG CGG G 	12329.95
F10 	VIBAGA33 	#= 42	AAA CCG GTC GTG TTT GCC AAT GGT TCG CAA GTT AAC TCA AAC 	12897.32
G10 	VIBAGA34 	#= 44	ACT CAT TAG CTC CTT CTA CGG TGT TTG AGT TAA CTT GCG AAC CA 	13447.66
H10 	VIBAGA35 	#= 42	ACC GTA GAA GGA GCT AAT GAG TTT GGC ATT GCT TTG GCT ACT 	12999.37
I10 	VIBAGA36 	#= 41	CGC AAC AGT TAC GTT AGC CAC AGT AGC CAA AGC AAT GCC AA 	12565.13
J10 	VIBAGA37 	#= 43	GTG GCT AAC GTA ACT GTT GCG GGT AAC ACA GTG AGT ACA ACG G 	13356.60
K10 	VIBAGA38 	#= 46	CGT CAG ACG AGT TAA TGT CAT CTT CCG TTG TAC TCA CTG TGT TAC C 	14057.03
L10 	VIBAGA39 	#= 46	AAG ATG ACA TTA ACT CGT CTG ACG ACA TCG AGA ACA ACT TCA CAG C 	14104.12
M10 	VIBAGA40 	#= 45	TGT TAT GTT CAA CAT TGA TGC CCG CTG TGA AGT TGT TCT CGA TGT 	13853.89
N10 	VIBAGA41 	#= 43	GGG CAT CAA TGT TGA ACA TAA CAG CCG CGA TAT TGT GGT AGA T 	13330.60
O10 	VIBAGA42 	#= 42	CAC CCA CGG TAA TAG TAT TGC TAT CTA CCA CAA TAT CGC GGC 	12802.26
P10 	VIBAGA43 	#= 43	AGC AAT ACT ATT ACC GTG GGT GCT TCA GGC AAC TTT GCT ACG G 	13233.51
A11 	VIBAGA44 	#= 48	GAT CTT GAA AGG CCA ATA CAT TAA TAC CCG TAG CAA AGT TGC CTG AAG 	14792.56
B11 	VIBAGA45 	#= 47	GTA TTA ATG TAT TGG CCT TTC AAG ATC ACC ACG CGC CGT TAA ATC AT 	14387.27
C11 	VIBAGA46 	#= 40	ATG TTG CTG CTA GCT TGA GCA TGA TTT AAC GGC GCG TGG T 	12388.95
D11 	VIBAGA47 	#= 47	GCT CAA GCT AGC AGC AAC ATT ACT TTG GTT AGA AAC ATC TTT AAA GG 	14469.35
E11 	VIBAGA48 	#= 52	GGC TAA AAT GGT ATT CTC ACC AGT TCC TTT AAA GAT GTT TCT AAC CAA AGT A 	15959.31
F11 	VIBAGA49 	#= 49	AAC TGG TGA GAA TAC CAT TTT AGC CTT TGG CTT CTC TAA CTT AGT GGT T 	15057.68
G11 	VIBAGA50 	#= 44	TGC GAG GCA TTG TTG TCT TCA ACC ACT AAG TTA GAG AAG CCA AA 	13563.76
H11 	VIBAGA51 	#= 42	GAA GAC AAC AAT GCC TCG CAG TTT ACA ACG CGT AAC CCT TAC 	12820.29
I11 	VIBAGA52 	#= 47	CGT TGT AAA AAG ACG CAG TTA CTT GGT AAG GGT TAC GCG TTG TAA AC 	14581.40
J11 	VIBAGA53 	#= 45	CAA GTA ACT GCG TCT TTT TAC AAC GTG CCT TGT GGG TTA AGT ACC 	13816.89
K11 	VIBAGA54 	#= 40	TTA GTA CCG CGC GCT GTG CTG GTA CTT AAC CCA CAA GGC A 	12256.88
L11 	VIBAGA55 	#= 45	AGC ACA GCG CGC GGT ACT AAC AAC AAT ATT CGT TAC AAC CAA AGC 	13784.92
M11 	VIBAGA56 	#= 45	TTG CCG GTG CCG TTA AAC GAG CTT TGG TTG TAA CGA ATA TTG TTG 	13927.94
N11 	VIBAGA57 	#= 40	TCG TTT AAC GGC ACC GGC AAT GCG CCG CAG TAC TAC GAC A 	12250.89
O11 	VIBAGA58 	#= 43	ACC TGA TAC AAC GTT ACC GTT TTT GTC GTA GTA CTG CGG CGC A 	13184.47
P11 	VIBAGA59 	#= 48	AAA ACG GTA ACG TTG TAT CAG GTT ATA CTT GCC AAT AGC TCG AGT ATT 	14804.55
A12 	VIBAGA60 	#= 26	GAA TAC TCG AGC TAT TGG CAA GTA TA 	8018.22
B12 	LQ48AGA1 	#= 48	ACT TAC ATA TGA ACG ATT GGG ATA CAA TTC CAA TTC CTG CCA ATC CTG 	14669.47
C12 	LQ48AGA2 	#= 42	CTC CCA GAC ATA GCC GGT ACC AGG ATT GGC AGG AAT TGG AAT 	12972.36
D12 	LQ48AGA3 	#= 45	GTA CCG GCT ATG TCT GGG AGC TTC AAG AAG CCT ATT CAG ATT CCT 	13826.89
E12 	LQ48AGA4 	#= 50	TCA TTG GTT TTT CCG GAA TAG TTG AAG GAA TCT GAA TAG GCT TCT TGA AG 	15499.97
F12 	LQ48AGA5 	#= 50	TCA ACT ATT CCG GAA AAA CCA ATG AGT TCA CCA GTA AGT GGA ATG ATA GC 	15418.97
G12 	LQ48AGA6 	#= 50	CTG GAC CTG TCC AAC TCT TAA AAT AGC TAT CAT TCC ACT TAC TGG TGA AC 	15238.82
H12 	LQ48AGA7 	#= 47	TAT TTT AAG AGT TGG ACA GGT CCA GGT CTA ACC CAT TGG GAC TCA TC 	14468.31
I12 	LQ48AGA8 	#= 42	CAT CGG CAA CCC ACG ATT CAG ATG AGT CCC AAT GGG TTA GAC 	12892.31
J12 	LQ48AGA9 	#= 41	TGA ATC GTG GGT TGC CGA TGG CAA CCT AAT TGT TAG CGC CT 	12647.12
K12 	LQ48AGA10 	#= 42	TGT CGG TTC CTT GGC GGC GCG AGG CGC TAA CAA TTA GGT TGC 	12993.32
L12 	LQ48AGA11 	#= 41	CGC GCC GCC AAG GAA CCG ACA AAG TCA ATG CCG GCG TGA TT 	12614.12
M12 	LQ48AGA12 	#= 46	GGG TAT TTC ACC TTA GTT TTT GAG GTA ATC ACG CCG GCA TTG ACT T 	14152.09
N12 	LQ48AGA13 	#= 52	ACC TCA AAA ACT AAG GTG AAA TAC CCT ATT TTC CTA GAA GCT AGC ATC AAG G 	15956.32
O12 	LQ48AGA14 	#= 53	AAT TAG AAG ATA GCT CTA GGT TAC TCA CCT TGA TGC TAG CTT CTA GGA AAA TA 	16337.55
P12 	LQ48AGA15 	#= 51	TGA GTA ACC TAG AGC TAT CTT CTA ATT TCT GGC TAT TAA GCG AGA ATG ATG 	15742.15
A13 	LQ48AGA16 	#= 49	ACT TCA AGA ATG TCT ATT TCT CGC TCA TCA TTC TCG CTT AAT AGC CAG A 	14915.61
B13 	LQ48AGA17 	#= 45	AGC GAG AAA TAG ACA TTC TTG AAG TTT ACG GTG GGG CCG CTG ATA 	13989.01
C13 	LQ48AGA18 	#= 45	GTA GAC ATG TTT TTG GCA TAC CAT GTA TCA GCG GCC CCA CCG TAA 	13795.88
D13 	LQ48AGA19 	#= 46	CAT GGT ATG CCA AAA ACA TGT CTA CCA ACT TCC ACG TGT TCA TCC G 	14013.03
E13 	LQ48AGA20 	#= 41	TTT GGT TGC TGG CAG CGT CTC GGA TGA ACA CGT GGA AGT TG 	12743.17
F13 	LQ48AGA21 	#= 43	AGA CGC TGC CAG CAA CCA AAT CAT CAG TGA CTT TAA CGA CCA A 	13142.51
G13 	LQ48AGA22 	#= 43	CAA GAG GGT TCG TTG TGG GTT TGG TCG TTA AAG TCA CTG ATG A 	13399.61
H13 	LQ48AGA23 	#= 40	ACC CAC AAC GAA CCC TCT TGG GGA ACC TAC TGG CGA GAT G 	12259.90
I13 	LQ48AGA24 	#= 40	GGC AGC AAA TCG ATG AAA GCC ATC TCG CCA GTA GGT TCC C 	12274.91
J13 	LQ48AGA25 	#= 40	GCT TTC ATC GAT TTG CTG CCT ACT GGA AAA GCC CAA CCG A 	12215.87
K13 	LQ48AGA26 	#= 44	TGG CCA TCA ATG TAG AAA GTT ACC TCG GTT GGG CTT TTC CAG TA 	13552.72
L13 	LQ48AGA27 	#= 44	GGT AAC TTT CTA CAT TGA TGG CCA ACA GAC ACC AGA AGG CTC CT 	13484.70
M13 	LQ48AGA28 	#= 43	ATC TTT CAT CAC TAC TTG AGC CCA GGA GCC TTC TGG TGT CTG T 	13126.42
N13 	LQ48AGA29 	#= 46	GGG CTC AAG TAG TGA TGA AAG ATA AAG ATT ACA CTG GTG CTG TTC T 	14292.22
O13 	LQ48AGA30 	#= 44	AGG TTG TAG ACG CTT TTG TCG AGA ACA GCA CCA GTG TAA TCT TT 	13576.74
P13 	LQ48AGA31 	#= 43	CGA CAA AAG CGT CTA CAA CCT AAA CCA AGA GGC CTT CAT CAT T 	13117.49
A14 	LQ48AGA32 	#= 43	GCT ATG GTC TTC GGT GTC AAT AAT GAT GAA GGC CTC TTG GTT T 	13285.53
B14 	LQ48AGA33 	#= 41	ATT GAC ACC GAA GAC CAT AGC TGG CGC TCA GAA ATG GGC AT 	12652.17
C14 	LQ48AGA34 	#= 44	GCT AAG TCG GTA TCA CTG GCA ATA ATG CCC ATT TCT GAG CGC CA 	13491.68
D14 	LQ48AGA35 	#= 49	TAT TGC CAG TGA TAC CGA CTT AGC TGA CAA CAG CAA AAA CAA GAT GTA T 	15089.77
E14 	LQ48AGA36 	#= 45	TAG ACG CGC ACC CAA TCA ACA TAC ATC TTG TTT TTG CTG TTG TCA 	13720.84
F14 	LQ48AGA37 	#= 43	GTT GAT TGG GTG CGC GTC TAC AAA CCA GTG ACT GAT GAT AGC T 	13313.56
G14 	LQ48AGA38 	#= 44	CAT TTC CGT TTT CTC CCC CTG AGC TAT CAT CAG TCA CTG GTT TG 	13341.56
H14 	LQ48AGA39 	#= 44	CAG GGG GAG AAA ACG GAA ATG TCA GCG TAC CTA GTA CTT ACA CC 	13607.78
I14 	LQ48AGA40 	#= 45	CGC TAT GAA CCA ACT GTA GGT TGG TGT AAG TAC TAG GTA CGC TGA 	13939.97
J14 	LQ48AGA41 	#= 44	AAC CTA CAG TTG GTT CAT AGC GAC CTT TGC TTA GAC GTT GCT AG 	13512.69
K14 	LQ48AGA42 	#= 42	TTC CAT TCC AAG TCG CTC CAC TAG CAA CGT CTA AGC AAA GGT 	12802.26
L14 	LQ48AGA43 	#= 46	TGG AGC GAC TTG GAA TGG AAG TAC CTA TCA GCA GTG GAT ATG TAA T 	14317.23
M14 	LQ48AGA44 	#= 46	CGT TGA TCG CTA TTG CCT GTA TTA CAT ATC CAC TGC TGA TAG GTA C 	14081.05
N14 	LQ48AGA45 	#= 41	ACA GGC AAT AGC GAT CAA CGC TTT CAG TTT TCC GCG CTA GG 	12585.10
O14 	LQ48AGA46 	#= 41	TGA TGG CAT ACT GCC CGT TGC CTA GCG CGG AAA ACT GAA AG 	12659.15
P14 	LQ48AGA47 	#= 40	CAA CGG GCA GTA TGC CAT CAG CTC CGA AGT AAG CCA GCT C 	12259.90
A15 	LQ48AGA48 	#= 40	GCT TGG TCA AGT TCT AGG CAG AGC TGG CTT ACT TCG GAG C 	12358.93
B15 	LQ48AGA49 	#= 40	TGC CTA GAA CTT GAC CAA GCA AGC CAT GCC GAT GGT GCA A 	12298.93
C15 	LQ48AGA50 	#= 44	GGT TAC AAA CCC ACT GAT GAA CTG TTG CAC CAT CGG CAT GGC TT 	13491.68
D15 	LQ48AGA51 	#= 44	CAG TTC ATC AGT GGG TTT GTA ACC ACT CCG ACA GTA AGC AAA CC 	13484.70
E15 	LQ48AGA52 	#= 44	GCT ACC TTT ATC AAA TAG GGT CCA GGT TTG CTT ACT GTC GGA GT 	13543.70
F15 	LQ48AGA53 	#= 46	TGG ACC CTA TTT GAT AAA GGT AGC AGC ACC TTT GAA ATC CGT AAC A 	14141.13
G15 	LQ48AGA54 	#= 46	TTT CTA AGC ATT TTC CAG AGA CCT TGT TAC GGA TTT CAA AGG TGC T 	14120.09
H15 	LQ48AGA55 	#= 49	AGG TCT CTG GAA AAT GCT TAG AAA TTG CCA ATG CTT CTA GTA ATA ACG G 	15142.77
I15 	LQ48AGA56 	#= 45	ACC ACT GTT GGA GCG GAG CGC CGT TAT TAC TAG AAG CAT TGG CAA 	13909.95
J15 	LQ48AGA57 	#= 40	CGC TCC GCT CCA ACA GTG GTC CTG TGA CGG AGG CAA CAA C 	12251.87
K15 	LQ48AGA58 	#= 53	AGA ATA CTC GAG TTA GAG GAA TTT AAA GCG TTG GTT GTT GCC TCC GTC ACA GG 	16426.56
L15 	LQ48AGA59 	#= 33	CAA CGC TTT AAA TTC CTC TAA CTC GAG TAT TCT 	9997.48
M15 	PAMR3 	#= 30	TAC GGT ATC AGT CAT TTT AGG GAA GTC ACG 	9260.99
N15 	PAMF4 	#= 21	CTC CCT GCA GCC CCT TTT TAC 	6244.04
O15 	BP_199 	#= 25	CCC GGG GTA CCA CGG AGA GAT GGT G 	7773.01
P15 	pam-1 	#= 70	AAT ACC AGA GAT AAG AGA GTA GGC TGG TAG ATG GAG TTG CCC GTC GTG CTC AAT GAA AGG AGA TAA GGT C 	21864.05
A16 	pam-2 	#= 70	AAT ACC AGA GAT AAG AGA GTA GGC TGG TAG ATG GAG TTG GCC TTG GTG CTC AAT GAA AGG AGA TAA GGT C 	21919.09
B16 	pam-3 	#= 70	AAT ACC AGA GAT AAG AGA GTA GGC TGG TAG ATG GAG TTG GGG GGC GTG CTC AAT GAA AGG AGA TAA GGT C 	22009.14
C16 	pam-4 	#= 70	AAT ACC AGA GAT AAG AGA GTA GGC TGG TAG ATG GAG TTG CGG AAG GTG CTC AAT GAA AGG AGA TAA GGT C 	21977.14
D16 	pam-5 	#= 70	AAT ACC AGA GAT AAG AGA GTA GGC TGG TAG ATG GAG TTC CCA TAT GTG CTC AAT GAA AGG AGA TAA GGT C 	21847.07
E16 	pam-6 	#= 70	AAT ACC AGA GAT AAG AGA GTA GGC TGG TAG ATG GAG TTC CCC GTT GTG CTC AAT GAA AGG AGA TAA GGT C 	21839.04
F16 	pam-7 	#= 70	AAT ACC AGA GAT AAG AGA GTA GGC TGG TAG ATG GAG TTA CAC TTA GTG CTC AAT GAA AGG AGA TAA GGT C 	21871.09
G16 	pam-8 	#= 70	AAT ACC AGA GAT AAG AGA GTA GGC TGG TAG ATG GAG TTT CCG GGA GTG CTC AAT GAA AGG AGA TAA GGT C 	21928.10
H16 	pam-9 	#= 70	AAT ACC AGA GAT AAG AGA GTA GGC TGG TAG ATG GAG TTT CGC CCC GTG CTC AAT GAA AGG AGA TAA GGT C 	21824.03
I16 	pam-10 	#= 70	AAT ACC AGA GAT AAG AGA GTA GGC TGG TAG ATG GAG TTC TCA TGG GTG CTC AAT GAA AGG AGA TAA GGT C 	21903.09
J16 	pam-11 	#= 70	AAT ACC AGA GAT AAG AGA GTA GGC TGG TAG ATG GAG TTA GGT AAG GTG CTC AAT GAA AGG AGA TAA GGT C 	21976.15
K16 	pam-12 	#= 70	AAT ACC AGA GAT AAG AGA GTA GGC TGG TAG ATG GAG TTG TAC AGG GTG CTC AAT GAA AGG AGA TAA GGT C 	21952.13
L16 	pam-13 	#= 70	AAT ACC AGA GAT AAG AGA GTA GGC TGG TAG ATG GAG TTC GAT ACC GTG CTC AAT GAA AGG AGA TAA GGT C 	21872.08
M16 	pam-14 	#= 70	AAT ACC AGA GAT AAG AGA GTA GGC TGG TAG ATG GAG TTA GTA CAT GTG CTC AAT GAA AGG AGA TAA GGT C 	21911.11
N16 	pam-15 	#= 70	AAT ACC AGA GAT AAG AGA GTA GGC TGG TAG ATG GAG TTT GGG AAA GTG CTC AAT GAA AGG AGA TAA GGT C 	21976.15
O16 	pam-16 	#= 70	AAT ACC AGA GAT AAG AGA GTA GGC TGG TAG ATG GAG TTC GAA TAT GTG CTC AAT GAA AGG AGA TAA GGT C 	21911.11
P16 	pam-17 	#= 70	AAT ACC AGA GAT AAG AGA GTA GGC TGG TAG ATG GAG TTC TTC CAA GTG CTC AAT GAA AGG AGA TAA GGT C 	21847.07
A17 	pam-18 	#= 70	AAT ACC AGA GAT AAG AGA GTA GGC TGG TAG ATG GAG TTG AAC GAA GTG CTC AAT GAA AGG AGA TAA GGT C 	21945.14
B17 	pam-19 	#= 70	AAT ACC AGA GAT AAG AGA GTA GGC TGG TAG ATG GAG TTG GAC CGG GTG CTC AAT GAA AGG AGA TAA GGT C 	21953.11
C17 	pam-20 	#= 70	AAT ACC AGA GAT AAG AGA GTA GGC TGG TAG ATG GAG TTT AAT CAG GTG CTC AAT GAA AGG AGA TAA GGT C 	21911.11
D17 	pam-21 	#= 70	AAT ACC AGA GAT AAG AGA GTA GGC TGG TAG ATG GAG TTG ACC ACC GTG CTC AAT GAA AGG AGA TAA GGT C 	21857.07
E17 	pam-22 	#= 70	AAT ACC AGA GAT AAG AGA GTA GGC TGG TAG ATG GAG TTC TGG GGA GTG CTC AAT GAA AGG AGA TAA GGT C 	21968.13
F17 	pam-23 	#= 70	AAT ACC AGA GAT AAG AGA GTA GGC TGG TAG ATG GAG TTC GTG GGA GTG CTC AAT GAA AGG AGA TAA GGT C 	21968.13
G17 	pam-24 	#= 70	AAT ACC AGA GAT AAG AGA GTA GGC TGG TAG ATG GAG TTC GCT TAT GTG CTC AAT GAA AGG AGA TAA GGT C 	21878.08
H17 	pam-25 	#= 70	AAT ACC AGA GAT AAG AGA GTA GGC TGG TAG ATG GAG TTA GAG GCA GTG CTC AAT GAA AGG AGA TAA GGT C 	21961.14
I17 	pam-26 	#= 70	AAT ACC AGA GAT AAG AGA GTA GGC TGG TAG ATG GAG TTC GAC GAT GTG CTC AAT GAA AGG AGA TAA GGT C 	21912.10
