where	code	length	seq	monoisotopic_mass
A1 	p03_F1-Fb 	#= 29	TAT AGG ATC CAT GAA GGT CGA TGA GTT GC 	8996.82
B1 	p03_F1-Rs 	#= 27	TAT AGT CGA CGA TTT ACC CCG GCA GAC 	8244.34
C1 	p03_F2-Fb 	#= 26	TAT AGG ATC CTG TCT GCC GGG GTA AA 	8026.19
D1 	p03_F2-Rs 	#= 32	TAT AGT CGA CAC GTA AGA AAT CTT CAA GGG TT 	9871.41
E1 	p10_F1-Fb 	#= 26	TAT AGG ATC CAT GGG AAG CTC CCA CC 	7940.15
F1 	p10_F1-Rs 	#= 27	TAT AGT CGA CAG GGG AGT AGT CAG ACC 	8373.43
G1 	p10_F2-Fb 	#= 27	TAT AGG ATC CGG GTC TGA CTA CTC CCC 	8211.30
H1 	p10_F2-Rs 	#= 31	TAT AGT CGA CAT AGT CGT TGA TCG TCT TCT G 	9507.13
I1 	p03_F1-R 	#= 17	GAT TTA CCC CGG CAG AC 	5155.37
J1 	p03_F2-F 	#= 16	TGT CTG CCG GGG TAA A 	4937.22
K1 	p10_F1-R 	#= 17	AGG GGA GTA GTC AGA CC 	5284.45
L1 	p10_F2-F 	#= 17	GGG TCT GAC TAC TCC CC 	5122.33
M1 	p03_M-F 	#= 22	CAT TAG TTT TCG TTA ACA CGC G 	6700.36
N1 	p03_M-R 	#= 25	GAT CGA TAT AAA GTT GGG AAG TAC G 	7794.07
O1 	p10_M-F 	#= 22	GCG GTA AAG AAA ATT TTG AGC G 	6847.47
P1 	p10_M-R 	#= 23	TGG GTC GAT ATA AAG CTT GCT CA 	7078.60
A2 	p03_F1-1 	#= 47	ATG AAG GTC GAT GAG TTG CCG GTC GAT GAA CGT TTG AAG GCA GTG TT 	14669.42
B2 	p03_F1-2 	#= 55	GGT GGA TAA AGC TCC TCA ATT CCG CGC TCC TTC AAC ACT GCC TTC AAA CGT TCA T 	16740.75
C2 	p03_F1-3 	#= 47	GGA ATT GAG GAG CTT TAT CCA CCA CAG GCT GAA GCT TTA AAA TCC GG 	14511.35
D2 	p03_F1-4 	#= 45	CTA AGT TGC GCC CCT CCA ATG CTC CGG ATT TTA AAG CTT CAG CCT 	13682.79
E2 	p03_F1-5 	#= 55	TTG GAG GGG CGC AAC TTA GTT CTG GCG ATT CCT ACG GCT TCC GGA AAA ACC CTT G 	16957.86
F2 	p03_F1-6 	#= 59	CTT CCT GGA TAA GCT TAT TTA CCA TTA CGA TTT CGG AGA CAA GGG TTT TTC CGG AAG CC 	18141.65
G2 	p03_F1-7 	#= 65	GTA ATG GTA AAT AAG CTT ATC CAG GAA GGG GGG AAG GCT GTG TAT CTG GTT CCC TTA AAA GCT TT 	20212.98
H2 	p03_F1-8 	#= 59	CCA CTC TTT GAA TTC GCG ATA CTT TTC TTC GGC TAA AGC TTT TAA GGG AAC CAG ATA CA 	18069.62
I2 	p03_F1-9 	#= 60	AGT ATC GCG AAT TCA AAG AGT GGG AAA AGC TTG GTT TGA AAG TTG CAG CTA CTA CGG GTG 	18707.03
J2 	p03_F1-10 	#= 47	CAA GCC AGT CAT CGG TCG AGT CAT AAT CAC CCG TAG TAG CTG CAA CT 	14392.27
K2 	p03_F1-11 	#= 48	TCG ACC GAT GAC TGG CTT GGG CGT TAC GAC ATC ATT GTT GCG ACT GCT 	14781.47
L2 	p03_F1-12 	#= 50	CCA TGA CGC AAT AAT GAG TCA AAT TTC TCA GCA GTC GCA ACA ATG ATG TC 	15345.91
M2 	p03_F1-13 	#= 45	AAT TTG ACT CAT TAT TGC GTC ATG GGG CAC GTT GGA TCA ACG ACG 	13890.94
N2 	p03_F1-14 	#= 53	ATA AGA TGC ACT TCA TCT GCC ACA ACT AAC TTG ACG TCG TTG ATC CAA CGT GC 	16195.43
O2 	p03_F1-15 	#= 58	GTG GCA GAT GAA GTG CAT CTT ATC GGC TCG TAC GAC CGC GGG GCT ACG CTG GAA ATG A 	18003.53
P2 	p03_F1-16 	#= 43	CGC GGC CTA ACA TAT GAG TTA AGA TCA TTT CCA GCG TAG CCC C 	13147.47
A3 	p03_F1-17 	#= 58	CTT AAC TCA TAT GTT AGG CCG CGC GCA AAT CTT GGC ACT TTC GGC AAC CGT AGG CAA T 	17792.42
B3 	p03_F1-18 	#= 54	AGA GAA GCG TCC AAC CAC TCC GCA AGC TCT TCG GCA TTG CCT ACG GTT GCC GAA 	16536.61
C3 	p03_F1-19 	#= 42	GAG TGG TTG GAC GCT TCT CTT GTT GTA TCA GAT TGG CGC CCA 	12958.30
D3 	p03_F1-20 	#= 46	TGA AAG ACA CCG CGA CGA AGC TGT ACT GGG CGC CAA TCT GAT ACA A 	14186.15
E3 	p03_F1-21 	#= 58	TTC GTC GCG GTG TCT TTC ACC TTG GTA CAT TAA TCT GGG AGG ACG GAA AGG TGG AGT C 	17990.51
F3 	p03_F1-22 	#= 49	CAA CTA AAG AAT ACC AAT TTT CAG GGT ACG ACT CCA CCT TTC CGT CCT C 	14879.59
G3 	p03_F1-23 	#= 64	ACC CTG AAA ATT GGT ATT CTT TAG TTG TGG ACG CGG TGA AGC GCG GTA AGG GTG CAT TAG TTT T 	19897.75
H3 	p03_F1-24 	#= 42	CCG AAC GAC GCG TGT TAA CGA AAA CTA ATG CAC CCT TAC CGC 	12821.27
I3 	p03_F1-25 	#= 51	GTT AAC ACG CGT CGT TCG GCT GAA AAG GAA GCT TTG GCC TTG TCT AAA TTG 	15760.12
J3 	p03_F1-26 	#= 48	GGG TTT TGT CAG GTG CGA AGA GAC CAA TTT AGA CAA GGC CAA AGC TTC 	14880.58
K3 	p03_F1-27 	#= 41	CTT CGC ACC TGA CAA AAC CCG AAA AAC GCG CTT TGG AGT CG 	12548.09
L3 	p03_F1-28 	#= 40	GTC CTC TAA CTG GCT CGC AAG CGA CTC CAA AGC GCG TTT T 	12207.85
M3 	p03_F1-29 	#= 52	TTG CGA GCC AGT TAG AGG ACA ACC CAA CAT CTG AGA AAT TGA AAC GTG CAC T 	16038.35
N3 	p03_F1-30 	#= 44	TGA AAA GCC ACT CCC CCA CGC AGT GCA CGT TTC AAT TTC TCA GA 	13380.62
O3 	p03_F1-31 	#= 45	GTG GGG GAG TGG CTT TTC ATC ACG CGG GAC TGA GTC GCG TAG AGC 	14029.97
P3 	p03_F1-32 	#= 57	AAT TAA CCC CTC GCG AAA AGC GTC CTC AAT TAA TGT ACG CTC TAC GCG ACT CAG TCC 	17361.17
A4 	p03_F1-33 	#= 64	GCT TTT CGC GAG GGG TTA ATT AAA GTT ATT ACG GCA ACA CCC ACT TTG TCT GCC GGG GTA AAT C 	19731.65
B4 	p03_F1-34 	#= 32	GAT TTA CCC CGG CAG ACA AAG TGG GTG TTG CC 	9865.36
C4 	p03_F2-1 	#= 57	TGT CTG CCG GGG TAA ATC TTC CCT CAT TTC GCG TAA TTA TCC GTG ACA CTA AGC GCT 	17436.17
D4 	p03_F2-2 	#= 53	GAC AGG GAT GTC TGT CCA CCC GAA ACC AGC GTA GCG CTT AGT GTC ACG GAT AA 	16351.50
E4 	p03_F2-3 	#= 47	GGT GGA CAG ACA TCC CTG TCC TTG AGA TCC AGC AAA TGA TGG GTC GT 	14519.32
F4 	p03_F2-4 	#= 58	ATA GCT TCT CCA TAT TTG TCG TAG CGG GGG CGC CCG GCA CGA CCC ATC ATT TGC TGG A 	17816.39
G4 	p03_F2-5 	#= 58	GCT ACG ACA AAT ATG GAG AAG CTA TCA TCG TGG CAC GCA CCG ATG AAC CCG GAA AAT T 	17901.54
H4 	p03_F2-6 	#= 57	AGC TTC TCC GGC TTT CCA CGA ATG TAA CGT TCC ATT AAT TTT CCG GGT TCA TCG GTG 	17442.17
I4 	p03_F2-7 	#= 43	GTG GAA AGC CGG AGA AGC TTT TCT CAA TGC TGG CCA ATG AAC A 	13300.58
J4 	p03_F2-8 	#= 46	AGC CAA AAC TTG AGA GCG GAA CGC CTG TTC ATT GGC CAG CAT TGA G 	14208.15
K4 	p03_F2-9 	#= 51	TCC GCT CTC AAG TTT TGG CTT TGA TTA CAA ATT TCG GAA TTC GCT CCT TCC 	15522.96
L4 	p03_F2-10 	#= 57	ATA GAA TGT ACG TTC CAG GAA ACG TAC CAG CTC CGG GAA GGA GCG AAT TCC GAA ATT 	17643.36
M4 	p03_F2-11 	#= 57	CGT TTC CTG GAA CGT ACA TTC TAT GCA CAT CAG CGT AAA GAC CTG AGC AGC TTG GAG 	17552.28
N4 	p03_F2-12 	#= 48	AAA AAT AAA CTA CCT CCT TTG CCT TGT ACT CCA AGC TGC TCA GGT CTT 	14596.41
O4 	p03_F2-13 	#= 64	CAA GGC AAA GGA GGT AGT TTA TTT TTT AAT CGA GAA TGA ATT TAT TGA TTT GGA TCT TGA GGA T 	19926.83
P4 	p03_F2-14 	#= 66	GGG AAG TAC GCT TGC CAA ACG GCA GTG GGA TGA AGC GAT CCT CAA GAT CCA AAT CAA TAA ATT CAT 	20412.15
A5 	p03_F2-15 	#= 54	GTT TGG CAA GCG TAC TTC CCA ACT TTA TAT CGA TCC TTT AAC TGC AAA GAA ATT 	16528.66
B5 	p03_F2-16 	#= 66	GAT TTG GGT TGC GCT CGA TGG CGG GAA ACG CGT CCT TAA ATT TCT TTG CAG TTA AAG GAT CGA TAT 	20460.11
C5 	p03_F2-17 	#= 56	CAT CGA GCG CAA CCC AAA TCC GTT CGG GAT TTT CCA GTT AAT TGC GAG TAC TCC TG 	17150.01
D5 	p03_F2-18 	#= 62	CTT CCA TTT CAC GAC GGC GGG CGG TTA ATG TCG CCA TAT CAG GAG TAC TCG CAA TTA ACT GG 	19084.23
E5 	p03_F2-19 	#= 48	CGC CGT CGT GAA ATG GAA GAT TAT TTA GAC CTT GCT TAT GAA CTG GAG 	14861.57
F5 	p03_F2-20 	#= 64	TGA ATC CTC ATA GTA CGG GAT TGA GGC GTA TAA CTT GTC CTC CAG TTC ATA AGC AAG GTC TAA A 	19732.69
G5 	p03_F2-21 	#= 46	TCA ATC CCG TAC TAT GAG GAT TCA CGC TTC CAG GGG TTC TTA GGC C 	14092.04
H5 	p03_F2-22 	#= 50	AGT CTA ACA GCA CCT TAG CTG TCT TTA CTT GGC CTA AGA ACC CCT GGA AG 	15304.85
I5 	p03_F2-23 	#= 57	ACA GCT AAG GTG CTG TTA GAC TGG ATT AAC GAG GTC CCG GAA GCC CGC ATC TAC GAA 	17611.31
J5 	p03_F2-24 	#= 40	GCC GGG GTC GAT TGA GTA GGT TTC GTA GAT GCG GGC TTC C 	12430.95
K5 	p03_F2-25 	#= 45	CTA CTC AAT CGA CCC CGG CGA TCT TTA TCG TCT TTT AGA GCT GGC 	13713.80
L5 	p03_F2-26 	#= 52	TTC GAT AAG GCT GTA CAT TAA CCA ATC GGC CAG CTC TAA AAG ACG ATA AAG A 	16021.36
M5 	p03_F2-27 	#= 58	TTG GTT AAT GTA CAG CCT TAT CGA ACT TTA CAA GCT GTT CGA GCC TAA AGA AGA GAT C 	17878.52
N5 	p03_F2-28 	#= 57	TAA GCG TAA ATG AAG GTC ACG CAG ATA ATT CAA GAT CTC TTC TTT AGG CTC GAA CAG 	17583.34
O5 	p03_F2-29 	#= 59	GCG TGA CCT TCA TTT ACG CTT ACG TCA TGG GGT TCG CGA GGA GCT TCT GGA GCT TGT AC 	18206.63
P5 	p03_F2-30 	#= 45	GCT TGC GAC CAA TGT TTG GAA GGC GTA CAA GCT CCA GAA GCT CCT 	13845.90
A6 	p03_F2-31 	#= 52	TCC AAA CAT TGG TCG CAA GCG CGC GCG TGC ACT GTA TAA CGC TGG ATT TCG T 	15995.26
B6 	p03_F2-32 	#= 44	GTT GGC GAT CGC TTC TAC GCT ACG AAA TCC AGC GTT ATA CAG TG 	13522.69
C6 	p03_F2-33 	#= 51	CGT AGA AGC GAT CGC CAA CGC CAA GCC AGC CGA ATT GTT GGC GGT GGA AGG 	15824.15
D6 	p03_F2-34 	#= 45	ACC GTC CAG GAT CTT TGC TCC GAT ACC TTC CAC CGC CAA CAA TTC 	13596.74
E6 	p03_F2-35 	#= 56	GAG CAA AGA TCC TGG ACG GTA TTT ATC GCC ACC TGG GCA TCG AAA AGC GTG TCA CA 	17282.11
F6 	p03_F2-36 	#= 46	GTT CCC TTA CGC TTC GGT TTC TCC TCT GTG ACA CGC TTT TCG ATG C 	13966.93
G6 	p03_F2-37 	#= 40	GAA ACC GAA GCG TAA GGG AAC CCT TGA AGA TTT CTT ACG T 	12352.98
H6 	p03_F2-38 	#= 19	ACG TAA GAA ATC TTC AAG G 	5844.84
I6 	p10_F1-1 	#= 43	ATG GGA AGC TCC CAC CAC CAC CAC CAT CAC TCA TCG GGT CTG G 	13078.41
J6 	p10_F1-2 	#= 57	TCC AGG CTC TCA ATT TTC ATG TGG CTA CCG CGC GGT ACC AGA CCC GAT GAG TGA TGG 	17536.22
K6 	p10_F1-3 	#= 62	CAC ATG AAA ATT GAG AGC CTG GAC CTG CCG GAC GAA GTG AAA CAG TTT TAT TTA GAC TCC GG 	19174.33
L6 	p10_F1-4 	#= 55	CGG CCT GAG GTG GAT AAA GTT CCA AGA TAC CGG AGT CTA AAT AAA ACT GTT TCA C 	16990.95
M6 	p10_F1-5 	#= 46	ACT TTA TCC ACC TCA GGC CGA GGC TGT CGA AAA GGG CTT GTT AGA A 	14174.12
N6 	p10_F1-6 	#= 47	AAT AGC CGC TAA AAG GTT ACG CCC TTC TAA CAA GCC CTT TTC GAC AG 	14351.25
O6 	p10_F1-7 	#= 46	GCG TAA CCT TTT AGC GGC TAT TCC CAC CGC TTC GGG GAA AAC GTT G 	14117.06
P6 	p10_F1-8 	#= 54	TTC AGA ATA GAC TTA AGC ATT GCC AGC TCC GCC AGC AAC GTT TTC CCC GAA GCG 	16510.61
A7 	p10_F1-9 	#= 54	TGG CAA TGC TTA AGT CTA TTC TGA ACG GGG GAA AGG CAC TTT ACA TTG TTC CGC 	16666.70
B7 	p10_F1-10 	#= 55	AAA CGC TTA AAT TTT TCA GAA GCC AGC GCG CGA AGC GGA ACA ATG TAA AGT GCC T 	16984.95
C7 	p10_F1-11 	#= 61	TGG CTT CTG AAA AAT TTA AGC GTT TTC GTG AGT TTT CTA AAT TGG GTA TCC GTG TGG GGA T 	18931.14
D7 	p10_F1-12 	#= 45	CGC GAA GAT CAT AAT CAC CAG TTG AAA TCC CCA CAC GGA TAC CCA 	13720.87
E7 	p10_F1-13 	#= 60	AAC TGG TGA TTA TGA TCT TCG CGA TGA GGG CCT TGG AGT GAA TGA CAT CAT TGT CGC AAC 	18584.93
F7 	p10_F1-14 	#= 54	ATT ACG CAA TAA AGA GTC TGT CTT TTC GCT CGT TGC GAC AAT GAT GTC ATT CAC 	16560.65
G7 	p10_F1-15 	#= 48	GAA AAG ACA GAC TCT TTA TTG CGT AAT GAG ACG GTG TGG ATG CAG GAA 	14968.65
H7 	p10_F1-16 	#= 45	ACT TCG TCA GCC ACA ACT ACA GAA ATT TCC TGC ATC CAC ACC GTC 	13613.78
I7 	p10_F1-17 	#= 46	TGT AGT TGT GGC TGA CGA AGT GCA TTT GAT CGA TAG CCC AGA TCG T 	14251.15
J7 	p10_F1-18 	#= 61	CTT ACG TAA TTT TGC CAA AGT GAT TTC CAG AGT CGG ACC ACG ATC TGG GCT ATC GAT CAA A 	18762.06
K7 	p10_F1-19 	#= 60	GAA ATC ACT TTG GCA AAA TTA CGT AAG ATG AAT CCT TCA TGC CAA ATC CTG GCT TTA TCG 	18415.87
L7 	p10_F1-20 	#= 53	CGG CAA GTT CAT CGG CAT TTC CGA TTG TAG CCG ATA AAG CCA GGA TTT GGC AT 	16347.50
M7 	p10_F1-21 	#= 43	AAA TGC CGA TGA ACT TGC CGC GTG GCT TGA AGC TGG CCT GGT A 	13299.54
N7 	p10_F1-22 	#= 38	TTG GAC GCC ATT CGG ACA ATA CCA GGC CAG CTT CAA GC 	11632.50
O7 	p10_F1-23 	#= 57	TTG TCC GAA TGG CGT CCA ACC GAA CTT CGT GAG GGA GTC TTC TTC AAC GGT ACT TTT 	17516.22
P7 	p10_F1-24 	#= 55	GCT CGA TTG ATT TCT CGC GGT CTT TAC AAT AAA AAG TAC CGT TGA AGA AGA CTC C 	16907.89
A8 	p10_F1-25 	#= 56	CCG CGA GAA ATC AAT CGA GCA GAG TAC AAA GGA TGA AGC AGT TAA TCT GGT GTT GG 	17434.23
B8 	p10_F1-26 	#= 61	TTC AAA AAC AAG ACA CTG ACC GTC TTC GCG CAA AGT GTC CAA CAC CAG ATT AAC TGC TTC A 	18638.02
C8 	p10_F1-27 	#= 58	ACG GTC AGT GTC TTG TTT TTG AAA ACA GTC GCA AGA ATT GCA TGG CCT TCG CCA AAA A 	17879.51
D8 	p10_F1-28 	#= 45	AAA TTT TCT TTA CCG CAC TTG ACG CCT TTT TGG CGA AGG CCA TGC 	13752.84
E8 	p10_F1-29 	#= 61	CGT CAA GTG CGG TAA AGA AAA TTT TGA GCG CCG AGG ACA AAG AAG CTT TAG CGG AGA TTG C 	18999.22
F8 	p10_F1-30 	#= 50	GGT CTC GGA ATT CTC TAA AAC TTC ATC TGC AAT CTC CGC TAA AGC TTC TT 	15220.79
G8 	p10_F1-31 	#= 47	TGA AGT TTT AGA GAA TTC CGA GAC CGA TAC GTC AGC AGC CTT AGC TG 	14502.34
H8 	p10_F1-32 	#= 40	CGG TTC CGG AGC GAA TAC ACG CAG CTA AGG CTG CTG ACG T 	12346.93
I8 	p10_F1-33 	#= 50	TGT ATT CGC TCC GGA ACC GCG TTT CAC CAT GCG GGT CTG ACT ACT CCC CT 	15215.73
J8 	p10_F1-34 	#= 28	AGG GGA GTA GTC AGA CCC GCA TGG TGA A 	8727.64
K8 	p10_F2-1 	#= 50	GGG TCT GAC TAC TCC CCT GCG TGA ACT GGT CGA AGA CGG TTT TCG CGC TG 	15400.84
L8 	p10_F2-2 	#= 48	AGG AGT CGA GCT GAT AAG TTT AAT TTT GCC AGC GCG AAA ACC GTC TTC 	14806.53
M8 	p10_F2-3 	#= 65	AAA TTA AAC TTA TCA GCT CGA CTC CTA CTT TGG CTG CCG GCT TGA ATC TTC CTG CTC GTC GTG TC 	19833.70
N8 	p10_F2-4 	#= 56	ATC TTC CGA AGA GTA GCG GCG ATA GGA GCG GAT AAC GAC ACG ACG AGC AGG AAG AT 	17454.23
O8 	p10_F2-5 	#= 48	GCC GCT ACT CTT CGG AAG ATG GGA TGC AGC CGA TTC CCG TTA TTG AGT 	14790.48
P8 	p10_F2-6 	#= 41	GCG TCC TGC CAT CTG CTT ATA CTC AAT AAC GGG AAT CGG CT 	12536.06
A9 	p10_F2-7 	#= 47	TAA GCA GAT GGC AGG ACG CGC AGG GCG CCC TCG TCT TGA CCC ATA CG 	14475.28
B9 	p10_F2-8 	#= 47	AGC TCT TTG CCA CCA AAA CAG CCT CGC CGT ATG GGT CAA GAC GAG GG 	14458.29
C9 	p10_F2-9 	#= 53	CTG TTT TGG TGG CAA AGA GCT ATG AAG AGT TCG TGT TTC TGT TTC GTA ACT AC 	16389.52
D9 	p10_F2-10 	#= 64	TCC AAG CTT ACT CCA GAT GTC TTC CGC GTC AGC TTC GAT GTA GTT ACG AAA CAG AAA CAC GAA C 	19607.61
E9 	p10_F2-11 	#= 54	AAG ACA TCT GGA GTA AGC TTG GAA CCG AAA ACG CCT TGC GCA CGC ATG TTT TGA 	16678.73
F9 	p10_F2-12 	#= 46	TGC GCG CAA AAC CAT TAG AGA TCG TAC TCA AAA CAT GCG TGC GCA A 	14145.14
G9 	p10_F2-13 	#= 54	CTC TAA TGG TTT TGC GCG CAC AAA GGA AGA GCT TAT GGA ATT CCT GGA GGC GAC 	16725.74
H9 	p10_F2-14 	#= 48	GAA ATT AGA GTA TTG GAA CGC AAA AAA AGT CGC CTC CAG GAA TTC CAT 	14825.60
I9 	p10_F2-15 	#= 53	TTT TTT TGC GTT CCA ATA CTC TAA TTT CGG ATT ATC GAC GGT GGT TGA CGA AT 	16299.47
J9 	p10_F2-16 	#= 44	CTT CTT GGC GAA GAA AGT TTA AGC ATT CGT CAA CCA CCG TCG AT 	13490.69
K9 	p10_F2-17 	#= 51	GCT TAA ACT TTC TTC GCC AAG AAG AAA TGT TAG AAA AAA CGG ATA CGC TGA 	15747.19
L9 	p10_F2-18 	#= 62	ATA AAG CTT GCT CAC TAA TTT TCC AAA CGA CGT GCT AAT CAG CGT ATC CGT TTT TTC TAA CA 	18935.19
M9 	p10_F2-19 	#= 59	TTT GGA AAA TTA GTG AGC AAG CTT TAT ATC GAC CCA CTG TCC GCA GCA CGC ATT GTT AA 	18143.67
N9 	p10_F2-20 	#= 44	AAG AAT TTT GGC CTC CTT CAG ACC TTT AAC AAT GCG TGC TGC GG 	13497.68
O9 	p10_F2-21 	#= 62	GTC TGA AGG AGG CCA AAA TTC TTA CAG AAC TTA CCC TGC TGC ATT TGG TGT GCT CTA CAC CG 	19043.22
P9 	p10_F2-22 	#= 47	TTA CGC ATA TAC AAC AAA CGC ATA TCC GGT GTA GAG CAC ACC AAA TG 	14417.33
A10 	p10_F2-23 	#= 55	GAT ATG CGT TTG TTG TAT ATG CGT AAT CAA GAC TAC CAG GAC ATC AAT GAC TAT G 	16986.95
B10 	p10_F2-24 	#= 57	TAC ACG CAC GAA CTC GTC CGC GTG AGC GAT TAC ATA GTC ATT GAT GTC CTG GTA GTC 	17519.24
C10 	p10_F2-25 	#= 49	GGA CGA GTT CGT GCG TGT ACC ATC CCC ATT TAA CTA TAC CGA ATA TGA G 	15055.69
D10 	p10_F2-26 	#= 47	TTC ACT TCG CCA AGG AAC CAC TCA TAT TCG GTA TAG TTA AAT GGG GA 	14461.32
E10 	p10_F2-27 	#= 39	TGG TTC CTT GGC GAA GTG AAA ACC TCG CTG CTT CTG GTG 	12020.71
F10 	p10_F2-28 	#= 57	AGG CAA ATT TCG TTT TCG GAC TTT TCA TGA ATC CAG TCC ACC AGA AGC AGC GAG GTT 	17542.27
G10 	p10_F2-29 	#= 43	AGT CCG AAA ACG AAA TTT GCC TTA AAT TTG GGA TCG GGG AGG G 	13395.64
H10 	p10_F2-30 	#= 49	CTG CAA TGT CTG CGA TAG CGT GGA TAT CCC CCT CCC CGA TCC CAA ATT T 	14903.57
I10 	p10_F2-31 	#= 46	CGC TAT CGC AGA CAT TGC AGA ATG GCT GAT GCA CGT CAC GGC TCA A 	14144.10
J10 	p10_F2-32 	#= 58	TGC TTC TTT TGC TCC TTT AAG CTC CAG CAA GCG GGC CAG TTG AGC CGT GAC GTG CAT C 	17782.37
K10 	p10_F2-33 	#= 47	AGC TTA AAG GAG CAA AAG AAG CAG CCG AGT TAG AGA AAC GCA TTC AT 	14595.45
L10 	p10_F2-34 	#= 49	TCC ATA AGC TCC GGT GAA GCG CCG TAA TGA ATG CGT TTC TCT AAC TCG G 	15047.66
M10 	p10_F2-35 	#= 46	GCT TCA CCG GAG CTT ATG GAT TTG CTT GAC ATC CGT GGA ATC GGA C 	14172.09
N10 	p10_F2-36 	#= 57	CGG AAG CCA CTT TCA TAA AGT TTG CGT GCG CGC ATG CGT CCG ATT CCA CGG ATG TCA 	17520.23
O10 	p10_F2-37 	#= 43	CAA ACT TTA TGA AAG TGG CTT CCG CTC GTC CGC AGA ATT GGC G 	13218.50
P10 	p10_F2-38 	#= 56	GTC CAA GCA AGG CAG CAA CTT TTA CGG GGT CCG CGC CCG CCA ATT CTG CGG ACG AG 	17236.03
A11 	p10_F2-39 	#= 44	GTT GCT GCC TTG CTT GGA CCT AAG ATT GCG GAT CGC ATC TTT AA 	13519.68
B11 	p10_F2-40 	#= 46	ATA CCT CAC GGC GTC CAA TCT GCT TAA AGA TGC GAT CCG CAA TCT T 	14029.03
C11 	p10_F2-41 	#= 40	GAT TGG ACG CCG TGA GGT ATT ACC GGA AAT TGC GGA ACC A 	12409.99
D11 	p10_F2-42 	#= 44	AAC TCG GAC TTT TTT CAG GCA GCG TTG GTT CCG CAA TTT CCG GT 	13495.65
E11 	p10_F2-43 	#= 48	CTG CCT GAA AAA AGT CCG AGT TCT GGA CAG AAG ACG ATC AAC GAC TAT 	14802.56
F11 	p10_F2-44 	#= 25	ATA GTC GTT GAT CGT CTT CTG TCC A 	7613.92
G11 	T7 	#= 20	TAA TAC GAC TCA CTA TAG GG 	6125.01
H11 	T7t 	#= 19	GCT AGT TAT TGC TCA GCG G 	5834.79
I11 	RBLCK73 	#= 47	ATT GTA CGA CTT ATA CTG GAC CGA AGA GAT GGA CGA CCA GTT GCG CG 	14552.36
J11 	RBLCK74 	#= 44	AGG AAG GCT TGT CTT CCT CTA AGG CGC GCA ACT GGT CGT CCA TC 	13499.66
K11 	RBLCK75 	#= 49	CCT TAG AGG AAG ACA AGC CTT CCT TAC GTC TTT TGT CGT AAG GAT CCG A 	15046.67
L11 	RBLCK76 	#= 45	CTT GTC GAC GGA GCT CGA ATT CGG ATC CTT ACG ACA AAA GAC GTA 	13853.93
M11 	RBLCK-F-PTZ 	#= 35	CCT CGC GAA TGC ATC TAG ATG CCT GGT GCC GCG CG 	10724.88
N11 	RBLCK-R1-PTZ 	#= 39	CGA CGG GCC CGG GAT CCG ATC CGC AGC ACA GTG CTT GCA 	11979.68
O11 	RBLCK-F2-PTZ 	#= 43	CCT CGC GAA TGC ATC TAG ATG TGC AAG CAC TGT GCT GCG GAT T 	13234.50
P11 	RBLCK-R-PTZ 	#= 45	CGA CGG GCC CGG GAT CCG ATC TTG TCG ACG GAG CTC GAA TTC GGA 	13903.90
A12 	PIA900-1 	#= 29	CAT ATG CAG GGT TCT GTG ACA GAG TTT CT 	8938.77
B12 	PIA900-2 	#= 29	AGA AAC TCT GTC ACA GAA CCC TGC ATA TG 	8854.75
C12 	PIA900-3 	#= 24	CTT GTC AGC GAG CTG AGG AAC CCT 	7353.76
D12 	PIA900-4 	#= 24	AGG GTT CCT CAG CTC GCT GAC AAG 	7353.76
E12 	PIA900-5 	#= 27	TTC TCG CTC AAA CAG GTC ACT GCT GTC 	8186.29
F12 	PIA900-6 	#= 27	GAC AGC AGT GAC CTG TTT GAG CGA GAA 	8373.43
G12 	PIA900-7 	#= 29	GGC CTC AAA TAA CGT AAA AAC CCG CTT CG 	8839.74
H12 	PIA900-8 	#= 29	CGA AGC GGG TTT TTA CGT TAT TTG AGG CC 	8954.77
I12 	PIA900-9 	#= 23	TCG TCG TTA AGC GGC CGC ACT CG 	7016.53
J12 	PIA900-10 	#= 23	CGA GTG CGG CCG CTT AAC GAC GA 	7074.58
K12 	gR_ompC_F_218 	#= 65	gag aAC TAG tAT ATT CCC ACT GGC CGT AAC gTT TTA GAG CTA GAA ATA GCA AGT TAA AAT AAG GC 	20111.97
L12 	2.gR_ompC_F_714 	#= 65	cag aAC TAG tCA CCA GTG TAG GTT TCA GCA gTT TTA GAG CTA GAA ATA GCA AGT TAA AAT AAG GC 	20152.00
M12 	gR_RplB_F_709 	#= 65	gag aAC TAG tGC TGC GGG TCT TCT TAC CTT gTT TTA GAG CTA GAA ATA GCA AGT TAA AAT AAG GC 	20140.96
N12 	NIKITEEV_TDT_1_F 	#= 28	GCG CAT GGT TAT CCA GCA TCA TTT TAC G 	8554.53
O12 	NIKITEEV_TDT_2_R 	#= 28	GGA TAA CCA TGC GCT CTA CGA TCG TAC C 	8533.52
P12 	NIKITEEV_TDT_3_R 	#= 23	CCA ACT GTT CAC CGA TGC CCT CG 	6920.48
A13 	primerF 	#= 20	CTT TCG GGC TTT GTT AGC AG 	6129.97
B13 	primerR 	#= 20	GAA GGA GAT ATA CCA TGG GC 	6215.06
C13 	Unnamedsequence_F1-0 	#= 33	CTA GAG GGG AAT TGT TAT CCG CTC ACA ATT CCC 	10088.51
D13 	Unnamedsequence_F1-1 	#= 79	GGG AAT TGT GAG CGG ATA ACA ATT CCC CTC TAG AAA TAA TTT TGT TTA ACT TTA AGA AGG AGA TAT ACC ATG CGT TGC A 	24448.73
E13 	Unnamedsequence_F1-2 	#= 76	CCA CGT CAG CCA GCC TGT TCT TGC GGT TTG GCG AAT TGC CCG AGT GCA ACG CAT GGT ATA TCT CCT TCT TAA AGT T 	23317.90
F13 	Unnamedsequence_F1-3 	#= 52	CCG CAA GAA CAG GCT GGC TGA CGT GGC TGG CGA TTC TTG CCG TCA CGG CGC C 	16023.23
G13 	Unnamedsequence_F1-4 	#= 59	CGG GAG GAT CGT CGG CCC ATG CCG GCG AAG TCA CGG GCG CCG TGA CGG CAA GAA TCG CC 	18274.67
H13 	Unnamedsequence_F1-5 	#= 54	CGG CAT GGG CCG ACG ATC CTC CCG CCA CCG TAT ACA AGT ATG ACT CCC GCC CGC 	16434.51
I13 	Unnamedsequence_F1-6 	#= 75	TCG TTG TTT CCC CAC GCC GTG AAT CCG TTC TGG AAA ACG TCC TCC GGC GGG CGG GAG TCA TAC TTG TAT ACG GTG 	23095.73
J13 	Unnamedsequence_F1-7 	#= 57	CGG ATT CAC GGC GTG GGG AAA CAA CGA CAA TGT GCT CGA CCA TCT GAC CGG ACG TTC 	17588.28
K13 	Unnamedsequence_F1-8 	#= 55	CGC TGT TGC TGC TGC CGA CCT GGC AGG AAC GTC CGG TCA GAT GGT CGA GCA CAT T 	16959.84
L13 	Unnamedsequence_F1-9 	#= 66	GCC AGG TCG GCA GCA GCA ACA GCG CTT TCG TCT CCA CCA GCA GCA GCC GGC GCT ATA CCG AGG TCT 	20246.94
M13 	Unnamedsequence_F1-10 	#= 65	GTT CGG CCT CGA CCG CTT CCT GCA TGC GAT GTT CGA GAT AGA CCT CGG TAT AGC GCC GGC TGC TG 	19991.75
N13 	Unnamedsequence_F1-11 	#= 64	CAT GCA GGA AGC GGT CGA GGC CGA ACG CGC CGG CAG GGG CAC CGG CCA CTT CAT CGG CTA CAT C 	19743.61
O13 	Unnamedsequence_F1-12 	#= 70	AGC TGG CGG CGC CGT AGA AAT TGT TGT CGG CGC GGA CTT CGT AGA TGT AGC CGA TGA AGT GGC CGG TGC C 	21774.89
P13 	Unnamedsequence_F1-13 	#= 71	ACA ACA ATT TCT ACG GCG CCG CCA GCT CGT ACT TCG AAT ACG TCG ACA CTT ATG GCG ACA ATG CCG GCC GT 	21743.93
A14 	Unnamedsequence_F1-14 	#= 57	CTG GTA GGT GGC CAG CGC GCC GGC GAG GAT ACG GCC GGC ATT GTC GCC ATA AGT GTC 	17668.27
B14 	Unnamedsequence_F1-15 	#= 54	CCG GCG CGC TGG CCA CCT ACC AGA GCG GTT ATC TGG CAC ACC GGC GCA TTC CGC 	16506.54
C14 	Unnamedsequence_F1-16 	#= 60	TGA TAG ACC CGC GTT ACC CTG CGG ATG TTT TCG GGC GGA ATG CGC CGG TGT GCC AGA TAA 	18563.87
D14 	Unnamedsequence_F1-17 	#= 72	ACA TCC GCA GGG TAA CGC GGG TCT ATC ACA ACG GCA TCA CCG GCG AGA CCA CGA CCA CGG AGT ATT CCA ACG 	22135.19
E14 	Unnamedsequence_F1-18 	#= 63	GGA TTG GCG CGA GTC TGC TGG CTG ACG TAG CGA GCG TTG GAA TAC TCC GTG GTC GTG GTC TCG 	19589.48
F14 	Unnamedsequence_F1-19 	#= 60	GTC AGC CAG CAG ACT CGC GCC AAT CCC AAC CCC TAC ACA TCG CGA AGG TCC GTA GCG TCG 	18305.73
G14 	Unnamedsequence_F1-20 	#= 71	AAG CGC CAA TCA CCG GCG CCA TGC GCA CCA ATG TGC CGA CGA TCG ACG CTA CGG ACC TTC GCG ATG TGT AG 	21819.96
H14 	Unnamedsequence_F1-21 	#= 49	GCA TGG CGC CGG TGA TTG GCG CTT GCA TGG CGC GGC AGG CCG AAA GCT C 	15196.70
I14 	Unnamedsequence_F1-22 	#= 49	TTC GGA CCA GGC TGC CAT GGC CTC GGA GCT TTC GGC CTG CCG CGC CAT G 	15018.58
J14 	Unnamedsequence_F1-23 	#= 71	CGA GGC CAT GGC AGC CTG GTC CGA ACG CGC CGG CGA GGC GAT GGT TCT CGT GTA CTA CGA AAG CAT CGC GT 	21963.01
K14 	Unnamedsequence_F1-24 	#= 71	GCT GTC ATA GCC GGA ATC CTG GCG TTC CAC TGC GAA CGA ATA CGC GAT GCT TTC GTA GTA CAC GAG AAC CA 	21848.00
L14 	Unnamedsequence_F1-25 	#= 70	GGA ACG CCA GGA TTC CGG CTA TGA CAG CCT TGA TGG GGT GGG ATC GCG ATC GTT CTC GTT GGG CGA GGT G 	21805.90
M14 	Unnamedsequence_F1-26 	#= 72	GCC GGG TCA TTT CCA GTT CCG CCG CTT CCA CGG CGG CCA TGT CGG ACA CCT CGC CCA ACG AGA ACG ATC GCG 	22028.05
N14 	Unnamedsequence_F1-27 	#= 68	GCG GCG GAA CTG GAA ATG ACC CGG CAA GTC TTG CAC GCC GGG GCG CGG CAG GAC GAT GCC GAG CCG GG 	21165.50
O14 	Unnamedsequence_F1-28 	#= 48	CCA GTG CGC CGA CGC ACC GCT CAC GCC CGG CTC GGC ATC GTC CTG CCG 	14589.30
P14 	Unnamedsequence_F1-29 	#= 57	TGA GCG GTG CGT CGG CGC ACT GGG GGC AGC GGG CGC TGC AGG GCG CCC AGG CGG TGG 	17832.32
A15 	Unnamedsequence_F1-30 	#= 66	TGC GTC ATC AGG GCA ATG GCA TGA ACC AGC CGC TGC GCC GCC GCC ACC GCC TGG GCG CCC TGC AGC 	20224.89
B15 	Unnamedsequence_F1-31 	#= 62	TGG TTC ATG CCA TTG CCC TGA TGA CGC AAT TCG GCC GGG CCG GTT CCA CCA ACA CGC CGC AG 	18992.14
C15 	Unnamedsequence_F1-32 	#= 52	ACA CGG CCG CCG ACA ACG AGG CCG CTT CCT GCG GCG TGT TGG TGG AAC CGG C 	16033.23
D15 	Unnamedsequence_F1-33 	#= 60	GGC CTC GTT GTC GGC GGC CGT GTT CGG CTT GGG CGA GGC CAG CAG CGC CGT GGC CGA AAC 	18583.82
E15 	Unnamedsequence_F1-34 	#= 68	AAA CCG CCG GCC CAG CGC GAA GAC CCG CGG AAA AAA CCG CTC ACG GTT TCG GCC ACG GCG CTG CTG GC 	20893.35
F15 	Unnamedsequence_F1-35 	#= 62	TCT TCG CGC TGG GCC GGC GGT TTC GGC GTG GCT GGC GGC GCG ATG GCG CTG GGA GGC GGC AT 	19320.25
G15 	Unnamedsequence_F1-36 	#= 54	CAA CGA CAT CCC GGC GCC AAC GGC CGC GGC GAT GCC GCC TCC CAG CGC CAT CGC 	16430.49
H15 	Unnamedsequence_F1-37 	#= 49	GCC GTT GGC GCC GGG ATG TCG TTG ACC GAT GAC GCG CCG GCC GGA CAG A 	15181.69
I15 	Unnamedsequence_F1-38 	#= 68	TTC CAC CTG TCA ACT GCA GCG CGA TCT CGG CGC CGG CGG CGG CCT TCT GTC CGG CCG GCG CGT CAT CG 	20822.23
J15 	Unnamedsequence_F1-39 	#= 67	GAG ATC GCG CTG CAG TTG ACA GGT GGA ACG GTC GAG CTG GCT TCT TCC ATC GCG TTG GCG CTG GCC G 	20755.22
K15 	Unnamedsequence_F1-40 	#= 61	CCG GCC ACC TGC AAG CCG CTG GTC ACG CCG CGC GCC GCG GCC AGC GCC AAC GCG ATG GAA G 	18718.93
L15 	Unnamedsequence_F1-41 	#= 85	ACC AGC GGC TTG CAG GTG GCC GGG GCG TCG GCC GGG GCG GCT GCC GGC GCA TTG GCC GCG GCG CTC AGT CCC ATG GAG ATT TAC G 	26370.74
M15 	Unnamedsequence_F1-42 	#= 39	CGT AAA TCT CCA TGG GAC TGA GCG CCG CGG CCA ATG CGC 	11978.69
N15 	Unnamedsequence_F2-0 	#= 29	CAC CAG GCC GTA AAT CTC CAT GGG ACT GA 	8871.74
O15 	Unnamedsequence_F2-1 	#= 69	TCA GTC CCA TGG AGA TTT ACG GCC TGG TGC AGC AAT CGC ACT ATG CGG ATC AGC TGG ACA AGC TGG CGC 	21302.63
P15 	Unnamedsequence_F2-2 	#= 69	GGC CAG CAA GGC GTC GCC CTC GTA ACC GTA TGC GCT CGA TTC CTG CGC CAG CTT GTC CAG CTG ATC CGC 	21102.45
A16 	Unnamedsequence_F2-3 	#= 52	ACG AGG GCG ACG CCT TGC TGG CCC AGC TGT ATC GCG ACA AGA CGG CCG CCG A 	16026.25
B16 	Unnamedsequence_F2-4 	#= 70	GCC CCC ACC GTG CTC AGG ACG GCG GAG ACG CCG GCG ACG GCG CCC TCG GCG GCC GTC TTG TCG CGA TAC A 	21517.69
C16 	Unnamedsequence_F2-5 	#= 68	GCC GTC CTG AGC ACG GTG GGG GCG GCG GTG TCG ATC GCC GCG GCG GCC AGC GTG GTA GGG GCC CCG GT 	21178.43
D16 	Unnamedsequence_F2-6 	#= 59	TTG AGA GCC CCG GTC AGC AAG GAA GTG ACC ACC GCC ACC GGG GCC CCT ACC ACG CTG GC 	18098.57
E16 	Unnamedsequence_F2-7 	#= 69	TCA CTT CCT TGC TGA CCG GGG CTC TCA ACG GCA TCC TGC GCG GCG TGC AGC AGC CCA TCA TCG AAA AGC 	21119.49
F16 	Unnamedsequence_F2-8 	#= 61	AGC TCG TCG ATC TTG CGA GCG TAA TCG TTG GCC AGC TTT TCG ATG ATG GGC TGC TGC ACG C 	18810.01
G16 	Unnamedsequence_F2-9 	#= 63	AAC GAT TAC GCT CGC AAG ATC GAC GAG CTG GGC GGG CCG CAA GCG TAC TTC GAG AAA AAC CTG 	19484.50
H16 	Unnamedsequence_F2-10 	#= 67	AGG CCG TCC GAA TTG GCC AGT TGT TCG TGA CGC GCC TGC AGG TTT TTC TCG AAG TAC GCT TGC GGC C 	20640.16
I16 	Unnamedsequence_F2-11 	#= 63	CGA ACA ACT GGC CAA TTC GGA CGG CCT ACG GAA AAT GCT GGC CGA CCT GCA GGC CGG TTG GAA 	19476.48
J16 	Unnamedsequence_F2-12 	#= 66	TTG GAA ATC TCT GTC GTC TGC ACC CCG ATC ACG CTG CTG GCG TTC CAA CCG GCC TGC AGG TCG GCC 	20185.87
K16 	Unnamedsequence_F2-13 	#= 67	GAT CGG GGT GCA GAC GAC AGA GAT TTC CAA GTC GGC GCT CGA ACT GGC CGC CAT TAC CGG CAA CGC G 	20704.24
L16 	Unnamedsequence_F2-14 	#= 59	CGG TCC ACG AAC ACG TCG ACG GAT TTC AGG TTG TCC GCG TTG CCG GTA ATG GCG GCC AG 	18220.64
M16 	Unnamedsequence_F2-15 	#= 52	TGA AAT CCG TCG ACG TGT TCG TGG ACC GCT TCG TCC AGG GCG AGC GGG TGG C 	16109.28
N16 	Unnamedsequence_F2-16 	#= 53	CGG CGA CGT CGA GGA CCA CCG GCT GGC CGG CCA CCC GCT CGC CCT GGA CGA AG 	16277.38
O16 	Unnamedsequence_F2-17 	#= 54	GCC GGT GGT CCT CGA CGT CGC CGC CGG CGG CAT CGA TAT CGC CAG CCG CAA GGG 	16627.60
P16 	Unnamedsequence_F2-18 	#= 64	CGG CCA GCG GCG TGA TGA ACG TCA GCG CCG GCC GCT CGC CCT TGC GGC TGG CGA TAT CGA TGC C 	19708.55
A17 	Unnamedsequence_F2-19 	#= 60	CTG ACG TTC ATC ACG CCG CTG GCC GCG CCA GGA GAA GAG CAG CGC CGG CGC ACG AAA ACG 	18500.84
