where	code	length	seq	monoisotopic_mass
B17 	Unnamedsequence_F2-20 	#= 65	CTT GCC CAC GAT CTC GAC GAA TGT GGT GAA TTC GCT CTT GCC CGT TTT CGT GCG CCG GCG CTG CT 	19908.69
C17 	Unnamedsequence_F2-21 	#= 73	TCA CCA CAT TCG TCG AGA TCG TGG GCA AGC AGG ACC GCT GGC GCA TCC GGG ACG GCG CGG CCG ACA CCA CCA T 	22464.34
D17 	Unnamedsequence_F2-22 	#= 55	CGA CCA GTT GCG ACA CCA CCT TGG CCA GAT CGA TGG TGG TGT CGG CCG CGC CGT C 	16905.79
E17 	Unnamedsequence_F2-23 	#= 68	GGC CAA GGT GGT GTC GCA ACT GGT CGA CGC CAA TGG CGT GCT CAA GCA CAG CAT CAA ACT GGA TGT GA 	21071.49
F17 	Unnamedsequence_F2-24 	#= 66	ATT GGC AAG CAC GAC GTC ATC GCC ATC TCC GCC GAT CAC ATC CAG TTT GAT GCT GTG CTT GAG CAC 	20200.93
G17 	Unnamedsequence_F2-25 	#= 62	AGA TGG CGA TGA CGT CGT GCT TGC CAA TGC TTC GCG CAT CCA TTA TGA CGG CGG CGC GGG CA 	19167.24
H17 	Unnamedsequence_F2-26 	#= 62	ATC CTG TCG ACC CAG GGC GGC ATA GCT GAC CGT GTT GGT GCC CGC GCC GCC GTC ATA ATG GA 	19088.18
I17 	Unnamedsequence_F2-27 	#= 57	GCT ATG CCG CCC TGG GTC GAC AGG ATT CCA TTA CCG TGT CCG CCG ACG GGG AAC GTT 	17538.20
J17 	Unnamedsequence_F2-28 	#= 65	GCG ATA CAC GTT GGC GTT GTT CAA CTG CTT GCG CAC GTT GAA ACG TTC CCC GTC GGC GGA CAC GG 	20024.79
K17 	Unnamedsequence_F2-29 	#= 72	AGC AGT TGA ACA ACG CCA ACG TGT ATC GCG AAG GCG TGG CTA CCC AGA CAA CCG CCT ACG GCA AGC GCA CGG 	22200.23
L17 	Unnamedsequence_F2-30 	#= 66	GCC CGA CAC GGG CCA GCT CGA CAT GGC GGT ATT GGA CAT TCT CCG TGC GCT TGC CGT AGG CGG TTG 	20370.98
M17 	Unnamedsequence_F2-31 	#= 51	ATG TCG AGC TGG CCC GTG TCG GGC AAC TGG TGG AGG TCG ACA CGC TCG AGC 	15814.10
N17 	Unnamedsequence_F2-32 	#= 55	GCC GGC CCC GCC GAT GAT GTG CTG CAC ATG CTC GAG CGT GTC GAC CTC CAC CAG T 	16825.74
O17 	Unnamedsequence_F2-33 	#= 69	AGC ACA TCA TCG GCG GGG CCG GCA ACG ATT CGA TCA CCG GCA ATG CGC ACG ACA ACT TCC TAG CCG GCG 	21211.57
P17 	Unnamedsequence_F2-34 	#= 57	GGC GCC GCC ATC CAG CCT GTC GTC GCC CGA CCC GCC GGC TAG GAA GTT GTC GTG CGC 	17461.12
A18 	Unnamedsequence_F2-35 	#= 59	ACG ACA GGC TGG ATG GCG GCG CCG GCA ACG ACA CCC TGG TTG GCG GCG AGG GCC AAA AC 	18307.70
B18 	Unnamedsequence_F2-36 	#= 60	AGG AAT ACG TCG TCG CCG GCG CCG CCG ATG ACC GTG TTT TGG CCC TCG CCG CCA ACC AGG 	18415.75
C18 	Unnamedsequence_F2-37 	#= 56	CGG CGC CGG CGA CGA CGT ATT CCT GCA GGA CCT GGG GGT ATG GAG CAA CCA GCT CG 	17333.07
D18 	Unnamedsequence_F2-38 	#= 54	TCA CGG TAT CGA CGC CCG CGC CGC CAT CGA GCT GGT TGC TCC ATA CCC CCA GGT 	16456.51
E18 	Unnamedsequence_F2-39 	#= 52	CGG CGC GGG CGT CGA TAC CGT GAA GTA CAA CGT GCA CCA GCC TTC CGA GGA G 	16065.28
F18 	Unnamedsequence_F2-40 	#= 59	GGA TGC CCG TGT CGC CCA TGC GTT CGA GGC GCT CCT CGG AAG GCT GGT GCA CGT TGT AC 	18203.60
G18 	Unnamedsequence_F2-41 	#= 54	GAA CGC ATG GGC GAC ACG GGC ATC CAT GCC GAT CTT CAA AAG GGC ACG GTC GAG 	16715.72
H18 	Unnamedsequence_F2-42 	#= 68	TGA CAT GGT CGA CGC TGA ACA GGT TCA GGG CCG GCC ACT TCT CGA CCG TGC CCT TTT GAA GAT CGG CA 	20940.38
I18 	Unnamedsequence_F2-43 	#= 65	CCT GAA CCT GTT CAG CGT CGA CCA TGT CAA GAA TAT CGA GAA TCT GCA CGG CTC CCG CCT GAA CG 	19914.77
J18 	Unnamedsequence_F2-44 	#= 67	GCC CCA GAG CTC GTT GTC CTG GTC GTC GCC GGC GAT GCG GTC GTT CAG GCG GGA GCC GTG CAG ATT C 	20692.16
K18 	Unnamedsequence_F2-45 	#= 53	ACG ACC AGG ACA ACG AGC TCT GGG GCC ACG ATG GCA ACG ACA CGA TAC GCG GC 	16365.51
L18 	Unnamedsequence_F2-46 	#= 58	AGG CCG CCG CGC AGG ATG TCG TCG CCG CCC CGG CCG CGT ATC GTG TCG TTG CCA TCG T 	17796.32
M18 	Unnamedsequence_F2-47 	#= 60	GAC GAC ATC CTG CGC GGC GGC CTG GGC CTG GAC ACG CTG TAT GGC GAG GAC GGC AAC GAC 	18578.86
N18 	Unnamedsequence_F2-48 	#= 67	TCG ATG TCA TCG CTG ACG GTC TCG TCG TCC TGC AGG AAG ATG TCG TTG CCG TCC TCG CCA TAC AGC G 	20569.12
O18 	Unnamedsequence_F2-49 	#= 29	GAC GAC GAG ACC GTC AGC GAT GAC ATC GA 	8945.79
P18 	Unnamedsequence_F3-0 	#= 25	GCC GCC GTC GAT GTC ATC GCT GAC G 	7634.91
A19 	Unnamedsequence_F3-1 	#= 52	CGT CAG CGA TGA CAT CGA CGG CGG CGC GGG GCT GGA CAC CGT CGA CTA CTC C 	16017.23
B19 	Unnamedsequence_F3-2 	#= 58	GGC GCA ACG ATC CTG CCT GGA TGG ATC ATG GCG GAG TAG TCG ACG GTG TCC AGC CCC G 	17941.46
C19 	Unnamedsequence_F3-3 	#= 56	GAT CCA TCC AGG CAG GAT CGT TGC GCC GCA TGA ATA CGG CTT CGG GAT CGA GGC GG 	17347.09
D19 	Unnamedsequence_F3-4 	#= 62	GCG GAC GCC TTG CGC ACC CAT TCC CTG GAC AGG TCC GCC TCG ATC CCG AAG CCG TAT TCA TG 	18928.09
E19 	Unnamedsequence_F3-5 	#= 57	GGA ATG GGT GCG CAA GGC GTC CGC GCT GGG CGT GGA CTA TTA CGA TAA TGT CCG CAA 	17715.34
F19 	Unnamedsequence_F3-6 	#= 63	CCT TCA TGC TCG TAC CGA TGA CGT TTT CGA CAT TGC GGA CAT TAT CGT AAT AGT CCA CGC CCA 	19243.34
G19 	Unnamedsequence_F3-7 	#= 63	GTC GAA AAC GTC ATC GGT ACG AGC ATG AAG GAT GTG CTC ATC GGC GAC GCG CAA GCC AAT ACC 	19459.49
H19 	Unnamedsequence_F3-8 	#= 52	GTA TCG TCG CCG CCC TGG CCC ATC AGG GTA TTG GCT TGC GCG TCG CCG ATG A 	15980.19
I19 	Unnamedsequence_F3-9 	#= 61	TGA TGG GCC AGG GCG GCG ACG ATA CCG TGC GCG GCG GCG ACG GCG ATG ATC TGC TGT TCG G 	19001.10
J19 	Unnamedsequence_F3-10 	#= 72	GGT GTC GTT GCC GGC GTC GCC ATA CAG CAT GTC GTT GCC GTC GCC GCC GAA CAG CAG ATC ATC GCC GTC GCC 	22090.07
K19 	Unnamedsequence_F3-11 	#= 56	GTA TGG CGA CGC CGG CAA CGA CAC CCT CTA CGG GGG GCT GGG CGA CGA TAC CCT TG 	17293.05
L19 	Unnamedsequence_F3-12 	#= 66	CGC CTG CGT CTG GCC GAA CCA ATC GTT GCC CGC GCC GCC TTC AAG GGT ATC GTC GCC CAG CCC CCC 	20061.78
M19 	Unnamedsequence_F3-13 	#= 60	CGA TTG GTT CGG CCA GAC GCA GGC GCG CGA GCA TGA CGT GCT GCG CGG CGG AGA TGG GGT 	18720.93
N19 	Unnamedsequence_F3-14 	#= 56	TGC GCG CCG GTC TGG CTG TAA TCG ACG GTA TCC ACC CCA TCT CCG CCG CGC AGC AC 	17074.90
O19 	Unnamedsequence_F3-15 	#= 67	TCG ATT ACA GCC AGA CCG GCG CGC ATG CCG GCA TTG CCG CGG GTC GCA TCG GGC TGG GCA TCC TGG C 	20655.15
P19 	Unnamedsequence_F3-16 	#= 68	TGC CGG CCT CGC CCA GCT TGT CGA CGC GGC CGG CGC CCA GGT CAG CCA GGA TGC CCA GCC CGA TGC GA 	20859.28
A20 	Unnamedsequence_F3-17 	#= 67	CGA CAA GCT GGG CGA GGC CGG CAG CAG CGC CTA CGA TAC GGT TTC CGG TAT CGA GAA CGT GGT GGG C 	20816.29
B20 	Unnamedsequence_F3-18 	#= 56	CGC CCG TGA TGC GGT CGG CCA GTT CCG TGC CCA CCA CGT TCT CGA TAC CGG AAA CC 	17098.92
C20 	Unnamedsequence_F3-19 	#= 46	ACT GGC CGA CCG CAT CAC GGG CGA TGC GCA GGC CAA CGT GCT GCG C 	14148.05
D20 	Unnamedsequence_F3-20 	#= 61	CCC TCG CCG CCC GCA AGC ACG TCG GCG CCA CCC GCG CCG CGC AGC ACG TTG GCC TGC GCA T 	18556.81
E20 	Unnamedsequence_F3-21 	#= 64	GAC GTG CTT GCG GGC GGC GAG GGC GAC GAT GTG CTG CTG GGC GGC GAC GGC GAC GAC CAG CTG T 	19973.70
F20 	Unnamedsequence_F3-22 	#= 68	CGT CAC CGG CTT CGC CGT ACA AGC GAT CGC GTC CGG CGT CGC CCG ACA GCT GGT CGT CGC CGT CGC CG 	20816.24
G20 	Unnamedsequence_F3-23 	#= 57	CGC TTG TAC GGC GAA GCC GGT GAC GAC TGG TTC TTC CAG GAT GCC GCC AAT GCC GGC 	17563.21
H20 	Unnamedsequence_F3-24 	#= 64	ATC CAC GGT ATC GCG GCC GTC GCC GCC GTC GAG CAG ATT GCC GGC ATT GGC GGC ATC CTG GAA G 	19731.58
I20 	Unnamedsequence_F3-25 	#= 70	GGC GAC GGC CGC GAT ACC GTG GAT TTC AGC GGC CCG GGC CGG GGC CTC GAC GCC GGC GCA AAG GGC GTA T 	21701.81
J20 	Unnamedsequence_F3-26 	#= 58	ATC AGG CTG GCG AAC CCC TTG CCC AAG CTC AGG AAT ACG CCC TTT GCG CCG GCG TCG A 	17765.36
K20 	Unnamedsequence_F3-27 	#= 56	TTG GGC AAG GGG TTC GCC AGC CTG ATG GAC GAA CCC GAA ACC AGC AAC GTG TTG CG 	17340.11
L20 	Unnamedsequence_F3-28 	#= 68	GCA CGT CAT CAC GCG CGC TGC CCA CGG CGT TCT CGA TAT TGC GCA ACA CGT TGC TGG TTT CGG GTT CG 	20874.31
M20 	Unnamedsequence_F3-29 	#= 68	GGG CAG CGC GCG TGA TGA CGT GCT GAT CGG CGA CGC AGG CGC CAA CGT CCT CAA TGG CCT GGC GGG CA 	21082.43
N20 	Unnamedsequence_F3-30 	#= 66	CAG CAG CAC ATC GTC GCC AGC GCC GCC GGA CAG CAC GTC GTT GCC CGC CAG GCC ATT GAG GAC GTT 	20247.93
O20 	Unnamedsequence_F3-31 	#= 54	GGC GCT GGC GAC GAT GTG CTG CTG GGC GAC GAG GGC TCG GAC CTG CTC AGC GGC 	16778.68
P20 	Unnamedsequence_F3-32 	#= 62	TCG CCC TGC CCG CCG AAC AGA TCG TCG TTG CCC GCA TCG CCG CTG AGC AGG TCC GAG CCC TC 	18890.04
A21 	Unnamedsequence_F3-33 	#= 62	CGA TCT GTT CGG CGG GCA GGG CGA TGA TAC TTA TCT GTT CGG GGT CGG GTA CGG GCA CGA CA 	19278.30
B21 	Unnamedsequence_F3-34 	#= 52	TCA TGG CCG CCG CCC GAT TCG TAG ATC GTG TCG TGC CCG TAC CCG ACC CCG A 	15854.12
C21 	Unnamedsequence_F3-35 	#= 54	ATC TAC GAA TCG GGC GGC GGC CAT GAC ACC ATC CGC ATC AAC GCG GGG GCG GAC 	16652.66
D21 	Unnamedsequence_F3-36 	#= 51	CGT TGC CCT GGC GCG CGA ACC ACA GCT GGT CCG CCC CCG CGT TGA TGC GGA 	15630.97
E21 	Unnamedsequence_F3-37 	#= 65	GTG GTT CGC GCG CCA GGG CAA CGA CCT GGA GAT CCG CAT TCT CGG CAC CGA CGA TGC ACT TAC CG 	19988.77
F21 	Unnamedsequence_F3-38 	#= 69	GAT TTC CAC CCG GTG ATC GGC GTC GCG ATA CCA GTC GTG CAC GGT AAG TGC ATC GTC GGT GCC GAG AAT 	21309.61
G21 	Unnamedsequence_F3-39 	#= 69	GCG ACG CCG ATC ACC GGG TGG AAA TCA TCC ATG CCG CCA ACC AGG CGG TAG ACC AGG CAG GCA TCG AAA 	21293.64
H21 	Unnamedsequence_F3-40 	#= 56	CGG ATA CTG CGC CAT TGC CTC GAC CAG CTT TTC GAT GCC TGC CTG GTC TAC CGC CT 	17045.88
I21 	Unnamedsequence_F3-41 	#= 50	CTG GTC GAG GCA ATG GCG CAG TAT CCG GAC CCC GGC GCG GCG GCG GCT GC 	15471.86
J21 	Unnamedsequence_F3-42 	#= 60	CTG CAT CAG CGT GTC CGG CAC GCG CGC CGC CGG CGG GGC AGC CGC CGC CGC GCC GGG GTC 	18460.71
K21 	Unnamedsequence_F3-43 	#= 72	CGC GTG CCG GAC ACG CTG ATG CAG TCC CTG GCT GTC AAC TGG CGC CAC CAC CAC CAC CAC CAC TGA GGA TCC 	21966.03
L21 	Unnamedsequence_F3-44 	#= 35	GGA TCC TCA GTG GTG GTG GTG GTG GTG GCG CCA GT 	10946.99
M21 	Unnamedsequence_F1-F_(pTZ/F) 	#= 39	CGA CGG GCC CGG GAT CCG ATG GGA ATT GTG AGC GGA TAA 	12162.81
N21 	Unnamedsequence_F1-R_(pTZ/F) 	#= 40	CCT CGC GAA TGC ATC TAG ATC GTA AAT CTC CAT GGG ACT G 	12255.90
O21 	Unnamedsequence_F2-F_(pTZ/F) 	#= 40	CGA CGG GCC CGG GAT CCG ATT CAG TCC CAT GGA GAT TTA C 	12297.90
P21 	Unnamedsequence_F2-R_(pTZ/F) 	#= 37	CCT CGC GAA TGC ATC TAG ATT CGA TGT CAT CGC TGA C 	11300.28
A22 	Unnamedsequence_F3-F_(pTZ/F) 	#= 37	CGA CGG GCC CGG GAT CCG ATC GTC AGC GAT GAC ATC G 	11401.32
B22 	Unnamedsequence_F3-R_(pTZ/F) 	#= 37	CCT CGC GAA TGC ATC TAG ATG GAT CCT CAG TGG TGG T 	11396.32
C22 	pTZ_F 	#= 20	ATC GGA TCC CGG GCC CGT CG 	6094.93
D22 	pTZ_R 	#= 28	ATC TAG ATG CAT TCG CGA GGT ACC GAG C 	8613.57
E22 	16S_v3-4_seqprimerminus_F=5 	#= 31	TCG TCG GCA GCG TCC CTA CGG GNG GCW GCA G 	NaN
F22 	16S_v3-4_seqprimerminus_F=5 	#= 31	TCG TCG GCA GCG TCC CTA CGG GNG GCW GCA G 	NaN
G22 	16S-v3-4_seqprimerminus_R=5 	#= 36	GTC TCG TGG GCT CGG GAC TAC HVG GGT ATC TAA TCC 	NaN
H22 	16S-v3-4_seqprimerminus_R=5 	#= 36	GTC TCG TGG GCT CGG GAC TAC HVG GGT ATC TAA TCC 	NaN
I22 	InfA-BC01/2F 	#= 58	GGT GCT GAA GAA AGT TGT CGG TGT CTT TGT GTT AAC CTA gTC Agg CAg CAA AAg CAg g 	18056.59
J22 	unitail-oxford 	#= 27	TTA ACC TAg TCA ggC AgC AAA AgC Agg 	8326.42
K22 	InfA_-BC01/2R 	#= 59	GGT GCT GAA GAA AGT TGT CGG TGT CTT TGT GTT AAC CTA gAA Agg gAg TAg AAA CAA gg 	18457.87
L22 	Runitail-oxford 	#= 28	TTA ACC TAg AAA ggg AgT AgA AAC AAg g 	8727.70
M22 	InfA_-BC02/2F 	#= 58	GGT GCT GTC GAT TCC GTT TGT AGT CGT CTG TTT AAC CTA gTC Agg CAg CAA AAg CAg g 	17934.49
N22 	InfA_-BC02/2R 	#= 59	GGT GCT GTC GAT TCC GTT TGT AGT CGT CTG TTT AAC CTA gAA Agg gAg TAg AAA CAA gg 	18335.77
O22 	Alpha_1000_1_LEFT 	#= 26	GGA TAG TGC GTC TCA TTC TTT AGA CT 	7967.15
P22 	Alpha_1000_1__RIGHT 	#= 22	CCA GTC ACC AAC ACT CCA TTG T 	6599.30
A23 	Alpha_1000_2_LEFT 	#= 24	TGC CAA AGT CTA CAA AAG CAT TGG 	7369.81
B23 	Alpha_1000_2_RIGHT 	#= 22	CTG GAG ATA GGG ACA GGC TCA T 	6824.43
C23 	Alpha_400_1_LEFT 	#= 22	TGT GGT TCT GAT GGC AAA CCT G 	6781.39
D23 	Alpha_400_1__RIGHT 	#= 20	TTC CAG TCA CCC ACA CTC CA 	5941.87
E23 	Alpha_400_2_LEFT 	#= 25	AGA CCT GTT TTC TTT CAT GCT CTC A 	7548.89
F23 	Alpha_400_2_RIGHT 	#= 23	CAC ACT TTC ACT GAA ATC GCC AC 	6912.50
G23 	InfA-BC01/2F 	#= 58	GGT GCT GAA GAA AGT TGT CGG TGT CTT TGT GTT AAC CTA gTC Agg CAg CAA AAg CAg g 	18056.59
H23 	unitail-oxford 	#= 27	TTA ACC TAg TCA ggC AgC AAA AgC Agg 	8326.42
I23 	InfA_-BC01/2R 	#= 59	GGT GCT GAA GAA AGT TGT CGG TGT CTT TGT GTT AAC CTA gAA Agg gAg TAg AAA CAA gg 	18457.87
J23 	Runitail-oxford 	#= 28	TTA ACC TAg AAA ggg AgT AgA AAC AAg g 	8727.70
K23 	InfA_-BC02/2F 	#= 58	GGT GCT GTC GAT TCC GTT TGT AGT CGT CTG TTT AAC CTA gTC Agg CAg CAA AAg CAg g 	17934.49
L23 	InfA_-BC02/2R 	#= 59	GGT GCT GTC GAT TCC GTT TGT AGT CGT CTG TTT AAC CTA gAA Agg gAg TAg AAA CAA gg 	18335.77
