;where;code;seq;-;--;length;Nucleic Acid(ng/uL);Unnamed: 7;monoisotopic_mass;pM/mkl;score;mkl;quantile;pmol;final conc, pmol/mkl;target_well
33;K19;Sema_SUMO_F0-0;TGC CCA TGG TAT ATC TCC TTC TTA;(DMT OFF);Nikiteev;#= 24;1220,494;;7244,69;168,4673878;True;5;7;842,3369392;8,1;1
34;L19;Sema_SUMO_F0-1;TAA GAA GGA GAT ATA CCA TGG GCA GCA GCC ATC ATC ATC ATC ATC A;(DMT OFF);Nikiteev;#= 46;2343,218;;14144,15;165,6669365;True;5;7;828,3346825;7,96;1
35;M19;Sema_SUMO_F0-2;GAC ATG CTA GCG CTG CCG CGC GGC ACC AGG CCG CTG CCG TGA TGA TGA TGA TGA TGG CTG C;(DMT OFF);Nikiteev;#= 61;1961,881;;18864,04;104,0011047;True;8;1;832,008838;8;1
36;N19;Sema_SUMO_F0-3;GCG GCA GCG CTA GCA TGT CGG ACT CAG AAG TCA ATC AAG AAG CTA AGC CAG AGG T;(DMT OFF);Nikiteev;#= 55;1896,732;;17051,97;111,2324265;True;8;1;889,8594121;8,56;1
37;O19;Sema_SUMO_F0-4;CTC AGG CTT GAC TTC TGG CTT GAC CTC TGG CTT AGC TTC TTG AT;(DMT OFF);Nikiteev;#= 44;2526,386;;13437,6;188,0087218;False;4;;752,0348872;7,23;1
38;P19;Sema_SUMO_F0-5;AGC CAG AAG TCA AGC CTG AGA CTC ACA TCA ATT TAA AGG TGT CCG ATG GAT CTT C;(DMT OFF);Nikiteev;#= 55;2244,239;;16926,9;132,5841708;True;6;4;795,5050245;7,65;1
39;A20;Sema_SUMO_F0-6;GAG TGG TCT TTT TGA TCT TGA AGA AGA TCT CTG AAG ATC CAT CGG ACA CCT TTA AA;(DMT OFF);Nikiteev;#= 56;2473,172;;17267,12;143,2301391;True;6;5;859,3808348;8,26;1
40;B20;Sema_SUMO_F0-7;CTT CTT CAA GAT CAA AAA GAC CAC TCC TTT AAG AAG GCT GAT GGA AGC GT;(DMT OFF);Nikiteev;#= 50;1985,68;;15385,93;129,058172;True;6;3;774,3490319;7,45;1
41;C20;Sema_SUMO_F0-8;AGT CCA TTT CCT TAC CCT GTC TTT TAG CGA ACG CTT CCA TCA GCC TTC TT;(DMT OFF);Nikiteev;#= 50;1866,755;;15114,69;123,5060064;True;7;2;864,5420449;8,31;1
42;D20;Sema_SUMO_F0-9;AAG ACA GGG TAA GGA AAT GGA CTC CTT AAG ATT CTT GTA CGA CGG TAT TAG AAT TCA;(DMT OFF);Nikiteev;#= 57;2137,305;;17687,41;120,8376467;True;7;2;845,8635267;8,13;1
43;E20;Sema_SUMO_F0-10;TTA TCC TCC ATG TCC AAA TCT TCA GGG GTC TGA TCA GCT TGA ATT CTA ATA CCG TCG TAC AAG AA;(DMT OFF);Nikiteev;#= 65;2595,952;;19907,8;130,3987382;True;6;4;782,3924291;7,52;1
44;F20;Sema_SUMO_F0-11;CTG AAG ATT TGG ACA TGG AGG ATA ACG ATA TTA TTG AGG CTC ACA GAG AAC AGA TTG GTG;(DMT OFF);Nikiteev;#= 60;2940,177;;18715,05;157,1022786;True;5;6;785,5113932;7,55;1
45;G20;Sema_SUMO_F0-12;CAC ATC GCT GGT AAA GGT GCC CTC ACC ACC AAT CTG TTC TCT GTG AGC;(DMT OFF);Nikiteev;#= 48;1943,113;;14639,4;132,7317376;True;6;5;796,3904258;7,66;1
46;H20;Sema_SUMO_F0-13;GCA CCT TTA CCA GCG ATG TGA GCA GTT ATC TGG AGG GCC AGG C;(DMT OFF);Nikiteev;#= 43;1277,705;;13284,52;96,17998994;True;8;1;769,4399195;7,4;1
47;I20;Sema_SUMO_F0-14;ACC AGC CAC GCG ATA AAC TCT TTC GCC GCC TGG CCC TCC AGA TAA C;(DMT OFF);Nikiteev;#= 46;1840,336;;13944,96;131,9714076;True;6;4;791,8284455;7,61;1
48;J20;Sema_SUMO_F0-15;AGT TTA TCG CGT GGC TGG TCC GTG GCC GCG GTT GAT CCG GCT GCT AAC AAA G;(DMT OFF);Nikiteev;#= 52;2078,888;;16083,28;129,2577136;True;6;3;775,5462816;7,46;1
49;K20;Sema_SUMO_F0-16;CTT TGT TAG CAG CCG GAT CAA CCG;(DMT OFF);Nikiteev;#= 24;1172,365;;7328,75;159,9679345;True;5;6;799,8396725;7,69;1
