;where;code;seq;-;--;length;Nucleic Acid(ng/uL);Unnamed: 7;monoisotopic_mass;pM/mkl;score;mkl;quantile;pmol;final conc, pmol/mkl;target_well
52;N20;Sema_SUMO_F0-0;TGC CCA TGG TAT ATC TCC TTC TTA;(DMT ON);Nikiteev;#= 24;1041,257;;7244,69;143,7269228;True;5;5;718,6346138;6,65;1
53;O20;Sema_SUMO_F0-1;TAA GAA GGA GAT ATA CCA TGG GCA GCA GCC ATC ATC ATC ATC ATC A;(DMT ON);Nikiteev;#= 46;2144,991;;14144,15;151,6521672;True;5;7;758,2608358;7,02;1
54;P20;Sema_SUMO_F0-2;GAC ATG CTA GCG CTG CCG CGC GGC ACC AGG CCG CTG CCG TGA TGA TGA TGA TGA TGG CTG C;(DMT ON);Nikiteev;#= 61;1981,885;;18864,04;105,0615351;True;8;1;840,4922806;7,78;1
55;A21;Sema_SUMO_F0-3;GCG GCA GCG CTA GCA TGT CGG ACT CAG AAG TCA ATC AAG AAG CTA AGC CAG AGG T;(DMT ON);Nikiteev;#= 55;2290,719;;17051,97;134,3374988;True;6;4;806,024993;7,46;1
56;B21;Sema_SUMO_F0-4;CTC AGG CTT GAC TTC TGG CTT GAC CTC TGG CTT AGC TTC TTG AT;(DMT ON);Nikiteev;#= 44;1938,558;;13437,6;144,2637078;True;5;5;721,318539;6,68;1
57;C21;Sema_SUMO_F0-5;AGC CAG AAG TCA AGC CTG AGA CTC ACA TCA ATT TAA AGG TGT CCG ATG GAT CTT C;(DMT ON);Nikiteev;#= 55;2646,249;;16926,9;156,3339418;True;5;7;781,6697092;7,24;1
58;D21;Sema_SUMO_F0-6;GAG TGG TCT TTT TGA TCT TGA AGA AGA TCT CTG AAG ATC CAT CGG ACA CCT TTA AA;(DMT ON);Nikiteev;#= 56;2332,931;;17267,12;135,1082867;True;6;4;810,6497204;7,51;1
59;E21;Sema_SUMO_F0-7;CTT CTT CAA GAT CAA AAA GAC CAC TCC TTT AAG AAG GCT GAT GGA AGC GT;(DMT ON);Nikiteev;#= 50;1119,133;;15385,93;72,73742959;False;11;;800,1117255;7,41;1
60;F21;Sema_SUMO_F0-8;AGT CCA TTT CCT TAC CCT GTC TTT TAG CGA ACG CTT CCA TCA GCC TTC TT;(DMT ON);Nikiteev;#= 50;2116,179;;15114,69;140,0080981;True;6;4;840,0485885;7,78;1
61;G21;Sema_SUMO_F0-9;AAG ACA GGG TAA GGA AAT GGA CTC CTT AAG ATT CTT GTA CGA CGG TAT TAG AAT TCA;(DMT ON);Nikiteev;#= 57;1943,091;;17687,41;109,857294;True;7;2;769,0010578;7,12;1
62;H21;Sema_SUMO_F0-10;TTA TCC TCC ATG TCC AAA TCT TCA GGG GTC TGA TCA GCT TGA ATT CTA ATA CCG TCG TAC AAG AA;(DMT ON);Nikiteev;#= 65;1913,637;;19907,8;96,12498619;True;8;1;768,9998895;7,12;1
63;I21;Sema_SUMO_F0-11;CTG AAG ATT TGG ACA TGG AGG ATA ACG ATA TTA TTG AGG CTC ACA GAG AAC AGA TTG GTG;(DMT ON);Nikiteev;#= 60;2092,051;;18715,05;111,7844195;True;7;3;782,4909364;7,25;1
64;J21;Sema_SUMO_F0-12;CAC ATC GCT GGT AAA GGT GCC CTC ACC ACC AAT CTG TTC TCT GTG AGC;(DMT ON);Nikiteev;#= 48;1549,823;;14639,4;105,8665656;True;7;2;741,065959;6,86;1
65;K21;Sema_SUMO_F0-13;GCA CCT TTA CCA GCG ATG TGA GCA GTT ATC TGG AGG GCC AGG C;(DMT ON);Nikiteev;#= 43;1695,12;;13284,52;127,6011478;True;7;3;893,2080346;8,27;1
66;L21;Sema_SUMO_F0-14;ACC AGC CAC GCG ATA AAC TCT TTC GCC GCC TGG CCC TCC AGA TAA C;(DMT ON);Nikiteev;#= 46;2025,56;;13944,96;145,2539125;True;5;6;726,2695626;6,72;1
67;M21;Sema_SUMO_F0-15;AGT TTA TCG CGT GGC TGG TCC GTG GCC GCG GTT GAT CCG GCT GCT AAC AAA G;(DMT ON);Nikiteev;#= 52;2548,469;;16083,28;158,4545565;True;5;7;792,2727827;7,34;1
68;N21;Sema_SUMO_F0-16;CTT TGT TAG CAG CCG GAT CAA CCG;(DMT ON);Nikiteev;#= 24;1109,949;;7328,75;151,4513389;True;5;6;757,2566945;7,01;1
