where	code	length	seq	monoisotopic_mass
B11 	NAD_Ligase-9 	#= 58	CGC ATT CAA CCT GGA TGA ACT GAA AGC CTT TGA GGA ACG TAT TGA ACG TGC ACT TGG C 	17905.51
C11 	NAD_Ligase-10 	#= 58	CTT GTG CTC GAC CGT ATA TGC AAA CGG GCC TTT GCG GCC AAG TGC ACG TTC AAT ACG T 	17824.42
D11 	NAD_Ligase-11 	#= 62	TTT GCA TAT ACG GTC GAG CAC AAG GTT GAT GGT TTG TCA GTT AAT CTG TAC TAT GAG GAA GG 	19272.37
E11 	NAD_Ligase-12 	#= 49	TCG CGC CAT AAA CCA GCA CAC CTT CCT CAT AGT ACA GAT TAA CTG ACA A 	14906.63
F11 	NAD_Ligase-13 	#= 43	TGT GCT GGT TTA TGG CGC GAC CGC CGG CGA TGG TGA AGT TGG T 	13393.56
G11 	NAD_Ligase-14 	#= 59	AAT GGT CGG AAT TGT CAG GAG ATT TTG CGT AAC TTC TTC ACC AAC TTC ACC ATC GCC GG 	18111.62
H11 	NAD_Ligase-15 	#= 46	AAA ATC TCC TGA CAA TTC CGA CCA TTC CAC GTC GCC TCA AAG GTG T 	13998.02
I11 	NAD_Ligase-16 	#= 44	CCG CGC ACC TCA AGA CGT TCC GGA ACA CCT TTG AGG CGA CGT GG 	13503.66
J11 	NAD_Ligase-17 	#= 58	AAC GTC TTG AGG TGC GCG GCG AAG TCT ATA TGC CGA TCG AAG CGT TCC TCC GTC TGA A 	17889.46
K11 	NAD_Ligase-18 	#= 47	GTT CGC CGC GTT CTT CCA ATT CCT CAT TCA GAC GGA GGA ACG CTT CG 	14357.20
L11 	NAD_Ligase-19 	#= 51	AAT TGG AAG AAC GCG GCG AAC GCA TCT TCA AAA ACC CAC GTA ATG CGG CCG 	15720.13
M11 	NAD_Ligase-20 	#= 40	CTT TCT GAC GCA GGC TGC CTG CGG CCG CAT TAC GTG GGT T 	12286.85
N11 	NAD_Ligase-21 	#= 50	AGG CAG CCT GCG TCA GAA AGA TCC GCG CAT CAC CGC AAA ACG TGG CCT TC 	15334.85
O11 	NAD_Ligase-22 	#= 45	AGG CCC AGC GCA TAA AAC GTT GCG CGA AGG CCA CGT TTT GCG GTG 	13911.93
P11 	NAD_Ligase-23 	#= 59	ACG TTT TAT GCG CTG GGC CTG GGT CTG GAA GAG GTT GAA CGC GAA GGT GTT GCC ACC CA 	18314.71
A12 	NAD_Ligase-24 	#= 44	TTT CAG CCA ATG AAG CAG CGC GAA TTG GGT GGC AAC ACC TTC GC 	13541.71
B12 	NAD_Ligase-25 	#= 48	GCG CTG CTT CAT TGG CTG AAA GAG AAA GGT TTC CCG GTT GAA CAT GGT 	14878.55
C12 	NAD_Ligase-26 	#= 59	CTG CTT CAA CGC CTT CTG CAC CCA CTG CGC GCG CGT AAC CAT GTT CAA CCG GGA AAC CT 	17948.49
D12 	NAD_Ligase-27 	#= 58	GTG CAG AAG GCG TTG AAG CAG TTT ATC AAG ATT GGC TGA AAA AGC GTC GTG CAC TCC C 	17970.54
E12 	NAD_Ligase-28 	#= 42	ACC ACG CCA TCC GCT TCA AAC GGG AGT GCA CGA CGC TTT TTC 	12795.22
F12 	NAD_Ligase-29 	#= 44	TTT GAA GCG GAT GGC GTG GTC GTG AAA CTG GAC GAA CTT GCC CT 	13643.75
G12 	NAD_Ligase-30 	#= 44	CGT ATA GCC CAG TTC ACG CCA GAG GGC AAG TTC GTC CAG TTT CA 	13492.67
H12 	NAD_Ligase-31 	#= 56	TGG CGT GAA CTG GGC TAT ACG GCG CGC GCG CCG CGT TTT GCG ATC GCG TAT AAA TT 	17319.07
I12 	NAD_Ligase-32 	#= 58	ATC CAG AAG ACG CGT TTC TTT TTC TTC CGC TGG AAA TTT ATA CGC GAT CGC AAA ACG C 	17766.42
J12 	NAD_Ligase-33 	#= 47	AGA AAA AGA AAC GCG TCT TCT GGA TGT TGT GTT TCA GGT TGG CCG CA 	14573.37
K12 	NAD_Ligase-34 	#= 54	GGT TCA AGA ATG CCA ACC GGC GTC ACG CGA CCG GTG CGG CCA ACC TGA AAC ACA 	16604.66
L12 	NAD_Ligase-35 	#= 51	GCC GGT TGG CAT TCT TGA ACC GGT TTT CCT GGA AGG CTC AGA GGT GTC ACG 	15769.08
M12 	NAD_Ligase-36 	#= 51	TCA ATG TAC GAT TCG TTA TGC AGG GTG ACA CGT GAC ACC TCT GAG CCT TCC 	15641.04
N12 	NAD_Ligase-37 	#= 55	CCC TGC ATA ACG AAT CGT ACA TTG AGG AAC TGG ATA TCC GCA TCG GTG ACT GGG T 	16974.90
O12 	NAD_Ligase-38 	#= 55	ACT TCC GGA ATA ACG CCA CCC GCT TTA TGA ACC AGG ACC CAG TCA CCG ATG CGG A 	16818.81
P12 	NAD_Ligase-39 	#= 44	GGG TGG CGT TAT TCC GGA AGT GCT GCG TGT GCT GAA AGA ACG CC 	13684.77
A13 	NAD_Ligase-40 	#= 42	ATC GGA CGT TCT TCA CCG GTG CGG CGT TCT TTC AGC ACA CGC 	12833.22
B13 	NAD_Ligase-41 	#= 46	CAC CGG TGA AGA ACG TCC GAT TCG TTG GCC GGA AAC GTG CCC AGA A 	14194.12
C13 	NAD_Ligase-42 	#= 48	TTA CCT TCT TTC AAA AGG CGG TGG CCA CAT TCT GGG CAC GTT TCC GGC 	14701.42
D13 	NAD_Ligase-43 	#= 59	CCA CCG CCT TTT GAA AGA AGG TAA AGT GCA CCG CTG CCC AAA TCC ACT GTG CCC GGC AA 	18054.59
E13 	NAD_Ligase-44 	#= 47	CAA AAT GAC GAA TGG CTT CGA AGC GTT TTG CCG GGC ACA GTG GAT TT 	14558.36
F13 	NAD_Ligase-45 	#= 58	GCT TCG AAG CCA TTC GTC ATT TTG CGT CAC GCA AAG CGA TGG ACA TCC AGG GCC TGG G 	17874.44
G13 	NAD_Ligase-46 	#= 54	GAC CTT TTT CCA ACA GAC GTT CGA TAA GTT TCT CGC CCA GGC CCT GGA TGT CCA 	16483.57
H13 	NAD_Ligase-47 	#= 53	TCG AAC GTC TGT TGG AAA AAG GTC TGG TTA AAG ACG TTG CAG ATC TGT ATC GC 	16426.56
I13 	NAD_Ligase-48 	#= 52	CCA GGC CCA CAA GAT CTT CCT TAC GCA GGC GAT ACA GAT CTG CAA CGT CTT T 	15868.20
J13 	NAD_Ligase-49 	#= 45	AAG GAA GAT CTT GTG GGC CTG GAG CGT ATG GGC GAA AAA TCT GCA 	14039.04
K13 	NAD_Ligase-50 	#= 58	CTT TTT CGA TTC CTC GAT TTC ACG CAG CAG GTT CTG TGC AGA TTT TTC GCC CAT ACG C 	17682.32
L13 	NAD_Ligase-51 	#= 60	GCG TGA AAT CGA GGA ATC GAA AAA GCG TGG CCT GGA ACG CCT GCT GTA TGC GTT GGG TCT 	18660.95
M13 	NAD_Ligase-52 	#= 42	AAC ACT TCG CCG ACA CCT GGG AGA CCC AAC GCA TAC AGC AGG 	12856.29
N13 	NAD_Ligase-53 	#= 57	CCA GGT GTC GGC GAA GTG TTG GCA CGT AAT CTG GCG GCG CGT TTC GGC AAC ATG GAC 	17682.30
O13 	NAD_Ligase-54 	#= 41	CAG TGA CGC CTC AAG CAA ACG GTC CAT GTT GCC GAA ACG CG 	12589.10
P13 	NAD_Ligase-55 	#= 47	CGT TTG CTT GAG GCG TCA CTG GAG GAA CTG CTG GAA GTG GAG GAG GT 	14711.42
A14 	NAD_Ligase-56 	#= 54	GTT TCC AGG ATT GCA CGC GCG GTC AGT TCA CCC ACC TCC TCC ACT TCC AGC AGT 	16405.50
B14 	NAD_Ligase-57 	#= 47	GCG CGT GCA ATC CTG GAA ACC CTG AAA GAT CCG GCG TTT CGT GAT CT 	14455.28
C14 	NAD_Ligase-58 	#= 56	CAT CTC CAC GCC CGC TTC CTT CAG GCG GCG CAC CAG ATC ACG AAA CGC CGG ATC TT 	17026.90
D14 	NAD_Ligase-59 	#= 57	GGA AGC GGG CGT GGA GAT GGA GGC CAA AGA GAA GGG TGG TGA AGC GCT TAA AGG CCT 	17951.51
E14 	NAD_Ligase-60 	#= 54	GGA CGC GAG AGT TCG CCT GTG ATA ACA CTC GTC AGG CCT TTA AGC GCT TCA CCA 	16582.63
F14 	NAD_Ligase-61 	#= 41	CAG GCG AAC TCT CGC GTC CAC GCG AAG AAG TTA AAG CGC TG 	12629.13
G14 	NAD_Ligase-62 	#= 54	CTA TCT GTG ACT TTT GCG CCC AGA CGA CGC AGC AGC GCT TTA ACT TCT TCG CGT 	16490.56
H14 	NAD_Ligase-63 	#= 53	CTG GGC GCA AAA GTC ACA GAT AGT GTG TCA CGT AAA ACG TCA TAT CTG GTC GT 	16380.54
I14 	NAD_Ligase-64 	#= 53	GCC TGG GTT TTC GCC TGG ATT TTC ACC CAC GAC CAG ATA TGA CGT TTT ACG TG 	16256.41
J14 	NAD_Ligase-65 	#= 44	ATC CAG GCG AAA ACC CAG GCT CCA AGC TTG AAA AAG CAC GTG CG 	13537.74
K14 	NAD_Ligase-66 	#= 44	CCG TCA GTG TTG GAA CAC CCA ACG CAC GTG CTT TTT CAA GCT TG 	13458.64
L14 	NAD_Ligase-67 	#= 48	TGG GTG TTC CAA CAC TGA CGG AGG AAG AAC TTT ACC GTC TGC TGG AGG 	14888.55
M14 	NAD_Ligase-68 	#= 58	TTA CAC GAG TTC TTC CGC TTT TTT ACC TGT GCG CGC CTC CAG CAG ACG GTA AAG TTC T 	17716.34
N14 	UhpT_D388CM_F0-1 	#= 42	ATG CTA GCT TTT CTA AAT CAG GTG AGA AAA CCA ACA TTA GAT 	12928.38
O14 	UhpT_D388CM_F0-2 	#= 51	CCA CAT TTT TCT ACG AAC TTC TAA TGG TAA ATC TAA TGT TGG TTT TCT CAC 	15554.02
P14 	UhpT_D388CM_F0-3 	#= 58	AAG TTC GTA GAA AAA TGT GGT TTA AAC CAT TTA TGC AGT CAT ATT TAG TTG TTT TTA T 	17918.56
A15 	UhpT_D388CM_F0-4 	#= 51	CTG ATT AAA TAC ATT GTT AAG TAC CCA ATA AAA ACA ACT AAA TAT GAC TGC 	15649.17
B15 	UhpT_D388CM_F0-5 	#= 49	GGT ACT TAA CAA TGT ATT TAA TCA GAA AGA ATT TTA ATA TCG CTC AAA A 	15092.80
C15 	UhpT_D388CM_F0-6 	#= 47	AAC CAT AAG TTG AAA TCA TAT CAT TTT GAG CGA TAT TAA AAT TCT TT 	14432.36
D15 	UhpT_D388CM_F0-7 	#= 54	TGA TAT GAT TTC AAC TTA TGG TTT ATC TAT GAC GCA GCT AGG TAT GAT CGG TTT 	16676.72
E15 	UhpT_D388CM_F0-8 	#= 56	CAA GAG TTT TAC CAA CAC CAT AAG TGA TAG AAA ATC CTA AAC CGA TCA TAC CTA GC 	17145.10
F15 	UhpT_D388CM_F0-9 	#= 45	GGT GTT GGT AAA ACT CTT GTT TCA TAT TAC GCT GAT GGA AAA AAC 	13912.98
G15 	UhpT_D388CM_F0-10 	#= 58	AGC TGA TAA GAT AAG CAT GAA TGG AAG AAA TTG TTT TGT GTT TTT TCC ATC AGC GTA A 	17987.60
H15 	UhpT_D388CM_F0-11 	#= 42	TCA TGC TTA TCT TAT CAG CTA TTT GCA TGT TAG GAT TTT CAG 	12865.29
I15 	UhpT_D388CM_F0-12 	#= 47	ATG ATA CTG AAC CTG AAC CCA TTG ATG CTG AAA ATC CTA ACA TGC AA 	14407.33
J15 	UhpT_D388CM_F0-13 	#= 57	GGT TCA GGT TCA GTA TCA TTA TTC CTA ATG ATT GCA TTT TAT GCT TTA TCT GGT TTT 	17506.24
K15 	UhpT_D388CM_F0-14 	#= 62	AAT TGT TGA ATA TGA ACA TGA ACC ACC AGT AGA TTG AAA AAA ACC AGA TAA AGC ATA AAA TG 	19207.47
L15 	UhpT_D388CM_F0-15 	#= 50	GTT CAT GTT CAT ATT CAA CAA TTA CTA AGT GGA CTC CTA GAA GAA AAA GA 	15407.98
M15 	UhpT_D388CM_F0-16 	#= 56	GTT GTG AGA GAT GTT CCA AAA ACC TAA GAA AGT TCC TCT TTT TCT TCT AGG AGT CC 	17218.08
N15 	UhpT_D388CM_F0-17 	#= 54	TGG AAC ATC TCT CAC AAC TTA GGG GGT GCT GGA GCA GCT GGT GTT GCT TTA TTT 	16704.70
O15 	UhpT_D388CM_F0-18 	#= 47	ACG TGT CCA TCA AAT AAA TAA TTA GCT CCA AAT AAA GCA ACA CCA GC 	14369.33
P15 	UhpT_D388CM_F0-19 	#= 45	ATT ATT TAT TTG ATG GAC ACG TGA TTG GAA TGT TTA TCT TTC CAT 	13850.93
A16 	UhpT_D388CM_F0-20 	#= 53	CCA ATA AAC CCA ACA ATT AAT GCG ATA ATA GAT GGA AAG ATA AAC ATT CCA AT 	16294.59
B16 	UhpT_D388CM_F0-21 	#= 57	CAT TAA TTG TTG GGT TTA TTG GAC TTA GAT ACG GTT CAG ATT CAC CTG AAT CAT ATG 	17592.32
C16 	UhpT_D388CM_F0-22 	#= 46	AAA AGC TCT TCA GCT TTT CCT AAA CCA TAT GAT TCA GGT GAA TCT G 	14082.09
D16 	UhpT_D388CM_F0-23 	#= 52	GAA AAG CTG AAG AGC TTT TTG GTG AAG AGA TCT CAG AAG AAG ATA AAG AAA C 	16238.52
E16 	UhpT_D388CM_F0-24 	#= 49	GCC ACT TAG TCA TAT CAG TAG ATT CTG TTT CTT TAT CTT CTT CTG AGA T 	14958.62
F16 	UhpT_D388CM_F0-25 	#= 42	ACT GAT ATG ACT AAG TGG CAA ATT TTT GTT GAA TAC GTT CTT 	12947.36
G16 	UhpT_D388CM_F0-26 	#= 50	ACA TAA TAA CCA AAT TAC TTT GTT TTT AAG AAC GTA TTC AAC AAA AAT TT 	15315.96
H16 	UhpT_D388CM_F0-27 	#= 61	AAA CAA AGT AAT TTG GTT ATT ATG TTT TGC TAA TAT TTT TCT TTA TGT GGT GAG AAT TGG T 	18902.17
I16 	UhpT_D388CM_F0-28 	#= 52	TTG AAA AGC GTA TAC TGT TGA CCA TTG ATC GAT ACC AAT TCT CAC CAC ATA A 	15913.28
J16 	UhpT_D388CM_F0-29 	#= 51	CAA CAG TAT ACG CTT TTC AAG AAT TAA AAT TAT CGA AAG CTG TTG CTA TTC 	15654.12
K16 	UhpT_D388CM_F0-30 	#= 41	TGC TTC AAA TAA AGT AAA TCC TTG AAT AGC AAC AGC TTT CG 	12575.15
L16 	UhpT_D388CM_F0-31 	#= 54	AGG ATT TAC TTT ATT TGA AGC AGG TGC TTT AGT AGG TAC TCT ATT ATG GGG ATG 	16781.78
M16 	UhpT_D388CM_F0-32 	#= 45	TCG ACC ATT TGC TAG ATC AGA TAG CCA TCC CCA TAA TAG AGT ACC 	13732.87
N16 	UhpT_D388CM_F0-33 	#= 39	GAT CTA GCA AAT GGT CGA CGT GGA TTA GTT GCA TGT ATC 	12076.78
O16 	UhpT_D388CM_F0-34 	#= 51	CAC CTA AAG TAG CGA TAA TTA GAG CTA AAG CGA TAC ATG CAA CTA ATC CAC 	15661.14
P16 	UhpT_D388CM_F0-35 	#= 45	CTA ATT ATC GCT ACT TTA GGT GTT TAT CAA CAT GCA TCA AAT GAA 	13791.92
A17 	UhpT_D388CM_F0-36 	#= 54	AAC CTA AAG CGA ATA GAG AAG CTA AAT AAA TAT ATT CAT TTG ATG CAT GTT GAT 	16706.83
B17 	UhpT_D388CM_F0-37 	#= 54	TTC TCT ATT CGC TTT AGG TTT TTT AGT ATT CGG TCC TCA GTT ATT AAT TGG AGT 	16575.63
C17 	UhpT_D388CM_F0-38 	#= 53	TTG CTT TCT TAG GTA CAA ATC CAA CAG CTG CTA CTC CAA TTA ATA ACT GAG GA 	16233.48
D17 	UhpT_D388CM_F0-39 	#= 61	GAT TTG TAC CTA AGA AAG CAA TTG GAG CAG CTT GCG GGA TCA AAG GAA CCT TTG CAT ATC T 	18875.15
E17 	UhpT_D388CM_F0-40 	#= 43	AGT TTA GCA AAA GAA TCA CCA ATT AGA TAT GCA AAG GTT CCT T 	13241.59
F17 	UhpT_D388CM_F0-41 	#= 41	GGT GAT TCT TTT GCT AAA CTA GGT CTT GGA ATG ATT GCA GA 	12700.18
G17 	UhpT_D388CM_F0-42 	#= 47	AAC CTG TTA AAC CAA AAA CAG GAG TCC CAT CTG CAA TCA TTC CAA GA 	14361.31
H17 	UhpT_D388CM_F0-43 	#= 60	TGT TTT TGG TTT AAC AGG TTG GGC TGG GAC GTT TGC AGC ATT AGA TAT TGC TGC TAT CGG 	18634.92
I17 	UhpT_D388CM_F0-44 	#= 39	ATT GCC ATA AGA CAG ATA CAA CCG ATA GCA GCA ATA TCT 	11960.77
J17 	UhpT_D388CM_F0-45 	#= 46	TGT ATC TGT CTT ATG GCA ATT GTT GCT GTA ATG GAA GAA CGT AAA A 	14257.20
K17 	UhpT_D388CM_F0-46 	#= 62	TTA AGC AAC AGT TAA CTG TTG AAT TTT CTT TTC ACG TCT GAT TTT ACG TTC TTC CAT TAC AG 	18953.19
L17 	MaLionG_myco-1 	#= 46	ATG GTT TCT AAA GGT GAA GAA TTA TTT ACT GGT GTA GTA CCT ATC C 	14208.16
M17 	MaLionG_myco-2 	#= 38	TCA CCA TCA AGT TCA ACA AGG ATA GGT ACT ACA CCA GT 	11623.54
N17 	MaLionG_myco-3 	#= 52	TTG TTG AAC TTG ATG GTG ATG TTA ACG GAC ACA AAT TTT CTG TTT CAG GGG A 	16133.37
O17 	MaLionG_myco-4 	#= 49	AGT TTA CCG TAA GTA GCA TCA CCT TCT CCT TCC CCT GAA ACA GAA AAT T 	14918.63
P17 	MaLionG_myco-5 	#= 47	GAT GCT ACT TAC GGT AAA CTA ACT TTA AAA TTT ATT TGT ACC ACG GG 	14450.34
A18 	MaLionG_myco-6 	#= 57	GTA GTA ACT AAG GTT GGC CAA GGT ACT GGA AGC TTA CCC GTG GTA CAA ATA AAT TTT 	17654.37
B18 	MaLionG_myco-7 	#= 57	GGC CAA CCT TAG TTA CTA CAT TTG GTT ACG GAT TAA TGT GTT TTG CAA GAT ATC CTG 	17553.28
C18 	MaLionG_myco-8 	#= 57	ATT GCA GAT TTA AAA AAA TCA TGT TGT TTC ATG TGG TCA GGA TAT CTT GCA AAA CAC 	17587.36
D18 	MaLionG_myco-9 	#= 57	ACA TGA TTT TTT TAA ATC TGC AAT GCC AGA AGG GTA TGT TCA AGA AAG AAC TAT CTT 	17587.36
E18 	MaLionG_myco-10 	#= 62	CTT CAG CAC GAG TCT TAT AAT TCC CAT CGT CTT TAA AAA AGA TAG TTC TTT CTT GAA CAT AC 	18934.21
F18 	MaLionG_myco-11 	#= 57	TTA TAA GAC TCG TGC TGA AGT TAA GTT CGA AGG AGA TAC ACT TGT TAA TAG AAT TGA 	17692.42
G18 	MaLionG_myco-12 	#= 51	CTT CCT TAA AGT CAA TAC CCT TTA ATT CAA TTC TAT TAA CAA GTG TAT CTC 	15491.01
H18 	MaLionG_myco-13 	#= 53	AGG GTA TTG ACT TTA AGG AAG ACG GAA ATA TCT TAG GTC ACA AAT TAG AAT AT 	16474.66
I18 	MaLionG_myco-14 	#= 48	AGT TTT CAT ACC TCT CCA ATT ATA TTC TAA TTT GTG ACC TAA GAT ATT 	14630.45
J18 	MaLionG_myco-15 	#= 45	AAT TGG AGA GGT ATG AAA ACT GTG AAA GTA AAC ATT ACG ACA CCA 	13967.06
K18 	MaLionG_myco-16 	#= 43	TCA GCA TCA TAA ACT GGT CCA TCT GGT GTC GTA ATG TTT ACT T 	13173.48
L18 	MaLionG_myco-17 	#= 42	GAC CAG TTT ATG ATG CTG ATA TCG AAA TGG TAT CAG TTA GAG 	13031.42
M18 	MaLionG_myco-18 	#= 44	AAT TCC TAG ATC ACC TGA TTC AGC TCT AAC TGA TAC CAT TTC GA 	13384.65
N18 	MaLionG_myco-19 	#= 44	GAA TCA GGT GAT CTA GGA ATT TTA CCT GGT CAT ATT CCG ACA AA 	13553.76
O18 	MaLionG_myco-20 	#= 53	CTT TAA TCT AAC TGC TCC GAT TTT TAA AGG TGC TTT TGT CGG AAT ATG ACC AG 	16277.47
P18 	MaLionG_myco-21 	#= 55	TCG GAG CAG TTA GAT TAA AGA AAG ATG GTC AAA CCG AAT ATG TTG CTG TTT CAG G 	17101.02
A19 	MaLionG_myco-22 	#= 59	GTA ATA GTT ACT TGA TCC GGT CTA ACC TCC ACG TTC CCA CCT GAA ACA GCA ACA TAT TC 	17968.57
B19 	MaLionG_myco-23 	#= 59	ACC GGA TCA AGT AAC TAT TAC AGC TCA AGC TGC TGA AAC TGC TGA AGG TAT TGA TAA GG 	18250.76
C19 	MaLionG_myco-24 	#= 55	CTC TTG TGC TCT TTG TCT TGC CGC TTC TGC TCT TTC CTT ATC AAT ACC TTC AGC A 	16627.63
D19 	MaLionG_myco-25 	#= 49	AAG ACA AAG AGC ACA AGA GCG TCT TAA CTC TCA ATC TGA TGA CAC AGA T 	15083.77
E19 	MaLionG_myco-26 	#= 58	TTT AAT GCT CTT TGT AAA GCT AAC TCT GCT CTA CGA ATA TCT GTG TCA TCA GAT TGA G 	17801.45
F19 	MaLionG_myco-27 	#= 55	TTA GCT TTA CAA AGA GCA TTA AAT AGA CTA GAT GTT GCA GAA ATG AAA GCT TTA A 	17036.04
G19 	MaLionG_myco-28 	#= 56	ATC AGC CAT AAT ATA AAC ATT ATG TGA AAA TTC TTT TAA AGC TTT CAT TTC TGC AA 	17152.10
H19 	MaLionG_myco-29 	#= 61	ACA TAA TGT TTA TAT TAT GGC TGA TAA GCA AAA AAA TGG AAT TAA AGT TAA CTT CAA AAT C 	18856.24
I19 	MaLionG_myco-30 	#= 49	CGA CCC ATC TTC AAT GTT ATG TCT GAT TTT GAA GTT AAC TTT AAT TCC A 	14960.65
J19 	MaLionG_myco-31 	#= 50	AAC ATT GAA GAT GGG TCG GTA CAA CTT GCG GAT CAC TAT CAA CAA AAC AC 	15403.96
K19 	MaLionG_myco-32 	#= 47	ATA AAA CTG GAC CAT CAC CAA TAG GAG TGT TTT GTT GAT AGT GAT CC 	14500.36
L19 	MaLionG_myco-33 	#= 54	GGT GAT GGT CCA GTT TTA TTA CCT GAT AAC CAC TAT CTT TCA TAC CAA TCA GCA 	16504.63
M19 	MaLionG_myco-34 	#= 60	GTA CCA TAT GGT CAC GTT TTT CGT TCG GAT CTT TTG ATA ATG CTG ATT GGT ATG AAA GAT 	18545.91
N19 	MaLionG_myco-35 	#= 55	AAA CGT GAC CAT ATG GTA CTT CTT GAA TTT GTG ACA GCA GCT GGT ATT ACT TTA G 	16968.92
O19 	MaLionG_myco-36 	#= 43	TTA TTT GTA AAG TTC ATC CAT TCC TAA AGT AAT ACC AGC TGC T 	13125.49
P19 	Unnamedsequence_F0-0 	#= 19	TGT TGA GTG GCG GCG AGT T 	5930.83
A20 	Unnamedsequence_F0-1 	#= 42	AAC TCG CCG CCA CTC AAC ACC CCG GAG AGT GAA GTC CCG AGC 	12808.24
B20 	Unnamedsequence_F0-2 	#= 51	CAC GAA TAC TGC GAG ACC TTG GTC GCG ATA AAG CTC GGG ACT TCA CTC TCC 	15620.03
C20 	Unnamedsequence_F0-3 	#= 51	CAA GGT CTC GCA GTA TTC GTG TCA ACG CAA AAC CAC CCT GAA CAA CTA CAA 	15574.06
D20 	Unnamedsequence_F0-4 	#= 52	TAA TTT CGA AGG CAT CGG TGA ATT TTT TGT TGT AGT TGT TCA GGG TGG TTT T 	16152.36
E20 	Unnamedsequence_F0-5 	#= 49	ATT CAC CGA TGC CTT CGA AAT TAT GGC CGA AAA CTA TGA ATT TAA AGA A 	15079.76
F20 	Unnamedsequence_F0-6 	#= 57	CGC GCA GAA ATT CAA GAC AAA AAA TCT CGT TTT CTT TAA ATT CAT AGT TTT CGG CCA 	17468.28
G20 	Unnamedsequence_F0-7 	#= 55	TTT TGT CTT GAA TTT CTG CGC GCA GCG TCC CTT CTG AAA TCA CTG CCA TTC CCG G 	16760.72
H20 	Unnamedsequence_F0-8 	#= 54	CAT GGC AGG CCC TGG ATA TCT TTC ATG CGC GTA ACC GGG AAT GGC AGT GAT TTC 	16668.68
I20 	Unnamedsequence_F0-9 	#= 50	ATA TCC AGG GCC TGC CAT GCA TGG GTG ACC AGG TCC GTG ATA TTA TTG AA 	15440.92
J20 	Unnamedsequence_F0-10 	#= 51	GGA CGA TTC ACC TTC TTC AAT GAT TTC TTC AAT AAT ATC ACG GAC CTG GTC 	15574.02
K20 	Unnamedsequence_F0-11 	#= 50	TCA TTG AAG AAG GTG AAT CGT CCC GCG TCA AAG AGG TGC TGA ATG ATG AG 	15563.02
L20 	Unnamedsequence_F0-12 	#= 62	GCC AAA AAC AGA GGT AAA TTG TTT AAA GCT TTT GTA ACG CTC ATC ATT CAG CAC CTC TTT GA 	19033.27
M20 	Unnamedsequence_F0-13 	#= 63	TTT AAA CAA TTT ACC TCT GTT TTT GGC GTC GGC GTT AAA ACA TCA GAA AAA TGG TAC CGC ATG 	19393.49
N20 	Unnamedsequence_F0-14 	#= 55	TCC GCT TTC ACT TCT TCA ACG GTA CGC AGG CCC ATG CGG TAC CAT TTT TCT GAT G 	16769.74
O20 	Unnamedsequence_F0-15 	#= 51	CGT TGA AGA AGT GAA AGC GGA TAA AAC CCT GAA GCT CAG TAA AAT GCA AAA 	15839.27
P20 	Unnamedsequence_F0-16 	#= 62	CGC ACG ACA CAA GAT CTT CAT AAT ACA GAA AAC CCG CTT TTT GCA TTT TAC TGA GCT TCA GG 	18979.22
A21 	Unnamedsequence_F0-17 	#= 55	ATG AAG ATC TTG TGT CGT GCG TGT CAA AAG CCG AAG CAG ACG CCG TGA GTC TCA T 	17014.92
B21 	Unnamedsequence_F0-18 	#= 48	GCA GGA AGG TAC AAA CGG TGT TTT TGA CAA TGA GAC TCA CGG CGT CTG 	14896.58
C21 	Unnamedsequence_F0-19 	#= 48	CAC CGT TTG TAC CTT CCT GCC GGA CGC GCT GGT GAC GAT TAC CGG TGG 	14743.42
D21 	Unnamedsequence_F0-20 	#= 50	ATC GTG ACC AAT TTT TTT GCC GCG ACG AAA GCC ACC GGT AAT CGT CAC CA 	15289.83
E21 	Unnamedsequence_F0-21 	#= 51	CGG CAA AAA AAT TGG TCA CGA TAT CGA CTT TCT CAT TAC CAA CCC AGG CCC 	15556.03
F21 	Unnamedsequence_F0-22 	#= 44	ATG CAG CAG CTC GTC ATC TTC GCG CGG GCC TGG GTT GGT AAT GA 	13595.70
G21 	Unnamedsequence_F0-23 	#= 45	AGA TGA CGA GCT GCT GCA TAA GGG TCT GTT GTT GTA CTG TGA TAT 	13976.98
H21 	Unnamedsequence_F0-24 	#= 61	GCT CGG CAG CTG TTC TTT CAC AAA TGT AGA TTC AAT AAT ATC ACA GTA CAA CAA CAG ACC C 	18668.04
I21 	Unnamedsequence_F0-25 	#= 41	GAA AGA ACA GCT GCC GAG CCG CAA AGT GGA CGC CAT GGA TC 	12687.18
J21 	Unnamedsequence_F0-26 	#= 55	GTA CAA CTT CAG AAT TGC GAA ACA TTT CTG GAA ATG ATC CAT GGC GTC CAC TTT G 	16907.89
K21 	Unnamedsequence_F0-27 	#= 63	TGT TTC GCA ATT CTG AAG TTG TAC CAA CCA CGT GTT GAT AAC TCG TCG TAC AAT ACC TCA AAA 	19298.43
L21 	Unnamedsequence_F0-28 	#= 55	TCC AGT CTT TCA CCT CCG CCA TAT CCA ATT TTT TTG AGG TAT TGT ACG ACG AGT T 	16782.77
M21 	Unnamedsequence_F0-29 	#= 47	GCG GAG GTG AAA GAC TGG AAG GCG ATT CGT GTT GAT CTG GTT ATT AC 	14669.42
N21 	Unnamedsequence_F0-30 	#= 47	GTA CGC GTA CTG CTC AAA CGG TGT AAT AAC CAG ATC AAC ACG AAT CG 	14449.33
O21 	Unnamedsequence_F0-31 	#= 52	CGT TTG AGC AGT ACG CGT ACG CAT TGC TGG GCT GGA CCG GTT CTC GTC AGT T 	16049.25
P21 	Unnamedsequence_F0-32 	#= 57	TAC GTT CGT GGG TTG CGT AAC GAC GCA GGT CAC GAC CAA ACT GAC GAG AAC CGG TCC 	17588.28
A22 	Unnamedsequence_F0-33 	#= 41	TAC GCA ACC CAC GAA CGT AAA ATG ATC CTG GAT AAC CAC GC 	12525.11
B22 	Unnamedsequence_F0-34 	#= 61	CCC GCT TTC AGG AAA ATA CGT TTA CGA CGG TCA TAC AGC GCG TGG TTA TCC AGG ATC ATT T 	18754.04
C22 	Unnamedsequence_F0-35 	#= 46	ACG TAT TTT CCT GAA AGC GGG TAG CGA GGA AGA AAT TTT TGC GCA T 	14268.19
D22 	Unnamedsequence_F0-36 	#= 51	TCC CAC GGT TCC ACA TAG TCC AGA CCC AGA TGC GCA AAA ATT TCT TCC TCG 	15498.97
E22 	Unnamedsequence_F0-37 	#= 39	GAC TAT GTG GAA CCG TGG GAA CGC AAC GCC GCG AAT GCA 	12075.78
F22 	Unnamedsequence_F0-38 	#= 19	TGC ATT CGC GGC GTT GCG T 	5826.76
G22 	F6-1 	#= 41	TGC GGG CGG CGA GGG CGA CGA TGT GCT GCT GGG CGG CGA CG 	12846.19
H22 	F6-2 	#= 42	CGC CCG ACA GCT GGT CGT CGC CGT CGC CGC CCA GCA GCA CAT 	12783.18
I22 	F6-3 	#= 42	GCG ACG ACC AGC TGT CGG GCG ACG CCG GAC GCG ATC GCT TGT 	12958.28
J22 	F6-4 	#= 43	CAG TCG TCA CCG GCT TCG CCG TAC AAG CGA TCG CGT CCG GCG T 	13157.42
K22 	F6-5 	#= 47	ACG GCG AAG CCG GTG ACG ACT GGT TCT TCC AGG ATG CCG CCA ATG CC 	14466.26
L22 	F6-6 	#= 46	GCC GCC GTC GAG CAG ATT GCC GGC ATT GGC GGC ATC CTG GAA GAA C 	14202.10
M22 	F6-7 	#= 45	GGC AAT CTG CTC GAC GGC GGC GAC GGC CGC GAT ACC GTG GAT TTC 	13879.88
N22 	F6-8 	#= 44	AGG CCC CGG CCC GGG CCG CTG AAA TCC ACG GTA TCG CGG CCG TC 	13481.61
O22 	F6-9 	#= 40	AGC GGC CCG GGC CGG GGC CTC GAC GCC GGC GCA AAG GGC G 	12400.91
P22 	F6-10 	#= 47	CGA ACC CCT TGC CCA AGC TCA GGA ATA CGC CCT TTG CGC CGG CGT CG 	14322.17
A23 	F6-11 	#= 52	TAT TCC TGA GCT TGG GCA AGG GGT TCG CCA GCC TGA TGG ACG AAC CCG AAA C 	16054.29
B23 	F6-12 	#= 52	TTC TCG ATA TTG CGC AAC ACG TTG CTG GTT TCG GGT TCG TCC ATC AGG CTG G 	15999.23
C23 	F6-13 	#= 47	CAG CAA CGT GTT GCG CAA TAT CGA GAA CGC CGT GGG CAG CGC GCG TG 	14555.33
D23 	F6-14 	#= 43	TGC GTC GCC GAT CAG CAC GTC ATC ACG CGC GCT GCC CAC GGC G 	13127.39
E23 	F6-15 	#= 45	ATG ACG TGC TGA TCG GCG ACG CAG GCG CCA ACG TCC TCA ATG GCC 	13832.87
F23 	F6-16 	#= 43	ACA GCA CGT CGT TGC CCG CCA GGC CAT TGA GGA CGT TGG CGC C 	13206.45
G23 	F6-17 	#= 41	TGG CGG GCA ACG ACG TGC TGT CCG GCG GCG CTG GCG ACG AT 	12725.12
H23 	F6-18 	#= 41	GCC CTC GTC GCC CAG CAG CAC ATC GTC GCC AGC GCC GCC GG 	12454.96
I23 	F6-19 	#= 43	GTG CTG CTG GGC GAC GAG GGC TCG GAC CTG CTC AGC GGC GAT G 	13358.52
J23 	F6-20 	#= 45	GCC GAA CAG ATC GTC GTT GCC CGC ATC GCC GCT GAG CAG GTC CGA 	13808.84
K23 	F6-21 	#= 50	CGG GCA ACG ACG ATC TGT TCG GCG GGC AGG GCG ATG ATA CTT ATC TGT TC 	15473.90
L23 	F6-22 	#= 48	GTC GTG CCC GTA CCC GAC CCC GAA CAG ATA AGT ATC ATC GCC CTG CCC 	14579.35
M23 	F6-23 	#= 44	GGG GTC GGG TAC GGG CAC GAC ACG ATC TAC GAA TCG GGC GGC GG 	13729.78
N23 	F6-24 	#= 48	CGC GTT GAT GCG GAT GGT GTC ATG GCC GCC GCC CGA TTC GTA GAT CGT 	14823.47
O23 	F6-25 	#= 47	CCA TGA CAC CAT CCG CAT CAA CGC GGG GGC GGA CCA GCT GTG GTT CG 	14451.25
P23 	F6-26 	#= 43	CCA GGT CGT TGC CCT GGC GCG CGA ACC ACA GCT GGT CCG CCC C 	13103.37
A24 	F6-27 	#= 45	CGC GCC AGG GCA ACG ACC TGG AGA TCC GCA TTC TCG GCA CCG ACG 	13802.84
B24 	F6-28 	#= 51	GAT ACC AGT CGT GCA CGG TAA GTG CAT CGT CGG TGC CGA GAA TGC GGA TCT 	15796.12
C24 	F6-29 	#= 48	ATG CAC TTA CCG TGC ACG ACT GGT ATC GCG ACG CCG ATC ACC GGG TGG 	14770.46
D24 	F6-30 	#= 46	GCC TGG TTG GCG GCA TGG ATG ATT TCC ACC CGG TGA TCG GCG TCG C 	14206.07
E24 	F6-31 	#= 51	AAA TCA TCC ATG CCG CCA ACC AGG CGG TAG ACC AGG CAG GCA TCG AAA AGC 	15690.11
F24 	F6-32 	#= 51	GGA TAC TGC GCC ATT GCC TCG ACC AGC TTT TCG ATG CCT GCC TGG TCT ACC 	15544.94
G24 	F6-33 	#= 46	TGG TCG AGG CAA TGG CGC AGT ATC CGG ACC CCG GCG CGG CGG CGG C 	14260.10
H24 	F6-34 	#= 42	ACG CGC GCC GCC GGC GGG GCA GCC GCC GCC GCG CCG GGG TCC 	12907.20
I24 	F6-35 	#= 44	TGC CCC GCC GGC GGC GCG CGT GCC GGA CAC GCT GAT GCA GTC CC 	13473.59
J24 	F6-36 	#= 45	TGG TGG CGC CAG TTG ACA GCC AGG GAC TGC ATC AGC GTG TCC GGC 	13919.90
K24 	F6-37 	#= 47	TGG CTG TCA ACT GGC GCC ACC ACC ACC ACC ACC ACT GAG GAT CCG AA 	14308.20
L24 	F6-38 	#= 43	TTG TCG ACG GAG CTC GAA TTC GGA TCC TCA GTG GTG GTG GTG G 	13377.56
M24 	F1-F 	#= 41	CCT CGC GAA TGC ATC TAG ATC GTC CGG CGT AGA GGA TCG AG 	12651.13
N24 	F1-R 	#= 52	CGA CGG GCC CGG GAT CCG ATT CGT ATT AGA TAG GGT CTG GCT GTA AGG TCA G 	16156.34
O24 	pTZ_F 	#= 20	ATC GGA TCC CGG GCC CGT CG 	6094.93
P24 	pTZ_R 	#= 28	ATC TAG ATG CAT TCG CGA GGT ACC GAG C 	8613.57
