where	code	length	seq	monoisotopic_mass
A1 	RPOB-F 	#= 79	CCT CGC GAA TGC ATC TAG ATC TTT AAG AAG GAG ATA TAG CTA TGA AAA AAA ACT CGG CCT TTC ATA ATA CTC AAT ATT C 	24290.66
B1 	RPOB-1 	#= 42	GTT CAG TTT GTA CCA ATC TAA AAC TAA GTT CTT CCA TTT TTG 	12818.28
C1 	RPOB-2 	#= 42	CAA AAA TGG AAG AAC TTA GTT TTA GAT TGG TAC AAA CTG AAC 	13001.44
D1 	RPOB-3 	#= 36	CGT CTT CGT AGT TAT AAC CAC TCC AAG TAG TAA AAC 	10987.12
E1 	RPOB-4 	#= 36	GTT TTA CTA CTT GGA GTG GTT ATA ACT ACG AAG ACG 	11129.19
F1 	RPOB-5 	#= 27	ATA AGC TTG AAG CGC CCA CAC TTC CAT 	8188.32
G1 	RPOC-F 	#= 84	CCT CGC GAA TGC ATC TAG ATC TTT AAG AAG GAG ATA TAG CTA TGG ATA AGC TAA AGA AAA AAA ATA AAA ATA AAC GAA TTC GTG 	26067.86
H1 	RPOC-1 	#= 32	AGG TTT TTT TAC TTC ACC ATG AGA CCA AGA TC 	9773.33
I1 	RPOC-2 	#= 32	GAT CTT GGT CTC ATG GTG AAG TAA AAA AAC CT 	9871.41
J1 	RPOC-3 	#= 36	GTA ATT CTT TAG TCA TCC AGA TGT GAG CTA CTG GAA 	11089.17
K1 	RPOC-4 	#= 36	TTC CAG TAG CTC ACA TCT GGA TGA CTA AAG AAT TAC 	11027.15
L1 	RPOC-5 	#= 37	GAT GCT TTG ATT CCA GAT TCT TTT AAC CAC TTA ATC G 	11279.29
M1 	RPOC-8 	#= 33	TAG CTT CTT GGC ATA TCT TAG GGC CAA AAG ATG 	10167.57
N1 	RPOC-9 	#= 45	CTT TAA TAT CTT TAG ATA CGT TAT CTT TAA CAT CAG CCC ATA AAC 	13686.86
O1 	RPOC-10 	#= 45	GTT TAT GGG CTG ATG TTA AAG ATA ACG TAT CTA AAG ATA TTA AAG 	13985.06
P1 	RPOC-11 	#= 31	TCA GCG ATC GTA GCT AAT TCC CAT TCT TTT G 	9427.09
A2 	RPOE-F 	#= 75	CCT CGC GAA TGC ATC TAG ATC TTT AAG AAG GAG ATA TAG CTA TGG CTT CAT TAA TTG ATA AGG CTT ACG AAG TTG 	23204.92
B2 	RPOE-1 	#= 37	CGT CTT TAA CAA CTA GTT TCC ATA AGT CGT TAA AAG T 	11321.34
C2 	RPOE-2 	#= 37	ACT TTT AAC GAC TTA TGG AAA CTA GTT GTT AAA GAC G 	11410.40
D2 	RPOE-3 	#= 31	TTC AGA TAA TTT TGC CCA TTC ATC ATG AAG C 	9444.13
E2 	RPOE-4 	#= 31	GCT TCA TGA TGA ATG GGC AAA ATT ATC TGA A 	9582.22
F2 	RPOE-R 	#= 62	ATC GGA TCC CGG GCC CGT CGA CTT AAT TTT CCT CCT CTG TTG AAT CAA CAA TAA TAT TGT CG 	18944.16
G2 	RPOD-F 	#= 78	CCT CGC GAA TGC ATC TAG ATC TTT AAG AAG GAG ATA TAG CTA TGC TTT TTA TAC CTT TAA CAT TTA CAA GAA TGG CAA 	24014.47
H2 	RPOD-1 	#= 31	GCT TGT CTG ATC CAC CAT GTT GCA TAA GTT G 	9492.12
I2 	RPOD-4 	#= 28	CAC CCT TGG CAC CAA CAA ATG ACC CTT G 	8462.49
J2 	RPOD-R 	#= 63	ATC GGA TCC CGG GCC CGT CGA CTT AAT TTT CTG AGT CAT GTT TTA AGA AAG AAC GTA ATC TCG 	19386.45
K2 	RPOD-5 	#= 58	GGA CAG CAA ATG GGT CGC GGA TCC CTT TTT ATA CCT TTA ACA TTT ACA AGA ATG GCA A 	17863.51
L2 	RPOD-6 	#= 65	GTG GTG GTG GTG GTG GTG CTC GAG TTA ATT TTC TGA GTC ATG TTT TAA GAA AGA ACG TAA TCT CG 	20256.98
M2 	RBLK-F 	#= 33	TAT TCA TAT GAT GTC CGA TTC TGA AGT GAA CCA 	10126.56
N2 	RBLK-R 	#= 40	AAA TCT CGA GTT ACG ACA AAA GAC GTA AGG AAG GCT TGT C 	12386.02
O2 	RBLK-R1 	#= 33	GCA TGA CGG TTG ACG AAC AGA TTC CAG TAA TTG 	10201.60
P2 	RBLK-F1 	#= 33	CAA TTA CTG GAA TCT GTT CGT CAA CCG TCA TGC 	10063.50
A3 	RBLK-T7T 	#= 27	GGT TAT GCT AGT TAT TGC TCA GCG GTG 	8352.38
B3 	T201-1 	#= 41	TTG ATG GTC AAG TAG ACT TAT TTA GAA ATG CCC GTA ATG GT 	12693.20
C3 	T201-2 	#= 43	ACA CTA CCT TCT GTA ATA AGA ACA CCA TTA CGG GCA TTT CTA A 	13113.49
D3 	T201-3 	#= 44	GTT CTT ATT ACA GAA GGT AGT GTT AAA GGT TTA CAA CCA TCT GT 	13574.76
E3 	T201-4 	#= 41	GAC TAG CTT GTT TGG GAC CTA CAG ATG GTT GTA AAC CTT TA 	12645.15
F3 	T201-5 	#= 42	AGG TCC CAA ACA AGC TAG TCT TAA TGG AGT CAC ATT AAT TGG 	12945.37
G3 	T201-6 	#= 42	ACT GTG TTT TTA CGG CTT CTC CAA TTA ATG TGA CTC CAT TAA 	12819.27
H3 	T201-7 	#= 46	AGA AGC CGT AAA AAC ACA GTT CAA TTA TTA TAA GAA AGT TGA TGG T 	14261.26
I3 	T201-8 	#= 46	TCA GGT AAT TGT TGG ACA ACA CCA TCA ACT TTC TTA TAA TAA TTG A 	14105.13
J3 	T201-9 	#= 43	GTT GTC CAA CAA TTA CCT GAA ACT TAC TTT ACT CAG AGT AGA A 	13168.53
K3 	T201-10 	#= 46	CCT GGG TTT AAA TTC TTG TAA ATT TCT ACT CTG AGT AAA GTA AGT T 	14158.14
L3 	T201-11 	#= 45	ATT TAC AAG AAT TTA AAC CCA GGA GTC AAA TGG AAA TTG ATT TCT 	13874.00
M3 	T201-12 	#= 46	TGA ATT CAT CCA TAG CTA ATT CTA AGA AAT CAA TTT CCA TTT GAC T 	14040.09
N3 	T201-13 	#= 47	TAG AAT TAG CTA TGG ATG AAT TCA TTG AAC GGT ATA AAT TAG AAG GC 	14612.46
O3 	T201-14 	#= 43	ACG ATA TGT TCG AAG GCA TAG CCT TCT AAT TTA TAC CGT TCA A 	13175.51
P3 	T201-15 	#= 44	TAT GCC TTC GAA CAT ATC GTT TAT GGA GAT TTT AGT CAT AGT CA 	13525.73
A4 	T201-16 	#= 45	AGT AGA TGT AAA CCA CCT AAC TGA CTA TGA CTA AAA TCT CCA TAA 	13772.94
B4 	T201-17 	#= 41	GTT AGG TGG TTT ACA TCT ACT GAT TGG ACT AGC TAA ACG TT 	12660.16
C4 	T201-18 	#= 42	AAT TCA AAA GGT GAT TCC TTA AAA CGT TTA GCT AGT CCA ATC 	12879.34
D4 	T201-19 	#= 45	TTA AGG AAT CAC CTT TTG AAT TAG AAG ATT TTA TTC CTA TGG ACA 	13846.96
E4 	T201-20 	#= 50	CTG TTA TGA AAT AGT TTT TAA CTG TAC TGT CCA TAG GAA TAA AAT CTT CT 	15361.93
F4 	T201-21 	#= 47	GTA CAG TTA AAA ACT ATT TCA TAA CAG ATG CGC AAA CAG GTT CAT CT 	14437.35
G4 	T201-22 	#= 40	ATA ACA GAA CAC ACA CAC TTA GAT GAA CCT GTT TGC GCA T 	12240.93
H4 	T201-23 	#= 46	AAG TGT GTG TGT TCT GTT ATT GAT TTA TTA CTT GAT GAT TTT GTT G 	14248.16
I4 	T201-24 	#= 53	CAG ATA AAT CTT GGG ATT TTA TTA TTT CAA CAA AAT CAT CAA GTA ATA AAT CA 	16287.57
J4 	T201-25 	#= 49	AAA TAA TAA AAT CCC AAG ATT TAT CTG TAG TTT CTA AGG TTG TCA AAG T 	15099.79
K4 	T201-26 	#= 47	TGA AAT TTC TGT ATA GTC AAT AGT CAC TTT GAC AAC CTT AGA AAC TA 	14418.34
L4 	T201-27 	#= 47	GAC TAT TGA CTA TAC AGA AAT TTC ATT TAT GCT TTG GTG TAA AGA TG 	14520.38
M4 	T201-28 	#= 43	GGT AAA ATG TTT CTA CAT GGC CAT CTT TAC ACC AAA GCA TAA A 	13177.54
N4 	T201-29 	#= 44	GCC ATG TAG AAA CAT TTT ACC CAA AAT TAC AAT CTA GTC AAG CG 	13475.73
O4 	T201-30 	#= 44	CAT AGC AAC ACC CGG TTG CCA CGC TTG ACT AGA TTG TAA TTT TG 	13481.68
P4 	T201-31 	#= 44	TGG CAA CCG GGT GTT GCT ATG CCT AAT CTT TAC AAA ATG CAA AG 	13554.74
A5 	T201-32 	#= 45	GTC ACA CTT TTC TAA TAG CAT TCT TTG CAT TTT GTA AAG ATT AGG 	13804.91
B5 	T201-33 	#= 45	AAT GCT ATT AGA AAA GTG TGA CCT TCA AAA TTA TGG TGA TAG TGC 	13946.02
C5 	T201-34 	#= 45	CAT TAT GCC TTT AGG TAA TGT TGC ACT ATC ACC ATA ATT TTG AAG 	13798.91
D5 	T201-35 	#= 44	AAC ATT ACC TAA AGG CAT AAT GAT GAA TGT CGC AAA ATA TAC TC 	13523.78
E5 	T201-36 	#= 45	TGT GTT TAA ATA TTG ACA CAG TTG AGT ATA TTT TGC GAC ATT CAT 	13868.96
F5 	T201-37 	#= 46	AAC TGT GTC AAT ATT TAA ACA CAT TAA CAT TAG CTG TAC CCT ATA A 	14058.12
G5 	T201-38 	#= 47	GCA CCA AAA TGT ATA ACT CTC ATA TTA TAG GGT ACA GCT AAT GTT AA 	14452.36
H5 	T201-39 	#= 44	TAT GAG AGT TAT ACA TTT TGG TGC TGG TTC TGA TAA AGG AGT TG 	13701.82
I5 	T201-40 	#= 40	TAA AAC AGC TGT ACC TGG TGC AAC TCC TTT ATC AGA ACC A 	12207.90
J5 	T201-41 	#= 41	CAC CAG GTA CAG CTG TTT TAA GAC AGT GGT TGC CTA CGG GT 	12656.14
K5 	T201-42 	#= 42	ATC TGA ATC GAC AAG CAG CGT ACC CGT AGG CAA CCA CTG TCT 	12852.29
L5 	T201-43 	#= 43	ACG CTG CTT GTC GAT TCA GAT CTT AAT GAC TTT GTC TCT GAT G 	13180.47
M5 	T201-44 	#= 44	TCA CCA ATC AAA GTT GAA TCT GCA TCA GAG ACA AAG TCA TTA AG 	13524.77
N5 	T202-1 	#= 47	TTG TGC AAC TGT ACA TAC AGC TAA TAA ATG GGA TCT CAT TAT TAG TG 	14490.36
O5 	T202-2 	#= 47	AGT CTT AGG GTC GTA CAT ATC ACT AAT AAT GAG ATC CCA TTT ATT AG 	14450.34
P5 	T202-3 	#= 45	ATA TGT ACG ACC CTA AGA CTA AAA ATG TTA CAA AAG AAA ATG ACT 	13870.03
A6 	T202-4 	#= 46	AAG TGA AAA AAC CCT CTT TAG AGT CAT TTT CTT TTG TAA CAT TTT T 	14077.10
B6 	T202-5 	#= 42	CTA AAG AGG GTT TTT TCA CTT ACA TTT GTG GGT TTA TAC AAC 	12923.34
C6 	T202-6 	#= 41	ACC TCC AAG AGC TAG CTT TTG TTG TAT AAA CCC ACA AAT GT 	12527.10
D6 	T202-7 	#= 40	AAA AGC TAG CTC TTG GAG GTT CCG TGG CTA TAA AGA TAA C 	12367.99
E6 	T202-8 	#= 40	CAG CAT TCC AAG AAT GTT CTG TTA TCT TTA TAG CCA CGG A 	12244.91
F6 	T202-9 	#= 41	AGA ACA TTC TTG GAA TGC TGA TCT TTA TAA GCT CAT GGG AC 	12638.16
G6 	T202-10 	#= 42	AGG CTG TCC ACC ATG CGA AGT GTC CCA TGA GCT TAT AAA GAT 	12922.33
H6 	T202-11 	#= 41	ACT TCG CAT GGT GGA CAG CCT TTG TTA CTA ATG TGA ATG CG 	12646.13
I6 	T202-12 	#= 42	TTA AAA ATG CTT CAG ATG ATG ACG CAT TCA CAT TAG TAA CAA 	12912.38
J6 	T202-13 	#= 43	TCA TCA TCT GAA GCA TTT TTA ATT GGA TGT AAT TAT CTT GGC A 	13211.53
K6 	T202-14 	#= 41	ATC TAT TTG TTC GCG TGG TTT GCC AAG ATA ATT ACA TCC AA 	12564.11
L6 	T202-15 	#= 40	AAC CAC GCG AAC AAA TAG ATG GTT ATG TCA TGC ATG CAA A 	12330.00
M6 	T202-16 	#= 45	ATT TGT ATT CCT CCA AAA TAT GTA ATT TGC ATG CAT GAC ATA ACC 	13751.90
N6 	T202-17 	#= 45	TTA CAT ATT TTG GAG GAA TAC AAA TCC AAT TCA GTT GTC TTC CTA 	13782.91
O6 	T202-18 	#= 46	GAA ATT TAC TCA TGT CAA ATA AAG AAT AGG AAG ACA ACT GAA TTG G 	14270.27
P6 	T202-19 	#= 46	TTC TTT ATT TGA CAT GAG TAA ATT TCC CCT TAA ATT AAG GGG TAC T 	14118.11
A7 	T202-20 	#= 43	CCT TCT TTT AAA GAC ATA ACA GCA GTA CCC CTT AAT TTA AGG G 	13144.50
B7 	T202-21 	#= 50	GCT GTT ATG TCT TTA AAA GAA GGT CAA ATC AAT GAT ATG ATT TTA TCT CT 	15401.95
C7 	T202-22 	#= 54	CTA ATT ATA AGT CTA CCT TTA CTA AGA AGA GAT AAA ATC ATA TCA TTG ATT TGA 	16607.77
D7 	T202-23 	#= 49	TCT TAG TAA AGG TAG ACT TAT AAT TAG AGA AAA CAA CAG AGT TGT TAT T 	15188.85
E7 	T202-24 	#= 44	TGT TAA CAA GAA CAT CAC TAG AAA TAA CAA CTC TGT TGT TTT CT 	13471.73
F7 	T202-25 	#= 42	TCT AGT GAT GTT CTT GTT AAC AAC TAA ACG AAC AAT GTT TGT 	12916.35
G7 	T202-26 	#= 41	AGT GGC AAT AAA ACA AGA AAA ACA AAC ATT GTT CGT TTA GT 	12681.25
H7 	T202-27 	#= 41	TTT TCT TGT TTT ATT GCC ACT AGT CTC TAG TCA GTG TGT TA 	12534.06
I7 	T202-28 	#= 40	TTG AGT TCT GGT TGT AAG ATT AAC ACA CTG ACT AGA GAC T 	12348.98
J7 	T202-29 	#= 40	ATC TTA CAA CCA GAA CTC AAT TAC CCC CTG CAT ACA CTA A 	12080.84
K7 	T202-30 	#= 40	AAA CAC CAC GTG TGA AAG AAT TAG TGT ATG CAG GGG GTA A 	12466.07
L7 	T202-31 	#= 40	TTC TTT CAC ACG TGG TGT TTA TTA CCC TGA CAA AGT TTT C 	12192.85
M7 	T202-32 	#= 41	TGA ATG TAA AAC TGA GGA TCT GAA AAC TTT GTC AGG GTA AT 	12735.25
N7 	T202-33 	#= 41	AGA TCC TCA GTT TTA CAT TCA ACT CAG GAC TTG TTC TTA CC 	12460.04
O7 	T202-34 	#= 42	CCA AGT AAC ATT GGA AAA GAA AGG TAA GAA CAA GTC CTG AGT 	13045.47
P7 	T202-35 	#= 42	TTT CTT TTC CAA TGT TAC TTG GTT CCA TGC TAT ACA TGT CTC 	12752.20
A8 	T202-36 	#= 40	TCT TAG TAC CAT TGG TCC CAG AGA CAT GTA TAG CAT GGA A 	12318.96
B8 	T202-37 	#= 40	TGG GAC CAA TGG TAC TAA GAG GTT TGA TAA CCC TGT CCT A 	12334.96
C8 	T202-38 	#= 44	AAA ATA AAC ACC ATC ATT AAA TGG TAG GAC AGG GTT ATC AAA CC 	13557.81
D8 	T202-39 	#= 44	CCA TTT AAT GAT GGT GTT TAT TTT GCT TCC ACT GAG AAG TCT AA 	13516.71
E8 	T202-40 	#= 42	AAA AAT CCA GCC TCT TAT TAT GTT AGA CTT CTC AGT GGA AGC 	12871.32
F8 	T202-41 	#= 44	CAT AAT AAG AGG CTG GAT TTT TGG TAC TAC TTT AGA TTC GAA GA 	13623.80
G8 	T202-42 	#= 42	AAC AAT AAG TAG GGA CTG GGT CTT CGA ATC TAA AGT AGT ACC 	12994.41
H8 	T202-43 	#= 44	CCC AGT CCC TAC TTA TTG TTA ATA ACG CTA CTA ATG TTG TTA TT 	13396.64
I8 	T202-44 	#= 47	CAA AAT TGA AAT TCA CAG ACT TTA ATA ACA ACA TTA GTA GCG TTA TT 	14435.38
J8 	T202-45 	#= 43	AAA GTC TGT GAA TTT CAA TTT TGT AAT GAT CCA TTT TTG GGT G 	13282.57
K8 	T202-46 	#= 30	TGG TAA TAA ACA CCC AAA AAT GGA TCA TTA 	9215.02
L8 	T203-1 	#= 45	CAA AAA CAA CAA AAG TTG GAT GGA AAG TGA GTT CAG AGT TTA TTC 	13973.06
M8 	T203-2 	#= 43	AAG TGC AAT TAT TCG CAC TAG AAT AAA CTC TGA ACT CAC TTT C 	13128.50
N8 	T203-3 	#= 40	TAG TGC GAA TAA TTG CAC TTT TGA ATA TGT CTC TCA GCC T 	12250.90
O8 	T203-4 	#= 40	CCT TCA AGG TCC ATA AGA AAA GGC TGA GAG ACA TAT TCA A 	12330.00
P8 	T203-5 	#= 44	TTT CTT ATG GAC CTT GAA GGA AAA CAG GGT AAT TTC AAA AAT CT 	13576.79
A9 	T203-6 	#= 49	AAT ATT CTT AAA CAC AAA TTC CCT AAG ATT TTT GAA ATT ACC CTG TTT T 	14936.67
B9 	T203-7 	#= 52	TAG GGA ATT TGT GTT TAA GAA TAT TGA TGG TTA TTT TAA AAT ATA TTC TAA G 	16153.45
C9 	T203-8 	#= 48	CAC TAA ATT AAT AGG CGT GTG CTT AGA ATA TAT TTT AAA ATA ACC ATC 	14755.57
D9 	T203-9 	#= 41	CAC ACG CCT ATT AAT TTA GTG CGT GAT CTC CCT CAG GGT TT 	12517.05
E9 	T203-10 	#= 40	CCA ATG GTT CTA AAG CCG AAA AAC CCT GAG GGA GAT CAC G 	12331.97
F9 	T203-11 	#= 44	TTC GGC TTT AGA ACC ATT GGT AGA TTT GCC AAT AGG TAT TAA CA 	13559.75
G9 	T203-12 	#= 46	AGT AAA GTT TGA AAC CTA GTG ATG TTA ATA CCT ATT GGC AAA TCT A 	14194.19
H9 	T203-13 	#= 46	TCA CTA GGT TTC AAA CTT TAC TTG CTT TAC ATA GAA GTT ATT TGA C 	14078.09
I9 	T203-14 	#= 44	CTG AAG AAG AAT CAC CAG GAG TCA AAT AAC TTC TAT GTA AAG CA 	13573.81
J9 	T203-15 	#= 41	TCC TGG TGA TTC TTC TTC AGG TTG GAC AGC TGG TGC TGC AG 	12645.10
K9 	T203-16 	#= 45	GTT GAA GAT AAC CCA CAT AAT AAG CTG CAG CAC CAG CTG TCC AAC 	13775.91
L9 	T203-17 	#= 51	CTT ATT ATG TGG GTT ATC TTC AAC CTA GGA CTT TTC TAT TAA AAT ATA ATG 	15657.11
M9 	T203-18 	#= 48	CAT CTG TAA TGG TTC CAT TTT CAT TAT ATT TTA ATA GAA AAG TCC TAG 	14719.51
N9 	T203-19 	#= 41	AAA ATG GAA CCA TTA CAG ATG CTG TAG ACT GTG CAC TTG AC 	12641.18
O9 	T203-20 	#= 40	CAC TTT GTT TCT GAG AGA GGG TCA AGT GCA CAG TCT ACA G 	12350.95
P9 	T203-21 	#= 40	CCT CTC TCA GAA ACA AAG TGT ACG TTG AAA TCC TTC ACT G 	12198.88
A10 	T203-22 	#= 45	GAA GTT TGA TAG ATT CCT TTT TCT ACA GTG AAG GAT TTC AAC GTA 	13878.96
B10 	T203-23 	#= 46	TAG AAA AAG GAA TCT ATC AAA CTT CTA ACT TTA GAG TCC AAC CAA C 	14086.15
C10 	T203-24 	#= 48	ATA TTA GGA AAT CTA ACA ATA GAT TCT GTT GGT TGG ACT CTA AAG TTA 	14842.60
D10 	T203-25 	#= 47	AGA ATC TAT TGT TAG ATT TCC TAA TAT TAC AAA CTT GTG CCC TTT TG 	14382.28
E10 	T203-26 	#= 40	GGT GGC GTT AAA AAC TTC ACC AAA AGG GCA CAA GTT TGT A 	12377.01
F10 	T203-27 	#= 40	GTG AAG TTT TTA ACG CCA CCA GAT TTG CAT CTG TTT ATG C 	12266.90
G10 	T203-28 	#= 40	TGA TTC TCT TCC TGT TCC AAG CAT AAA CAG ATG CAA ATC T 	12188.88
H10 	T203-29 	#= 40	TTG GAA CAG GAA GAG AAT CAG CAA CTG TGT TGC TGA TTA T 	12423.03
I10 	T203-30 	#= 40	GCG GAA TTA TAT AGG ACA GAA TAA TCA GCA ACA CAG TTG C 	12370.02
J10 	T203-31 	#= 42	TCT GTC CTA TAT AAT TCC GCA TCA TTT TCC ACT TTT AAG TGT 	12745.22
K10 	T203-32 	#= 42	TTA GTA GGA GAC ACT CCA TAA CAC TTA AAA GTG GAA AAT GAT 	12986.43
L10 	T203-33 	#= 46	TAT GGA GTG TCT CCT ACT AAA TTA AAT GAT CTC TGC TTT ACT AAT G 	14103.10
M10 	T203-34 	#= 51	CTA ATT ACA AAT GAA TCT GCA TAG ACA TTA GTA AAG CAG AGA TCA TTT AAT 	15720.20
N10 	T203-35 	#= 45	TCT ATG CAG ATT CAT TTG TAA TTA GAG GTG ATG AAG TCA GAC AAA 	13946.02
O10 	T203-36 	#= 41	TTC CAG TTT GCC CTG GAG CGA TTT GTC TGA CTT CAT CAC CT 	12484.01
P10 	T203-37 	#= 48	TCG CTC CAG GGC AAA CTG GAA AGA TTG CTG ATT ATA ATT ATA AAT TAC 	14797.57
A11 	T203-38 	#= 47	GCA GCC TGT AAA ATC ATC TGG TAA TTT ATA ATT ATA ATC AGC AAT CT 	14418.34
B11 	T203-39 	#= 43	CAG ATG ATT TTA CAG GCT GCG TTA TAG CTT GGA ATT CTA ACA A 	13255.56
C11 	T203-40 	#= 43	CAC CAA CCT TAG AAT CAA GAT TGT TAG AAT TCC AAG CTA TAA C 	13146.53
D11 	T203-41 	#= 47	TCT TGA TTC TAA GGT TGG TGG TAA TTA TAA TTA CCT GTA TAG ATT GT 	14533.37
E11 	T203-42 	#= 49	GGT TTG AGA TTA GAC TTC CTA AAC AAT CTA TAC AGG TAA TTA TAA TTA C 	15075.76
F11 	T203-43 	#= 45	TTA GGA AGT CTA ATC TCA AAC CTT TTG AGA GAG ATA TTT CAA CTG 	13856.96
G11 	T203-44 	#= 49	AGG TGT GCT ACC GGC CTG ATA GAT TTC AGT TGA AAT ATC TCT CTC AAA A 	15069.71
H11 	T201-PTZF 	#= 52	ATC GGA TCC CGG GCC CGT CGT TGA TGG TCA AGT AGA CTT ATT TAG AAA TGC C 	16034.29
I11 	T201-PTZR 	#= 53	ATC TAG ATG CAT TCG CGA GGT ACC GTC ACC AAT CAA AGT TGA ATC TGC ATC AG 	16284.49
J11 	T202-PTZF 	#= 51	ATC GGA TCC CGG GCC CGT CGT TGT GCA ACT GTA CAT ACA GCT AAT AAA TGG 	15699.09
K11 	T202-PTZR 	#= 57	ATC TAG ATG CAT TCG CGA GGT ACC GTG GTA ATA AAC ACC CAA AAA TGG ATC ATT ACA 	17561.34
L11 	T203-PTZF 	#= 50	ATC GGA TCC CGG GCC CGT CGC AAA AAC AAC AAA AGT TGG ATG GAA AGT GA 	15495.00
M11 	T203-PTZR 	#= 47	ATC TAG ATG CAT TCG CGA GGT ACC GAG GTG TGC TAC CGG CCT GAT AG 	14535.32
N11 	T201-T202 	#= 59	CCA TTT ATT AGC TGT ATG TAC AGT TGC ACA ATC ACC AAT CAA AGT TGA ATC TGC ATC AG 	18086.66
O11 	T202-T201 	#= 59	CTG ATG CAG ATT CAA CTT TGA TTG GTG ATT GTG CAA CTG TAC ATA CAG CTA ATA AAT GG 	18237.75
P11 	T202-T203 	#= 62	CTC ACT TTC CAT CCA ACT TTT GTT GTT TTT GTG GTA ATA AAC ACC CAA AAA TGG ATC ATT AC 	18925.19
A12 	T203-T202 	#= 62	GTA ATG ATC CAT TTT TGG GTG TTT ATT ACC ACA AAA ACA ACA AAA GTT GGA TGG AAA GTG AG 	19250.43
B12 	phiX174-V2_F1-1 	#= 55	GAG TTT TAT CGC TTC CAT GAC GCA GAA GTT AAC ACT TTC GGA TAT TTC TGA TGA G 	16944.90
C12 	phiX174-V2_F1-2 	#= 62	GCA GTA GTA ATT CCT GCT TTA TCA AGA TAA TTT TTC GAC TCA TCA GAA ATA TCC GAA AGT GT 	19063.29
D12 	phiX174-V2_F1-3 	#= 57	TGA TAA AGC AGG AAT TAC TAC TGC TTG TTT ACG AAT TAA ATC GAA GTG GAC TGC TGG 	17669.38
E12 	phiX174-V2_F1-4 	#= 47	AGG ATA GGT CGA ATT TTC TCA TTT TCC GCC AGC AGT CCA CTT CGA TT 	14370.24
F12 	phiX174-V2_F1-5 	#= 62	AAA ATG AGA AAA TTC GAC CTA TCC TTG CGC AGC TCG AGA AGC TCT TAC TTT GCG ACC TTT CG 	19011.22
G12 	phiX174-V2_F1-6 	#= 51	TCA GTT TTT GAC AGA ATC GTT AGT TGA TGG CGA AAG GTC GCA AAG TAA GAG 	15881.23
H12 	phiX174-V2_F1-7 	#= 55	ACT AAC GAT TCT GTC AAA AAC TGA CGC GTT GGA TGA GGA GAA GTG GCT TAA TAT G 	17086.01
I12 	phiX174-V2_F1-8 	#= 55	ATC TAA ACC AGT CCT TGA CGA ACG TGC CAA GCA TAT TAA GCC ACT TCT CCT CAT C 	16717.77
J12 	phiX174-V2_F1-9 	#= 45	TTC GTC AAG GAC TGG TTT AGA TAT GAG TCA CAT TTT GTT CAT GGT 	13901.94
K12 	phiX174-V2_F1-10 	#= 56	ACG CTC TTT TAA AAT GTC AAC AAG AGA ATC TCT ACC ATG AAC AAA ATG TGA CTC AT 	17166.11
L12 	phiX174-V2_F1-11 	#= 52	CTT GTT GAC ATT TTA AAA GAG CGT GGA TTA CTA TCT GAG TCC GAT GCT GTT C 	16029.30
M12 	phiX174-V2_F1-12 	#= 47	CTC ATG ATT TCT TAC CTA TTA GTG GTT GAA CAG CAT CGG ACT CAG AT 	14418.29
N12 	phiX174-V2_F1-13 	#= 55	ACC ACT AAT AGG TAA GAA ATC ATG AGT CAA GTT ACT GAA CAA TCC GTA CGT TTC C 	16893.91
O12 	phiX174-V2_F1-14 	#= 41	AAT AGA GGC CAA AGC GGT CTG GAA ACG TAC GGA TTG TTC AG 	12747.22
P12 	phiX174-V2_F1-15 	#= 56	GAC CGC TTT GGC CTC TAT TAA GCT CAT TCA GGC TTC TGC CGT TTT GGA TTT AAC CG 	17128.97
A13 	phiX174-V2_F1-16 	#= 50	TGT TAC TCG TCA GAA AAT CGA AAT CAT CTT CGG TTA AAT CCA AAA CGG CA 	15344.92
B13 	phiX174-V2_F1-17 	#= 47	ATT TCG ATT TTC TGA CGA GTA ACA AAG TTT GGA TTG CTA CTG ACC GC 	14458.31
C13 	phiX174-V2_F1-18 	#= 58	ACC ATA AAC GCA AGC CTC AAC GCA GCG ACG AGC ACG AGA GCG GTC AGT AGC AAT CCA A 	17850.50
D13 	phiX174-V2_F1-19 	#= 44	TGA GGC TTG CGT TTA TGG TAC GCT GGA CTT TGT GGG ATA CCC TC 	13591.70
E13 	phiX174-V2_F1-20 	#= 58	AAT GAC GGC AGC AAT AAA CTC AAC AGG AGC AGG AAA GCG AGG GTA TCC CAC AAA GTC C 	17953.59
F13 	phiX174-V2_F1-21 	#= 44	GAG TTT ATT GCT GCC GTC ATT GCT TAT TAT GTT CAT CCC GTC AA 	13444.64
G13 	phiX174-V2_F1-22 	#= 45	GAT GAG ACA GGC CGT TTG AAT GTT GAC GGG ATG AAC ATA ATA AGC 	14022.05
H13 	phiX174-V2_F1-23 	#= 42	TCA AAC GGC CTG TCT CAT CAT GGA AGG CGC TGA ATT TAC GGA 	12938.33
I13 	phiX174-V2_F1-24 	#= 44	ACG CTC GAC GCC ATT AAT AAT GTT TTC CGT AAA TTC AGC GCC TT 	13416.64
J13 	phiX174-V2_F1-25 	#= 54	TTA TTA ATG GCG TCG AGC GTC CGG TTA AAG CCG CTG AAT TGT TCG CGT TTA CCT 	16624.65
K13 	phiX174-V2_F1-26 	#= 55	GTA AGA ACG TCA GTG TTT CCT GCG CGT ACA CGC AAG GTA AAC GCG AAC AAT TCA G 	16976.93
L13 	phiX174-V2_F1-27 	#= 61	CAG GAA ACA CTG ACG TTC TTA CTG ACG CAG AAG AAA ACG TGC GTC AAA AAT TAC GTG CGG A 	18872.17
M13 	phiX174-V2_F1-28 	#= 54	AAC GTT TTT TAC CTT TAG ACA TTA CAT CAC TCC TTC CGC ACG TAA TTT TTG ACG 	16421.57
N13 	phiX174-V2_F1-29 	#= 58	ATG TAA TGT CTA AAG GTA AAA AAC GTT CTG GCG CTC GCC CTG GTC GTC CGC AGC CGT T 	17848.44
O13 	phiX174-V2_F1-30 	#= 47	GCC TTT ACG CTT GCC TTT AGT ACC TCG CAA CGG CTG CGG ACG ACC AG 	14367.20
P13 	phiX174-V2_F1-31 	#= 51	CTA AAG GCA AGC GTA AAG GCG CTC GTC TTT GGT ATG TAG GTG GTC AAC AAT 	15818.17
A14 	phiX174-V2_F1-32 	#= 55	CTC AAG TAA GGG GCC GAA GCC CCT GCA ATT AAA ATT GTT GAC CAC CTA CAT ACC A 	16840.86
B14 	phiX174-V2_F1-33 	#= 50	CTT CGG CCC CTT ACT TGA GGA TAA ATT ATG TCT AAT ATT CAA ACT GGC GC 	15309.86
C14 	phiX174-V2_F1-34 	#= 52	AGA TGG GAA AGG TCA TGC GGC ATA CGC TCG GCG CCA GTT TGA ATA TTA GAC A 	16141.38
D14 	phiX174-V2_F1-35 	#= 40	CGC ATG ACC TTT CCC ATC TTG GCT TCC TTG CTG GTC AGA T 	12155.79
E14 	phiX174-V2_F1-36 	#= 56	GAT AAC CGG AGT AGT TGA AAT GGT AAT AAG ACG ACC AAT CTG ACC AGC AAG GAA GC 	17396.23
F14 	phiX174-V2_F1-37 	#= 47	CCA TTT CAA CTA CTC CGG TTA TCG CTG GCG ACT CCT TCG AGA TGG AC 	14341.20
G14 	phiX174-V2_F1-38 	#= 48	AAT GGA GAA AGA CGG AGA GCG CCA ACG GCG TCC ATC TCG AAG GAG TCG 	14934.61
H14 	phiX174-V2_F1-39 	#= 48	GCT CTC CGT CTT TCT CCA TTG CGT CGT GGC CTT GCT ATT GAC TCT ACT 	14560.30
I14 	phiX174-V2_F1-40 	#= 55	GAC GAT GAG GGA CAT AAA AAG TAA AAA TGT CTA CAG TAG AGT CAA TAG CAA GGC C 	17115.08
J14 	phiX174-V2_F1-41 	#= 47	TTA CTT TTT ATG TCC CTC ATC GTC ACG TTT ATG GTG AAC AGT GGA TT 	14406.26
K14 	phiX174-V2_F1-42 	#= 51	GTG GCA TTA ACA CCA TCC TTC ATG AAC TTA ATC CAC TGT TCA CCA TAA ACG 	15521.02
L14 	phiX174-V2_F1-43 	#= 49	GAA GGA TGG TGT TAA TGC CAC TCC TCT CCC GAC TGT TAA CAC TAC TGG T 	15022.65
M14 	phiX174-V2_F1-44 	#= 43	GAA AAG CGG CAT GGT CAA TAT AAC CAG TAG TGT TAA CAG TCG G 	13348.62
N14 	phiX174-V2_F1-45 	#= 41	ATA TTG ACC ATG CCG CTT TTC TTG GCA CGA TTA ACC CTG AT 	12501.05
O14 	phiX174-V2_F1-46 	#= 59	CAA ATA ACC CTG AAA CAA ATG CTT AGG GAT TTT ATT GGT ATC AGG GTT AAT CGT GCC AA 	18215.75
P14 	phiX174-V2_F1-47 	#= 57	AAG CAT TTG TTT CAG GGT TAT TTG AAT ATC TAT AAC AAC TAT TTT AAA GCG CCG TGG 	17585.33
A15 	phiX174-V2_F1-48 	#= 21	CCA CGG CGC TTT AAA ATA GTT 	6405.18
B15 	phiX174-V2_F2-1 	#= 56	ACT ATT TTA AAG CGC CGT GGA TGC CTG ACC GTA CCG AGG CTA ACC CTA ATG AGC TT 	17199.04
C15 	phiX174-V2_F2-2 	#= 44	CCA TAA CGA GCA TCA TCT TGA TTA AGC TCA TTA GGG TTA GCC TC 	13465.68
D15 	phiX174-V2_F2-3 	#= 55	AAT CAA GAT GAT GCT CGT TAT GGT TTC CGT TGC TGC CAT CTC AAA AAC ATT TGG A 	16913.89
E15 	phiX174-V2_F2-4 	#= 53	GAA AGC TCA GTC TCA GGA GGA AGC GGA GCA GTC CAA ATG TTT TTG AGA TGG CA 	16494.61
F15 	phiX174-V2_F2-5 	#= 48	CCT CCT GAG ACT GAG CTT TCT CGC CAA ATG ACG ACT TCT ACC ACA TCT 	14558.36
G15 	phiX174-V2_F2-6 	#= 55	AGC ATA AGC AGC TTG CAG ACC CAT AAT GTC AAT AGA TGT GGT AGA AGT CGT CAT T 	17005.96
H15 	phiX174-V2_F2-7 	#= 55	TCT GCA AGC TGC TTA TGC TAA TTT GCA TAC TGA CCA AGA ACG TGA TTA CTT CAT G 	16873.86
I15 	phiX174-V2_F2-8 	#= 62	TTT ACC TCC AAA TGA AGA AAT AAC ATC ATG GTA ACG CTG CAT GAA GTA ATC ACG TTC TTG GT 	19082.31
J15 	phiX174-V2_F2-9 	#= 52	GAT GTT ATT TCT TCA TTT GGA GGT AAA ACC TCT TAT GAC GCT GAC AAC CGT C 	15958.27
K15 	phiX174-V2_F2-10 	#= 46	AGA GAT TAG AGC GCA TGA CAA GTA AAG GAC GGT TGT CAG CGT CAT A 	14320.24
L15 	phiX174-V2_F2-11 	#= 47	TTG TCA TGC GCT CTA ATC TCT GGG CAT CTG GCT ATG ATG TTG ATG GA 	14497.29
M15 	phiX174-V2_F2-12 	#= 48	AAC TGG CCT AAC GAC GTT TGG TCA GTT CCA TCA ACA TCA TAG CCA GAT 	14695.47
N15 	phiX174-V2_F2-13 	#= 41	AAA CGT CGT TAG GCC AGT TTT CTG GTC GTG TTC AAC AGA CC 	12591.10
O15 	phiX174-V2_F2-14 	#= 53	CAG GAA CAA AGA AAC GCG GCA CAG AAT GTT TAT AGG TCT GTT GAA CAC GAC CA 	16400.59
P15 	phiX174-V2_F2-15 	#= 54	CCG CGT TTC TTT GTT CCT GAG CAT GGC ACT ATG TTT ACT CTT GCG CTT GTT CGT 	16499.54
A16 	phiX174-V2_F2-16 	#= 45	ATC TCT TTA GTC GCA GTA GGC GGA AAA CGA ACA AGC GCA AGA GTA 	13936.00
B16 	phiX174-V2_F2-17 	#= 55	GCC TAC TGC GAC TAA AGA GAT TCA GTA CCT TAA CGC TAA AGG TGC TTT GAC TTA T 	16907.89
C16 	phiX174-V2_F2-18 	#= 51	TAC AAA ACA GGG TCG CCA GCA ATA TCG GTA TAA GTC AAA GCA CCT TTA GCG 	15709.14
D16 	phiX174-V2_F2-19 	#= 55	CTG GCG ACC CTG TTT TGT ATG GCA ACT TGC CGC CGC GTG AAA TTT CTA TGA AGG A 	16947.86
E16 	phiX174-V2_F2-20 	#= 60	TCT TAA ACT TCT TAG ACG AAT CAC CAG AAC GGA AAA CAT CCT TCA TAG AAA TTT CAC GCG 	18362.86
F16 	phiX174-V2_F2-21 	#= 48	GGT GAT TCG TCT AAG AAG TTT AAG ATT GCT GAG GGT CAG TGG TAT CGT 	14963.61
G16 	phiX174-V2_F2-22 	#= 40	AGA AAC ATA CGA AGG CGC ATA ACG ATA CCA CTG ACC CTC A 	12244.94
H16 	phiX174-V2_F2-23 	#= 54	TGC GCC TTC GTA TGT TTC TCC TGC TTA TCA CCT TCT TGA AGG CTT CCC ATT CAT 	16372.48
I16 	phiX174-V2_F2-24 	#= 57	ACG CGT TCT TGC AAA TCA CCA GAA GGC GGT TCC TGA ATG AAT GGG AAG CCT TCA AGA 	17610.33
J16 	phiX174-V2_F2-25 	#= 42	GTG ATT TGC AAG AAC GCG TAC TTA TTC GCC ACC ATG ATT ATG 	12903.32
K16 	phiX174-V2_F2-26 	#= 48	AAC TGA ACG GAC TGG AAA CAC TGG TCA TAA TCA TGG TGG CGA ATA AGT 	14897.62
L16 	phiX174-V2_F2-27 	#= 59	TGT TTC CAG TCC GTT CAG TTG TTG CAG TGG AAT AGT CAG GTT AAA TTT AAT GTG ACC GT 	18242.70
M16 	phiX174-V2_F2-28 	#= 61	CAT GAT TGA ATC GCG AGT GGT CGG CAG ATT GCG ATA AAC GGT CAC ATT AAA TTT AAC CTG A 	18875.15
N16 	phiX174-V2_F2-29 	#= 52	CCA CTC GCG ATT CAA TCA TGA CTT CGT GAT AAA AGA TTG AGT GTG AGG TTA T 	16056.34
O16 	phiX174-V2_F2-30 	#= 65	CTC AGC GGC AAA AAT TAA AAT TTT TAC CGC TTC GGC GTT ATA ACC TCA CAC TCA ATC TTT TAT CA 	19810.76
P16 	phiX174-V2_F2-31 	#= 57	AAA AAT TTT AAT TTT TGC CGC TGA GGG GTT GAC CAA GCG AAG CGC GGT AGG TTT TCT 	17668.34
A17 	phiX174-V2_F2-32 	#= 48	AAG TCT GAA ACA TGA TTA AAC TCC TAA GCA GAA AAC CTA CCG CGC TTC 	14681.50
B17 	phiX174-V2_F2-33 	#= 53	AGG AGT TTA ATC ATG TTT CAG ACT TTT ATT TCT CGC CAT AAT TCA AAC TTT TT 	16201.44
C17 	phiX174-V2_F2-34 	#= 52	ACA GAA GTG AGA ACC AGC TTA TCA GAA AAA AAG TTT GAA TTA TGG CGA GAA A 	16182.49
D17 	phiX174-V2_F2-35 	#= 52	ATA AGC TGG TTC TCA CTT CTG TTA CTC CAG CTT CTT CGG CAC CTG TTT TAC A 	15812.14
E17 	phiX174-V2_F2-36 	#= 44	GTT GAC GAT GTA GCT TTA GGT GTC TGT AAA ACA GGT GCC GAA GA 	13690.82
F17 	phiX174-V2_F2-37 	#= 60	CAC CTA AAG CTA CAT CGT CAA CGT TAT ATT TTG ATA GTT TGA CGG TTA ATG CTG GTA ATG 	18492.90
G17 	phiX174-V2_F2-38 	#= 55	ATG TAT CCA TCT GAA TGC AAT GAA GAA AAC CAC CAT TAC CAG CAT TAA CCG TCA A 	16831.89
H17 	phiX174-V2_F2-39 	#= 54	TTC ATT GCA TTC AGA TGG ATA CAT CTG TCA ACG CCG CTA ATC AGG TTG TTT CTG 	16567.64
I17 	phiX174-V2_F2-40 	#= 51	GGT CGG CAT CAA AAG CAA TAT CAG CAC CAA CAG AAA CAA CCT GAT TAG CGG 	15712.16
J17 	phiX174-V2_F2-41 	#= 46	ATA TTG CTT TTG ATG CCG ACC CTA AAT TTT TTG CCT GTT TGG TTC G 	14084.04
K17 	phiX174-V2_F2-42 	#= 44	CGG AAC CGA AGA AGA CTC AAA GCG AAC CAA ACA GGC AAA AAA TT 	13595.84
L17 	phiX174-V2_F2-43 	#= 55	TTG AGT CTT CTT CGG TTC CGA CTA CCC TCC CGA CTG CCT ATG ATG TTT ATC CTT T 	16701.68
M17 	phiX174-V2_F2-44 	#= 50	AAT AAC CAC CAT CAT GGC GAC CAT TCA AAG GAT AAA CAT CAT AGG CAG TC 	15332.92
N17 	phiX174-V2_F2-45 	#= 40	TCG CCA TGA TGG TGG TTA TTA TAC CGT CAA GGA CTG TGT G 	12372.95
O17 	phiX174-V2_F2-46 	#= 20	CAC ACA GTC CTT GAC GGT AT 	6076.96
P17 	phiX174-V2_F3-1 	#= 39	TAC CGT CAA GGA CTG TGT GAC TAT TGA CGT CCT TCC CCG 	11909.65
A18 	phiX174-V2_F3-2 	#= 44	AAC ATA AAC GTT ATT GCC CGG CGT ACG GGG AAG GAC GTC AAT AG 	13638.79
