where	code	length	seq	monoisotopic_mass
B18 	phiX174-V2_F3-3 	#= 47	CCG GGC AAT AAC GTT TAT GTT GGT TTC ATG GTT TGG TCT AAC TTT AC 	14471.29
C18 	phiX174-V2_F3-4 	#= 60	GAT TCA GCG AAA CCA ATC CGC GGC ATT TAG TAG CGG TAA AGT TAG ACC AAA CCA TGA AAC 	18502.94
D18 	phiX174-V2_F3-5 	#= 59	CGG ATT GGT TTC GCT GAA TCA GGT TAT TAA AGA GAT TAT TTG TCT CCA GCC ACT TAA GT 	18195.69
E18 	phiX174-V2_F3-6 	#= 46	AAT AGC ACC AAA CAT AAA TCA CCT CAC TTA AGT GGC TGG AGA CAA A 	14121.16
F18 	phiX174-V2_F3-7 	#= 50	AGG TGA TTT ATG TTT GGT GCT ATT GCT GGC GGT ATT GCT TCT GCT CTT GC 	15447.87
G18 	phiX174-V2_F3-8 	#= 56	TGA CCG CCT CCA AAC AAT TTA GAC ATG GCG CCA CCA GCA AGA GCA GAA GCA ATA CC 	17158.06
H18 	phiX174-V2_F3-9 	#= 53	AAT TGT TTG GAG GCG GTC AAA AAG CCG CCT CCG GTG GCA TTC AAG GTG ATG TG 	16468.56
I18 	phiX174-V2_F3-10 	#= 57	CAT CAC CCA TGC CTA CAG TAT TGT TAT CGG TAG CAA GCA CAT CAC CTT GAA TGC CAC 	17376.18
J18 	phiX174-V2_F3-11 	#= 58	ATA CTG TAG GCA TGG GTG ATG CTG GTA TTA AAT CTG CCA TTC AAG GCT CTA ATG TTC C 	17892.49
K18 	phiX174-V2_F3-12 	#= 61	GCA CCA GAA ACA AAA CTA GGG GCG GCC TCA TCA GGG TTA GGA ACA TTA GAG CCT TGA ATG G 	18929.18
L18 	phiX174-V2_F3-13 	#= 47	CCC TAG TTT TGT TTC TGG TGC TAT GGC TAA AGC TGG TAA AGG ACT TC 	14481.30
M18 	phiX174-V2_F3-14 	#= 41	GCC TGC AAC GTA CCT TCA AGA AGT CCT TTA CCA GCT TTA GC 	12480.04
N18 	phiX174-V2_F3-15 	#= 50	TTG AAG GTA CGT TGC AGG CTG GCA CTT CTG CCG TTT CTG ATA AGT TGC TT 	15419.88
O18 	phiX174-V2_F3-16 	#= 47	GAC TTG CCA CCA AGT CCA ACC AAA TCA AGC AAC TTA TCA GAA ACG GC 	14347.28
P18 	phiX174-V2_F3-17 	#= 48	TTG GAC TTG GTG GCA AGT CTG CCG CTG ATA AAG GAA AGG ATA CTC GTG 	14927.59
A19 	phiX174-V2_F3-18 	#= 46	GGA AAT GCA GCA GCA AGA TAA TCA CGA GTA TCC TTT CCT TTA TCA G 	14141.13
B19 	phiX174-V2_F3-19 	#= 42	TTA TCT TGC TGC TGC ATT TCC TGA GCT TAA TGC TTG GGA GCG 	12908.28
C19 	phiX174-V2_F3-20 	#= 50	CAT ACC AGC AGA GGA AGC ATC AGC ACC AGC ACG CTC CCA AGC ATT AAG CT 	15295.86
D19 	phiX174-V2_F3-21 	#= 40	ATG CTT CCT CTG CTG GTA TGG TTG ACG CCG GAT TTG AGA A 	12348.93
E19 	phiX174-V2_F3-22 	#= 55	TGA TTG TCC AGT TGC ATT TTA GTA AGC TCT TTT TGA TTC TCA AAT CCG GCG TCA A 	16861.83
F19 	phiX174-V2_F3-23 	#= 48	ACT AAA ATG CAA CTG GAC AAT CAG AAA GAG ATT GCC GAG ATG CAA AAT 	14867.65
G19 	phiX174-V2_F3-24 	#= 48	AAT GCC AGC AAT CTC TTT TTG AGT CTC ATT TTG CAT CTC GGC AAT CTC 	14609.39
H19 	phiX174-V2_F3-25 	#= 51	TCA AAA AGA GAT TGC TGG CAT TCA GTC GGC GAC TTC ACG CCA GAA TAC GAA 	15725.14
I19 	phiX174-V2_F3-26 	#= 43	CAT TTT GTG CAT ATA CCT GGT CTT TCG TAT TCT GGC GTG AAG T 	13211.48
J19 	phiX174-V2_F3-27 	#= 47	AGA CCA GGT ATA TGC ACA AAA TGA GAT GCT TGC TTA TCA ACA GAA GG 	14552.41
K19 	phiX174-V2_F3-28 	#= 55	TTT CCA TAA TAG ACG CAA CGC GAG CAG TAG ACT CCT TCT GTT GAT AAG CAA GCA T 	16901.89
L19 	phiX174-V2_F3-29 	#= 42	GCG TTG CGT CTA TTA TGG AAA ACA CCA ATC TTT CCA AGC AAC 	12841.30
M19 	phiX174-V2_F3-30 	#= 57	GAG TAA GCA TTT GGC GCA TAA TCT CGG AAA CCT GCT GTT GCT TGG AAA GAT TGG TGT 	17693.36
N19 	phiX174-V2_F3-31 	#= 45	TTA TGC GCC AAA TGC TTA CTC AAG CTC AAA CGG CTG GTC AGT ATT 	13794.89
O19 	phiX174-V2_F3-32 	#= 49	AGT CAT TTC TTT GAT TTG GTC ATT GGT AAA ATA CTG ACC AGC CGT TTG A 	15081.71
P19 	phiX174-V2_F3-33 	#= 45	CAA TGA CCA AAT CAA AGA AAT GAC TCG CAA GGT TAG TGC TGA GGT 	13935.01
A20 	phiX174-V2_F3-34 	#= 55	TAC CGC TGA TTC TGC GTT TGC TGA TGA ACT AAG TCA ACC TCA GCA CTA ACC TTG C 	16795.79
B20 	phiX174-V2_F3-35 	#= 54	AAA CGC AGA ATC AGC GGT ATG GCT CTT CTC ATA TTG GCG CTA CTG CAA AGG ATA 	16653.72
C20 	phiX174-V2_F3-36 	#= 50	CCA GAA GCA GCA TCA GTG ACG ACA TTA GAA ATA TCC TTT GCA GTA GCG CC 	15371.91
D20 	phiX174-V2_F3-37 	#= 45	TCA CTG ATG CTG CTT CTG GTG TGG TTG ATA TTT TTC ATG GTA TTG 	13890.90
E20 	phiX174-V2_F3-38 	#= 48	CAA GTA TCG GCA ACA GCT TTA TCA ATA CCA TGA AAA ATA TCA ACC ACA 	14673.52
F20 	phiX174-V2_F3-39 	#= 50	ATA AAG CTG TTG CCG ATA CTT GGA ACA ATT TCT GGA AAG ACG GTA AAG CT 	15480.99
G20 	phiX174-V2_F3-40 	#= 48	CCT AGA CAA ATT AGA GCC AAT ACC ATC AGC TTT ACC GTC TTT CCA GAA 	14623.45
H20 	phiX174-V2_F3-41 	#= 63	GGT ATT GGC TCT AAT TTG TCT AGG AAA TAA CCG TCA GGA TTG ACA CCC TCC CAA TTG TAT GTT 	19376.45
I20 	phiX174-V2_F3-42 	#= 50	AAA AAG CCT CCA AGA TTT GGA GGC ATG AAA ACA TAC AAT TGG GAG GGT GT 	15564.06
J20 	phiX174-V2_F3-43 	#= 59	CTC CAA ATC TTG GAG GCT TTT TTA TGG TTC GTT CTT ATT ACC CTT CTG AAT GTC ACG CT 	18015.54
K20 	phiX174-V2_F3-44 	#= 58	AGG TTT AAG AGC CTC GAT ACG CTC AAA GTC AAA ATA ATC AGC GTG ACA TTC AGA AGG G 	17955.58
L20 	phiX174-V2_F3-45 	#= 59	CGT ATC GAG GCT CTT AAA CCT GCT ATT GAG GCT TGT GGC ATT TCT ACT CTT TCT CAA TC 	18034.56
M20 	phiX174-V2_F3-46 	#= 63	ATG CGG TTA TCC ATC TGC TTA TGG AAG CCA AGC ATT GGG GAT TGA GAA AGA GTA GAA ATG CCA 	19582.60
N20 	phiX174-V2_F4-1 	#= 42	AGC AGA TGG ATA ACC GCA TCA AGC TCT TGG AAG AGA TTC TGT 	12986.38
O20 	phiX174-V2_F4-2 	#= 52	TAT CGA ACT CAA CGC CCT GCA TAC GAA AAG ACA GAA TCT CTT CCA AGA GCT T 	15893.26
P20 	phiX174-V2_F4-3 	#= 44	CAG GGC GTT GAG TTC GAT AAT GGT GAT ATG TAT GTT GAC GGC CA 	13697.80
A21 	phiX174-V2_F4-4 	#= 60	ACA GAT ACA AAC TCA TCA CGA ACG TCA GAA GCA GCC TTA TGG CCG TCA ACA TAC ATA TCA 	18366.86
B21 	phiX174-V2_F4-5 	#= 57	GTT CGT GAT GAG TTT GTA TCT GTT ACT GAG AAG TTA ATG GAT GAA TTG GCA CAA TGC 	17722.39
C21 	phiX174-V2_F4-6 	#= 46	ATA TCA AGT TGG GGG AGC ACA TTG TAG CAT TGT GCC AAT TCA TCC A 	14188.14
D21 	phiX174-V2_F4-7 	#= 43	GTG CTC CCC CAA CTT GAT ATT AAT AAC ACT ATA GAC CAC CGC C 	13035.42
E21 	phiX174-V2_F4-8 	#= 46	AAA AAC CAT TTT TCG TCC CCT TCG GGG CGG TGG TCT ATA GTG TTA T 	14137.08
F21 	phiX174-V2_F4-9 	#= 44	AAG GGG ACG AAA AAT GGT TTT TAG AGA ACG AGA AGA CGG TTA CG 	13790.92
G21 	phiX174-V2_F4-10 	#= 58	TTA AGA GGG CGT TCA GCA GCC AGC TTG CGG CAA AAC TGC GTA ACC GTC TTC TCG TTC T 	17824.42
H21 	phiX174-V2_F4-11 	#= 46	CTG CTG AAC GCC CTC TTA AGG ATA TTC GCG ATG AGT ATA ATT ACC C 	14084.07
I21 	phiX174-V2_F4-12 	#= 56	TGA ACA CTC ATC CTT AAT ACC TTT CTT TTT GGG GTA ATT ATA CTC ATC GCG AAT AT 	17103.02
J21 	phiX174-V2_F4-13 	#= 51	GAA AGG TAT TAA GGA TGA GTG TTC AAG ATT GCT GGA GGC CTC CAC TAT GAA 	15866.22
K21 	phiX174-V2_F4-14 	#= 47	ACG CTG AAT AGC AAA GCC TCT ACG CGA TTT CAT AGT GGA GGC CTC CA 	14432.29
L21 	phiX174-V2_F4-15 	#= 40	AGG CTT TGC TAT TCA GCG TTT GAT GAA TGC AAT GCG ACA G 	12365.97
M21 	phiX174-V2_F4-16 	#= 55	GTG TCA AAA ACG ATA AAC CAA CCA TCA GCA TGA GCC TGT CGC ATT GCA TTC ATC A 	16839.87
N21 	phiX174-V2_F4-17 	#= 51	GGT TGG TTT ATC GTT TTT GAC ACT CTC ACG TTG GCT GAC GAC CGA TTA GAG 	15733.08
O21 	phiX174-V2_F4-18 	#= 48	CGC AAA GCA TTG GGA TTA TCA TAA AAC GCC TCT AAT CGG TCG TCA GCC 	14720.48
P21 	phiX174-V2_F4-19 	#= 50	TGA TAA TCC CAA TGC TTT GCG TGA CTA TTT TCG TGA TAT TGG TCG TAT GG 	15417.90
A22 	phiX174-V2_F4-20 	#= 55	ATC ATT AGC CTT GCG ACC CTC GGC AGC AAG AAC CAT ACG ACC AAT ATC ACG AAA A 	16818.86
B22 	phiX174-V2_F4-21 	#= 49	GGG TCG CAA GGC TAA TGA TTC ACA CGC CGA CTG CTA TCA GTA TTT TTG T 	15077.69
C22 	phiX174-V2_F4-22 	#= 60	AAT GAA GAC GGC CAT TAG CTG TAC CAT ACT CAG GCA CAC AAA AAT ACT GAT AGC AGT CGG 	18502.94
D22 	phiX174-V2_F4-23 	#= 39	AGC TAA TGG CCG TCT TCA TTT CCA TGC GGT GCA CTT TAT 	11914.66
E22 	phiX174-V2_F4-24 	#= 42	CGC TAC CTG TAG GAA GTG TCC GCA TAA AGT GCA CCG CAT GGA 	12948.33
F22 	phiX174-V2_F4-25 	#= 48	GAC ACT TCC TAC AGG TAG CGT TGA CCC TAA TTT TGG TCG TCG GGT ACG 	14765.47
G22 	phiX174-V2_F4-26 	#= 54	ACG TAT TTT GCA AGC TAT TTA ACT GGC GGC GAT TGC GTA CCC GAC GAC CAA AAT 	16604.68
H22 	phiX174-V2_F4-27 	#= 52	CAG TTA AAT AGC TTG CAA AAT ACG TGG CCT TAT GGT TAC AGT ATG CCC ATC G 	16001.31
I22 	phiX174-V2_F4-28 	#= 59	AAC CAG AAC GTG AAA AAG CGT CCT GCG TGT AGC GAA CTG CGA TGG GCA TAC TGT AAC CA 	18246.74
J22 	phiX174-V2_F4-29 	#= 50	CGC TTT TTC ACG TTC TGG TTG GTT GTG GCC TGT TGA TGC TAA AGG TGA GC 	15466.89
K22 	phiX174-V2_F4-30 	#= 49	ACA GCC ATA TAA CTG GTA GCT TTA AGC GGC TCA CCT TTA GCA TCA ACA G 	15008.68
L22 	phiX174-V2_F4-31 	#= 56	AAG CTA CCA GTT ATA TGG CTG TTG GTT TCT ATG TGG CTA AAT ACG TTA ACA AAA AG 	17315.17
M22 	phiX174-V2_F4-32 	#= 45	GCA GCA AGG TCC ATA TCT GAC TTT TTG TTA ACG TAT TTA GCC ACA 	13784.89
N22 	phiX174-V2_F4-33 	#= 55	TCA GAT ATG GAC CTT GCT GCT AAA GGT CTA GGA GCT AAA GAA TGG AAC AAC TCA C 	16999.96
O22 	phiX174-V2_F4-34 	#= 47	GAA GTA GCG ACA GCT TGG TTT TTA GTG AGT TGT TCC ATT CTT TAG CT 	14511.32
P22 	phiX174-V2_F4-35 	#= 49	ACC AAG CTG TCG CTA CTT CCC AAG AAG CTG TTC AGA ATC AGA ATG AGC C 	15018.68
A23 	phiX174-V2_F4-36 	#= 50	ATT GTG AGC ATT TTC ATC CCG AAG TTG CGG CTC ATT CTG ATT CTG AAC AG 	15356.87
B23 	phiX174-V2_F4-37 	#= 57	CGG GAT GAA AAT GCT CAC AAT GAC AAA TCT GTC CAC GGA GTG CTT AAT CCA ACT TAC 	17513.29
C23 	phiX174-V2_F4-38 	#= 59	TAT CTG GTT GAA CGG CGT CGC GTC GTA ACC CAG CTT GGT AAG TTG GAT TAA GCA CTC CG 	18208.66
D23 	phiX174-V2_F4-39 	#= 40	GAC GCC GTT CAA CCA GAT ATT GAA GCA GAA CGC AAA AAG A 	12349.01
E23 	phiX174-V2_F4-40 	#= 51	AGT AAC TTT TCC CAG CCT CAA TCT CAT CTC TCT TTT TGC GTT CTG CTT CAA 	15417.90
F23 	phiX174-V2_F4-41 	#= 60	TTG AGG CTG GGA AAA GTT ACT GTA GCC GAC GTT TTG GCG GCG CAA CCT GTG ACG ACA AAT 	18619.94
G23 	phiX174-V2_F4-42 	#= 49	TTT TAT CGA AGC GCG CAT AAA TTT GAG CAG ATT TGT CGT CAC AGG TTG C 	15116.72
H23 	phiX174-V2_F4-43 	#= 44	TTT ATG CGC GCT TCG ATA AAA ATG ATT GGC GTA TCC AAC CTG CA 	13505.71
I23 	phiX174-V2_F4-44 	#= 23	TGC AGG TTG GAT ACG CCA ATC AT 	7063.59
J23 	phiX174-V2_F1_P-F_(pTZ/F) 	#= 41	CGA CGG GCC CGG GAT CCG ATG AGT TTT ATC GCT TCC ATG AC 	12593.08
K23 	phiX174-V2_F1_P-R_(pTZ/F) 	#= 40	CCT CGC GAA TGC ATC TAG ATC CAC GGC GCT TTA AAA TAG T 	12239.90
L23 	phiX174-V2_F2_P-F_(pTZ/F) 	#= 40	CGA CGG GCC CGG GAT CCG ATA CTA TTT TAA AGC GCC GTG G 	12337.92
M23 	phiX174-V2_F2_P-R_(pTZ/F) 	#= 39	CCT CGC GAA TGC ATC TAG ATC ACA CAG TCC TTG ACG GTA 	11911.68
N23 	phiX174-V2_F3_P-F_(pTZ/F) 	#= 39	CGA CGG GCC CGG GAT CCG ATT ACC GTC AAG GAC TGT GTG 	12049.73
O23 	phiX174-V2_F3_P-R_(pTZ/F) 	#= 39	CCT CGC GAA TGC ATC TAG ATA TGC GGT TAT CCA TCT GCT 	11908.66
P23 	phiX174-V2_F4_P-F_(pTZ/F) 	#= 39	CGA CGG GCC CGG GAT CCG ATA GCA GAT GGA TAA CCG CAT 	12051.75
A24 	phiX174-V2_F4_P-R_(pTZ/F) 	#= 36	CCT CGC GAA TGC ATC TAG ATT GCA GGT TGG ATA CGC 	11076.13
B24 	phiX174-V2_F1_P-F_T 	#= 51	GAT AAA AAT GAT TGG CGT ATC CAA CCT GCA GAG TTT TAT CGC TTC CAT GAC 	15672.10
C24 	phiX174-V2_F1_P-R_T 	#= 40	GCC TCG GTA CGG TCA GGC ATC CAC GGC GCT TTA AAA TAG T 	12296.91
D24 	phiX174-V2_F2_P-F_T 	#= 40	TTA TTT GAA TAT CTA TAA CAA CTA TTT TAA AGC GCC GTG G 	12282.95
E24 	phiX174-V2_F2_P-R_T 	#= 40	ACG GGG AAG GAC GTC AAT AGT CAC ACA GTC CTT GAC GGT A 	12378.98
F24 	phiX174-V2_F3_P-F_T 	#= 40	TCG CCA TGA TGG TGG TTA TTA TAC CGT CAA GGA CTG TGT G 	12372.95
G24 	phiX174-V2_F3_P-R_T 	#= 40	AGA ATC TCT TCC AAG AGC TTG ATG CGG TTA TCC ATC TGC T 	12236.88
H24 	phiX174-V2_F4_P-F_T 	#= 40	CCC CAA TGC TTG GCT TCC ATA AGC AGA TGG ATA ACC GCA T 	12224.88
I24 	phiX174-V2_F4_P-R_T 	#= 46	AAC TTC TGC GTC ATG GAA GCG ATA AAA CTC TGC AGG TTG GAT ACG C 	14198.14
J24 	P177A_F 	#= 40	GCG TTA ACC GTG CGG AAG CAG AGG CAG TCA GTA TGC TGG T 	12441.99
K24 	P177A_R 	#= 40	GCC TCT GCT TCC GCA CGG TTA ACG CAC GAG ACC AGG TCC T 	12193.82
L24 	S291L_F 	#= 40	ATT CTG AGA AAT TGG GTC AGC AGG AAG GTA AAG GTT GGA A 	12537.10
M24 	S291L_R 	#= 40	TCC TGC TGA CCC AAT TTC TCA GAA TGA ACA CGA CCG TGA T 	12199.87
N24 	D50Y_F 	#= 40	TGG CGG AAA ACT ACG AAT TGC GTG AAA ATG AAG GCT CGT G 	12458.04
O24 	D50Y_R 	#= 40	TCA CGC AAT TCG TAG TTT TCC GCC AGG ATG TCG AGG GCA T 	12302.91
P24 	KITV-S1-5-F 	#= 56	GCC CTT GAC TGC AAG TGC AAA GGT TGA GGA ATC CGC TTC AGA CTC AAA CGC AGA CG 	17267.10
A1 	KITV-S1-5-R 	#= 56	CGT GTT TCT TAC GAC TAT CTG TCT TGT TGT TGT TTC GTC TGC GTT TGA GTC TGA AG 	17227.01
B1 	f-KITV-S1-5 	#= 20	GCC CTT GAC TGC AAG TGC AA 	6101.97
C1 	T7-KITV-S1-5-F 	#= 36	TAA TAC GAC TCA CTA TAG GGC CCT TGA CTG CAA GTG 	11044.13
D1 	f-T7-KITV-S1-5 	#= 25	TAA TAC GAC TCA CTA TAG GGC CCT T 	7600.94
E1 	r-KITV-S1-5 	#= 29	CGT GTT TCT TAC GAC TAT CTG TCT TGT TG 	8846.70
F1 	KITV-S1-3-F1 	#= 55	AGG CTG ATC ACA CCT ACA CTA AAC ACA CAC AGA CAC GTT AGA GTA GAG CGC CCT G 	16859.87
G1 	KITV-S1-3-R 	#= 56	GTG TAC GGT GGC GCT AAC ACC GCA ACC TGG TTT TTC CAG GGC GCT CTA CTC TAA CG 	17182.99
H1 	KITV-S1-3-F2 	#= 56	GTG TTA GCG CCA CCG TAC ACG AAC ACG ACA AAA CTG AAT TGG GGG AAA AAG TAA AA 	17365.22
I1 	f-KITV-S1-3 	#= 20	AGG CTG ATC ACA CCT ACA CT 	6045.95
J1 	r-KITV-S1-3 	#= 25	TTT TAC TTT TTC CCC CAA TTC AGT T 	7498.86
K1 	T7-KITV-S1-3-F 	#= 39	TAA TAC GAC TCA CTA TAG GAG GCT GAT CAC ACC TAC ACT 	11903.70
L1 	f-T7-KITV-S1-3 	#= 24	TAA TAC GAC TCA CTA TAG GAG GCT 	7360.80
M1 	KITV-S2-5-F1 	#= 54	GCC GGT GGC AAG TGC ATA CAT CGA CAA CGA ATA CCG CTG ACT CCC CAA GGA AGT 	16618.69
N1 	KITV-S2-5-R1 	#= 53	TCC TTT CCC CAA CTT GCT TCA GGA CAA ATC CTT ACT TCC TTG GGG AGT CAG CG 	16145.35
O1 	KITV-S2.1-5-F2 	#= 56	GAA GCA AGT TGG GGA AAG GAA AAA AAA CAA CAA AAA AGA ACA AAA AAA ATA GAG AA 	17546.46
P1 	KITV-S2.2-5-F2 	#= 56	GAA GCA AGT TGG GGA AAG GAA AAA AAA CAA CAA ATA AGA ACA AAA AAA ATA GAG AA 	17537.45
A2 	KITV-S2-5-R2 	#= 51	TTG CCA TTC TTG TCT TGT CTT AGC AGT TTC TTT CTC TAT TTT TTT TGT TCT 	15487.91
B2 	f-KITV-S2-5 	#= 20	GCC GGT GGC AAG TGC ATA CA 	6167.01
C2 	r-KITV-S2-5 	#= 27	TTG CCA TTC TTG TCT TGT CTT AGC AGT 	8213.30
D2 	T7-KITV-S2-5-F 	#= 39	TAA TAC GAC TCA CTA TAG GGC CGG TGG CAA GTG CAT ACA 	12024.76
E2 	f-T7-KITV-S2-5 	#= 24	TAA TAC GAC TCA CTA TAG GGC CGG 	7361.78
F2 	KITV-S2.1-3-F1 	#= 60	GCT CCT TAC ACA AAG GCG GGA ACG GAG ACC GAC CCA GGA AAG GTA TCG GAC ACT CGA ACA 	18539.93
G2 	KITV-S2.2-3-F1 	#= 60	GCT CCT TAC ACA AAG GCG GGA ACG GAG ACC GAC CCA GGA AAG GCA TCG GAC ACC CGA ACA 	18509.90
H2 	KITV-S2.1-3-R1 	#= 61	AGG TTG AAA AAG GTA GGT GCA TTT CTG ATG GGT GCG TTC CGT GTT CGA GTG TCC GAT ACC T 	18952.13
I2 	KITV-S2.2-3-R1 	#= 61	AGA TTG AAA AAG GTA GGT GCA TTT CTG ATG GGT GCG TTC CGT GTT CGG GTG TCC GAT GCC T 	18968.13
J2 	KITV-S2.1-3-F2 	#= 61	GCA CCT ACC TTT TTC AAC CTT TTG TTC TAC CCT TTT TTG TTT AAT TTC TTT TCC CCT CTT C 	18346.75
K2 	KITV-S2.2-3-F2 	#= 61	GCA CCT ACC TTT TTC AAT CTT TTG TTC TAC CCT TTT TTG TTT AAT TTC TTT TCC CCT CTT C 	18361.76
L2 	KITV-S2-3-R2 	#= 61	ATA AGA TAG AGC TCC CTC TAA CCC CCA GGC CAG TAG GTG GGG AAG AGG GGA AAA GAA ATT A 	18962.21
M2 	KITV-S2-3-F3 	#= 61	TAG AGG GAG CTC TAT CTT ATG CTA TGA CGC CCG GGA AAC CGG TTA TGG CCG CAT GCG TCA C 	18821.05
N2 	KITV-S2-3-R3 	#= 61	ATG CTT AGG TTT TTT CCT TTT TTT GTG TTT TTT TAT TGG CCG TGA CGC ATG CGG CCA TAA C 	18725.98
O2 	KITV-S2-3-F4 	#= 61	AAA GGA AAA AAC CTA AGC ATA GAA AGC TCC CAA CCG ATC CTC CAT ATG GCT GGC AAG TGC T 	18761.11
P2 	KITV-S2-3-R4 	#= 65	CCC TTC CGG ATC CTC CTA GCT CAC CCC ACT CAC TTG AGG GGG CTT TAG CAC TTG CCA GCC ATA TG 	19759.63
A3 	f-KITV-S2-3 	#= 20	GCT CCT TAC ACA AAG GCG GG 	6126.98
B3 	r-KITV-S2-3 	#= 20	CCC TTC CGG ATC CTC CTA GC 	5964.86
C3 	T7-KITV-S2-3-F 	#= 39	TAA TAC GAC TCA CTA TAG GGC TCC TTA CAC AAA GGC GGG 	11984.74
D3 	f-T7-KITV-S2-3 	#= 30	TAA TAC GAC TCA CTA TAG GGC TCC TTA CAC 	9109.91
E3 	KITV-S3-5-F 	#= 65	GAC TGC AAG TGC ACA GGT TTT GGA CCT CGC GCT AGA CTC ACT TTA CAG ACT AGA ATT GTG AAT AG 	20062.89
F3 	KITV-S3.1-5-R 	#= 65	TTG AAG TTC TCA ACA ATC GCT TGT AAG TTT TTT TTC CTT TCT TTC CTA TTC ACA ATT CTA GTC TG 	19792.71
G3 	KITV-S3.2-5-R 	#= 55	TTA AAG TTC TCA ACA ATC GTT TGT AAG TTT TTT TTC TAT TCA CAA TTC TAG TCT G 	16809.83
H3 	f-KITV-S3-5 	#= 20	GAC TGC AAG TGC ACA GGT TT 	6157.01
I3 	r-KITV-S3.1-5 	#= 28	TTG AAG TTC TCA ACA ATC GCT TGT AAG T 	8577.57
J3 	r-KITV-S3.2-5 	#= 28	TTA AAG TTC TCA ACA ATC GTT TGT AAG T 	8576.58
K3 	T7-KITV-S3-5-F 	#= 39	TAA TAC GAC TCA CTA TAG GGA CTG CAA GTG CAC AGG TTT 	12014.76
L3 	f-T7-KITV-S3-5 	#= 24	TAA TAC GAC TCA CTA TAG GGA CTG 	7360.80
M3 	KITV-S3.1-3-F1 	#= 60	GCC GCG CTT AGG TGA CCA CAT GGA AAC GAC CCG GAC CGT TAG ACG GAA CAA AGG ACA AGG 	18595.95
N3 	KITV-S3.2-3-F1 	#= 60	GTT GCG CTT ACG TGA CCA CAC GGA AAC GAC CCG GAC CGT TAG ACG GAA CAA AGG ACA AGG 	18570.94
O3 	KITV-S3-3-R1 	#= 60	GTC ATT GCT AGG GCG CCA GTG TTT GTC TTG AAC TTG TGA TCC TTG TCC TTT GTT CCG TCT 	18408.75
P3 	KITV-S3-3-F2 	#= 63	ACT GGC GCC CTA GCA ATG ACT AGG TTG CGG CAA GCG CCA CCG CAA ACA AAA AAA TAG AAA AAA 	19446.56
A4 	KITV-S3.1-3-R2 	#= 54	TTC GGT CGC TTC AAC TAC AGA CTT TTA TGT TCC ATT TTT TCT ATT TTT TTG TTT 	16436.55
B4 	f-KITV-S3.1-3 	#= 18	GCC GCG CTT AGG TGA CCA 	5500.57
C4 	f-KITV-S3.2-3 	#= 20	GTT GCG CTT ACG TGA CCA CA 	6092.96
D4 	r-KITV-S3.1-3 	#= 29	TTC GGT CGC TTC AAC TAC AGA CTT TTA TG 	8833.71
E4 	r-KITV-S3.2-3 	#= 29	TTT TTT CTA TTT TTT TGT TTG CGG TGG CG 	8898.72
F4 	T7-KITV-S3.1-3-F 	#= 37	TAA TAC GAC TCA CTA TAG GGC CGC GCT TAG GTG ACC A 	11358.33
G4 	T7-KITV-S3.2-3-F 	#= 39	TAA TAC GAC TCA CTA TAG GGT TGC GCT TAC GTG ACC ACA 	11950.71
H4 	f-T7-KITV-S3.1-3 	#= 24	TAA TAC GAC TCA CTA TAG GGC CGC 	7321.76
I4 	f-T7-KITV-S3.2-3 	#= 26	TAA TAC GAC TCA CTA TAG GGT TGC GC 	7970.17
J4 	KITV-S4-5-F1 	#= 57	CTC TGA GTT GCA AGT GCT ATA GCT CGG AAT CCC GTC GCA GAC TCA ATC GAA CGA AAC 	17506.25
K4 	KITV-S4.1-5-R 	#= 57	TAG CAG TAG TTG CAG AGC TGG TTT TGC TAT TTG GAG TGT TTC GTT CGA TTG AGT CTG 	17703.33
L4 	KITV-S4.2-5-R 	#= 57	TAG CAA TAG TTG CAG AGC TGG TTT TGC TAT TTG GAG TGT TTC GTT CGA TTG AGT CTG 	17687.33
M4 	KITV-S4.1-5-F2 	#= 56	CAG CTC TGC AAC TAC TGC TAG AGA CAG ACG GAT TTG TGG GAG TAC CAA CAA CAA CA 	17259.12
N4 	KITV-S4.2-5-F2 	#= 56	CAG CTC TGC AAC TAT TGC TAG AGA CAG ACG GAT TTG TGG GAG TAC CAA CAA CAA CA 	17274.13
O4 	f-KITV-S4-5 	#= 22	CTC TGA GTT GCA AGT GCT ATA G 	6765.39
P4 	r-KITV-S4-5 	#= 20	TGT TGT TGT TGG TAC TCC CA 	6104.95
A5 	T7-KITV-S4-5-F 	#= 41	TAA TAC GAC TCA CTA TAG GCT CTG AGT TGC AAG TGC TAT AG 	12623.15
B5 	f-T7-KITV-S4-5 	#= 26	TAA TAC GAC TCA CTA TAG GCT CTG AG 	7954.17
C5 	KITV-S4-3-F1 	#= 59	GGG GTT TCG TTC ACG CCG GAA AAG ACG AAA AAC AAA CCC ATC CCC GCT AGC AGC GGC GG 	18193.68
D5 	KITV-S4-3-R1 	#= 59	CGT AGT GTT CCG TTT CCT GCA GCT CCG CGG CCC CAT TCC CCG CCG CTG CTA GCG GGG AT 	18010.46
E5 	KITV-S4-3-F2 	#= 59	GCA GGA AAC GGA ACA CTA CGC CCC CAA GGG GGT TGC GGA GGT AGC GTA ACC GCA CAA AA 	18291.76
F5 	KITV-S4-3-R2 	#= 59	TCC GGA GAA GAC GAT TTT TGT GCC ACT TTT TAT TTC TTT TTT TGT GCG GTT ACG CTA CC 	18086.58
G5 	KITV-S4-3-F3 	#= 59	CAA AAA TCG TCT TCT CCG GAT CGG AGC ATG GAG ATG GCA AGT GCT TAC AGG GGC CTC AA 	18244.71
H5 	KITV-S4-3-R3 	#= 52	TCC GGA GTA TGG AAC GAG ATC AGG GCA CTC ACT TGA GGC CCC TGT AAG CAC T 	16038.30
I5 	f-KITV-S4-3 	#= 20	GGG GTT TCG TTC ACG CCG GA 	6164.98
J5 	r-KITV-S4-3 	#= 25	TCC GGA GTA TGG AAC GAG ATC AGG G 	7796.05
K5 	T7-KITV-S4-3-F 	#= 39	TAA TAC GAC TCA CTA TAG GGG GGT TTC GTT CAC GCC GGA 	12022.74
L5 	f-T7-KITV-S4-3 	#= 31	TAA TAC GAC TCA CTA TAG GGG GGT TTC GTT C 	9541.16
M5 	MS2-F1 	#= 57	ATG GCG AGC AAC TTT ACC CAG TTT GTG CTG GTG GAT AAC GGC GGC ACC GGC GAT GTG 	17681.31
N5 	MS2-R1 	#= 57	CCG CCA CGC CGT TCG CAA AGT TGC TCG GCG CCA CGG TCA CAT CGC CGG TGC CGC CGT 	17405.09
O5 	MS2-F2 	#= 57	CTT TGC GAA CGG CGT GGC GGA ATG GAT TAG CAG CAA CAG CCG CAG CCA GGC GTA TAA 	17677.34
P5 	MS2-R2 	#= 57	GTT CTG CGC GCT GCT CTG GCG CAC GCT GCA GGT CAC TTT ATA CGC CTG GCT GCG GCT 	17487.14
A6 	MS2-F3 	#= 57	GCC AGA GCA GCG CGC AGA ACC GCA AAT ATA CCA TTA AAG TGG AAG TGC CGA AAG TGG 	17687.39
B6 	MS2-R3 	#= 57	GCC ACC GGC AGT TCC ACG CCG CCC ACG GTC TGG GTC GCC ACT TTC GGC ACT TCC ACT 	17315.04
C6 	MS2-F4 	#= 57	GGC GTG GAA CTG CCG GTG GCG GCG TGG CGC AGC TAT CTG AAC ATG GAA CTG ACC ATT 	17691.31
D6 	MS2-R4 	#= 57	CAA TCA GTT CGC AAT CGC TGT TGG TCG CAA AAA TCG GAA TGG TCA GTT CCA TGT TCA 	17542.27
E6 	MS2-F5 	#= 57	CAG CGA TTG CGA ACT GAT TGT GAA AGC GAT GCA GGG CCT GCT GAA AGA TGG CAA CCC 	17676.35
F6 	MS2-R5 	#= 57	ATA AAT GCC GCT GTT CGC CGC AAT CGC GCT CGG AAT CGG GTT GCC ATC TTT CAG CAG 	17496.20
G6 	f-MS2 	#= 22	ATG GCG AGC AAC TTT ACC CAG T 	6719.37
H6 	f-cacc-MS2 	#= 22	CAC CAT GGC GAG CAA CTT TAC C 	6664.34
I6 	r-MS2 	#= 20	ATA AAT GCC GCT GTT CGC CG 	6092.96
J6 	1fl_HSTV2_F_CACC 	#= 24	CAC CAG CGG TCC GTC GCC GCC TTT 	7241.66
K6 	1fl_HSTV2_F 	#= 20	AGC GGT CCG TCG CCG CCT TT 	6060.91
L6 	1HSTV2_F 	#= 66	AGC GGT CCG TCG CCG CCT TTA CCG GCG GCG GGC GCC ACC TGC TAC CTG ATT CGT GAT GGC GCG CAC 	20252.88
M6 	1HSTV2_R 	#= 66	GAG TGC GCA GCC AGT TTA AGC AGC CGG TAT CTC CGC GCT TAA TGA CGT GCG CGC CAT CAC GAA TCA 	20300.00
N6 	1fl_HSTV_R 	#= 20	GAG TGC GCA GCC AGT TTA AG 	6182.02
O6 	2fl_HSTV2_F 	#= 20	CTT AAA CTG GCT GCG CAC TC 	6052.93
P6 	2HSTV2_F 	#= 66	CTT AAA CTG GCT GCG CAC TCA AGA CAA AGA CTG TCC CAA TGC AAT CCT GTC ATA CCA CCA TGA CCG 	20139.95
A7 	2HSTV2_R 	#= 66	GAG TTC GCT AAT GGT CGC GGT CTG GCC GGC GCA AAT AAC ATG TTT CCG GTC ATG GTG GTA TGA CAG 	20472.09
B7 	2fl_HSTV2_R 	#= 20	GAG TTC GCT AAT GGT CGC GG 	6189.01
C7 	3fl_HSTV2_F 	#= 20	CCG CGA CCA TTA GCG AAC TC 	6046.94
D7 	3HSTV2_F 	#= 66	CCG CGA CCA TTA GCG AAC TCA TCG CAG ATG TTA GCG ATG TGG TAT CCG GCG AGG GAG CTT CTG CCG 	20387.03
E7 	3HSTV2_R 	#= 66	AGG GCC GTT TTG GTG ATG TTC AGG GCC GCT TTG CCC GCT GCC TCC ACG GCA GAA GCT CCC TCG CCG 	20257.89
F7 	3fl_HSTV2_R 	#= 20	AGG GCC GTT TTG GTG ATG TT 	6210.01
G7 	4fl_HSTV2_F 	#= 20	GAA CAT CAC CAA AAC GGC CC 	6048.96
H7 	4HSTV2_F 	#= 65	GAA CAT CAC CAA AAC GGC CCT TCT ACG TGC CAA GGA AAA ATT TTT CAA AAC GAA AAA TTT TTT CG 	19935.88
I7 	4HSTV2_R 	#= 60	ACA CCC GCA CTG GCG TTG ACA TAG CTT TCG AAA AAA TTT TTC GTT TTG AAA AAT TTT TCC 	18372.83
J7 	4fl_HSTV2_R 	#= 20	ACA CCC GCA CTG GCG TTG AC 	6062.93
K7 	5fl_HSTV2_F 	#= 20	GTC AAC GCC AGT GCG GGT GT 	6173.99
L7 	5HSTV2_F 	#= 60	GTC AAC GCC AGT GCG GGT GTG GGT CCG ACG GTA CTG CGC TGG TCG GCT ACA TTG GCG GTG 	18652.88
M7 	5HSTV2_R 	#= 62	TAT AAT TGC CGG TGG CAG TCG CAA ATG TGC CCC CAG AAG GAG CAC CGC CAA TGT AGC CGA CC 	19082.24
N7 	5fl_HSTV2_R 	#= 20	TAT AAT TGC CGG TGG CAG TC 	6147.99
O7 	1HSTV2_F2 	#= 55	AGC GGT CCG TCG CCG CCT TTA CCG GCG GCG GGC GCC ACC TGC TAC CTG ATT CGT G 	16848.73
P7 	1HSTV2_R2 	#= 55	GCC GGT ATC TCC GCG CTT AAT GAC GTG CGC GCC ATC ACG AAT CAG GTA GCA GGT G 	16952.85
A8 	1fl_HSTV2_R2 	#= 20	GCC GGT ATC TCC GCG CTT AA 	6068.93
B8 	2fl_HSTV2_F2 	#= 20	TTA AGC GCG GAG ATA CCG GC 	6167.01
C8 	2HSTV2_F2 	#= 55	TTA AGC GCG GAG ATA CCG GCT GCT TAA ACT GGC TGC GCA CTC AAG ACA AAG ACT G 	16977.91
D8 	2HSTV2_R2 	#= 55	TCC GGT CAT GGT GGT ATG ACA GGA TTG CAT TGG GAC AGT CTT TGT CTT GAG TGC G 	17089.93
E8 	2fl_HSTV2_R2 	#= 20	TCC GGT CAT GGT GGT ATG AC 	6163.99
F8 	3fl_HSTV2_F2 	#= 20	GTC ATA CCA CCA TGA CCG GA 	6070.96
G8 	3HSTV2_F2 	#= 55	GTC ATA CCA CCA TGA CCG GAA ACA TGT TAT TTG CGC CGG CCA GAC CGC GAC CAT T 	16824.80
H8 	3HSTV2_R2 	#= 55	GAT ACC ACA TCG CTA ACA TCT GCG ATG AGT TCG CTA ATG GTC GCG GTC TGG CCG G 	16942.85
I8 	3fl_HSTV2_R2 	#= 20	GAT ACC ACA TCG CTA ACA TC 	6029.95
J8 	4fl_HSTV2_F2 	#= 20	GAT GTT AGC GAT GTG GTA TC 	6203.03
K8 	4HSTV2_F2 	#= 55	GAT GTT AGC GAT GTG GTA TCC GGC GAG GGA GCT TCT GCC GTG GAG GCA GCG GGC A 	17184.97
L8 	4HSTV2_R2 	#= 55	TAG AAG GGC CGT TTT GGT GAT GTT CAG GGC CGC TTT GCC CGC TGC CTC CAC GGC A 	16941.81
M8 	4fl_HSTV2_R2 	#= 20	TAG AAG GGC CGT TTT GGT GA 	6228.04
N8 	5fl_HSTV2_F2 	#= 20	ACA TCA CCA AAA CGG CCC TT 	6014.94
O8 	5HSTV2_F2 	#= 63	ACA TCA CCA AAA CGG CCC TTC TAC GTG CCA AGG AAA AAT TTT TCA AAA CGA AAA ATT TTT TCG 	19293.47
P8 	Unnamedsequence_F0-F_(pTZ/F) 	#= 35	CGA CGG GCC CGG GAT CCG ATA ACT CGC CGC CAC TC 	10663.84
A9 	Unnamedsequence_F0-R_(pTZ/F) 	#= 35	CCT CGC GAA TGC ATC TAG ATT GCA TTC GCG GCG TT 	10713.89
B9 	pRS426G-F2 	#= 52	ATC GGA TCC CGG GCC CGT CGA CTG CAG AGG CGC GCT TGG CGT AAT CAT GGT C 	16038.24
C9 	pRS426G-R2 	#= 50	ATC TAG ATG CAT TCG CGA GGT ACC GAG CTC CAA GCT TAT CGA TAC CGT CG 	15345.86
D9 	N4F6-Fs 	#= 22	ACC AAT ACA AGG AGA TAT TCC C 	6696.39
E9 	N4F10-Rs 	#= 20	CAT AGG TTG TCA TCA CAG TG 	6131.99
F9 	F6err-1 	#= 45	GAT AAG TGG CTG TTC ACA GTT CAA GAC GGT AAC GTC CTG ATT AAC 	13883.95
G9 	F6err-2 	#= 45	GTT AAT CAG GAC GTT ACC GTC TTG AAC TGT GAA CAG CCA CTT ATC 	13794.89
H9 	F6err-3 	#= 41	CGA TAT CAC CTA TCG AGT TCG GCT TTT TGA TAA CCG GAC AG 	12575.10
I9 	F6err-4 	#= 41	CTG TCC GGT TAT CAA AAA GCC GAA CTC GAT AGG TGA TAT CG 	12633.15
J9 	dCas9-F1 	#= 19	GAT TCT ACT GAT AAA GCC G 	5811.80
K9 	dCas9-R1 	#= 18	CAA AGC AAT GAG ATT CCC 	5476.60
L9 	MGA_WhiA-F 	#= 25	CAA GAG GTT AAA AGT GAG ATC TGT G 	7794.07
M9 	MGA_WhiA-R 	#= 22	GCT GTT GTT CTT CTA GTT CGT G 	6729.34
N9 	MGA_eno-F 	#= 22	GCG ATC TTA GCA GTA TCA ATG G 	6774.41
O9 	MGA_eno-R 	#= 22	ACC TTC ATC ACC TTT GTT AGT A 	6635.32
P9 	MGA_RplC_F 	#= 22	TTA AAC AAG CCG CAA TTA GGT C 	6727.40
A10 	MGA_RplC_R 	#= 22	TAC CCT TCA TAA CTC TTT GAG C 	6620.31
B10 	UhpTM-F 	#= 32	TAT AGG ATC CAT GCT AGC TTT TCT AAA TCA GG 	9813.36
C10 	UhpTM-R 	#= 32	TAT AGT CGA CTT AAG CAA CAG TTA ACT GTT GA 	9846.39
D10 	UhpTM-MF 	#= 32	TAT AGC ATG CAT GCT AGC TTT TCT AAA TCA GG 	9813.36
E10 	UhpTM-MR 	#= 32	TAT ATC TAG ATT AAG CAA CAG TTA ACT GTT GA 	9845.41
F10 	NADLig-F 	#= 30	TAT AGG ATC CAT GAC CCT GGA AGA AGC GCG 	9265.00
G10 	NADLig-R 	#= 30	TAT AGT CGA CTT ACA CGA GTT CTT CCG CTT 	9122.89
H10 	MaLionG-F 	#= 44	CTG AAA GGA GGA TAC TCG AGA TGG TTT CTA AAG GTG AAG AAT TA 	13731.88
I10 	MaLionG-R 	#= 44	TTT TCT GCA GAT GTC CAT GGT TAT TTG TAA AGT TCA TCC ATT CC 	13443.65
J10 	NAD_Ligase-1 	#= 43	ATG ACC CTG GAA GAA GCG CGT AAG CGC GTG AAT GAA CTG CGC G 	13351.59
K10 	NAD_Ligase-2 	#= 54	AAC ATA ATA ACG GTA GTT ATG GTA ACG GAT CAG ATC GCG CAG TTC ATT CAC GCG 	16677.74
L10 	NAD_Ligase-3 	#= 66	TCC GTT ACC ATA ACT ACC GTT ATT ATG TTC TGG CGG ATC CAG AGA TCT CGG ACG CGG AAT ACG ACC 	20263.99
M10 	NAD_Ligase-4 	#= 53	GTT CCT CCA ATT CTT TCA ATT CGC GCA ACA GAC GGT CGT ATT CCG CGT CCG AG 	16170.36
N10 	NAD_Ligase-5 	#= 63	CGC GAA TTG AAA GAA TTG GAG GAA CGT TTT CCG GAA CTG AAG TCA CCA GAT TCT CCG ACC CTG 	19439.49
O10 	NAD_Ligase-6 	#= 54	AAG GTC GCT TCC AAC GGA CGG GCG CCA ACC TGC AGG GTC GGA GAA TCT GGT GAC 	16722.71
P10 	NAD_Ligase-7 	#= 59	CGT CCG TTG GAA GCG ACC TTC CGT CCA GTG CGC CAC CCG ACC CGC ATG TAC AGC TTG GA 	18045.53
A11 	NAD_Ligase-8 	#= 48	TTC AGT TCA TCC AGG TTG AAT GCG TTA TCC AAG CTG TAC ATG CGG GTC 	14764.48
