where	code	seq	DMT	comment	length	
A1 	F1-1 	CGT CCG GCG TAG AGG ATC GAG ATC TTA ATA CGA CTC GGT ATA GGG GAA TTG 	(DMT OFF) 	\"MOLODTSOV\" 	#= 51
B1 	F1-2 	TTC TAG AGG GGA ATT GTT ATC CGC TCA CAA TTC CCC TAT ACC GAG TCG TAT TAA 	(DMT OFF) 	\"MOLODTSOV\" 	#= 54
C1 	F1-3 	TGA GCG GAT AAC AAT TCC CCT CTA GAA ATA ATT TTG TTT AAC TTT AAG AAG GAG 	(DMT OFF) 	\"MOLODTSOV\" 	#= 54
D1 	F1-4 	TTG GGC GGA CGG AAG CAT GGT ATA TCT CCT TCT TAA AGT TAA ACA AAA TTA T 	(DMT OFF) 	\"MOLODTSOV\" 	#= 52
E1 	F1-5 	ATA TAC CAT GCT TCC GTC CGC CCA AGC GCC CTC CCT CCT CAA TCC CA 	(DMT OFF) 	\"MOLODTSOV\" 	#= 47
F1 	F1-6 	CCA GTG CCG CGA AGT CGT CGG TGG GAT TGA GGA GGG AGG GCG C 	(DMT OFF) 	\"MOLODTSOV\" 	#= 43
G1 	F1-7 	CCG ACG ACT TCG CGG CAC TGG GCA ATA TTG CCT GGC TGT GGA TGA ACT 	(DMT OFF) 	\"MOLODTSOV\" 	#= 48
H1 	F1-8 	GCC AGT CGC GGT GCA TGG GAG AGT TCA TCC ACA GCC AGG CAA TAT TGC 	(DMT OFF) 	\"MOLODTSOV\" 	#= 48
I1 	F1-9 	CTC CCA TGC ACC GCG ACT GGC CGG TGC ATC TGC TCG CAC GC 	(DMT OFF) 	\"MOLODTSOV\" 	#= 41
J1 	F1-10 	GTT GAA TCG GCG CGA GCG TGT TGC GTG CGA GCA GAT GCA CCG 	(DMT OFF) 	\"MOLODTSOV\" 	#= 42
K1 	F1-11 	AAC ACG CTC GCG CCG ATT CAA CTG GGC CAA TAC ATT CTG CTG CGA TG 	(DMT OFF) 	\"MOLODTSOV\" 	#= 47
L1 	F1-12 	GCA GTA TGC AAC CGG CAC GTC ATT GCA TCG CAG CAG AAT GTA TTG GCC CA 	(DMT OFF) 	\"MOLODTSOV\" 	#= 50
M1 	F1-13 	CAA TGA CGT GCC GGT TGC ATA CTG CAG CTG GGC CCT AAT GGA CGC CG 	(DMT OFF) 	\"MOLODTSOV\" 	#= 47
N1 	F1-14 	CGC CAT GAC ATA GGA GAG TTC GGT GTC GGC GTC CAT TAG GGC CCA GCT 	(DMT OFF) 	\"MOLODTSOV\" 	#= 48
O1 	F1-15 	ACA CCG AAC TCT CCT ATG TCA TGG CGC CCT CGT CGC TGG GCG GGA A 	(DMT OFF) 	\"MOLODTSOV\" 	#= 46
P1 	F1-16 	GGT CGC CGC AGT TCC AGG CAT TCC CGC CCA GCG ACG AGG G 	(DMT OFF) 	\"MOLODTSOV\" 	#= 40
A2 	F1-17 	TGC CTG GAA CTG CGG CGA CCG ACT GTG GAT CAT CGA CTG GAT CGC G 	(DMT OFF) 	\"MOLODTSOV\" 	#= 46
B2 	F1-18 	CGA TTG TCG TCG CGC GAG AAT GGC GCG ATC CAG TCG ATG ATC CAC AGT C 	(DMT OFF) 	\"MOLODTSOV\" 	#= 49
C2 	F1-19 	CCA TTC TCG CGC GAC GAC AAT CGT GCG CTG CGC CGC GCG CTG GC 	(DMT OFF) 	\"MOLODTSOV\" 	#= 44
D2 	F1-20 	CGC TGT CGG GGT GCC GTT CGG CCA GCG CGC GGC GCA GCG CA 	(DMT OFF) 	\"MOLODTSOV\" 	#= 41
E2 	F1-21 	CGA ACG GCA CCC CGA CAG CGT GGG CCG TTC GCT GCG CGT T 	(DMT OFF) 	\"MOLODTSOV\" 	#= 40
F2 	F1-22 	CGC GGT GTC GCC GCC GCG CCG AAC GCG CAG CGA ACG GCC CA 	(DMT OFF) 	\"MOLODTSOV\" 	#= 41
G2 	F1-23 	CGG CGC GGC GGC GAC ACC GCG CGC GTC AAG GAG TAC CGA GGC C 	(DMT OFF) 	\"MOLODTSOV\" 	#= 43
H2 	F1-24 	CGG CGG CCG CGT CCA GCG CGC GGC CTC GGT ACT CCT TGA CGC G 	(DMT OFF) 	\"MOLODTSOV\" 	#= 43
I2 	F1-25 	GCG CGC TGG ACG CGG CCG CCG CTC GCG CGC AGC TGG ACC GC 	(DMT OFF) 	\"MOLODTSOV\" 	#= 41
J2 	F1-26 	TCC TGC GAT CAG TTC GGC ATG GTA GCG GTC CAG CTG CGC GCG AG 	(DMT OFF) 	\"MOLODTSOV\" 	#= 44
K2 	F1-27 	TAC CAT GCC GAA CTG ATC GCA GGA CTG CGC GCG AGC AAC GGC GG 	(DMT OFF) 	\"MOLODTSOV\" 	#= 44
L2 	F1-28 	CCC GGC CTC GCG GCG CGT ATC CGC CGT TGC TCG CGC GCA G 	(DMT OFF) 	\"MOLODTSOV\" 	#= 40
M2 	F1-29 	ATA CGC GCC GCG AGG CCG GGG CAC CGC CTG ACC TTA CAG CCA 	(DMT OFF) 	\"MOLODTSOV\" 	#= 42
N2 	F1-30 	CGT CCG GCG TAG AGG ATC GAG ATC TTA ATA CGA CTC GGT ATA GGG GAA TTG 	(DMT OFF) 	\"MOLODTSOV\" 	#= 51
O2 	F2-1 	CCT TAC AGC CAG ACC CTA TCT AAT ACG ACT CAC TAT AGG GGA ATT GTG AGC GGA 	(DMT OFF) 	\"MOLODTSOV\" 	#= 54
P2 	F2-2 	AAA ATT ATT TCT AGA GGG GAA TTG TTA TCC GCT CAC AAT TCC CCT ATA GTG AGT 	(DMT OFF) 	\"MOLODTSOV\" 	#= 54
A3 	F2-3 	TAA CAA TTC CCC TCT AGA AAT AAT TTT GTT TAA CTT TAA GAA GGA GAT ATA CCA 	(DMT OFF) 	\"MOLODTSOV\" 	#= 54
B3 	F2-4 	CGA ATT GCC CGA GTG CAA CGC ATG GTA TAT CTC CTT CTT AAA GTT AAA C 	(DMT OFF) 	\"MOLODTSOV\" 	#= 49
C3 	F2-5 	TGC GTT GCA CTC GGG CAA TTC GCC AAA CCG CAA GAA CAG GCT GGC 	(DMT OFF) 	\"MOLODTSOV\" 	#= 45
D3 	F2-6 	GCA AGA ATC GCC AGC CAC GTC AGC CAG CCT GTT CTT GCG GTT TGG 	(DMT OFF) 	\"MOLODTSOV\" 	#= 45
E3 	F2-7 	TGA CGT GGC TGG CGA TTC TTG CCG TCA CGG CGC CCG TGA CTT 	(DMT OFF) 	\"MOLODTSOV\" 	#= 42
F3 	F2-8 	ATC GTC GGC CCA TGC CGG CGA AGT CAC GGG CGC CGT GAC G 	(DMT OFF) 	\"MOLODTSOV\" 	#= 40
G3 	F2-9 	CGC CGG CAT GGG CCG ACG ATC CTC CCG CCA CCG TAT ACA AGT ATG 	(DMT OFF) 	\"MOLODTSOV\" 	#= 45
H3 	F2-10 	GTC CTC CGG CGG GCG GGA GTC ATA CTT GTA TAC GGT GGC GGG AGG 	(DMT OFF) 	\"MOLODTSOV\" 	#= 45
I3 	F2-11 	ACT CCC GCC CGC CGG AGG ACG TTT TCC AGA ACG GAT TCA CGG CG 	(DMT OFF) 	\"MOLODTSOV\" 	#= 44
J3 	F2-12 	CGA GCA CAT TGT CGT TGT TTC CCC ACG CCG TGA ATC CGT TCT GGA AAA C 	(DMT OFF) 	\"MOLODTSOV\" 	#= 49
K3 	F2-13 	TGG GGA AAC AAC GAC AAT GTG CTC GAC CAT CTG ACC GGA CGT TCC TGC 	(DMT OFF) 	\"MOLODTSOV\" 	#= 48
L3 	F2-14 	GCT GTT GCT GCT GCC GAC CTG GCA GGA ACG TCC GGT CAG ATG GT 	(DMT OFF) 	\"MOLODTSOV\" 	#= 44
M3 	F2-15 	CAG GTC GGC AGC AGC AAC AGC GCT TTC GTC TCC ACC AGC AGC A 	(DMT OFF) 	\"MOLODTSOV\" 	#= 43
N3 	F2-16 	AGA CCT CGG TAT AGC GCC GGC TGC TGC TGG TGG AGA CGA AAG C 	(DMT OFF) 	\"MOLODTSOV\" 	#= 43
O3 	F2-17 	GCC GGC GCT ATA CCG AGG TCT ATC TCG AAC ATC GCA TGC AGG AAG C 	(DMT OFF) 	\"MOLODTSOV\" 	#= 46
P3 	F2-18 	CGG CGC GTT CGG CCT CGA CCG CTT CCT GCA TGC GAT GTT CGA GAT 	(DMT OFF) 	\"MOLODTSOV\" 	#= 45
A4 	F2-19 	GGT CGA GGC CGA ACG CGC CGG CAG GGG CAC CGG CCA CTT C 	(DMT OFF) 	\"MOLODTSOV\" 	#= 40
B4 	F2-20 	GCG GAC TTC GTA GAT GTA GCC GAT GAA GTG GCC GGT GCC CCT GC 	(DMT OFF) 	\"MOLODTSOV\" 	#= 44
C4 	F2-21 	ATC GGC TAC ATC TAC GAA GTC CGC GCC GAC AAC AAT TTC TAC GGC GC 	(DMT OFF) 	\"MOLODTSOV\" 	#= 47
D4 	F2-22 	ACG TAT TCG AAG TAC GAG CTG GCG GCG CCG TAG AAA TTG TTG TCG GC 	(DMT OFF) 	\"MOLODTSOV\" 	#= 47
E4 	F2-23 	CGC CAG CTC GTA CTT CGA ATA CGT CGA CAC TTA TGG CGA CAA TGC CG 	(DMT OFF) 	\"MOLODTSOV\" 	#= 47
F4 	F2-24 	CGC GCC GGC GAG GAT ACG GCC GGC ATT GTC GCC ATA AGT GTC G 	(DMT OFF) 	\"MOLODTSOV\" 	#= 43
G4 	F2-25 	GCC GTA TCC TCG CCG GCG CGC TGG CCA CCT ACC AGA GCG GT 	(DMT OFF) 	\"MOLODTSOV\" 	#= 41
H4 	F2-26 	AAT GCG CCG GTG TGC CAG ATA ACC GCT CTG GTA GGT GGC CAG 	(DMT OFF) 	\"MOLODTSOV\" 	#= 42
I4 	F2-27 	TAT CTG GCA CAC CGG CGC ATT CCG CCC GAA AAC ATC CGC AGG 	(DMT OFF) 	\"MOLODTSOV\" 	#= 42
J4 	F2-28 	GCC GTT GTG ATA GAC CCG CGT TAC CCT GCG GAT GTT TTC GGG CGG 	(DMT OFF) 	\"MOLODTSOV\" 	#= 45
K4 	F2-29 	GTA ACG CGG GTC TAT CAC AAC GGC ATC ACC GGC GAG ACC ACG ACC 	(DMT OFF) 	\"MOLODTSOV\" 	#= 45
L4 	F2-30 	GTA GCG AGC GTT GGA ATA CTC CGT GGT CGT GGT CTC GCC GGT GAT 	(DMT OFF) 	\"MOLODTSOV\" 	#= 45
M4 	F2-31 	ACG GAG TAT TCC AAC GCT CGC TAC GTC AGC CAG CAG ACT CGC GC 	(DMT OFF) 	\"MOLODTSOV\" 	#= 44
N4 	F2-32 	CGC GAT GTG TAG GGG TTG GGA TTG GCG CGA GTC TGC TGG CTG AC 	(DMT OFF) 	\"MOLODTSOV\" 	#= 44
O4 	F2-33 	CAA TCC CAA CCC CTA CAC ATC GCG AAG GTC CGT AGC GTC GAT CGT CG 	(DMT OFF) 	\"MOLODTSOV\" 	#= 47
P4 	F2-34 	CGC CAT GCG CAC CAA TGT GCC GAC GAT CGA CGC TAC GGA CCT T 	(DMT OFF) 	\"MOLODTSOV\" 	#= 43
A5 	F2-35 	GCA CAT TGG TGC GCA TGG CGC CGG TGA TTG GCG CTT GCA TG 	(DMT OFF) 	\"MOLODTSOV\" 	#= 41
B5 	F2-36 	GAG CTT TCG GCC TGC CGC GCC ATG CAA GCG CCA ATC ACC GG 	(DMT OFF) 	\"MOLODTSOV\" 	#= 41
C5 	F2-37 	GCG CGG CAG GCC GAA AGC TCC GAG GCC ATG GCA GCC TGG T 	(DMT OFF) 	\"MOLODTSOV\" 	#= 40
D5 	F2-38 	TCG CCT CGC CGG CGC GTT CGG ACC AGG CTG CCA TGG CCT CG 	(DMT OFF) 	\"MOLODTSOV\" 	#= 41
E5 	F2-39 	CCG AAC GCG CCG GCG AGG CGA TGG TTC TCG TGT ACT ACG AAA GCA TCG 	(DMT OFF) 	\"MOLODTSOV\" 	#= 48
F5 	F2-40 	GCG TTC CAC TGC GAA CGA ATA CGC GAT GCT TTC GTA GTA CAC GAG AAC CA 	(DMT OFF) 	\"MOLODTSOV\" 	#= 50
G5 	F2-41 	CGT ATT CGT TCG CAG TGG AAC GCC AGG ATT CCG GCT ATG ACA GCC TT 	(DMT OFF) 	\"MOLODTSOV\" 	#= 47
H5 	F2-42 	CGA TCG CGA TCC CAC CCC ATC AAG GCT GTC ATA GCC GGA ATC CTG 	(DMT OFF) 	\"MOLODTSOV\" 	#= 45
I5 	F2-43 	GAT GGG GTG GGA TCG CGA TCG TTC TCG TTG GGC GAG GTG TCC G 	(DMT OFF) 	\"MOLODTSOV\" 	#= 43
J5 	F2-44 	TTC CAC GGC GGC CAT GTC GGA CAC CTC GCC CAA CGA GAA 	(DMT OFF) 	\"MOLODTSOV\" 	#= 39
K5 	F3-1 	CGA GGT GTC CGA CAT GGC CGC CGT GGA AGC GGC GGA ACT GGA AAT GAC C 	(DMT OFF) 	\"MOLODTSOV\" 	#= 49
L5 	F3-2 	CCC CGG CGT GCA AGA CTT GCC GGG TCA TTT CCA GTT CCG CCG CTT CCA 	(DMT OFF) 	\"MOLODTSOV\" 	#= 48
M5 	F3-3 	CGG CAA GTC TTG CAC GCC GGG GCG CGG CAG GAC GAT GCC GAG C 	(DMT OFF) 	\"MOLODTSOV\" 	#= 43
N5 	F3-4 	CGA CGC ACC GCT CAC GCC CGG CTC GGC ATC GTC CTG CCG CG 	(DMT OFF) 	\"MOLODTSOV\" 	#= 41
O5 	F3-5 	CGG GCG TGA GCG GTG CGT CGG CGC ACT GGG GGC AGC GGG C 	(DMT OFF) 	\"MOLODTSOV\" 	#= 40
P5 	F3-6 	CCG CCT GGG CGC CCT GCA GCG CCC GCT GCC CCC AGT GCG C 	(DMT OFF) 	\"MOLODTSOV\" 	#= 40
A6 	F3-7 	GCT GCA GGG CGC CCA GGC GGT GGC GGC GGC GCA GCG GCT G 	(DMT OFF) 	\"MOLODTSOV\" 	#= 40
B6 	F3-8 	TTG CGT CAT CAG GGC AAT GGC ATG AAC CAG CCG CTG CGC CGC CGC CA 	(DMT OFF) 	\"MOLODTSOV\" 	#= 47
C6 	F3-9 	GTT CAT GCC ATT GCC CTG ATG ACG CAA TTC GGC CGG GCC GGT TCC ACC 	(DMT OFF) 	\"MOLODTSOV\" 	#= 48
D6 	F3-10 	AGG CCG CTT CCT GCG GCG TGT TGG TGG AAC CGG CCC GGC CGA A 	(DMT OFF) 	\"MOLODTSOV\" 	#= 43
E6 	F3-11 	AAC ACG CCG CAG GAA GCG GCC TCG TTG TCG GCG GCC GTG TTC GG 	(DMT OFF) 	\"MOLODTSOV\" 	#= 44
F6 	F3-12 	GCG CTG CTG GCC TCG CCC AAG CCG AAC ACG GCC GCC GAC AAC G 	(DMT OFF) 	\"MOLODTSOV\" 	#= 43
G6 	F3-13 	CTT GGG CGA GGC CAG CAG CGC CGT GGC CGA AAC CGT GAG CGG TT 	(DMT OFF) 	\"MOLODTSOV\" 	#= 44
H6 	F3-14 	CCA GCG CGA AGA CCC GCG GAA AAA ACC GCT CAC GGT TTC GGC CAC G 	(DMT OFF) 	\"MOLODTSOV\" 	#= 46
I6 	F3-15 	TTT TCC GCG GGT CTT CGC GCT GGG CCG GCG GTT TCG GCG TGG C 	(DMT OFF) 	\"MOLODTSOV\" 	#= 43
J6 	F3-16 	CCA GCG CCA TCG CGC CGC CAG CCA CGC CGA AAC CGC CGG C 	(DMT OFF) 	\"MOLODTSOV\" 	#= 40
K6 	F3-17 	TGG CGG CGC GAT GGC GCT GGG AGG CGG CAT CGC CGC GGC C 	(DMT OFF) 	\"MOLODTSOV\" 	#= 40
L6 	F3-18 	GGT CAA CGA CAT CCC GGC GCC AAC GGC CGC GGC GAT GCC GCC TC 	(DMT OFF) 	\"MOLODTSOV\" 	#= 44
M6 	F3-19 	GTT GGC GCC GGG ATG TCG TTG ACC GAT GAC GCG CCG GCC GGA CAG A 	(DMT OFF) 	\"MOLODTSOV\" 	#= 46
N6 	F3-20 	CTC GGC GCC GGC GGC GGC CTT CTG TCC GGC CGG CGC GTC ATC 	(DMT OFF) 	\"MOLODTSOV\" 	#= 42
O6 	F3-21 	AGG CCG CCG CCG GCG CCG AGA TCG CGC TGC AGT TGA CAG GTG GAA C 	(DMT OFF) 	\"MOLODTSOV\" 	#= 46
P6 	F3-22 	CGC GAT GGA AGA AGC CAG CTC GAC CGT TCC ACC TGT CAA CTG CAG CGC GAT 	(DMT OFF) 	\"MOLODTSOV\" 	#= 51
A7 	F3-23 	GGT CGA GCT GGC TTC TTC CAT CGC GTT GGC GCT GGC CGC GGC GCG 	(DMT OFF) 	\"MOLODTSOV\" 	#= 45
B7 	F3-24 	CTG CAA GCC GCT GGT CAC GCC GCG CGC CGC GGC CAG CGC CAA 	(DMT OFF) 	\"MOLODTSOV\" 	#= 42
C7 	F3-25 	CGG CGT GAC CAG CGG CTT GCA GGT GGC CGG GGC GTC GGC CGG 	(DMT OFF) 	\"MOLODTSOV\" 	#= 42
D7 	F3-26 	CCA ATG CGC CGG CAG CCG CCC CGG CCG ACG CCC CGG CCA C 	(DMT OFF) 	\"MOLODTSOV\" 	#= 40
E7 	F3-27 	GGC GGC TGC CGG CGC ATT GGC CGC GGC GCT CAG TCC CAT GGA 	(DMT OFF) 	\"MOLODTSOV\" 	#= 42
F7 	F3-28 	GCG ATT GCT GCA CCA GGC CGT AGA TCT CCA TGG GAC TGA GCG CCG CGG 	(DMT OFF) 	\"MOLODTSOV\" 	#= 48
G7 	F3-29 	GAT CTA CGG CCT GGT GCA GCA ATC GCA CTA TGC GGA TCA GCT GGA CAA GCT GG 	(DMT OFF) 	\"MOLODTSOV\" 	#= 53
H7 	F3-30 	CGT AAC CGT ATG CGC TCG ATT CCT GCG CCA GCT TGT CCA GCT GAT CCG CAT AGT 	(DMT OFF) 	\"MOLODTSOV\" 	#= 54
I7 	F3-31 	CGC AGG AAT CGA GCG CAT ACG GTT ACG AGG GCG ACG CCT TGC TGG CCC 	(DMT OFF) 	\"MOLODTSOV\" 	#= 48
J7 	F3-32 	GCG GCC GTC TTG TCG CGA TAC AGC TGG GCC AGC AAG GCG TCG CCC T 	(DMT OFF) 	\"MOLODTSOV\" 	#= 46
K7 	F3-33 	AGC TGT ATC GCG ACA AGA CGG CCG CCG AGG GCG CCG TCG CCG GCG 	(DMT OFF) 	\"MOLODTSOV\" 	#= 45
L7 	F3-34 	CAC CGT GCT CAG GAC GGC GGA GAC GCC GGC GAC GGC GCC CTC G 	(DMT OFF) 	\"MOLODTSOV\" 	#= 43
M7 	F3-35 	TCT CCG CCG TCC TGA GCA CGG TGG GGG CGG CGG TGT CGA TCG CC 	(DMT OFF) 	\"MOLODTSOV\" 	#= 44
N7 	F3-36 	CCC TAC CAC GCT GGC CGC CGC GGC GAT CGA CAC CGC CGC CCC 	(DMT OFF) 	\"MOLODTSOV\" 	#= 42
O7 	F3-37 	GCG GCG GCC AGC GTG GTA GGG GCC CCG GTG GCG GTG GTC ACT 	(DMT OFF) 	\"MOLODTSOV\" 	#= 42
P7 	F3-38 	CGT TGA GAG CCC CGG TCA GCA AGG AAG TGA CCA CCG CCA CCG GGG C 	(DMT OFF) 	\"MOLODTSOV\" 	#= 46
A8 	F3-39 	TCC TTG CTG ACC GGG GCT CTC AAC GGC ATC CTG CGC GGC GTG CAG C 	(DMT OFF) 	\"MOLODTSOV\" 	#= 46
B8 	F3-40 	CGT TGG CCA GCT TTT CGA TGA TGG GCT GCT GCA CGC CGC GCA GGA TGC 	(DMT OFF) 	\"MOLODTSOV\" 	#= 48
C8 	F3-41 	AGC CCA TCA TCG AAA AGC TGG CCA ACG ATT ACG CTC GCA AGA TCG ACG AGC TGG 	(DMT OFF) 	\"MOLODTSOV\" 	#= 54
D8 	F3-42 	CTC GAA GTA CGC TTG CGG CCC GCC CAG CTC GTC GAT CTT GCG AGC GTA AT 	(DMT OFF) 	\"MOLODTSOV\" 	#= 50
E8 	F3-43 	GCG GGC CGC AAG CGT ACT TCG AGA AAA ACC TGC AGG CGC GTC ACG AAC A 	(DMT OFF) 	\"MOLODTSOV\" 	#= 49
F8 	F3-44 	CCG TAG GCC GTC CGA ATT GGC CAG TTG TTC GTG ACG CGC CTG CAG GTT TTT 	(DMT OFF) 	\"MOLODTSOV\" 	#= 51
G8 	F3-45 	ACT GGC CAA TTC GGA CGG CCT ACG GAA AAT GCT GGC CGA CCT GCA 	(DMT OFF) 	\"MOLODTSOV\" 	#= 45
H8 	F3-46 	TGC AGG TCG GCC AGC ATT TT 	(DMT OFF) 	\"MOLODTSOV\" 	#= 20
I8 	F4-1 	GCC TAC GGA AAA TGC TGG CCG ACC TGC AGG CCG GTT GGA ACG CCA 	(DMT OFF) 	\"MOLODTSOV\" 	#= 45
J8 	F4-2 	GTC TGC ACC CCG ATC ACG CTG CTG GCG TTC CAA CCG GCC TGC A 	(DMT OFF) 	\"MOLODTSOV\" 	#= 43
K8 	F4-3 	GCA GCG TGA TCG GGG TGC AGA CGA CAG AGA TCT CCA AGT CGG CGC TC 	(DMT OFF) 	\"MOLODTSOV\" 	#= 47
L8 	F4-4 	TGC CGG TAA TGG CGG CCA GTT CGA GCG CCG ACT TGG AGA TCT CTG TC 	(DMT OFF) 	\"MOLODTSOV\" 	#= 47
M8 	F4-5 	GAA CTG GCC GCC ATT ACC GGC AAC GCG GAC AAC CTG AAA TCC GTC G 	(DMT OFF) 	\"MOLODTSOV\" 	#= 46
N8 	F4-6 	GAC GAA GCG GTC CAC GAA CAC GTC GAC GGA TTT CAG GTT GTC CGC GT 	(DMT OFF) 	\"MOLODTSOV\" 	#= 47
O8 	F4-7 	ACG TGT TCG TGG ACC GCT TCG TCC AGG GCG AGC GGG TGG CCG G 	(DMT OFF) 	\"MOLODTSOV\" 	#= 43
P8 	F4-8 	ACG TCG AGG ACC ACC GGC TGG CCG GCC ACC CGC TCG CCC TG 	(DMT OFF) 	\"MOLODTSOV\" 	#= 41
A9 	F4-9 	CCA GCC GGT GGT CCT CGA CGT CGC CGC CGG CGG CAT CGA TA 	(DMT OFF) 	\"MOLODTSOV\" 	#= 41
B9 	F4-10 	CTC GCC CTT GCG GCT GGC GAT ATC GAT GCC GCC GGC GGC G 	(DMT OFF) 	\"MOLODTSOV\" 	#= 40
C9 	F4-11 	TCG CCA GCC GCA AGG GCG AGC GGC CGG CGC TGA CGT TCA T 	(DMT OFF) 	\"MOLODTSOV\" 	#= 40
D9 	F4-12 	CTG GCG CGG CCA GCG GCG TGA TGA ACG TCA GCG CCG GCC G 	(DMT OFF) 	\"MOLODTSOV\" 	#= 40
E9 	F4-13 	CAC GCC GCT GGC CGC GCC AGG AGA AGA GCA GCG CCG GCG C 	(DMT OFF) 	\"MOLODTSOV\" 	#= 40
F9 	F4-14 	GTG AAT TCG CTC TTG CCC GTT TTC GTG CGC CGG CGC TGC TCT TCT C 	(DMT OFF) 	\"MOLODTSOV\" 	#= 46
G9 	F4-15 	ACG AAA ACG GGC AAG AGC GAA TTC ACC ACA TTC GTC GAG ATC GTG GGC AAG C 	(DMT OFF) 	\"MOLODTSOV\" 	#= 52
H9 	F4-16 	CCG GAT GCG CCA GCG GTC CTG CTT GCC CAC GAT CTC GAC GAA TGT G 	(DMT OFF) 	\"MOLODTSOV\" 	#= 46
I9 	F4-17 	AGG ACC GCT GGC GCA TCC GGG ACG GCG CGG CCG ACA CCA C 	(DMT OFF) 	\"MOLODTSOV\" 	#= 40
J9 	F4-18 	CGA CAC CAC CTT GGC CAG ATC GAT GGT GGT GTC GGC CGC GCC GTC 	(DMT OFF) 	\"MOLODTSOV\" 	#= 45
K9 	F4-19 	CAT CGA TCT GGC CAA GGT GGT GTC GCA ACT GGT CGA CGC CAA TGG CGT 	(DMT OFF) 	\"MOLODTSOV\" 	#= 48
L9 	F4-20 	ACA TCC AGT TTG ATG CTG TGC TTG AGC ACG CCA TTG GCG TCG ACC AGT TG 	(DMT OFF) 	\"MOLODTSOV\" 	#= 50
M9 	F4-21 	GCT CAA GCA CAG CAT CAA ACT GGA TGT GAT CGG CGG AGA TGG CGA TGA CG 	(DMT OFF) 	\"MOLODTSOV\" 	#= 50
N9 	F4-22 	GCG CGA AGC ATT GGC AAG CAC GAC GTC ATC GCC ATC TCC GCC GAT C 	(DMT OFF) 	\"MOLODTSOV\" 	#= 46
O9 	F4-23 	TCG TGC TTG CCA ATG CTT CGC GCA TCC ATT ATG ACG GCG GCG CGG 	(DMT OFF) 	\"MOLODTSOV\" 	#= 45
P9 	F4-24 	CGG CAT AGC TGA CCG TGT TGG TGC CCG CGC CGC CGT CAT AAT GGA T 	(DMT OFF) 	\"MOLODTSOV\" 	#= 46
A10 	F4-25 	GCA CCA ACA CGG TCA GCT ATG CCG CCC TGG GTC GAC AGG ATT CCA TTA CCG 	(DMT OFF) 	\"MOLODTSOV\" 	#= 51
B10 	F4-26 	ACG TTC CCC GTC GGC GGA CAC GGT AAT GGA ATC CTG TCG ACC CAG GG 	(DMT OFF) 	\"MOLODTSOV\" 	#= 47
C10 	F4-27 	TGT CCG CCG ACG GGG AAC GTT TCA ACG TGC GCA AGC AGT TGA ACA 	(DMT OFF) 	\"MOLODTSOV\" 	#= 45
D10 	F4-28 	GCC TTC GCG ATA CAC GTT GGC GTT GTT CAA CTG CTT GCG CAC GTT GAA 	(DMT OFF) 	\"MOLODTSOV\" 	#= 48
E10 	F4-29 	ACG CCA ACG TGT ATC GCG AAG GCG TGG CTA CCC AGA CAA CCG CCT ACG 	(DMT OFF) 	\"MOLODTSOV\" 	#= 48
F10 	F4-30 	GTA TTG GAC ATT CTC CGT GCG CTT GCC GTA GGC GGT TGT CTG GGT AGC CAC 	(DMT OFF) 	\"MOLODTSOV\" 	#= 51
G10 	F4-31 	GCA AGC GCA CGG AGA ATG TCC AAT ACC GCC ATG TCG AGC TGG CCC G 	(DMT OFF) 	\"MOLODTSOV\" 	#= 46
H10 	F4-32 	CGA CCT CCA CCA GTT GCC CGA CAC GGG CCA GCT CGA CAT GGC G 	(DMT OFF) 	\"MOLODTSOV\" 	#= 43
I10 	F4-33 	TGT CGG GCA ACT GGT GGA GGT CGA CAC GCT CGA GCA TGT GCA GCA 	(DMT OFF) 	\"MOLODTSOV\" 	#= 45
J10 	F4-34 	TGC CGG CCC CGC CGA TGA TGT GCT GCA CAT GCT CGA GCG TGT 	(DMT OFF) 	\"MOLODTSOV\" 	#= 42
K10 	F4-35 	CAT CAT CGG CGG GGC CGG CAA CGA TTC GAT CAC CGG CAA TGC GC 	(DMT OFF) 	\"MOLODTSOV\" 	#= 44
L10 	F4-36 	CCC GCC GGC TAG GAA GTT GTC GTG CGC ATT GCC GGT GAT CGA ATC GT 	(DMT OFF) 	\"MOLODTSOV\" 	#= 47
M10 	F4-37 	ACG ACA ACT TCC TAG CCG GCG GGT CGG GCG ACG ACA GGC TGG AT 	(DMT OFF) 	\"MOLODTSOV\" 	#= 44
N10 	F4-38 	GTG TCG TTG CCG GCG CCG CCA TCC AGC CTG TCG TCG CCC GA 	(DMT OFF) 	\"MOLODTSOV\" 	#= 41
O10 	F4-39 	GGC GGC GCC GGC AAC GAC ACC CTG GTT GGC GGC GAG GGC C 	(DMT OFF) 	\"MOLODTSOV\" 	#= 40
P10 	F4-40 	GCG CCG CCG ATG ACC GTG TTT TGG CCC TCG CCG CCA ACC AGG 	(DMT OFF) 	\"MOLODTSOV\" 	#= 42
A11 	F4-41 	AAA ACA CGG TCA TCG GCG GCG CCG GCG ACG ACG TAT TCC TGC AGG 	(DMT OFF) 	\"MOLODTSOV\" 	#= 45
B11 	F4-42 	GCT GGT TGC TCC ATA CCC CCA GGT CCT GCA GGA ATA CGT CGT CGC CG 	(DMT OFF) 	\"MOLODTSOV\" 	#= 47
C11 	F4-43 	ACC TGG GGG TAT GGA GCA ACC AGC TCG ATG GCG GCG CGG GCG TC 	(DMT OFF) 	\"MOLODTSOV\" 	#= 44
D11 	F4-44 	CTG GTG CAC GTT GTA CTT CAC GGT ATC GAC GCC CGC GCC GCC ATC GA 	(DMT OFF) 	\"MOLODTSOV\" 	#= 47
E11 	F4-45 	GAT ACC GTG AAG TAC AAC GTG CAC CAG CCT TCC GAG GAG CGC CTC GAA C 	(DMT OFF) 	\"MOLODTSOV\" 	#= 49
F11 	F4-46 	GTT CGA GGC GCT CCT CGG AAG G 	(DMT OFF) 	\"MOLODTSOV\" 	#= 22
G11 	F5-1 	CAC CAG CCT TCC GAG GAG CGC CTC GAA CGC ATG GGC GAC ACG GG 	(DMT OFF) 	\"MOLODTSOV\" 	#= 44
H11 	F5-2 	GTG CCC TTT TGA AGA TCG GCA TGG ATG CCC GTG TCG CCC ATG CGT TCG A 	(DMT OFF) 	\"MOLODTSOV\" 	#= 49
I11 	F5-3 	CAT CCA TGC CGA TCT TCA AAA GGG CAC GGT CGA GAA GTG GCC GGC CCT 	(DMT OFF) 	\"MOLODTSOV\" 	#= 48
J11 	F5-4 	TGA CAT GGT CGA CGC TGA ACA GGT TCA GGG CCG GCC ACT TCT CGA CC 	(DMT OFF) 	\"MOLODTSOV\" 	#= 47
K11 	F5-5 	GAA CCT GTT CAG CGT CGA CCA TGT CAA GAA TAT CGA GAA TCT GCA CGG CTC CC 	(DMT OFF) 	\"MOLODTSOV\" 	#= 53
L11 	F5-6 	CGG CGA TGC GGT CGT TCA GGC GGG AGC CGT GCA GAT TCT CGA TAT TCT 	(DMT OFF) 	\"MOLODTSOV\" 	#= 48
M11 	F5-7 	GCC TGA ACG ACC GCA TCG CCG GCG ACG ACC AGG ACA ACG AGC TCT 	(DMT OFF) 	\"MOLODTSOV\" 	#= 45
N11 	F5-8 	GTG TCG TTG CCA TCG TGG CCC CAG AGC TCG TTG TCC TGG TCG TCG C 	(DMT OFF) 	\"MOLODTSOV\" 	#= 46
O11 	F5-9 	GGG GCC ACG ATG GCA ACG ACA CGA TAC GCG GCC GGG GCG GCG 	(DMT OFF) 	\"MOLODTSOV\" 	#= 42
P11 	F5-10 	GCC GCC GCG CAG GAT GTC GTC GCC GCC CCG GCC GCG TAT C 	(DMT OFF) 	\"MOLODTSOV\" 	#= 40
A12 	F5-11 	ACG ACA TCC TGC GCG GCG GCC TGG GCC TGG ACA CGC TGT ATG GC 	(DMT OFF) 	\"MOLODTSOV\" 	#= 44
B12 	F5-12 	GCA GGA AGA TGT CGT TGC CGT CCT CGC CAT ACA GCG TGT CCA GGC CCA G 	(DMT OFF) 	\"MOLODTSOV\" 	#= 49
C12 	F5-13 	GAG GAC GGC AAC GAC ATC TTC CTG CAG GAC GAC GAG ACC GTC AGC GAT G 	(DMT OFF) 	\"MOLODTSOV\" 	#= 49
D12 	F5-14 	CCC CGC GCC GCC GTC GAT GTC ATC GCT GAC GGT CTC GTC GTC CT 	(DMT OFF) 	\"MOLODTSOV\" 	#= 44
E12 	F5-15 	ACA TCG ACG GCG GCG CGG GGC TGG ACA CCG TCG ACT ACT CCG CC 	(DMT OFF) 	\"MOLODTSOV\" 	#= 44
F12 	F5-16 	CGC AAC GAT CCT GCC TGG ATG GAT CAT GGC GGA GTA GTC GAC GGT GTC CAG 	(DMT OFF) 	\"MOLODTSOV\" 	#= 51
G12 	F5-17 	ATG ATC CAT CCA GGC AGG ATC GTT GCG CCG CAT GAA TAC GGC TTC GGG ATC G 	(DMT OFF) 	\"MOLODTSOV\" 	#= 52
H12 	F5-18 	CCA TTC CCT GGA CAG GTC CGC CTC GAT CCC GAA GCC GTA TTC ATG CGG 	(DMT OFF) 	\"MOLODTSOV\" 	#= 48
I12 	F5-19 	AGG CGG ACC TGT CCA GGG AAT GGG TGC GCA AGG CGT CCG CGC T 	(DMT OFF) 	\"MOLODTSOV\" 	#= 43
J12 	F5-20 	CGG ACA TTA TCG TAA TAG TCC ACG CCC AGC GCG GAC GCC TTG CGC AC 	(DMT OFF) 	\"MOLODTSOV\" 	#= 47
K12 	F5-21 	GGG CGT GGA CTA TTA CGA TAA TGT CCG CAA TGT CGA AAA CGT CAT CGG TAC GAG 	(DMT OFF) 	\"MOLODTSOV\" 	#= 54
L12 	F5-22 	CGT CGC CGA TGA GCA CAT CCT TCA TGC TCG TAC CGA TGA CGT TTT CGA CAT TG 	(DMT OFF) 	\"MOLODTSOV\" 	#= 53
M12 	F5-23 	CAT GAA GGA TGT GCT CAT CGG CGA CGC GCA AGC CAA TAC CCT GAT GGG CC 	(DMT OFF) 	\"MOLODTSOV\" 	#= 50
N12 	F5-24 	GCA CGG TAT CGT CGC CGC CCT GGC CCA TCA GGG TAT TGG CTT GCG 	(DMT OFF) 	\"MOLODTSOV\" 	#= 45
O12 	F5-25 	AGG GCG GCG ACG ATA CCG TGC GCG GCG GCG ACG GCG ATG AT 	(DMT OFF) 	\"MOLODTSOV\" 	#= 41
P12 	F5-26 	CCG TCG CCG CCG AAC AGC AGA TCA TCG CCG TCG CCG CCG C 	(DMT OFF) 	\"MOLODTSOV\" 	#= 40
A13 	F5-27 	CTG CTG TTC GGC GGC GAC GGC AAC GAC ATG CTG TAT GGC GAC GCC 	(DMT OFF) 	\"MOLODTSOV\" 	#= 45
B13 	F5-28 	CCC CCG TAG AGG GTG TCG TTG CCG GCG TCG CCA TAC AGC ATG TCG TTG 	(DMT OFF) 	\"MOLODTSOV\" 	#= 48
C13 	F5-29 	GGC AAC GAC ACC CTC TAC GGG GGG CTG GGC GAC GAT ACC CTT GAA GGC 	(DMT OFF) 	\"MOLODTSOV\" 	#= 48
D13 	F5-30 	CGA ACC AAT CGT TGC CCG CGC CGC CTT CAA GGG TAT CGT CGC CCA GC 	(DMT OFF) 	\"MOLODTSOV\" 	#= 47
E13 	F5-31 	GGC GCG GGC AAC GAT TGG TTC GGC CAG ACG CAG GCG CGC GAG 	(DMT OFF) 	\"MOLODTSOV\" 	#= 42
F13 	F5-32 	CCG CCG CGC AGC ACG TCA TGC TCG CGC GCC TGC GTC TGG C 	(DMT OFF) 	\"MOLODTSOV\" 	#= 40
G13 	F5-33 	CAT GAC GTG CTG CGC GGC GGA GAT GGG GTG GAT ACC GTC GAT TAC AG 	(DMT OFF) 	\"MOLODTSOV\" 	#= 47
H13 	F5-34 	CGG CAT GCG CGC CGG TCT GGC TGT AAT CGA CGG TAT CCA CCC CAT CT 	(DMT OFF) 	\"MOLODTSOV\" 	#= 47
I13 	F5-35 	CCA GAC CGG CGC GCA TGC CGG CAT TGC CGC GGG TCG CAT CG 	(DMT OFF) 	\"MOLODTSOV\" 	#= 41
J13 	F5-36 	AGG TCA GCC AGG ATG CCC AGC CCG ATG CGA CCC GCG GCA ATG C 	(DMT OFF) 	\"MOLODTSOV\" 	#= 43
K13 	F5-37 	GGC TGG GCA TCC TGG CTG ACC TGG GCG CCG GCC GCG TCG ACA 	(DMT OFF) 	\"MOLODTSOV\" 	#= 42
L13 	F5-38 	GCT GCC GGC CTC GCC CAG CTT GTC GAC GCG GCC GGC GCC C 	(DMT OFF) 	\"MOLODTSOV\" 	#= 40
M13 	F5-39 	AGC TGG GCG AGG CCG GCA GCA GCG CCT ACG ATA CGG TTT CCG GT 	(DMT OFF) 	\"MOLODTSOV\" 	#= 44
N13 	F5-40 	TCC GTG CCC ACC ACG TTC TCG ATA CCG GAA ACC GTA TCG TAG GCG CT 	(DMT OFF) 	\"MOLODTSOV\" 	#= 47
O13 	F5-41 	ATC GAG AAC GTG GTG GGC ACG GAA CTG GCC GAC CGC ATC ACG GG 	(DMT OFF) 	\"MOLODTSOV\" 	#= 44
P13 	F5-42 	AGC ACG TTG GCC TGC GCA TCG CCC GTG ATG CGG TCG GCC AGT 	(DMT OFF) 	\"MOLODTSOV\" 	#= 42
A14 	F5-43 	CGA TGC GCA GGC CAA CGT GCT GCG CGG CGC GGG TGG CGC CGA 	(DMT OFF) 	\"MOLODTSOV\" 	#= 42
B14 	F5-44 	CCT CGC CGC CCG CAA GCA CGT CGG CGC CAC CCG CGC CGC GC 	(DMT OFF) 	\"MOLODTSOV\" 	#= 41
C14 	F5-45 	CGT GCT TGC GGG CGG CGA GGG CGA CGA TGT GCT G 	(DMT OFF) 	\"MOLODTSOV\" 	#= 34
D14 	F5-46 	CAG CAC ATC GTC GC 	(DMT OFF) 	\"MOLODTSOV\" 	#= 14
E14 	F6-1 	TGC GGG CGG CGA GGG CGA CGA TGT GCT GCT GGG CGG CGA CG 	(DMT OFF) 	\"MOLODTSOV\" 	#= 41
F14 	F6-2 	CGC CCG ACA GCT GGT CGT CGC CGT CGC CGC CCA GCA GCA CAT 	(DMT OFF) 	\"MOLODTSOV\" 	#= 42
G14 	F6-3 	GCG ACG ACC AGC TGT CGG GCG ACG CCG GAC GCG ATC GCT TGT 	(DMT OFF) 	\"MOLODTSOV\" 	#= 42
H14 	F6-4 	CAG TCG TCA CCG GCT TCG CCG TAC AAG CGA TCG CGT CCG GCG T 	(DMT OFF) 	\"MOLODTSOV\" 	#= 43
I14 	F6-5 	ACG GCG AAG CCG GTG ACG ACT GGT TCT TCC AGG ATG CCG CCA ATG CC 	(DMT OFF) 	\"MOLODTSOV\" 	#= 47
J14 	F6-6 	GCC GCC GTC GAG CAG ATT GCC GGC ATT GGC GGC ATC CTG GAA GAA C 	(DMT OFF) 	\"MOLODTSOV\" 	#= 46
K14 	F6-7 	GGC AAT CTG CTC GAC GGC GGC GAC GGC CGC GAT ACC GTG GAT TTC 	(DMT OFF) 	\"MOLODTSOV\" 	#= 45
L14 	F6-8 	AGG CCC CGG CCC GGG CCG CTG AAA TCC ACG GTA TCG CGG CCG TC 	(DMT OFF) 	\"MOLODTSOV\" 	#= 44
M14 	F6-9 	AGC GGC CCG GGC CGG GGC CTC GAC GCC GGC GCA AAG GGC G 	(DMT OFF) 	\"MOLODTSOV\" 	#= 40
N14 	F6-10 	CGA ACC CCT TGC CCA AGC TCA GGA ATA CGC CCT TTG CGC CGG CGT CG 	(DMT OFF) 	\"MOLODTSOV\" 	#= 47
O14 	F6-11 	TAT TCC TGA GCT TGG GCA AGG GGT TCG CCA GCC TGA TGG ACG AAC CCG AAA C 	(DMT OFF) 	\"MOLODTSOV\" 	#= 52
P14 	F6-12 	TTC TCG ATA TTG CGC AAC ACG TTG CTG GTT TCG GGT TCG TCC ATC AGG CTG G 	(DMT OFF) 	\"MOLODTSOV\" 	#= 52
A15 	F6-13 	CAG CAA CGT GTT GCG CAA TAT CGA GAA CGC CGT GGG CAG CGC GCG TG 	(DMT OFF) 	\"MOLODTSOV\" 	#= 47
B15 	F6-14 	TGC GTC GCC GAT CAG CAC GTC ATC ACG CGC GCT GCC CAC GGC G 	(DMT OFF) 	\"MOLODTSOV\" 	#= 43
C15 	F6-15 	ATG ACG TGC TGA TCG GCG ACG CAG GCG CCA ACG TCC TCA ATG GCC 	(DMT OFF) 	\"MOLODTSOV\" 	#= 45
D15 	F6-16 	ACA GCA CGT CGT TGC CCG CCA GGC CAT TGA GGA CGT TGG CGC C 	(DMT OFF) 	\"MOLODTSOV\" 	#= 43
E15 	F6-17 	TGG CGG GCA ACG ACG TGC TGT CCG GCG GCG CTG GCG ACG AT 	(DMT OFF) 	\"MOLODTSOV\" 	#= 41
F15 	F6-18 	GCC CTC GTC GCC CAG CAG CAC ATC GTC GCC AGC GCC GCC GG 	(DMT OFF) 	\"MOLODTSOV\" 	#= 41
G15 	F6-19 	GTG CTG CTG GGC GAC GAG GGC TCG GAC CTG CTC AGC GGC GAT G 	(DMT OFF) 	\"MOLODTSOV\" 	#= 43
H15 	F6-20 	GCC GAA CAG ATC GTC GTT GCC CGC ATC GCC GCT GAG CAG GTC CGA 	(DMT OFF) 	\"MOLODTSOV\" 	#= 45
I15 	F6-21 	CGG GCA ACG ACG ATC TGT TCG GCG GGC AGG GCG ATG ATA CTT ATC TGT TC 	(DMT OFF) 	\"MOLODTSOV\" 	#= 50
J15 	F6-22 	GTC GTG CCC GTA CCC GAC CCC GAA CAG ATA AGT ATC ATC GCC CTG CCC 	(DMT OFF) 	\"MOLODTSOV\" 	#= 48
K15 	F6-23 	GGG GTC GGG TAC GGG CAC GAC ACG ATC TAC GAA TCG GGC GGC GG 	(DMT OFF) 	\"MOLODTSOV\" 	#= 44
L15 	F6-24 	CGC GTT GAT GCG GAT GGT GTC ATG GCC GCC GCC CGA TTC GTA GAT CGT 	(DMT OFF) 	\"MOLODTSOV\" 	#= 48
M15 	F6-25 	CCA TGA CAC CAT CCG CAT CAA CGC GGG GGC GGA CCA GCT GTG GTT CG 	(DMT OFF) 	\"MOLODTSOV\" 	#= 47
N15 	F6-26 	CCA GGT CGT TGC CCT GGC GCG CGA ACC ACA GCT GGT CCG CCC C 	(DMT OFF) 	\"MOLODTSOV\" 	#= 43
O15 	F6-27 	CGC GCC AGG GCA ACG ACC TGG AGA TCC GCA TTC TCG GCA CCG ACG 	(DMT OFF) 	\"MOLODTSOV\" 	#= 45
P15 	F6-28 	GAT ACC AGT CGT GCA CGG TAA GTG CAT CGT CGG TGC CGA GAA TGC GGA TCT 	(DMT OFF) 	\"MOLODTSOV\" 	#= 51
A16 	F6-29 	ATG CAC TTA CCG TGC ACG ACT GGT ATC GCG ACG CCG ATC ACC GGG TGG 	(DMT OFF) 	\"MOLODTSOV\" 	#= 48
B16 	F6-30 	GCC TGG TTG GCG GCA TGG ATG ATT TCC ACC CGG TGA TCG GCG TCG C 	(DMT OFF) 	\"MOLODTSOV\" 	#= 46
C16 	F6-31 	AAA TCA TCC ATG CCG CCA ACC AGG CGG TAG ACC AGG CAG GCA TCG AAA AGC 	(DMT OFF) 	\"MOLODTSOV\" 	#= 51
D16 	F6-32 	GGA TAC TGC GCC ATT GCC TCG ACC AGC TTT TCG ATG CCT GCC TGG TCT ACC 	(DMT OFF) 	\"MOLODTSOV\" 	#= 51
E16 	F6-33 	TGG TCG AGG CAA TGG CGC AGT ATC CGG ACC CCG GCG CGG CGG CGG C 	(DMT OFF) 	\"MOLODTSOV\" 	#= 46
F16 	F6-34 	ACG CGC GCC GCC GGC GGG GCA GCC GCC GCC GCG CCG GGG TCC 	(DMT OFF) 	\"MOLODTSOV\" 	#= 42
G16 	F6-35 	TGC CCC GCC GGC GGC GCG CGT GCC GGA CAC GCT GAT GCA GTC CC 	(DMT OFF) 	\"MOLODTSOV\" 	#= 44
H16 	F6-36 	TGG TGG CGC CAG TTG ACA GCC AGG GAC TGC ATC AGC GTG TCC GGC 	(DMT OFF) 	\"MOLODTSOV\" 	#= 45
