where	code	seq	DMT	comment	length	
I16 	F6-37 	TGG CTG TCA ACT GGC GCC ACC ACC ACC ACC ACC ACT GAG GAT CCG AA 	(DMT OFF) 	\"MOLODTSOV\" 	#= 47
J16 	F6-38 	TTG TCG ACG GAG CTC GAA TTC GGA TCC TCA GTG GTG GTG GTG G 	(DMT OFF) 	\"MOLODTSOV\" 	#= 43
K16 	F1-F 	CCT CGC GAA TGC ATC TAG ATC GTC CGG CGT AGA GGA TCG AG 	(DMT OFF) 	\"MOLODTSOV\" 	#= 41
L16 	F1-R 	CGA CGG GCC CGG GAT CCG ATT CGT ATT AGA TAG GGT CTG GCT GTA AGG TCA G 	(DMT OFF) 	\"MOLODTSOV\" 	#= 52
M16 	F2-F 	CCT CGC GAA TGC ATC TAG ATC CTT ACA GCC AGA CCC TAT CTA ATA CGA CTC 	(DMT OFF) 	\"MOLODTSOV\" 	#= 51
N16 	F2-R 	CGA CGG GCC CGG GAT CCG ATT TCC ACG GCG GCC ATG TC 	(DMT OFF) 	\"MOLODTSOV\" 	#= 38
O16 	F3-F 	CCT CGC GAA TGC ATC TAG ATC GAG GTG TCC GAC ATG GCC 	(DMT OFF) 	\"MOLODTSOV\" 	#= 39
P16 	F3-R 	CGA CGG GCC CGG GAT CCG ATT GCA GGT CGG CCA GCA TTT TC 	(DMT OFF) 	\"MOLODTSOV\" 	#= 41
A17 	F4-F 	CCT CGC GAA TGC ATC TAG ATG CCT ACG GAA AAT GCT GGC CG 	(DMT OFF) 	\"MOLODTSOV\" 	#= 41
B17 	F4-R 	CGA CGG GCC CGG GAT CCG ATG TTC GAG GCG CTC CTC GG 	(DMT OFF) 	\"MOLODTSOV\" 	#= 38
C17 	F5-F 	CCT CGC GAA TGC ATC TAG ATC ACC AGC CTT CCG AGG AGC 	(DMT OFF) 	\"MOLODTSOV\" 	#= 39
D17 	F5-R 	CGA CGG GCC CGG GAT CCG ATC AGC ACA TCG TCG CCC TCG 	(DMT OFF) 	\"MOLODTSOV\" 	#= 39
E17 	F6-F 	CCT CGC GAA TGC ATC TAG ATT GCG GGC GGC GAG 	(DMT OFF) 	\"MOLODTSOV\" 	#= 33
F17 	F6-R 	CGA CGG GCC CGG GAT CCG ATT TGT CGA CGG AGC TCG AAT TCG G 	(DMT OFF) 	\"MOLODTSOV\" 	#= 43
G17 	sig702 	AGT GGT GGT GGT GGT GGT GCT CGA GTT AAT CGT CCA GGA AGC TAC GCA GC 	(DMT OFF) 	\"MOLODTSOV\" 	#= 50
H17 	T7_term_F 	CAC AGG ATC CCA AAA AAC CCC TCA AGA C 	(DMT ON) 	\"DORONIN\" 	#= 28
I17 	T7_term_R 	CAA CGG ATC CCT AGC ATA ACC CCT TGG 	(DMT ON) 	\"DORONIN\" 	#= 27
J17 	18S_F 	GGA CAC GGA CAG GAT TGA CAG ATT GAT AG 	(DMT ON) 	\"KALISH\" 	#= 29
K17 	18S_R 	GGA CAT CTA AGG GCA TCA CAG ACC 	(DMT ON) 	\"KALISH\" 	#= 24
L17 	HPRT1_F 	CAC TAT GAG CCT ATA GAC TAT CAG TTC CCT TTG G 	(DMT ON) 	\"KALISH\" 	#= 34
M17 	HPRT1_R 	CCA GGA CAG AAC AAA ACT TCT TAG ATG CTG 	(DMT ON) 	\"KALISH\" 	#= 30
N17 	GUSB_F 	GAT CTT CAC TCG GCA GAG ACA ACC 	(DMT ON) 	\"KALISH\" 	#= 24
O17 	GUSB_R 	CTA GAA TAG ATG ACC ACA AAA CCC AGG C 	(DMT ON) 	\"KALISH\" 	#= 28
P17 	CD4_F 	CCC TGT CTA AAA TCC CTC CTT CAT CC 	(DMT ON) 	\"KALISH\" 	#= 26
A18 	CD4_R 	AGA TTT GTA ACC CTG ATT TCC CTG TGT CC 	(DMT ON) 	\"KALISH\" 	#= 29
B18 	CD8a_F 	TAC TTC TTG ATA CCT GGG ATA CTG TGC C 	(DMT ON) 	\"KALISH\" 	#= 28
C18 	CD8a_R 	GCC TTA GTT TAA CCT CAC TGA TGC TCA AAT 	(DMT ON) 	\"KALISH\" 	#= 30
D18 	NLRC5_F 	GCT GAT CTT TGA TGG GCT AGA TGA GGC 	(DMT ON) 	\"KALISH\" 	#= 27
E18 	NLRC5_R 	CGT CCA TTT GTC TGT AAC TCC ACC AGG 	(DMT ON) 	\"KALISH\" 	#= 27
F18 	Pet15+HisTAG_for_Gibson_Forward 	CAT ATG GCT GCC GCG CGG CAC 	(DMT OFF) 	\"Nikiteev\" 	#= 21
G18 	Pet15+HisTAG_for_Gibson_Reverse 	TGA TCC GGC TGC TAA CAA AGC CCG AAA GG 	(DMT OFF) 	\"Nikiteev\" 	#= 29
H18 	Tdt_for_Gibson_Forward 	TGC CGC GCG GCA GCC ATA TGA GCC CGA GCC CGG TTC CAG 	(DMT OFF) 	\"Nikiteev\" 	#= 39
I18 	Tdt_for_Gibson_Reverse 	CTT TGT TAG CAG CCG GAT CAC GCA TTA CGT TCC CAC GGT TCA ATG TAA TCA AG 	(DMT OFF) 	\"Nikiteev\" 	#= 53
J18 	Tdt_long_Gibson_Forward 	TGC CGC GCG GCA GCC ATA TG 	(DMT OFF) 	\"Nikiteev\" 	#= 20
K18 	Tdt_long_Gibson_Reverse 	CTT TGT TAG CAG CCG GAT CAC GCA TTA CG 	(DMT OFF) 	\"Nikiteev\" 	#= 29
L18 	Sema_general_forward 	TGC CGC GCG GCA GCC ATA TG 	(DMT OFF) 	\"Nikiteev\" 	#= 20
M18 	Sema_general_reverse 	CTT TGT TAG CAG CCG GAT CAA CCG CGG 	(DMT OFF) 	\"Nikiteev\" 	#= 27
N18 	Sema_ver2_F0-1 	TGC CGC GCG GCA GCC ATA TGG AGG GCA CCT TTA CCA GCG ATG TGA GCA GTT ATC T 	(DMT OFF) 	\"Nikiteev\" 	#= 55
O18 	Sema_ver2_F0-2 	CGC GAT AAA CTC TTT CGC CGC CTG GCC CTC CAG ATA ACT GCT CAC ATC GCT GGT AAA G 	(DMT OFF) 	\"Nikiteev\" 	#= 58
P18 	Sema_ver2_F0-3 	GGC GGC GAA AGA GTT TAT CGC GTG GCT GGT CCG TGG CCG CGG TTG ATC CGG CTG CTA ACA AAG 	(DMT OFF) 	\"Nikiteev\" 	#= 63
A19 	Sema_ver2_F0-4 	CTT TGT TAG CAG CCG GAT CAA CCG CGG CCA CGG 	(DMT OFF) 	\"Nikiteev\" 	#= 33
B19 	Pet15+HisTAG_for_Gibson_Forward 	CAT ATG GCT GCC GCG CGG CAC 	(DMT OFF) 	\"Nikiteev\" 	#= 21
C19 	Pet15-HisTAG_For_Gibson 	CAT GGT ATA TCT CCT TCT TAA AGT TAA ACA AAA TTA TTT CTA GAG GGG AAT TGT TAT CCG CTC AC 	(DMT OFF) 	\"Nikiteev\" 	#= 65
D19 	Pet15_for_all_for_Gibson_Reverse 	TGA TCC GGC TGC TAA CAA AGC CCG AAA GG 	(DMT OFF) 	\"Nikiteev\" 	#= 29
E19 	Tdt_for_Gibson_Forward 	TGC CGC GCG GCA GCC ATA TGA GCC CGA GCC CGG TTC CAG 	(DMT OFF) 	\"Nikiteev\" 	#= 39
F19 	Tdt_for_Gibson_Reverse 	CTT TGT TAG CAG CCG GAT CAC GCA TTA CGT TCC CAC GGT TCA ATG TAA TCA AG 	(DMT OFF) 	\"Nikiteev\" 	#= 53
G19 	Tdt_long_Gibson_Forward 	TGC CGC GCG GCA GCC ATA TG 	(DMT OFF) 	\"Nikiteev\" 	#= 20
H19 	Tdt_long_Gibson_Reverse 	CTT TGT TAG CAG CCG GAT CAC GCA TTA CG 	(DMT OFF) 	\"Nikiteev\" 	#= 29
I19 	Sema_general_forward 	TAA GAA GGA GAT ATA CCA TGG GCA GCA GCC ATC ATC 	(DMT OFF) 	\"Nikiteev\" 	#= 36
J19 	Sema_general_reverse 	CTT TGT TAG CAG CCG GAT CAA CCG CGG 	(DMT OFF) 	\"Nikiteev\" 	#= 27
K19 	Sema_SUMO_F0-0 	TGC CCA TGG TAT ATC TCC TTC TTA 	(DMT OFF) 	\"Nikiteev\" 	#= 24
L19 	Sema_SUMO_F0-1 	TAA GAA GGA GAT ATA CCA TGG GCA GCA GCC ATC ATC ATC ATC ATC A 	(DMT OFF) 	\"Nikiteev\" 	#= 46
M19 	Sema_SUMO_F0-2 	GAC ATG CTA GCG CTG CCG CGC GGC ACC AGG CCG CTG CCG TGA TGA TGA TGA TGA TGG CTG C 	(DMT OFF) 	\"Nikiteev\" 	#= 61
N19 	Sema_SUMO_F0-3 	GCG GCA GCG CTA GCA TGT CGG ACT CAG AAG TCA ATC AAG AAG CTA AGC CAG AGG T 	(DMT OFF) 	\"Nikiteev\" 	#= 55
O19 	Sema_SUMO_F0-4 	CTC AGG CTT GAC TTC TGG CTT GAC CTC TGG CTT AGC TTC TTG AT 	(DMT OFF) 	\"Nikiteev\" 	#= 44
P19 	Sema_SUMO_F0-5 	AGC CAG AAG TCA AGC CTG AGA CTC ACA TCA ATT TAA AGG TGT CCG ATG GAT CTT C 	(DMT OFF) 	\"Nikiteev\" 	#= 55
A20 	Sema_SUMO_F0-6 	GAG TGG TCT TTT TGA TCT TGA AGA AGA TCT CTG AAG ATC CAT CGG ACA CCT TTA AA 	(DMT OFF) 	\"Nikiteev\" 	#= 56
B20 	Sema_SUMO_F0-7 	CTT CTT CAA GAT CAA AAA GAC CAC TCC TTT AAG AAG GCT GAT GGA AGC GT 	(DMT OFF) 	\"Nikiteev\" 	#= 50
C20 	Sema_SUMO_F0-8 	AGT CCA TTT CCT TAC CCT GTC TTT TAG CGA ACG CTT CCA TCA GCC TTC TT 	(DMT OFF) 	\"Nikiteev\" 	#= 50
D20 	Sema_SUMO_F0-9 	AAG ACA GGG TAA GGA AAT GGA CTC CTT AAG ATT CTT GTA CGA CGG TAT TAG AAT TCA 	(DMT OFF) 	\"Nikiteev\" 	#= 57
E20 	Sema_SUMO_F0-10 	TTA TCC TCC ATG TCC AAA TCT TCA GGG GTC TGA TCA GCT TGA ATT CTA ATA CCG TCG TAC AAG AA 	(DMT OFF) 	\"Nikiteev\" 	#= 65
F20 	Sema_SUMO_F0-11 	CTG AAG ATT TGG ACA TGG AGG ATA ACG ATA TTA TTG AGG CTC ACA GAG AAC AGA TTG GTG 	(DMT OFF) 	\"Nikiteev\" 	#= 60
G20 	Sema_SUMO_F0-12 	CAC ATC GCT GGT AAA GGT GCC CTC ACC ACC AAT CTG TTC TCT GTG AGC 	(DMT OFF) 	\"Nikiteev\" 	#= 48
H20 	Sema_SUMO_F0-13 	GCA CCT TTA CCA GCG ATG TGA GCA GTT ATC TGG AGG GCC AGG C 	(DMT OFF) 	\"Nikiteev\" 	#= 43
I20 	Sema_SUMO_F0-14 	ACC AGC CAC GCG ATA AAC TCT TTC GCC GCC TGG CCC TCC AGA TAA C 	(DMT OFF) 	\"Nikiteev\" 	#= 46
J20 	Sema_SUMO_F0-15 	AGT TTA TCG CGT GGC TGG TCC GTG GCC GCG GTT GAT CCG GCT GCT AAC AAA G 	(DMT OFF) 	\"Nikiteev\" 	#= 52
K20 	Sema_SUMO_F0-16 	CTT TGT TAG CAG CCG GAT CAA CCG 	(DMT OFF) 	\"Nikiteev\" 	#= 24
L20 	Sema_general_forward 	TAA GAA GGA GAT ATA CCA TGG GCA GCA GCC ATC ATC 	(DMT ON) 	\"Nikiteev\" 	#= 36
M20 	Sema_general_reverse 	CTT TGT TAG CAG CCG GAT CAA CCG CGG 	(DMT ON) 	\"Nikiteev\" 	#= 27
N20 	Sema_SUMO_F0-0 	TGC CCA TGG TAT ATC TCC TTC TTA 	(DMT ON) 	\"Nikiteev\" 	#= 24
O20 	Sema_SUMO_F0-1 	TAA GAA GGA GAT ATA CCA TGG GCA GCA GCC ATC ATC ATC ATC ATC A 	(DMT ON) 	\"Nikiteev\" 	#= 46
P20 	Sema_SUMO_F0-2 	GAC ATG CTA GCG CTG CCG CGC GGC ACC AGG CCG CTG CCG TGA TGA TGA TGA TGA TGG CTG C 	(DMT ON) 	\"Nikiteev\" 	#= 61
A21 	Sema_SUMO_F0-3 	GCG GCA GCG CTA GCA TGT CGG ACT CAG AAG TCA ATC AAG AAG CTA AGC CAG AGG T 	(DMT ON) 	\"Nikiteev\" 	#= 55
B21 	Sema_SUMO_F0-4 	CTC AGG CTT GAC TTC TGG CTT GAC CTC TGG CTT AGC TTC TTG AT 	(DMT ON) 	\"Nikiteev\" 	#= 44
C21 	Sema_SUMO_F0-5 	AGC CAG AAG TCA AGC CTG AGA CTC ACA TCA ATT TAA AGG TGT CCG ATG GAT CTT C 	(DMT ON) 	\"Nikiteev\" 	#= 55
D21 	Sema_SUMO_F0-6 	GAG TGG TCT TTT TGA TCT TGA AGA AGA TCT CTG AAG ATC CAT CGG ACA CCT TTA AA 	(DMT ON) 	\"Nikiteev\" 	#= 56
E21 	Sema_SUMO_F0-7 	CTT CTT CAA GAT CAA AAA GAC CAC TCC TTT AAG AAG GCT GAT GGA AGC GT 	(DMT ON) 	\"Nikiteev\" 	#= 50
F21 	Sema_SUMO_F0-8 	AGT CCA TTT CCT TAC CCT GTC TTT TAG CGA ACG CTT CCA TCA GCC TTC TT 	(DMT ON) 	\"Nikiteev\" 	#= 50
G21 	Sema_SUMO_F0-9 	AAG ACA GGG TAA GGA AAT GGA CTC CTT AAG ATT CTT GTA CGA CGG TAT TAG AAT TCA 	(DMT ON) 	\"Nikiteev\" 	#= 57
H21 	Sema_SUMO_F0-10 	TTA TCC TCC ATG TCC AAA TCT TCA GGG GTC TGA TCA GCT TGA ATT CTA ATA CCG TCG TAC AAG AA 	(DMT ON) 	\"Nikiteev\" 	#= 65
I21 	Sema_SUMO_F0-11 	CTG AAG ATT TGG ACA TGG AGG ATA ACG ATA TTA TTG AGG CTC ACA GAG AAC AGA TTG GTG 	(DMT ON) 	\"Nikiteev\" 	#= 60
J21 	Sema_SUMO_F0-12 	CAC ATC GCT GGT AAA GGT GCC CTC ACC ACC AAT CTG TTC TCT GTG AGC 	(DMT ON) 	\"Nikiteev\" 	#= 48
K21 	Sema_SUMO_F0-13 	GCA CCT TTA CCA GCG ATG TGA GCA GTT ATC TGG AGG GCC AGG C 	(DMT ON) 	\"Nikiteev\" 	#= 43
L21 	Sema_SUMO_F0-14 	ACC AGC CAC GCG ATA AAC TCT TTC GCC GCC TGG CCC TCC AGA TAA C 	(DMT ON) 	\"Nikiteev\" 	#= 46
M21 	Sema_SUMO_F0-15 	AGT TTA TCG CGT GGC TGG TCC GTG GCC GCG GTT GAT CCG GCT GCT AAC AAA G 	(DMT ON) 	\"Nikiteev\" 	#= 52
N21 	Sema_SUMO_F0-16 	CTT TGT TAG CAG CCG GAT CAA CCG 	(DMT ON) 	\"Nikiteev\" 	#= 24
O21 	p03_F1_ug-0 	ATG AAG GTC GAT GAG TTG CCG GTC GAT GAA CGT TTG AAG GCA G 	(DMT ON) 	\"CHUDINOV\" 	#= 43
P21 	p03_F1_ug-1 	CGG CAA CTC ATC GAC CTT CAT 	(DMT ON) 	\"CHUDINOV\" 	#= 21
A22 	p03_F1_ug-2 	AAT TCC GCG CTC CTT CAA CAC TGC CTT CAA ACG TTC ATC GAC 	(DMT ON) 	\"CHUDINOV\" 	#= 42
B22 	p03_F1_ug-3 	TGT TGA AGG AGC GCG GAA TTG AGG AGC TTT ATC CAC CAC AGG 	(DMT ON) 	\"CHUDINOV\" 	#= 42
C22 	p03_F1_ug-4 	ATG CTC CGG ATT TTA AAG CTT CAG CCT GTG GTG GAT AAA GCT CCT C 	(DMT ON) 	\"CHUDINOV\" 	#= 46
D22 	p03_F1_ug-5 	CTG AAG CTT TAA AAT CCG GAG CAT TGG AGG GGC GCA ACT TAG TT 	(DMT ON) 	\"CHUDINOV\" 	#= 44
E22 	p03_F1_ug-6 	GAA GCC GTA GGA ATC GCC AGA ACT AAG TTG CGC CCC TCC A 	(DMT ON) 	\"CHUDINOV\" 	#= 40
F22 	p03_F1_ug-7 	CTG GCG ATT CCT ACG GCT TCC GGA AAA ACC CTT GTC TCC GA 	(DMT ON) 	\"CHUDINOV\" 	#= 41
G22 	p03_F1_ug-8 	TGG ATA AGC TTA TTT ACC ATT ACG ATT TCG GAG ACA AGG GTT TTT CCG 	(DMT ON) 	\"CHUDINOV\" 	#= 48
H22 	p03_F1_ug-9 	AAT CGT AAT GGT AAA TAA GCT TAT CCA GGA AGG GGG GAA GGC TGT GT 	(DMT ON) 	\"CHUDINOV\" 	#= 47
I22 	p03_F1_ug-10 	GGC TAA AGC TTT TAA GGG AAC CAG ATA CAC AGC CTT CCC CCC TTC C 	(DMT ON) 	\"CHUDINOV\" 	#= 46
J22 	p03_F1_ug-11 	ATC TGG TTC CCT TAA AAG CTT TAG CCG AAG AAA AGT ATC GCG AAT TCA AAG AG 	(DMT ON) 	\"CHUDINOV\" 	#= 53
K22 	p03_F1_ug-12 	AAC TTT CAA ACC AAG CTT TTC CCA CTC TTT GAA TTC GCG ATA CTT TTC TTC 	(DMT ON) 	\"CHUDINOV\" 	#= 51
L22 	p03_F1_ug-13 	TGG GAA AAG CTT GGT TTG AAA GTT GCA GCT ACT ACG GGT GAT TAT GA 	(DMT ON) 	\"CHUDINOV\" 	#= 47
M22 	p03_F1_ug-14 	CAA GCC AGT CAT CGG TCG AGT CAT AAT CAC CCG TAG TAG CTG C 	(DMT ON) 	\"CHUDINOV\" 	#= 43
N22 	p03_F1_ug-15 	CTC GAC CGA TGA CTG GCT TGG GCG TTA CGA CAT CAT TGT TGC 	(DMT ON) 	\"CHUDINOV\" 	#= 42
O22 	p03_F1_ug-16 	AAT AAT GAG TCA AAT TTC TCA GCA GTC GCA ACA ATG ATG TCG TAA CGC C 	(DMT ON) 	\"CHUDINOV\" 	#= 49
P22 	p03_F1_ug-17 	GAC TGC TGA GAA ATT TGA CTC ATT ATT GCG TCA TGG GGC ACG TTG GA 	(DMT ON) 	\"CHUDINOV\" 	#= 47
A23 	p03_F1_ug-18 	CCA CAA CTA ACT TGA CGT CGT TGA TCC AAC GTG CCC CAT GAC GC 	(DMT ON) 	\"CHUDINOV\" 	#= 44
B23 	p03_F1_ug-19 	TCA ACG ACG TCA AGT TAG TTG TGG CAG ATG AAG TGC ATC TTA TCG GCT 	(DMT ON) 	\"CHUDINOV\" 	#= 48
C23 	p03_F1_ug-20 	CGT AGC CCC GCG GTC GTA CGA GCC GAT AAG ATG CAC TTC ATC TG 	(DMT ON) 	\"CHUDINOV\" 	#= 44
D23 	p03_F1_ug-21 	CGT ACG ACC GCG GGG CTA CGC TGG AAA TGA TCT TAA CTC ATA TGT TA 	(DMT ON) 	\"CHUDINOV\" 	#= 47
E23 	p03_F1_ug-22 	TGC CAA GAT TTG CGC GCG GCC TAA CAT ATG AGT TAA GAT CAT TTC CAG 	(DMT ON) 	\"CHUDINOV\" 	#= 48
F23 	p03_F1_ug-23 	GGC CGC GCG CAA ATC TTG GCA CTT TCG GCA ACC GTA GGC AA 	(DMT ON) 	\"CHUDINOV\" 	#= 41
G23 	p03_F1_ug-24 	ACT CCG CAA GCT CTT CGG CAT TGC CTA CGG TTG CCG AAA G 	(DMT ON) 	\"CHUDINOV\" 	#= 40
H23 	p03_F1_ug-25 	TGC CGA AGA GCT TGC GGA GTG GTT GGA CGC TTC TCT TGT TGT 	(DMT ON) 	\"CHUDINOV\" 	#= 42
I23 	p03_F1_ug-26 	GTA CTG GGC GCC AAT CTG ATA CAA CAA GAG AAG CGT CCA ACC 	(DMT ON) 	\"CHUDINOV\" 	#= 42
J23 	p03_F1_ug-27 	ATC AGA TTG GCG CCC AGT ACA GCT TCG TCG CGG TGT CTT T 	(DMT ON) 	\"CHUDINOV\" 	#= 40
K23 	p03_F1_ug-28 	CCT CCC AGA TTA ATG TAC CAA GGT GAA AGA CAC CGC GAC GAA GCT 	(DMT ON) 	\"CHUDINOV\" 	#= 45
L23 	p03_F1_ug-29 	CAC CTT GGT ACA TTA ATC TGG GAG GAC GGA AAG GTG GAG TCG TAC C 	(DMT ON) 	\"CHUDINOV\" 	#= 46
M23 	p03_F1_ug-30 	CCA CAA CTA AAG AAT ACC AAT TTT CAG GGT ACG ACT CCA CCT TTC CGT 	(DMT ON) 	\"CHUDINOV\" 	#= 48
N23 	p03_F1_ug-31 	CTG AAA ATT GGT ATT CTT TAG TTG TGG ACG CGG TGA AGC GCG GTA AG 	(DMT ON) 	\"CHUDINOV\" 	#= 47
O23 	p03_F1_ug-32 	GCG TGT TAA CGA AAA CTA ATG CAC CCT TAC CGC GCT TCA CCG CGT 	(DMT ON) 	\"CHUDINOV\" 	#= 45
P23 	p03_F1_ug-33 	GGT GCA TTA GTT TTC GTT AAC ACG CGT CGT TCG GCT GAA AAG GAA GC 	(DMT ON) 	\"CHUDINOV\" 	#= 47
A24 	p03_F1_ug-34 	AGA GAC CAA TTT AGA CAA GGC CAA AGC TTC CTT TTC AGC CGA ACG AC 	(DMT ON) 	\"CHUDINOV\" 	#= 47
B24 	p03_F1_ug-35 	TTT GGC CTT GTC TAA ATT GGT CTC TTC GCA CCT GAC AAA ACC CGA 	(DMT ON) 	\"CHUDINOV\" 	#= 45
C24 	p03_F1_ug-36 	GCG ACT CCA AAG CGC GTT TTT CGG GTT TTG TCA GGT GCG A 	(DMT ON) 	\"CHUDINOV\" 	#= 40
D24 	p03_F1_ug-37 	AAA ACG CGC TTT GGA GTC GCT TGC GAG CCA GTT AGA GGA CA 	(DMT ON) 	\"CHUDINOV\" 	#= 41
E24 	p03_F1_ug-38 	CGT TTC AAT TTC TCA GAT GTT GGG TTG TCC TCT AAC TGG CTC GCA A 	(DMT ON) 	\"CHUDINOV\" 	#= 46
F24 	p03_F1_ug-39 	ACC CAA CAT CTG AGA AAT TGA AAC GTG CAC TGC GTG GGG GAG TGG 	(DMT ON) 	\"CHUDINOV\" 	#= 45
G24 	p03_F1_ug-40 	TCA GTC CCG CGT GAT GAA AAG CCA CTC CCC CAC GCA GTG CA 	(DMT ON) 	\"CHUDINOV\" 	#= 41
H24 	p03_F1_ug-41 	CTT TTC ATC ACG CGG GAC TGA GTC GCG TAG AGC GTA CAT TAA TTG 	(DMT ON) 	\"CHUDINOV\" 	#= 45
I24 	p03_F1_ug-42 	CCC CTC GCG AAA AGC GTC CTC AAT TAA TGT ACG CTC TAC GCG AC 	(DMT ON) 	\"CHUDINOV\" 	#= 44
J24 	p03_F1_ug-43 	AGG ACG CTT TTC GCG AGG GGT TAA TTA AAG TTA TTA CGG CAA CAC CC 	(DMT ON) 	\"CHUDINOV\" 	#= 47
K24 	p03_F1_ug-44 	GAT TTA CCC CGG CAG ACA AAG TGG GTG TTG CCG TAA TAA CTT TAA TTA A 	(DMT ON) 	\"CHUDINOV\" 	#= 49
L24 	p03_F1_ug-45 	ACT TTG TCT GCC GGG GTA AAT C 	(DMT ON) 	\"CHUDINOV\" 	#= 22
M24 	TDT_F0-F_(B/S) 	TAT AGG ATC CAG CCC GAG CCC GGT T 	(DMT OFF) 	\"CUSTOMER\" 	#= 25
N24 	TDT_F0-R_(B/S) 	TAT AGT CGA CCG CAT TAC GTT CCC ACG 	(DMT OFF) 	\"CUSTOMER\" 	#= 27
