,where,code,length,seq,monoisotopic_mass,Nucleic Acid(ng/uL),pM/mkl,pmol,mkl,A260/A280,A260/A230,COMMENT,DMT,score,quantile,"final conc, pmol/mkl",target_well
0,F1,Tr-1,#= 48,GAT TAT GAC ATC CCG ACG ACG GAA AAC CTG TAT TTC CAA GGC GCA ATG,14769.52,306.999,20.785983566155164,103.92991783077582,5.0,1.966,1.123,TRANSPOSASE,DMT OFF,True,7,0.16,1
1,G1,Tr-2,#= 40,GGC ATC ACC TCC GCG CTG CAC CGT GCA GCC GAC TGG GCC A,12204.81,171.764,14.073467755745481,98.51427429021837,7.0,1.738,0.968,TRANSPOSASE,DMT OFF,True,4,0.15,1
2,H1,Tr-3,#= 44,AAT CTG TGT TCT CTT CGG CAG CCC TGG GTG ATC CAC GTC GTA CG,13481.63,200.742,14.890039260831221,104.23027482581855,7.0,1.706,1.164,TRANSPOSASE,DMT OFF,True,4,0.16,1
3,I1,Tr-4,#= 45,GCA CGT CTC GTT AAT GTG GCA GCA CAG CTC GCG AAA TAT TCG GGT,13876.91,133.745,9.637952541307827,96.37952541307827,10.0,1.863,1.002,TRANSPOSASE,DMT OFF,True,2,0.15,1
4,J1,Tr-5,#= 48,AAA AGC ATT ACG ATT TCC AGC GAA GGC TCA AAA GCG ATG CAG GAG GGT,14907.62,285.986,19.18388045845011,115.10328275070066,6.0,2.063,1.178,TRANSPOSASE,DMT OFF,True,6,0.17,1
5,K1,Tr-6,#= 46,GCG TAC CGT TTC ATT CGC AAT CCG AAT GTT TCT GCC GAG GCC ATT C,14043.01,202.618,14.428388215916673,100.99871751141671,7.0,1.743,1.131,TRANSPOSASE,DMT OFF,True,4,0.15,1
6,L1,Tr-7,#= 45,GTA AAG CCG GTG CCA TGC AGA CCG TGA AAC TGG CAC AAG AGT TTC,13903.95,247.743,17.818173972144606,106.90904383286764,6.0,1.926,1.153,TRANSPOSASE,DMT OFF,True,6,0.16,1
7,M1,Tr-8,#= 45,CGG AAC TGT TGG CCA TTG AAG ATA CCA CCT CGC TGT CGT ACC GTC,13772.84,176.981,12.850000435639998,115.65000392075999,9.0,1.777,1.121,TRANSPOSASE,DMT OFF,True,3,0.17,1
8,N1,Tr-9,#= 49,ATC AGG TCG CAG AAG AGC TGG GCA AAC TGG GTT CAA TTC AAG ATA AAT C,15186.8,277.291,18.258685173966867,109.5521110438012,6.0,2.051,1.166,TRANSPOSASE,DMT OFF,True,6,0.17,1
9,O1,Tr-10,#= 44,GCG TGG CTG GTG GGT TCA CAG TGT TCT GCT TTT GGA AGC AAC GA,13665.75,216.449,15.838794065455609,95.03276439273365,6.0,1.82,1.373,TRANSPOSASE,DMT OFF,True,5,0.14,1
10,P1,Tr-11,#= 43,CCT TTC GTA CCG TTG GTC TGC TTC ACC AGG AGT GGT GGA TGC G,13248.47,146.136,11.030405775157433,99.2736519764169,9.0,1.725,1.28,TRANSPOSASE,DMT OFF,True,3,0.15,1
11,A2,Tr-12,#= 47,TCC GGA TGA CCC AGC GGA TGC AGA TGA GAA AGA GTC TGG TAA ATG GC,14626.41,253.226,17.31292914666005,103.87757487996029,6.0,1.968,1.24,TRANSPOSASE,DMT OFF,True,5,0.16,1
12,B2,Tr-13,#= 42,TGG CGG CAG CGG CGA CAA GTC GCC TCC GTA TGG GCT CTA TGA,12972.31,154.381,11.90081026432455,107.10729237892095,9.0,1.804,1.015,TRANSPOSASE,DMT OFF,True,3,0.16,1
13,C2,Tr-14,#= 43,TGA GCA ACG TCA TTG CCG TGT GCG ACC GCG AAG CAG ATA TTC A,13252.53,215.129,16.233051349440444,97.39830809664267,6.0,1.911,1.182,TRANSPOSASE,DMT OFF,True,5,0.15,1
14,D2,Tr-15,#= 45,TGC CTA TCT GCA GGA TAA ACT GGC GCA CAA CGA ACG CTT TGT GGT,13860.91,213.414,15.39682459521056,92.38094757126336,6.0,1.853,1.205,TRANSPOSASE,DMT OFF,True,5,0.14,1
15,E2,Tr-16,#= 52,TCG TAG CAA ACA TCC ACG TAA AGA TGT GGA ATC GGG TCT GTA CCT GTA TGA C,16051.33,281.866,17.5602893965796,105.36173637947759,6.0,1.936,1.143,TRANSPOSASE,DMT OFF,True,5,0.16,1
16,F2,Tr-17,#= 47,CAC TTG AAG AAC CAA CCG GAA CTC GGC GGC TAC CAG ATC TCC ATT GG,14402.27,112.296,7.797104206489672,101.36235468436573,13.0,1.862,1.08,TRANSPOSASE,DMT OFF,True,1,0.15,1
17,G2,Tr-18,#= 48,TCA GAA AGG CGT TGT TGA TAA ACG TGG CAA GCG TAA GAA TCG TCC GGC,14905.59,171.523,11.507293572411424,103.56564215170282,9.0,1.74,0.967,TRANSPOSASE,DMT OFF,True,3,0.16,1
18,H2,Tr-19,#= 40,ACG TAA AGC GAG CCT GAG CCT GCG TAG TGG TCG CAT CAC C,12306.91,217.182,17.647159197556494,105.88295518533897,6.0,1.814,1.069,TRANSPOSASE,DMT OFF,True,6,0.16,1
19,I2,Tr-20,#= 47,CTT AAA CAA GGC AAT ATT ACA CTG AAT GCG GTG CTG GCG GAG GAA AT,14584.41,150.452,10.315946959801597,103.15946959801596,10.0,2.042,1.227,TRANSPOSASE,DMT OFF,True,2,0.16,1
20,J2,Tr-21,#= 42,TAA CCC GCC GAA AGG TGA AAC CCC GCT GAA ATG GCT GCT GCT,12893.3,150.768,11.693515236595752,105.24163712936178,9.0,1.818,1.053,TRANSPOSASE,DMT OFF,True,3,0.16,1
21,K2,Tr-22,#= 42,GAC CAG CGA ACC AGT GGA ATC ACT TGC GCA GGC ACT GCG CGT,12934.31,176.105,13.615337810830265,95.30736467581185,7.0,1.891,1.073,TRANSPOSASE,DMT OFF,True,4,0.14,1
22,L2,Tr-23,#= 52,GAT CGA TAT TTA CAC CCA TCG TTG GCG TAT CGA GGA ATT CCA TAA GGC GTG G,16058.32,264.937,16.49842573818432,98.99055442910591,6.0,1.915,1.343,TRANSPOSASE,DMT OFF,True,5,0.15,1
23,M2,Tr-24,#= 40,AAA ACC GGT GCG GGT GCG GAA CGC CAG CGT ATG GAA GAG C,12470.02,111.302,8.925567080084875,89.25567080084875,10.0,1.966,1.178,TRANSPOSASE,DMT OFF,True,2,0.13,1
24,N2,Tr-25,#= 49,CGG ATA ACC TGG AAC GCA TGG TCA GTA TTC TGT CAT TTG TTG CGG TTC G,15124.7,145.804,9.640125093390282,96.40125093390282,10.0,1.785,1.35,TRANSPOSASE,DMT OFF,True,2,0.15,1
25,O2,Tr-26,#= 41,TCT GTT GCA GCT GCG TGA GAG CTT TAC CCC ACC GCA GGC CC,12514.01,8.201,0.6553454887761796,52.42763910209437,80.0,2.035,0.912,TRANSPOSASE,DMT OFF,False,,0.08,1
26,P2,Tr-27,#= 45,TCC GTG CCC AGG GTC TTC TGA AAG AAG CGG AAC ATG TCG AAA GTC,13894.94,270.694,19.481480308659123,116.88888185195474,6.0,1.87,1.142,TRANSPOSASE,DMT OFF,True,6,0.18,1
27,A3,Tr-28,#= 40,AGA GCG CCG AAA CCG TTC TGA CCC CGG ACG AAT GCC AAC T,12244.89,244.999,20.008264672038706,100.04132336019353,5.0,1.842,0.901,TRANSPOSASE,DMT OFF,True,7,0.15,1
28,B3,Tr-29,#= 47,TTT GGG CTA CCT GGA TAA AGG CAA GCG CAA ACG TAA AGA GAA AGC GG,14643.45,288.418,19.69604157490209,98.48020787451046,5.0,2.07,1.182,TRANSPOSASE,DMT OFF,True,7,0.15,1
29,C3,Tr-30,#= 41,GTT CGT TGC AGT GGG CGT ACA TGG CGA TTG CGC GCC TTG GT,12711.12,309.029,24.3117050267797,121.55852513389848,5.0,1.732,1.355,TRANSPOSASE,DMT OFF,False,,0.18,1
30,D3,Tr-31,#= 46,GGC TTT ATG GAC TCT AAA CGT ACC GGC ATT GCA AGC TGG GGT GCA C,14206.12,268.965,18.933037310680184,113.5982238640811,6.0,1.83,1.239,TRANSPOSASE,DMT OFF,True,6,0.17,1
31,E3,Tr-32,#= 44,TGT GGG AGG GCT GGG AGG CGC TGC AAT CGA AAC TGG ACG GTT TC,13749.8,23.498,1.7089703122954516,102.53821873772709,60.0,1.892,0.559,TRANSPOSASE,DMT OFF,False,,0.15,1
32,F3,Tr-33,#= 44,TGC AGC GCG GAG GTG ATG CCC ATT GCG CCT TGG AAA TAC AGG TT,13628.74,234.025,17.17143330931546,103.02859985589276,6.0,1.85,0.393,TRANSPOSASE,DMT OFF,True,5,0.16,1
33,G3,Tr-34,#= 43,GGC TGC CGA AGA GAA CAC AGA TTT GGC CCA GTC GGC TGC ACG G,13303.54,101.579,7.635486494572121,99.26132442943758,13.0,1.838,1.111,TRANSPOSASE,DMT OFF,True,1,0.15,1
34,H3,Tr-35,#= 43,CTG CCA CAT TAA CGA GAC GTG CCG TAC GAC GTG GAT CAC CCA G,13182.48,152.694,11.58310120705664,104.24791086350976,9.0,1.852,1.099,TRANSPOSASE,DMT OFF,True,3,0.16,1
35,I3,Tr-36,#= 49,CCT TCG CTG GAA ATC GTA ATG CTT TTA CCC GAA TAT TTC GCG AGC TGT G,15028.65,369.481,24.585109108269872,122.92554554134936,5.0,1.778,1.198,TRANSPOSASE,DMT OFF,False,,0.19,1
36,J3,Tr-37,#= 45,GGA TTG CGA ATG AAA CGG TAC GCA CCC TCC TGC ATC GCT TTT GAG,13836.89,148.937,10.763762666321696,107.63762666321696,10.0,1.799,1.154,TRANSPOSASE,DMT OFF,True,2,0.16,1
37,K3,Tr-38,#= 44,TCT GCA TGG CAC CGG CTT TAC GAA TGG CCT CGG CAG AAA CAT TC,13492.67,244.752,18.139626923359128,108.83776154015476,6.0,1.835,1.102,TRANSPOSASE,DMT OFF,True,6,0.16,1
38,L3,Tr-39,#= 49,GTA TCT TCA ATG GCC AAC AGT TCC GGA AAC TCT TGT GCC AGT TTC ACG G,15022.65,202.325,13.467996658379182,94.27597660865428,7.0,1.784,1.154,TRANSPOSASE,DMT OFF,True,4,0.14,1
39,M3,Tr-40,#= 42,CCC AGC TCT TCT GCG ACC TGA TGA CGG TAC GAC AGC GAG GTG,12916.28,230.653,17.857541025744254,107.14524615446553,6.0,1.778,1.151,TRANSPOSASE,DMT OFF,True,6,0.16,1
40,N3,Tr-41,#= 47,TGT GAA CCC ACC AGC CAC GCG ATT TAT CTT GAA TTG AAC CCA GTT TG,14373.25,118.112,8.217487346285635,106.82733550171325,13.0,1.793,1.12,TRANSPOSASE,DMT OFF,True,1,0.16,1
41,O3,Tr-42,#= 46,AGC AGA CCA ACG GTA CGA AAG GTC GTT GCT TCC AAA AGC AGA ACA C,14179.16,139.478,9.836830954725103,98.36830954725103,10.0,2.029,1.077,TRANSPOSASE,DMT OFF,True,2,0.15,1
42,P3,Tr-43,#= 41,CAT CCG CTG GGT CAT CCG GAC GCA TCC ACC ACT CCT GGT GA,12483.0,250.172,20.04101578146279,100.20507890731395,5.0,1.732,0.986,TRANSPOSASE,DMT OFF,True,7,0.15,1
43,A4,Tr-44,#= 47,ACT TGT CGC CGC TGC CGC CAG CCA TTT ACC AGA CTC TTT CTC ATC TG,14228.12,244.088,17.155323401826806,102.93194041096083,6.0,1.67,1.022,TRANSPOSASE,DMT OFF,True,5,0.16,1
44,B4,Tr-45,#= 43,ACA CGG CAA TGA CGT TGC TCA TCA TAG AGC CCA TAC GGA GGC G,13246.53,145.581,10.990123451198162,109.90123451198161,10.0,1.901,0.975,TRANSPOSASE,DMT OFF,True,2,0.17,2
45,C4,Tr-46,#= 46,GCC AGT TTA TCC TGC AGA TAG GCA TGA ATA TCT GCT TCG CGG TCG C,14132.07,312.463,22.110207492603703,110.55103746301852,5.0,1.702,0.958,TRANSPOSASE,DMT OFF,True,7,0.17,2
46,D4,Tr-47,#= 48,ACA TCT TTA CGT GGA TGT TTG CTA CGA ACC ACA AAG CGT TCG TTG TGC,14748.48,344.691,23.371289787150946,116.85644893575473,5.0,1.85,1.2,TRANSPOSASE,DMT OFF,True,7,0.18,2
47,E4,Tr-48,#= 50,CGA GTT CCG GTT GGT TCT TCA AGT GGT CAT ACA GGT ACA GAC CCG ATT CC,15367.86,200.545,13.049637360048829,117.44673624043946,9.0,1.8,1.153,TRANSPOSASE,DMT OFF,True,3,0.18,2
48,F4,Tr-49,#= 48,CAC GTT TAT CAA CAA CGC CTT TCT GAC CAA TGG AGA TCT GGT AGC CGC,14687.45,130.958,8.916319715130944,89.16319715130945,10.0,1.819,1.028,TRANSPOSASE,DMT OFF,True,2,0.13,2
49,G4,Tr-50,#= 42,GGC TCA GGC TCG CTT TAC GTG CCG GAC GAT TCT TAC GCT TGC,12864.23,141.678,11.013329208199792,99.11996287379813,9.0,1.693,1.161,TRANSPOSASE,DMT OFF,True,3,0.15,2
50,H4,Tr-51,#= 47,ATT CAG TGT AAT ATT GCC TTG TTT AAG GGT GAT GCG ACC ACT ACG CA,14483.32,215.371,14.870278361591128,104.09194853113789,7.0,1.922,1.042,TRANSPOSASE,DMT OFF,True,4,0.16,2
51,I4,Tr-52,#= 42,GGT TTC ACC TTT CGG CGG GTT AAT TTC CTC CGC CAG CAC CGC,12784.18,168.434,13.175189961342847,118.57670965208563,9.0,1.645,1.127,TRANSPOSASE,DMT OFF,True,3,0.18,2
52,J4,Tr-53,#= 42,TGA TTC CAC TGG TTC GCT GGT CAG CAG CAG CCA TTT CAG CGG,12897.27,178.815,13.864562035221407,97.05193424654985,7.0,1.749,1.136,TRANSPOSASE,DMT OFF,True,4,0.15,2
53,K4,Tr-54,#= 46,GCC AAC GAT GGG TGT AAA TAT CGA TCA CGC GCA GTG CCT GCG CAA G,14209.13,93.974,6.61363503606484,85.97725546884293,13.0,1.939,1.203,TRANSPOSASE,DMT OFF,True,1,0.13,2
54,L4,Tr-55,#= 46,TCC GCA CCC GCA CCG GTT TTC CAC GCC TTA TGG AAT TCC TCG ATA C,13932.94,242.014,17.36991618423678,104.21949710542067,6.0,1.71,1.035,TRANSPOSASE,DMT OFF,True,5,0.16,2
55,M4,Tr-56,#= 42,ACC ATG CGT TCC AGG TTA TCC GGC TCT TCC ATA CGC TGG CGT,12808.21,230.888,18.02656265005024,108.15937590030146,6.0,1.723,1.073,TRANSPOSASE,DMT OFF,True,6,0.16,2
56,N4,Tr-57,#= 48,CTC TCA CGC AGC TGC AAC AGA CGA ACC GCA ACA AAT GAC AGA ATA CTG,14701.5,127.337,8.66149712614359,86.6149712614359,10.0,1.988,1.039,TRANSPOSASE,DMT OFF,True,2,0.13,2
57,O4,Tr-58,#= 40,CAG AAG ACC CTG GGC ACG GAG GGC CTG CGG TGG GGT AAA G,12502.02,100.836,8.065576602820984,104.8524958366728,13.0,1.884,1.259,TRANSPOSASE,DMT OFF,True,1,0.16,2
58,P4,Tr-59,#= 45,CAG AAC GGT TTC GGC GCT CTG ACT TTC GAC ATG TTC CGC TTC TTT,13735.8,103.998,7.5713100074258515,98.42703009653607,13.0,1.653,1.151,TRANSPOSASE,DMT OFF,True,1,0.15,2
59,A5,Tr-60,#= 44,TTG CCT TTA TCC AGG TAG CCC AAA AGT TGG CAT TCG TCC GGG GT,13529.68,271.374,20.057680595549932,100.28840297774966,5.0,1.769,1.23,TRANSPOSASE,DMT OFF,True,7,0.15,2
60,B5,Tr-61,#= 44,TGT ACG CCC ACT GCA ACG AAC CCG CTT TCT CTT TAC GTT TGC GC,13345.56,190.864,14.301685354529896,100.11179748170927,7.0,1.656,1.024,TRANSPOSASE,DMT OFF,True,4,0.15,2
61,C5,Tr-62,#= 46,CCG GTA CGT TTA GAG TCC ATA AAG CCA CCA AGG CGC GCA ATC GCC A,14098.07,32.6,2.312373253927665,104.05679642674492,45.0,1.97,0.934,TRANSPOSASE,DMT OFF,False,,0.16,1
62,D5,Tr-63,#= 40,CGC CTC CCA GCC CTC CCA CAG TGC ACC CCA GCT TGC AAT G,12043.73,173.099,14.372540732812842,100.6077851296899,7.0,1.64,0.842,TRANSPOSASE,DMT OFF,True,4,0.15,2
63,E5,Tr-64,#= 63,GAT CTT AAT ACC CTG CGC CAT CAG ATC TTT TGC TGC CAG GAA ACC GTC CAG TTT CGA TTG CAG,19283.36,89.801,4.656916636934642,60.539916280150344,13.0,1.779,1.11,TRANSPOSASE,DMT OFF,True,1,0.09,2
