where	code	length	seq	monoisotopic_mass
F1 	Tr-1 	#= 48	GAT TAT GAC ATC CCG ACG ACG GAA AAC CTG TAT TTC CAA GGC GCA ATG 	14769.52
G1 	Tr-2 	#= 40	GGC ATC ACC TCC GCG CTG CAC CGT GCA GCC GAC TGG GCC A 	12204.81
H1 	Tr-3 	#= 44	AAT CTG TGT TCT CTT CGG CAG CCC TGG GTG ATC CAC GTC GTA CG 	13481.63
I1 	Tr-4 	#= 45	GCA CGT CTC GTT AAT GTG GCA GCA CAG CTC GCG AAA TAT TCG GGT 	13876.91
J1 	Tr-5 	#= 48	AAA AGC ATT ACG ATT TCC AGC GAA GGC TCA AAA GCG ATG CAG GAG GGT 	14907.62
K1 	Tr-6 	#= 46	GCG TAC CGT TTC ATT CGC AAT CCG AAT GTT TCT GCC GAG GCC ATT C 	14043.01
L1 	Tr-7 	#= 45	GTA AAG CCG GTG CCA TGC AGA CCG TGA AAC TGG CAC AAG AGT TTC 	13903.95
M1 	Tr-8 	#= 45	CGG AAC TGT TGG CCA TTG AAG ATA CCA CCT CGC TGT CGT ACC GTC 	13772.84
N1 	Tr-9 	#= 49	ATC AGG TCG CAG AAG AGC TGG GCA AAC TGG GTT CAA TTC AAG ATA AAT C 	15186.80
O1 	Tr-10 	#= 44	GCG TGG CTG GTG GGT TCA CAG TGT TCT GCT TTT GGA AGC AAC GA 	13665.75
P1 	Tr-11 	#= 43	CCT TTC GTA CCG TTG GTC TGC TTC ACC AGG AGT GGT GGA TGC G 	13248.47
A2 	Tr-12 	#= 47	TCC GGA TGA CCC AGC GGA TGC AGA TGA GAA AGA GTC TGG TAA ATG GC 	14626.41
B2 	Tr-13 	#= 42	TGG CGG CAG CGG CGA CAA GTC GCC TCC GTA TGG GCT CTA TGA 	12972.31
C2 	Tr-14 	#= 43	TGA GCA ACG TCA TTG CCG TGT GCG ACC GCG AAG CAG ATA TTC A 	13252.53
D2 	Tr-15 	#= 45	TGC CTA TCT GCA GGA TAA ACT GGC GCA CAA CGA ACG CTT TGT GGT 	13860.91
E2 	Tr-16 	#= 52	TCG TAG CAA ACA TCC ACG TAA AGA TGT GGA ATC GGG TCT GTA CCT GTA TGA C 	16051.33
F2 	Tr-17 	#= 47	CAC TTG AAG AAC CAA CCG GAA CTC GGC GGC TAC CAG ATC TCC ATT GG 	14402.27
G2 	Tr-18 	#= 48	TCA GAA AGG CGT TGT TGA TAA ACG TGG CAA GCG TAA GAA TCG TCC GGC 	14905.59
H2 	Tr-19 	#= 40	ACG TAA AGC GAG CCT GAG CCT GCG TAG TGG TCG CAT CAC C 	12306.91
I2 	Tr-20 	#= 47	CTT AAA CAA GGC AAT ATT ACA CTG AAT GCG GTG CTG GCG GAG GAA AT 	14584.41
J2 	Tr-21 	#= 42	TAA CCC GCC GAA AGG TGA AAC CCC GCT GAA ATG GCT GCT GCT 	12893.30
K2 	Tr-22 	#= 42	GAC CAG CGA ACC AGT GGA ATC ACT TGC GCA GGC ACT GCG CGT 	12934.31
L2 	Tr-23 	#= 52	GAT CGA TAT TTA CAC CCA TCG TTG GCG TAT CGA GGA ATT CCA TAA GGC GTG G 	16058.32
M2 	Tr-24 	#= 40	AAA ACC GGT GCG GGT GCG GAA CGC CAG CGT ATG GAA GAG C 	12470.02
N2 	Tr-25 	#= 49	CGG ATA ACC TGG AAC GCA TGG TCA GTA TTC TGT CAT TTG TTG CGG TTC G 	15124.70
O2 	Tr-26 	#= 41	TCT GTT GCA GCT GCG TGA GAG CTT TAC CCC ACC GCA GGC CC 	12514.01
P2 	Tr-27 	#= 45	TCC GTG CCC AGG GTC TTC TGA AAG AAG CGG AAC ATG TCG AAA GTC 	13894.94
A3 	Tr-28 	#= 40	AGA GCG CCG AAA CCG TTC TGA CCC CGG ACG AAT GCC AAC T 	12244.89
B3 	Tr-29 	#= 47	TTT GGG CTA CCT GGA TAA AGG CAA GCG CAA ACG TAA AGA GAA AGC GG 	14643.45
C3 	Tr-30 	#= 41	GTT CGT TGC AGT GGG CGT ACA TGG CGA TTG CGC GCC TTG GT 	12711.12
D3 	Tr-31 	#= 46	GGC TTT ATG GAC TCT AAA CGT ACC GGC ATT GCA AGC TGG GGT GCA C 	14206.12
E3 	Tr-32 	#= 44	TGT GGG AGG GCT GGG AGG CGC TGC AAT CGA AAC TGG ACG GTT TC 	13749.80
F3 	Tr-33 	#= 44	TGC AGC GCG GAG GTG ATG CCC ATT GCG CCT TGG AAA TAC AGG TT 	13628.74
G3 	Tr-34 	#= 43	GGC TGC CGA AGA GAA CAC AGA TTT GGC CCA GTC GGC TGC ACG G 	13303.54
H3 	Tr-35 	#= 43	CTG CCA CAT TAA CGA GAC GTG CCG TAC GAC GTG GAT CAC CCA G 	13182.48
I3 	Tr-36 	#= 49	CCT TCG CTG GAA ATC GTA ATG CTT TTA CCC GAA TAT TTC GCG AGC TGT G 	15028.65
J3 	Tr-37 	#= 45	GGA TTG CGA ATG AAA CGG TAC GCA CCC TCC TGC ATC GCT TTT GAG 	13836.89
K3 	Tr-38 	#= 44	TCT GCA TGG CAC CGG CTT TAC GAA TGG CCT CGG CAG AAA CAT TC 	13492.67
L3 	Tr-39 	#= 49	GTA TCT TCA ATG GCC AAC AGT TCC GGA AAC TCT TGT GCC AGT TTC ACG G 	15022.65
M3 	Tr-40 	#= 42	CCC AGC TCT TCT GCG ACC TGA TGA CGG TAC GAC AGC GAG GTG 	12916.28
N3 	Tr-41 	#= 47	TGT GAA CCC ACC AGC CAC GCG ATT TAT CTT GAA TTG AAC CCA GTT TG 	14373.25
O3 	Tr-42 	#= 46	AGC AGA CCA ACG GTA CGA AAG GTC GTT GCT TCC AAA AGC AGA ACA C 	14179.16
P3 	Tr-43 	#= 41	CAT CCG CTG GGT CAT CCG GAC GCA TCC ACC ACT CCT GGT GA 	12483.00
A4 	Tr-44 	#= 47	ACT TGT CGC CGC TGC CGC CAG CCA TTT ACC AGA CTC TTT CTC ATC TG 	14228.12
B4 	Tr-45 	#= 43	ACA CGG CAA TGA CGT TGC TCA TCA TAG AGC CCA TAC GGA GGC G 	13246.53
C4 	Tr-46 	#= 46	GCC AGT TTA TCC TGC AGA TAG GCA TGA ATA TCT GCT TCG CGG TCG C 	14132.07
D4 	Tr-47 	#= 48	ACA TCT TTA CGT GGA TGT TTG CTA CGA ACC ACA AAG CGT TCG TTG TGC 	14748.48
E4 	Tr-48 	#= 50	CGA GTT CCG GTT GGT TCT TCA AGT GGT CAT ACA GGT ACA GAC CCG ATT CC 	15367.86
F4 	Tr-49 	#= 48	CAC GTT TAT CAA CAA CGC CTT TCT GAC CAA TGG AGA TCT GGT AGC CGC 	14687.45
G4 	Tr-50 	#= 42	GGC TCA GGC TCG CTT TAC GTG CCG GAC GAT TCT TAC GCT TGC 	12864.23
H4 	Tr-51 	#= 47	ATT CAG TGT AAT ATT GCC TTG TTT AAG GGT GAT GCG ACC ACT ACG CA 	14483.32
I4 	Tr-52 	#= 42	GGT TTC ACC TTT CGG CGG GTT AAT TTC CTC CGC CAG CAC CGC 	12784.18
J4 	Tr-53 	#= 42	TGA TTC CAC TGG TTC GCT GGT CAG CAG CAG CCA TTT CAG CGG 	12897.27
K4 	Tr-54 	#= 46	GCC AAC GAT GGG TGT AAA TAT CGA TCA CGC GCA GTG CCT GCG CAA G 	14209.13
L4 	Tr-55 	#= 46	TCC GCA CCC GCA CCG GTT TTC CAC GCC TTA TGG AAT TCC TCG ATA C 	13932.94
M4 	Tr-56 	#= 42	ACC ATG CGT TCC AGG TTA TCC GGC TCT TCC ATA CGC TGG CGT 	12808.21
N4 	Tr-57 	#= 48	CTC TCA CGC AGC TGC AAC AGA CGA ACC GCA ACA AAT GAC AGA ATA CTG 	14701.50
O4 	Tr-58 	#= 40	CAG AAG ACC CTG GGC ACG GAG GGC CTG CGG TGG GGT AAA G 	12502.02
P4 	Tr-59 	#= 45	CAG AAC GGT TTC GGC GCT CTG ACT TTC GAC ATG TTC CGC TTC TTT 	13735.80
A5 	Tr-60 	#= 44	TTG CCT TTA TCC AGG TAG CCC AAA AGT TGG CAT TCG TCC GGG GT 	13529.68
B5 	Tr-61 	#= 44	TGT ACG CCC ACT GCA ACG AAC CCG CTT TCT CTT TAC GTT TGC GC 	13345.56
C5 	Tr-62 	#= 46	CCG GTA CGT TTA GAG TCC ATA AAG CCA CCA AGG CGC GCA ATC GCC A 	14098.07
D5 	Tr-63 	#= 40	CGC CTC CCA GCC CTC CCA CAG TGC ACC CCA GCT TGC AAT G 	12043.73
E5 	Tr-64 	#= 63	GAT CTT AAT ACC CTG CGC CAT CAG ATC TTT TGC TGC CAG GAA ACC GTC CAG TTT CGA TTG CAG 	19283.36
F5 	Tr-F 	#= 32	TAT AGG ATC CGA TTA TGA CAT CCC GAC GAC GG 	9833.36
G5 	Tr-R 	#= 32	TAT AGT CGA CGA TCT TAA TAC CCT GCG CCA TC 	9719.28
H5 	T7 	#= 20	TAA TAC GAC TCA CTA TAG GG 	6125.01
I5 	T7t 	#= 19	GCT AGT TAT TGC TCA GCG G 	5834.79
J5 	M13F 	#= 24	CGC CAG GGT TTT CCC AGT CAC GAC 	7289.71
K5 	M13R 	#= 24	AGC GGA TAA CAA TTT CAC ACA GGA 	7378.82
L5 	Tr_G-F 	#= 42	CGA CGG GCC CGG GAT CCG ATG ATT ATG ACA TCC CGA CGA CGG 	12950.31
M5 	Tr_G-R 	#= 42	CCT CGC GAA TGC ATC TAG ATG ATC TTA ATA CCC TGC GCC ATC 	12769.22
N5 	InfA-BC01/2F 	#= 58	GGT GCT GAA GAA AGT TGT CGG TGT CTT TGT GTT AAC CTA gTC Agg CAg CAA AAg CAg g 	18056.59
O5 	unitail-oxford 	#= 27	TTA ACC TAg TCA ggC AgC AAA AgC Agg 	8326.42
P5 	InfA-BC01/2R 	#= 59	GGT GCT GAA GAA AGT TGT CGG TGT CTT TGT GTT AAC CTA gAA Agg gAg TAg AAA CAA gg 	18457.87
A6 	Runitail-oxford 	#= 28	TTA ACC TAg AAA ggg AgT AgA AAC AAg g 	8727.70
B6 	InfA-BC02/2F 	#= 58	GGT GCT GTC GAT TCC GTT TGT AGT CGT CTG TTT AAC CTA gTC Agg CAg CAA AAg CAg g 	17934.49
C6 	InfA-BC02/2R 	#= 59	GGT GCT GTC GAT TCC GTT TGT AGT CGT CTG TTT AAC CTA gAA Agg gAg TAg AAA CAA gg 	18335.77
D6 	petR1 	#= 24	TTA AGG ATC CCA TAT GGC TGC CGC 	7328.74
E6 	petF2 	#= 24	ATA TGT CGA CGG TAC CTG ATC CGG 	7368.77
F6 	PAMR3 	#= 30	TAC GGT ATC AGT CAT TTT AGG GAA GTC ACG 	9260.99
G6 	PAMF4 	#= 21	CTC CCT GCA GCC CCT TTT TAC 	6244.04
H6 	BP_199 	#= 25	CCC GGG GTA CCA CGG AGA GAT GGT G 	7773.01
