,where,Date,Sample Name,Nucleic Acid(ng/uL),A260/A280,A260/A230,A260,A280,Nucleic Acid Factor,Baseline Correction (nm),Baseline Absorbance,code,length,seq,monoisotopic_mass
0,C13,06.03.2023 12:26,F1-1 1,1603.146,1.714,1.304,48.58,28.351,33.0,340,0.659,Unnamedsequence_F1-0,#= 33,CTA GAG GGG AAT TGT TAT CCG CTC ACA ATT CCC,10088.51
1,D13,06.03.2023 12:27,F1-1 2,2565.612,1.993,1.412,77.746,39.006,33.0,340,-0.572,Unnamedsequence_F1-1,#= 79,GGG AAT TGT GAG CGG ATA ACA ATT CCC CTC TAG AAA TAA TTT TGT TTA ACT TTA AGA AGG AGA TAT ACC ATG CGT TGC A,24448.73
2,E13,06.03.2023 12:28,F1-1 3,3394.609,1.74,1.498,102.867,59.115,33.0,340,-0.525,Unnamedsequence_F1-2,#= 76,CCA CGT CAG CCA GCC TGT TCT TGC GGT TTG GCG AAT TGC CCG AGT GCA ACG CAT GGT ATA TCT CCT TCT TAA AGT T,23317.9
3,F13,06.03.2023 12:29,F1-1 4,1954.935,1.754,1.516,59.24,33.768,33.0,340,-0.928,Unnamedsequence_F1-3,#= 52,CCG CAA GAA CAG GCT GGC TGA CGT GGC TGG CGA TTC TTG CCG TCA CGG CGC C,16023.23
4,G13,06.03.2023 12:29,F1-1 5,2658.799,1.859,1.428,80.57,43.338,33.0,340,-0.37,Unnamedsequence_F1-4,#= 59,CGG GAG GAT CGT CGG CCC ATG CCG GCG AAG TCA CGG GCG CCG TGA CGG CAA GAA TCG CC,18274.67
5,H13,06.03.2023 12:30,F1-1 6,2690.067,1.703,1.34,81.517,47.857,33.0,340,-0.377,Unnamedsequence_F1-5,#= 54,CGG CAT GGG CCG ACG ATC CTC CCG CCA CCG TAT ACA AGT ATG ACT CCC GCC CGC,16434.51
6,I13,06.03.2023 12:37,F1-1 7,1962.341,1.711,1.537,59.465,34.749,33.0,340,-0.896,Unnamedsequence_F1-6,#= 75,TCG TTG TTT CCC CAC GCC GTG AAT CCG TTC TGG AAA ACG TCC TCC GGC GGG CGG GAG TCA TAC TTG TAT ACG GTG,23095.73
7,J13,06.03.2023 12:38,F1-1 8,2346.592,1.796,1.387,71.109,39.595,33.0,340,-0.676,Unnamedsequence_F1-7,#= 57,CGG ATT CAC GGC GTG GGG AAA CAA CGA CAA TGT GCT CGA CCA TCT GAC CGG ACG TTC,17588.28
8,K13,06.03.2023 12:39,F1-1 9,2291.352,1.794,1.503,69.435,38.711,33.0,340,-0.262,Unnamedsequence_F1-8,#= 55,CGC TGT TGC TGC TGC CGA CCT GGC AGG AAC GTC CGG TCA GAT GGT CGA GCA CAT T,16959.84
9,L13,06.03.2023 12:39,F1-1 10,2023.572,1.753,1.372,61.32,34.98,33.0,340,0.196,Unnamedsequence_F1-9,#= 66,GCC AGG TCG GCA GCA GCA ACA GCG CTT TCG TCT CCA CCA GCA GCA GCC GGC GCT ATA CCG AGG TCT,20246.94
10,M13,06.03.2023 12:40,F1-1 11,2094.228,1.702,1.577,63.461,37.284,33.0,340,-0.141,Unnamedsequence_F1-10,#= 65,GTT CGG CCT CGA CCG CTT CCT GCA TGC GAT GTT CGA GAT AGA CCT CGG TAT AGC GCC GGC TGC TG,19991.75
11,N13,06.03.2023 12:41,F1-1 12,2303.261,1.809,1.389,69.796,38.577,33.0,340,-0.4,Unnamedsequence_F1-11,#= 64,CAT GCA GGA AGC GGT CGA GGC CGA ACG CGC CGG CAG GGG CAC CGG CCA CTT CAT CGG CTA CAT C,19743.61
12,O13,06.03.2023 12:42,F1-1 13,2950.673,1.824,1.609,89.414,49.012,33.0,340,-0.258,Unnamedsequence_F1-12,#= 70,AGC TGG CGG CGC CGT AGA AAT TGT TGT CGG CGC GGA CTT CGT AGA TGT AGC CGA TGA AGT GGC CGG TGC C,21774.89
13,P13,06.03.2023 12:43,F1-1 14,2489.902,1.828,1.407,75.452,41.271,33.0,340,-0.111,Unnamedsequence_F1-13,#= 71,ACA ACA ATT TCT ACG GCG CCG CCA GCT CGT ACT TCG AAT ACG TCG ACA CTT ATG GCG ACA ATG CCG GCC GT,21743.93
14,A14,06.03.2023 12:44,F1-1 15,2355.382,1.818,1.531,71.375,39.258,33.0,340,-0.288,Unnamedsequence_F1-14,#= 57,CTG GTA GGT GGC CAG CGC GCC GGC GAG GAT ACG GCC GGC ATT GTC GCC ATA AGT GTC,17668.27
15,B14,06.03.2023 12:44,F1-1 16,2029.721,1.767,1.399,61.507,34.8,33.0,340,0.574,Unnamedsequence_F1-15,#= 54,CCG GCG CGC TGG CCA CCT ACC AGA GCG GTT ATC TGG CAC ACC GGC GCA TTC CGC,16506.54
16,C14,06.03.2023 12:45,F1-1 17,2512.409,1.863,1.563,76.134,40.868,33.0,340,-0.54,Unnamedsequence_F1-16,#= 60,TGA TAG ACC CGC GTT ACC CTG CGG ATG TTT TCG GGC GGA ATG CGC CGG TGT GCC AGA TAA,18563.87
17,D14,06.03.2023 12:46,F1-1 18,2854.895,1.883,1.314,86.512,45.937,33.0,340,-0.689,Unnamedsequence_F1-17,#= 72,ACA TCC GCA GGG TAA CGC GGG TCT ATC ACA ACG GCA TCA CCG GCG AGA CCA CGA CCA CGG AGT ATT CCA ACG,22135.19
18,E14,06.03.2023 12:47,F1-1 19,2390.224,1.712,1.72,72.431,42.305,33.0,340,-1.032,Unnamedsequence_F1-18,#= 63,GGA TTG GCG CGA GTC TGC TGG CTG ACG TAG CGA GCG TTG GAA TAC TCC GTG GTC GTG GTC TCG,19589.48
19,F14,06.03.2023 12:47,F1-1 20,1939.497,1.737,1.334,58.773,33.827,33.0,340,-0.802,Unnamedsequence_F1-19,#= 60,GTC AGC CAG CAG ACT CGC GCC AAT CCC AAC CCC TAC ACA TCG CGA AGG TCC GTA GCG TCG,18305.73
20,G14,06.03.2023 12:48,F1-1 21,2140.798,1.799,1.444,64.873,36.068,33.0,340,-0.667,Unnamedsequence_F1-20,#= 71,AAG CGC CAA TCA CCG GCG CCA TGC GCA CCA ATG TGC CGA CGA TCG ACG CTA CGG ACC TTC GCG ATG TGT AG,21819.96
21,H14,06.03.2023 12:49,F1-1 22,2056.493,1.83,1.571,62.318,34.05,33.0,340,-0.165,Unnamedsequence_F1-21,#= 49,GCA TGG CGC CGG TGA TTG GCG CTT GCA TGG CGC GGC AGG CCG AAA GCT C,15196.7
22,I14,06.03.2023 12:49,F1-1 23,2222.969,1.66,1.605,67.363,40.569,33.0,340,-0.225,Unnamedsequence_F1-22,#= 49,TTC GGA CCA GGC TGC CAT GGC CTC GGA GCT TTC GGC CTG CCG CGC CAT G,15018.58
23,J14,06.03.2023 13:26,F1-1 24,1663.637,1.812,1.255,50.413,27.828,33.0,340,0.496,Unnamedsequence_F1-23,#= 71,CGA GGC CAT GGC AGC CTG GTC CGA ACG CGC CGG CGA GGC GAT GGT TCT CGT GTA CTA CGA AAG CAT CGC GT,21963.01
24,K14,06.03.2023 13:27,F1-1 25,2707.059,1.887,1.365,82.032,43.463,33.0,340,-0.933,Unnamedsequence_F1-24,#= 71,GCT GTC ATA GCC GGA ATC CTG GCG TTC CAC TGC GAA CGA ATA CGC GAT GCT TTC GTA GTA CAC GAG AAC CA,21848.0
25,L14,06.03.2023 13:28,F1-1 26,2147.403,1.776,1.607,65.073,36.641,33.0,340,-0.219,Unnamedsequence_F1-25,#= 70,GGA ACG CCA GGA TTC CGG CTA TGA CAG CCT TGA TGG GGT GGG ATC GCG ATC GTT CTC GTT GGG CGA GGT G,21805.9
26,M14,06.03.2023 13:28,F1-1 27,2675.666,1.73,1.392,81.081,46.858,33.0,340,-0.149,Unnamedsequence_F1-26,#= 72,GCC GGG TCA TTT CCA GTT CCG CCG CTT CCA CGG CGG CCA TGT CGG ACA CCT CGC CCA ACG AGA ACG ATC GCG,22028.05
27,N14,06.03.2023 13:29,F1-1 28,2674.405,1.877,1.494,81.043,43.176,33.0,340,-0.253,Unnamedsequence_F1-27,#= 68,GCG GCG GAA CTG GAA ATG ACC CGG CAA GTC TTG CAC GCC GGG GCG CGG CAG GAC GAT GCC GAG CCG GG,21165.5
28,O14,06.03.2023 13:30,F1-1 29,2066.62,1.674,1.473,62.625,37.408,33.0,340,0.477,Unnamedsequence_F1-28,#= 48,CCA GTG CGC CGA CGC ACC GCT CAC GCC CGG CTC GGC ATC GTC CTG CCG,14589.3
29,P14,06.03.2023 13:31,F1-1 30,1244.525,1.794,1.587,37.713,21.026,33.0,340,0.306,Unnamedsequence_F1-29,#= 57,TGA GCG GTG CGT CGG CGC ACT GGG GGC AGC GGG CGC TGC AGG GCG CCC AGG CGG TGG,17832.32
30,A15,06.03.2023 13:34,F1-1 31,1863.775,1.689,1.413,56.478,33.436,33.0,340,0.731,Unnamedsequence_F1-30,#= 66,TGC GTC ATC AGG GCA ATG GCA TGA ACC AGC CGC TGC GCC GCC GCC ACC GCC TGG GCG CCC TGC AGC,20224.89
31,B15,06.03.2023 13:35,F1-1 32,2298.056,1.765,1.433,69.638,39.45,33.0,340,-0.226,Unnamedsequence_F1-31,#= 62,TGG TTC ATG CCA TTG CCC TGA TGA CGC AAT TCG GCC GGG CCG GTT CCA CCA ACA CGC CGC AG,18992.14
32,C15,06.03.2023 13:36,F1-1 33,2060.54,1.804,1.538,62.441,34.618,33.0,340,-0.142,Unnamedsequence_F1-32,#= 52,ACA CGG CCG CCG ACA ACG AGG CCG CTT CCT GCG GCG TGT TGG TGG AAC CGG C,16033.23
33,D15,06.03.2023 13:36,F1-1 34,1427.701,1.791,1.493,43.264,24.15,33.0,340,0.504,Unnamedsequence_F1-33,#= 60,GGC CTC GTT GTC GGC GGC CGT GTT CGG CTT GGG CGA GGC CAG CAG CGC CGT GGC CGA AAC,18583.82
34,E15,06.03.2023 13:37,F1-1 35,2524.303,1.792,1.375,76.494,42.691,33.0,340,-0.46,Unnamedsequence_F1-34,#= 68,AAA CCG CCG GCC CAG CGC GAA GAC CCG CGG AAA AAA CCG CTC ACG GTT TCG GCC ACG GCG CTG CTG GC,20893.35
35,F15,06.03.2023 13:37,F1-1 36,1854.144,1.777,1.774,56.186,31.623,33.0,340,0.599,Unnamedsequence_F1-35,#= 62,TCT TCG CGC TGG GCC GGC GGT TTC GGC GTG GCT GGC GGC GCG ATG GCG CTG GGA GGC GGC AT,19320.25
36,G15,06.03.2023 13:38,F1-1 37,1986.746,1.715,1.341,60.204,35.104,33.0,340,-1.155,Unnamedsequence_F1-36,#= 54,CAA CGA CAT CCC GGC GCC AAC GGC CGC GGC GAT GCC GCC TCC CAG CGC CAT CGC,16430.49
37,H15,06.03.2023 13:38,F1-1 38,1990.809,1.833,1.528,60.328,32.911,33.0,340,-1.004,Unnamedsequence_F1-37,#= 49,GCC GTT GGC GCC GGG ATG TCG TTG ACC GAT GAC GCG CCG GCC GGA CAG A,15181.69
38,I15,06.03.2023 14:22,F1-1 39,2474.763,1.698,1.612,74.993,44.174,33.0,340,-0.637,Unnamedsequence_F1-38,#= 68,TTC CAC CTG TCA ACT GCA GCG CGA TCT CGG CGC CGG CGG CGG CCT TCT GTC CGG CCG GCG CGT CAT CG,20822.23
39,J15,06.03.2023 14:23,F1-1 40,2119.579,1.695,1.628,64.23,37.884,33.0,340,-0.239,Unnamedsequence_F1-39,#= 67,GAG ATC GCG CTG CAG TTG ACA GGT GGA ACG GTC GAG CTG GCT TCT TCC ATC GCG TTG GCG CTG GCC G,20755.22
40,K15,06.03.2023 14:52,F1-1 41,2129.079,1.804,1.401,64.518,35.766,33.0,340,-0.457,Unnamedsequence_F1-40,#= 61,CCG GCC ACC TGC AAG CCG CTG GTC ACG CCG CGC GCC GCG GCC AGC GCC AAC GCG ATG GAA G,18718.93
41,L15,06.03.2023 14:52,F1-1 42,2627.134,1.813,1.558,79.61,43.92,33.0,340,-0.289,Unnamedsequence_F1-41,#= 85,ACC AGC GGC TTG CAG GTG GCC GGG GCG TCG GCC GGG GCG GCT GCC GGC GCA TTG GCC GCG GCG CTC AGT CCC ATG GAG ATT TAC G,26370.74
42,M15,06.03.2023 14:53,F1-1 43,1742.678,1.778,1.42,52.808,29.708,33.0,340,0.513,Unnamedsequence_F1-42,#= 39,CGT AAA TCT CCA TGG GAC TGA GCG CCG CGG CCA ATG CGC,11978.69
43,N15,06.03.2023 14:54,F1-1 44,1866.262,1.906,1.355,56.553,29.678,33.0,340,0.461,Unnamedsequence_F2-0,#= 29,CAC CAG GCC GTA AAT CTC CAT GGG ACT GA,8871.74
44,O15,06.03.2023 14:55,F1-1 45,2753.228,1.839,1.453,83.431,45.358,33.0,340,-0.669,Unnamedsequence_F2-1,#= 69,TCA GTC CCA TGG AGA TTT ACG GCC TGG TGC AGC AAT CGC ACT ATG CGG ATC AGC TGG ACA AGC TGG CGC,21302.63
45,P15,06.03.2023 14:56,F1-1 46,2603.997,1.655,1.481,78.909,47.673,33.0,340,-0.903,Unnamedsequence_F2-2,#= 69,GGC CAG CAA GGC GTC GCC CTC GTA ACC GTA TGC GCT CGA TTC CTG CGC CAG CTT GTC CAG CTG ATC CGC,21102.45
46,A16,06.03.2023 14:56,F1-1 47,1530.612,1.816,1.286,46.382,25.536,33.0,340,0.611,Unnamedsequence_F2-3,#= 52,ACG AGG GCG ACG CCT TGC TGG CCC AGC TGT ATC GCG ACA AGA CGG CCG CCG A,16026.25
47,B16,06.03.2023 14:57,F1-1 48,2426.488,1.786,1.463,73.53,41.171,33.0,340,-1.002,Unnamedsequence_F2-4,#= 70,GCC CCC ACC GTG CTC AGG ACG GCG GAG ACG CCG GCG ACG GCG CCC TCG GCG GCC GTC TTG TCG CGA TAC A,21517.69
48,C16,06.03.2023 14:57,F1-1 49,1331.606,1.741,1.594,40.352,23.177,33.0,340,0.51,Unnamedsequence_F2-5,#= 68,GCC GTC CTG AGC ACG GTG GGG GCG GCG GTG TCG ATC GCC GCG GCG GCC AGC GTG GTA GGG GCC CCG GT,21178.43
49,D16,06.03.2023 14:58,F1-1 50,2026.531,1.767,1.333,61.41,34.75,33.0,340,0.247,Unnamedsequence_F2-6,#= 59,TTG AGA GCC CCG GTC AGC AAG GAA GTG ACC ACC GCC ACC GGG GCC CCT ACC ACG CTG GC,18098.57
50,E16,06.03.2023 14:58,F1-1 51,2730.857,1.778,1.372,82.753,46.555,33.0,340,-0.106,Unnamedsequence_F2-7,#= 69,TCA CTT CCT TGC TGA CCG GGG CTC TCA ACG GCA TCC TGC GCG GCG TGC AGC AGC CCA TCA TCG AAA AGC,21119.49
51,F16,06.03.2023 14:59,F1-1 52,2019.75,1.752,1.536,61.205,34.94,33.0,340,0.117,Unnamedsequence_F2-8,#= 61,AGC TCG TCG ATC TTG CGA GCG TAA TCG TTG GCC AGC TTT TCG ATG ATG GGC TGC TGC ACG C,18810.01
52,G16,06.03.2023 15:00,F1-1 53,2621.256,1.926,1.352,79.432,41.25,33.0,340,0.168,Unnamedsequence_F2-9,#= 63,AAC GAT TAC GCT CGC AAG ATC GAC GAG CTG GGC GGG CCG CAA GCG TAC TTC GAG AAA AAC CTG,19484.5
53,H16,06.03.2023 15:00,F1-1 54,1953.993,1.712,1.599,59.212,34.583,33.0,340,-0.151,Unnamedsequence_F2-10,#= 67,AGG CCG TCC GAA TTG GCC AGT TGT TCG TGA CGC GCC TGC AGG TTT TTC TCG AAG TAC GCT TGC GGC C,20640.16
54,I16,06.03.2023 15:01,F1-1 55,2464.309,1.957,1.408,74.676,38.161,33.0,340,0.272,Unnamedsequence_F2-11,#= 63,CGA ACA ACT GGC CAA TTC GGA CGG CCT ACG GAA AAT GCT GGC CGA CCT GCA GGC CGG TTG GAA,19476.48
55,J16,06.03.2023 15:01,F1-1 56,2532.672,1.703,1.486,76.748,45.054,33.0,340,-0.168,Unnamedsequence_F2-12,#= 66,TTG GAA ATC TCT GTC GTC TGC ACC CCG ATC ACG CTG CTG GCG TTC CAA CCG GCC TGC AGG TCG GCC,20185.87
56,K16,06.03.2023 15:02,F1-1 57,2355.524,1.84,1.408,71.38,38.79,33.0,340,0.001,Unnamedsequence_F2-13,#= 67,GAT CGG GGT GCA GAC GAC AGA GAT TTC CAA GTC GGC GCT CGA ACT GGC CGC CAT TAC CGG CAA CGC G,20704.24
57,L16,06.03.2023 15:03,F1-1 58,2495.22,1.823,1.576,75.613,41.466,33.0,340,-0.095,Unnamedsequence_F2-14,#= 59,CGG TCC ACG AAC ACG TCG ACG GAT TTC AGG TTG TCC GCG TTG CCG GTA ATG GCG GCC AG,18220.64
58,M16,06.03.2023 15:04,F1-1 59,1890.157,1.747,1.609,57.277,32.789,33.0,340,0.141,Unnamedsequence_F2-15,#= 52,TGA AAT CCG TCG ACG TGT TCG TGG ACC GCT TCG TCC AGG GCG AGC GGG TGG C,16109.28
59,N16,06.03.2023 15:05,F1-1 60,1903.688,1.783,1.367,57.688,32.354,33.0,340,0.321,Unnamedsequence_F2-16,#= 53,CGG CGA CGT CGA GGA CCA CCG GCT GGC CGG CCA CCC GCT CGC CCT GGA CGA AG,16277.38
60,O16,06.03.2023 15:05,F1-1 61,1611.959,1.81,1.439,48.847,26.993,33.0,340,0.442,Unnamedsequence_F2-17,#= 54,GCC GGT GGT CCT CGA CGT CGC CGC CGG CGG CAT CGA TAT CGC CAG CCG CAA GGG,16627.6
61,P16,06.03.2023 15:06,F1-1 62,2459.952,1.781,1.556,74.544,41.86,33.0,340,-0.382,Unnamedsequence_F2-18,#= 64,CGG CCA GCG GCG TGA TGA ACG TCA GCG CCG GCC GCT CGC CCT TGC GGC TGG CGA TAT CGA TGC C,19708.55
62,A17,06.03.2023 15:08,F1-1 63,1816.495,1.879,1.329,55.045,29.291,33.0,340,0.505,Unnamedsequence_F2-19,#= 60,CTG ACG TTC ATC ACG CCG CTG GCC GCG CCA GGA GAA GAG CAG CGC CGG CGC ACG AAA ACG,18500.84
63,B17,06.03.2023 15:09,F1-1 64,1978.59,1.631,1.633,59.957,36.761,33.0,340,-1.076,Unnamedsequence_F2-20,#= 65,CTT GCC CAC GAT CTC GAC GAA TGT GGT GAA TTC GCT CTT GCC CGT TTT CGT GCG CCG GCG CTG CT,19908.69
64,C17,06.03.2023 15:09,F1-1 65,2374.765,1.813,1.379,71.963,39.7,33.0,340,-0.239,Unnamedsequence_F2-21,#= 73,TCA CCA CAT TCG TCG AGA TCG TGG GCA AGC AGG ACC GCT GGC GCA TCC GGG ACG GCG CGG CCG ACA CCA CCA T,22464.34
65,D17,06.03.2023 15:10,F1-1 66,1911.492,1.726,1.551,57.924,33.566,33.0,340,-0.13,Unnamedsequence_F2-22,#= 55,CGA CCA GTT GCG ACA CCA CCT TGG CCA GAT CGA TGG TGG TGT CGG CCG CGC CGT C,16905.79
66,E17,06.03.2023 15:10,F1-1 67,2385.94,1.877,1.43,72.301,38.523,33.0,340,0.184,Unnamedsequence_F2-23,#= 68,GGC CAA GGT GGT GTC GCA ACT GGT CGA CGC CAA TGG CGT GCT CAA GCA CAG CAT CAA ACT GGA TGT GA,21071.49
67,F17,06.03.2023 15:11,F1-1 68,2074.154,1.78,1.437,62.853,35.313,33.0,340,-0.602,Unnamedsequence_F2-24,#= 66,ATT GGC AAG CAC GAC GTC ATC GCC ATC TCC GCC GAT CAC ATC CAG TTT GAT GCT GTG CTT GAG CAC,20200.93
68,G17,06.03.2023 15:11,F1-1 69,2455.3,1.848,1.567,74.403,40.258,33.0,340,-0.397,Unnamedsequence_F2-25,#= 62,AGA TGG CGA TGA CGT CGT GCT TGC CAA TGC TTC GCG CAT CCA TTA TGA CGG CGG CGC GGG CA,19167.24
69,H17,06.03.2023 15:12,F1-1 70,2183.543,1.804,1.512,66.168,36.68,33.0,340,-0.814,Unnamedsequence_F2-26,#= 62,ATC CTG TCG ACC CAG GGC GGC ATA GCT GAC CGT GTT GGT GCC CGC GCC GCC GTC ATA ATG GA,19088.18
70,I17,06.03.2023 15:12,F1-1 71,2197.854,1.756,1.529,66.602,37.926,33.0,340,-0.673,Unnamedsequence_F2-27,#= 57,GCT ATG CCG CCC TGG GTC GAC AGG ATT CCA TTA CCG TGT CCG CCG ACG GGG AAC GTT,17538.2
71,J17,06.03.2023 15:13,F1-1 72,2405.846,1.759,1.532,72.904,41.446,33.0,340,-1.001,Unnamedsequence_F2-28,#= 65,GCG ATA CAC GTT GGC GTT GTT CAA CTG CTT GCG CAC GTT GAA ACG TTC CCC GTC GGC GGA CAC GG,20024.79
72,K17,06.03.2023 15:14,F1-1 73,2557.552,1.907,1.339,77.502,40.64,33.0,340,-0.677,Unnamedsequence_F2-29,#= 72,AGC AGT TGA ACA ACG CCA ACG TGT ATC GCG AAG GCG TGG CTA CCC AGA CAA CCG CCT ACG GCA AGC GCA CGG,22200.23
73,L17,06.03.2023 15:14,F1-1 74,2519.719,1.766,1.676,76.355,43.247,33.0,340,-0.482,Unnamedsequence_F2-30,#= 66,GCC CGA CAC GGG CCA GCT CGA CAT GGC GGT ATT GGA CAT TCT CCG TGC GCT TGC CGT AGG CGG TTG,20370.98
74,M17,06.03.2023 15:15,F1-1 75,2187.715,1.809,1.547,66.294,36.641,33.0,340,-0.406,Unnamedsequence_F2-31,#= 51,ATG TCG AGC TGG CCC GTG TCG GGC AAC TGG TGG AGG TCG ACA CGC TCG AGC,15814.1
75,N17,06.03.2023 15:15,F1-1 76,1965.27,1.703,1.438,59.554,34.97,33.0,340,-0.727,Unnamedsequence_F2-32,#= 55,GCC GGC CCC GCC GAT GAT GTG CTG CAC ATG CTC GAG CGT GTC GAC CTC CAC CAG T,16825.74
76,O17,06.03.2023 15:16,F1-1 77,2241.699,1.841,1.353,67.93,36.892,33.0,340,-0.24,Unnamedsequence_F2-33,#= 69,AGC ACA TCA TCG GCG GGG CCG GCA ACG ATT CGA TCA CCG GCA ATG CGC ACG ACA ACT TCC TAG CCG GCG,21211.57
77,P17,06.03.2023 15:16,F1-1 78,2530.427,1.687,1.56,76.68,45.463,33.0,340,-0.216,Unnamedsequence_F2-34,#= 57,GGC GCC GCC ATC CAG CCT GTC GTC GCC CGA CCC GCC GGC TAG GAA GTT GTC GTG CGC,17461.12
78,A18,06.03.2023 15:17,F1-1 79,2351.286,1.918,1.381,71.251,37.153,33.0,340,-0.432,Unnamedsequence_F2-35,#= 59,ACG ACA GGC TGG ATG GCG GCG CCG GCA ACG ACA CCC TGG TTG GCG GCG AGG GCC AAA AC,18307.7
79,B18,06.03.2023 15:17,F1-1 80,1935.602,1.76,1.451,58.655,33.334,33.0,340,0.429,Unnamedsequence_F2-36,#= 60,AGG AAT ACG TCG TCG CCG GCG CCG CCG ATG ACC GTG TTT TGG CCC TCG CCG CCA ACC AGG,18415.75
80,C18,06.03.2023 15:18,F1-1 81,1608.865,1.853,1.416,48.753,26.315,33.0,340,0.53,Unnamedsequence_F2-37,#= 56,CGG CGC CGG CGA CGA CGT ATT CCT GCA GGA CCT GGG GGT ATG GAG CAA CCA GCT CG,17333.07
81,D18,06.03.2023 15:18,F1-1 82,2110.416,1.698,1.446,63.952,37.673,33.0,340,-0.825,Unnamedsequence_F2-38,#= 54,TCA CGG TAT CGA CGC CCG CGC CGC CAT CGA GCT GGT TGC TCC ATA CCC CCA GGT,16456.51
82,E18,06.03.2023 15:19,F1-1 83,2389.149,1.876,1.427,72.398,38.599,33.0,340,-0.735,Unnamedsequence_F2-39,#= 52,CGG CGC GGG CGT CGA TAC CGT GAA GTA CAA CGT GCA CCA GCC TTC CGA GGA G,16065.28
83,F18,06.03.2023 15:20,F1-1 84,2670.574,1.752,1.616,80.926,46.184,33.0,340,-0.703,Unnamedsequence_F2-40,#= 59,GGA TGC CCG TGT CGC CCA TGC GTT CGA GGC GCT CCT CGG AAG GCT GGT GCA CGT TGT AC,18203.6
84,G18,06.03.2023 15:20,F1-1 85,2439.769,1.882,1.388,73.932,39.276,33.0,340,-0.778,Unnamedsequence_F2-41,#= 54,GAA CGC ATG GGC GAC ACG GGC ATC CAT GCC GAT CTT CAA AAG GGC ACG GTC GAG,16715.72
85,H18,06.03.2023 15:21,F1-1 86,2467.205,1.812,1.471,74.764,41.261,33.0,340,-0.804,Unnamedsequence_F2-42,#= 68,TGA CAT GGT CGA CGC TGA ACA GGT TCA GGG CCG GCC ACT TCT CGA CCG TGC CCT TTT GAA GAT CGG CA,20940.38
86,I18,06.03.2023 15:22,F1-1 87,2596.811,1.786,1.363,78.691,44.057,33.0,340,-0.857,Unnamedsequence_F2-43,#= 65,CCT GAA CCT GTT CAG CGT CGA CCA TGT CAA GAA TAT CGA GAA TCT GCA CGG CTC CCG CCT GAA CG,19914.77
87,J18,06.03.2023 15:22,F1-1 88,2362.323,1.712,1.592,71.586,41.825,33.0,340,-0.877,Unnamedsequence_F2-44,#= 67,GCC CCA GAG CTC GTT GTC CTG GTC GTC GCC GGC GAT GCG GTC GTT CAG GCG GGA GCC GTG CAG ATT C,20692.16
88,K18,06.03.2023 15:23,F1-1 89,1904.692,1.95,1.33,57.718,29.599,33.0,340,0.536,Unnamedsequence_F2-45,#= 53,ACG ACC AGG ACA ACG AGC TCT GGG GCC ACG ATG GCA ACG ACA CGA TAC GCG GC,16365.51
89,L18,06.03.2023 15:24,F1-1 90,2283.523,1.665,1.657,69.198,41.554,33.0,340,-0.366,Unnamedsequence_F2-46,#= 58,AGG CCG CCG CGC AGG ATG TCG TCG CCG CCC CGG CCG CGT ATC GTG TCG TTG CCA TCG T,17796.32
90,M18,06.03.2023 15:24,F1-1 91,2907.066,1.888,1.465,88.093,46.651,33.0,340,-0.803,Unnamedsequence_F2-47,#= 60,GAC GAC ATC CTG CGC GGC GGC CTG GGC CTG GAC ACG CTG TAT GGC GAG GAC GGC AAC GAC,18578.86
91,N18,06.03.2023 15:25,F1-1 92,2501.362,1.725,1.529,75.799,43.935,33.0,340,-0.521,Unnamedsequence_F2-48,#= 67,TCG ATG TCA TCG CTG ACG GTC TCG TCG TCC TGC AGG AAG ATG TCG TTG CCG TCC TCG CCA TAC AGC G,20569.12
92,O18,06.03.2023 15:26,F1-1 93,1593.197,1.999,1.341,48.279,24.147,33.0,340,0.181,Unnamedsequence_F2-49,#= 29,GAC GAC GAG ACC GTC AGC GAT GAC ATC GA,8945.79
93,P18,06.03.2023 15:26,F1-1 94,1223.217,1.704,1.539,37.067,21.749,33.0,340,0.285,Unnamedsequence_F3-0,#= 25,GCC GCC GTC GAT GTC ATC GCT GAC G,7634.91
94,A19,06.03.2023 15:43,F1-1 95,2061.067,1.781,1.434,62.457,35.062,33.0,340,-0.548,Unnamedsequence_F3-1,#= 52,CGT CAG CGA TGA CAT CGA CGG CGG CGC GGG GCT GGA CAC CGT CGA CTA CTC C,16017.23
95,B19,06.03.2023 15:44,F1-1 96,2264.383,1.758,1.482,68.618,39.034,33.0,340,-0.938,Unnamedsequence_F3-2,#= 58,GGC GCA ACG ATC CTG CCT GGA TGG ATC ATG GCG GAG TAG TCG ACG GTG TCC AGC CCC G,17941.46
96,C19,06.03.2023 15:44,F1-1 97,1868.737,1.833,1.519,56.628,30.894,33.0,340,-1.086,Unnamedsequence_F3-3,#= 56,GAT CCA TCC AGG CAG GAT CGT TGC GCC GCA TGA ATA CGG CTT CGG GAT CGA GGC GG,17347.09
97,D19,06.03.2023 15:45,F1-1 98,1926.719,1.67,1.395,58.385,34.963,33.0,340,-0.833,Unnamedsequence_F3-4,#= 62,GCG GAC GCC TTG CGC ACC CAT TCC CTG GAC AGG TCC GCC TCG ATC CCG AAG CCG TAT TCA TG,18928.09
98,E19,06.03.2023 15:46,F1-1 99,2507.035,1.938,1.501,75.971,39.206,33.0,340,0.095,Unnamedsequence_F3-5,#= 57,GGA ATG GGT GCG CAA GGC GTC CGC GCT GGG CGT GGA CTA TTA CGA TAA TGT CCG CAA,17715.34
99,F19,06.03.2023 15:46,F1-1 100,2859.695,1.828,1.409,86.657,47.404,33.0,340,0.154,Unnamedsequence_F3-6,#= 63,CCT TCA TGC TCG TAC CGA TGA CGT TTT CGA CAT TGC GGA CAT TAT CGT AAT AGT CCA CGC CCA,19243.34
100,G19,06.03.2023 15:47,F1-1 101,2633.893,1.915,1.352,79.815,41.673,33.0,340,-0.672,Unnamedsequence_F3-7,#= 63,GTC GAA AAC GTC ATC GGT ACG AGC ATG AAG GAT GTG CTC ATC GGC GAC GCG CAA GCC AAT ACC,19459.49
101,H19,06.03.2023 15:47,F1-1 102,2413.505,1.777,1.626,73.137,41.15,33.0,340,-0.623,Unnamedsequence_F3-8,#= 52,GTA TCG TCG CCG CCC TGG CCC ATC AGG GTA TTG GCT TGC GCG TCG CCG ATG A,15980.19
102,I19,06.03.2023 15:48,F1-1 103,2429.848,1.821,1.675,73.632,40.425,33.0,340,-0.497,Unnamedsequence_F3-9,#= 61,TGA TGG GCC AGG GCG GCG ACG ATA CCG TGC GCG GCG GCG ACG GCG ATG ATC TGC TGT TCG G,19001.1
103,J19,06.03.2023 15:48,F1-1 104,2667.952,1.705,1.471,80.847,47.431,33.0,340,-0.617,Unnamedsequence_F3-10,#= 72,GGT GTC GTT GCC GGC GTC GCC ATA CAG CAT GTC GTT GCC GTC GCC GCC GAA CAG CAG ATC ATC GCC GTC GCC,22090.07
104,K19,06.03.2023 15:49,F1-1 105,2561.59,1.788,1.499,77.624,43.414,33.0,340,-1.082,Unnamedsequence_F3-11,#= 56,GTA TGG CGA CGC CGG CAA CGA CAC CCT CTA CGG GGG GCT GGG CGA CGA TAC CCT TG,17293.05
105,L19,06.03.2023 15:49,F1-1 106,2137.619,1.567,1.371,64.776,41.346,33.0,340,-0.792,Unnamedsequence_F3-12,#= 66,CGC CTG CGT CTG GCC GAA CCA ATC GTT GCC CGC GCC GCC TTC AAG GGT ATC GTC GCC CAG CCC CCC,20061.78
106,M19,06.03.2023 15:50,F1-1 107,2522.136,1.841,1.608,76.428,41.506,33.0,340,-0.701,Unnamedsequence_F3-13,#= 60,CGA TTG GTT CGG CCA GAC GCA GGC GCG CGA GCA TGA CGT GCT GCG CGG CGG AGA TGG GGT,18720.93
107,N19,06.03.2023 15:50,F1-1 108,2278.814,1.678,1.414,69.055,41.152,33.0,340,-0.406,Unnamedsequence_F3-14,#= 56,TGC GCG CCG GTC TGG CTG TAA TCG ACG GTA TCC ACC CCA TCT CCG CCG CGC AGC AC,17074.9
108,O19,06.03.2023 15:51,F1-1 109,2386.309,1.774,1.575,72.312,40.753,33.0,340,-0.415,Unnamedsequence_F3-15,#= 67,TCG ATT ACA GCC AGA CCG GCG CGC ATG CCG GCA TTG CCG CGG GTC GCA TCG GGC TGG GCA TCC TGG C,20655.15
109,P19,06.03.2023 15:51,F1-1 110,1961.693,1.766,1.42,59.445,33.669,33.0,340,0.638,Unnamedsequence_F3-16,#= 68,TGC CGG CCT CGC CCA GCT TGT CGA CGC GGC CGG CGC CCA GGT CAG CCA GGA TGC CCA GCC CGA TGC GA,20859.28
110,A20,06.03.2023 15:52,F1-1 111,2784.813,1.831,1.507,84.388,46.09,33.0,340,-1.303,Unnamedsequence_F3-17,#= 67,CGA CAA GCT GGG CGA GGC CGG CAG CAG CGC CTA CGA TAC GGT TTC CGG TAT CGA GAA CGT GGT GGG C,20816.29
111,B20,06.03.2023 15:53,F1-1 112,1860.191,1.744,1.377,56.369,32.322,33.0,340,-0.694,Unnamedsequence_F3-18,#= 56,CGC CCG TGA TGC GGT CGG CCA GTT CCG TGC CCA CCA CGT TCT CGA TAC CGG AAA CC,17098.92
112,C20,06.03.2023 15:53,F1-1 113,1920.689,1.799,1.466,58.203,32.355,33.0,340,-0.262,Unnamedsequence_F3-19,#= 46,ACT GGC CGA CCG CAT CAC GGG CGA TGC GCA GGC CAA CGT GCT GCG C,14148.05
113,D20,06.03.2023 15:54,F1-1 114,2348.453,1.682,1.467,71.165,42.319,33.0,340,-0.59,Unnamedsequence_F3-20,#= 61,CCC TCG CCG CCC GCA AGC ACG TCG GCG CCA CCC GCG CCG CGC AGC ACG TTG GCC TGC GCA T,18556.81
114,E20,06.03.2023 15:54,F1-1 115,2312.107,1.852,1.611,70.064,37.83,33.0,340,0.483,Unnamedsequence_F3-21,#= 64,GAC GTG CTT GCG GGC GGC GAG GGC GAC GAT GTG CTG CTG GGC GGC GAC GGC GAC GAC CAG CTG T,19973.7
115,F20,06.03.2023 15:55,F1-1 116,1850.295,1.691,1.554,56.07,33.162,33.0,340,-0.602,Unnamedsequence_F3-22,#= 68,CGT CAC CGG CTT CGC CGT ACA AGC GAT CGC GTC CGG CGT CGC CCG ACA GCT GGT CGT CGC CGT CGC CG,20816.24
116,G20,06.03.2023 15:55,F1-1 117,2769.129,1.816,1.566,83.913,46.213,33.0,340,-0.442,Unnamedsequence_F3-23,#= 57,CGC TTG TAC GGC GAA GCC GGT GAC GAC TGG TTC TTC CAG GAT GCC GCC AAT GCC GGC,17563.21
117,H20,06.03.2023 15:56,F1-1 118,2464.274,1.818,1.556,74.675,41.073,33.0,340,-0.248,Unnamedsequence_F3-24,#= 64,ATC CAC GGT ATC GCG GCC GTC GCC GCC GTC GAG CAG ATT GCC GGC ATT GGC GGC ATC CTG GAA G,19731.58
118,I20,06.03.2023 15:56,F1-1 119,2005.289,1.845,1.446,60.766,32.93,33.0,340,-0.122,Unnamedsequence_F3-25,#= 70,GGC GAC GGC CGC GAT ACC GTG GAT TTC AGC GGC CCG GGC CGG GGC CTC GAC GCC GGC GCA AAG GGC GTA T,21701.81
119,J20,06.03.2023 15:57,F1-1 120,2864.936,1.767,1.442,86.816,49.139,33.0,340,-0.484,Unnamedsequence_F3-26,#= 58,ATC AGG CTG GCG AAC CCC TTG CCC AAG CTC AGG AAT ACG CCC TTT GCG CCG GCG TCG A,17765.36
120,K20,06.03.2023 15:58,F1-1 121,1866.667,1.85,1.415,56.566,30.581,33.0,340,-0.694,Unnamedsequence_F3-27,#= 56,TTG GGC AAG GGG TTC GCC AGC CTG ATG GAC GAA CCC GAA ACC AGC AAC GTG TTG CG,17340.11
121,L20,06.03.2023 15:59,F1-1 122,2735.839,1.722,1.653,82.904,48.153,33.0,340,-0.541,Unnamedsequence_F3-28,#= 68,GCA CGT CAT CAC GCG CGC TGC CCA CGG CGT TCT CGA TAT TGC GCA ACA CGT TGC TGG TTT CGG GTT CG,20874.31
122,M20,06.03.2023 15:59,F1-1 123,1901.862,1.845,1.365,57.632,31.231,33.0,340,0.662,Unnamedsequence_F3-29,#= 68,GGG CAG CGC GCG TGA TGA CGT GCT GAT CGG CGA CGC AGG CGC CAA CGT CCT CAA TGG CCT GGC GGG CA,21082.43
123,N20,06.03.2023 16:00,F1-1 124,2392.825,1.749,1.442,72.51,41.449,33.0,340,-0.488,Unnamedsequence_F3-30,#= 66,CAG CAG CAC ATC GTC GCC AGC GCC GCC GGA CAG CAC GTC GTT GCC CGC CAG GCC ATT GAG GAC GTT,20247.93
124,O20,06.03.2023 16:00,F1-1 125,2030.647,1.802,1.634,61.535,34.153,33.0,340,-0.789,Unnamedsequence_F3-31,#= 54,GGC GCT GGC GAC GAT GTG CTG CTG GGC GAC GAG GGC TCG GAC CTG CTC AGC GGC,16778.68
125,P20,06.03.2023 16:01,F1-1 126,2333.273,1.611,1.421,70.705,43.884,33.0,340,-0.731,Unnamedsequence_F3-32,#= 62,TCG CCC TGC CCG CCG AAC AGA TCG TCG TTG CCC GCA TCG CCG CTG AGC AGG TCC GAG CCC TC,18890.04
126,A21,06.03.2023 16:02,F1-1 127,2279.177,1.88,1.556,69.066,36.729,33.0,340,-0.747,Unnamedsequence_F3-33,#= 62,CGA TCT GTT CGG CGG GCA GGG CGA TGA TAC TTA TCT GTT CGG GGT CGG GTA CGG GCA CGA CA,19278.3
127,B21,06.03.2023 16:02,F1-1 128,1544.13,1.648,1.427,46.792,28.397,33.0,340,0.762,Unnamedsequence_F3-34,#= 52,TCA TGG CCG CCG CCC GAT TCG TAG ATC GTG TCG TGC CCG TAC CCG ACC CCG A,15854.12
