;where;Date;Sample Name;Nucleic Acid(ng/uL);A260/A280;A260/A230;A260;A280;Nucleic Acid Factor;Baseline Correction (nm);Baseline Absorbance;code;length;seq;monoisotopic_mass;pM/mkl;score;mkl;quantile;pmol;final conc, pmol/mkl;target_well
0;C13;06.03.2023 12:26;F1-1 1;1603,146;1,714;1,304;48,58;28,351;33;340;0,659;Unnamedsequence_F1-0;#= 33;CTA GAG GGG AAT TGT TAT CCG CTC ACA ATT CCC;10088,51;158,9081044;False;7;;1112,356731;2,73;1
1;D13;06.03.2023 12:27;F1-1 2;2565,612;1,993;1,412;77,746;39,006;33;340;-0,572;Unnamedsequence_F1-1;#= 79;GGG AAT TGT GAG CGG ATA ACA ATT CCC CTC TAG AAA TAA TTT TGT TTA ACT TTA AGA AGG AGA TAT ACC ATG CGT TGC A;24448,73;104,9384569;True;12;3;1259,261483;3,09;1
2;E13;06.03.2023 12:28;F1-1 3;3394,609;1,74;1,498;102,867;59,115;33;340;-0,525;Unnamedsequence_F1-2;#= 76;CCA CGT CAG CCA GCC TGT TCT TGC GGT TTG GCG AAT TGC CCG AGT GCA ACG CAT GGT ATA TCT CCT TCT TAA AGT T;23317,9;145,5795333;True;6;6;873,4771999;2,14;1
3;F13;06.03.2023 12:29;F1-1 4;1954,935;1,754;1,516;59,24;33,768;33;340;-0,928;Unnamedsequence_F1-3;#= 52;CCG CAA GAA CAG GCT GGC TGA CGT GGC TGG CGA TTC TTG CCG TCA CGG CGC C;16023,23;122,0062996;True;9;4;1098,056696;2,69;1
4;G13;06.03.2023 12:29;F1-1 5;2658,799;1,859;1,428;80,57;43,338;33;340;-0,37;Unnamedsequence_F1-4;#= 59;CGG GAG GAT CGT CGG CCC ATG CCG GCG AAG TCA CGG GCG CCG TGA CGG CAA GAA TCG CC;18274,67;145,4909446;True;6;6;872,9456674;2,14;1
5;H13;06.03.2023 12:30;F1-1 6;2690,067;1,703;1,34;81,517;47,857;33;340;-0,377;Unnamedsequence_F1-5;#= 54;CGG CAT GGG CCG ACG ATC CTC CCG CCA CCG TAT ACA AGT ATG ACT CCC GCC CGC;16434,51;163,6840405;False;6;;982,1042428;2,41;1
6;I13;06.03.2023 12:37;F1-1 7;1962,341;1,711;1,537;59,465;34,749;33;340;-0,896;Unnamedsequence_F1-6;#= 75;TCG TTG TTT CCC CAC GCC GTG AAT CCG TTC TGG AAA ACG TCC TCC GGC GGG CGG GAG TCA TAC TTG TAT ACG GTG;23095,73;84,96553259;True;18;2;1529,379587;3,75;1
7;J13;06.03.2023 12:38;F1-1 8;2346,592;1,796;1,387;71,109;39,595;33;340;-0,676;Unnamedsequence_F1-7;#= 57;CGG ATT CAC GGC GTG GGG AAA CAA CGA CAA TGT GCT CGA CCA TCT GAC CGG ACG TTC;17588,28;133,4179351;True;7;5;933,9255459;2,29;1
8;K13;06.03.2023 12:39;F1-1 9;2291,352;1,794;1,503;69,435;38,711;33;340;-0,262;Unnamedsequence_F1-8;#= 55;CGC TGT TGC TGC TGC CGA CCT GGC AGG AAC GTC CGG TCA GAT GGT CGA GCA CAT T;16959,84;135,1045765;True;7;5;945,7320352;2,32;1
9;L13;06.03.2023 12:39;F1-1 10;2023,572;1,753;1,372;61,32;34,98;33;340;0,196;Unnamedsequence_F1-9;#= 66;GCC AGG TCG GCA GCA GCA ACA GCG CTT TCG TCT CCA CCA GCA GCA GCC GGC GCT ATA CCG AGG TCT;20246,94;99,94458422;True;12;3;1199,335011;2,94;1
10;M13;06.03.2023 12:40;F1-1 11;2094,228;1,702;1,577;63,461;37,284;33;340;-0,141;Unnamedsequence_F1-10;#= 65;GTT CGG CCT CGA CCG CTT CCT GCA TGC GAT GTT CGA GAT AGA CCT CGG TAT AGC GCC GGC TGC TG;19991,75;104,7546113;True;12;3;1257,055335;3,08;1
11;N13;06.03.2023 12:41;F1-1 12;2303,261;1,809;1,389;69,796;38,577;33;340;-0,4;Unnamedsequence_F1-11;#= 64;CAT GCA GGA AGC GGT CGA GGC CGA ACG CGC CGG CAG GGG CAC CGG CCA CTT CAT CGG CTA CAT C;19743,61;116,6585543;True;9;4;1049,926989;2,57;1
12;O13;06.03.2023 12:42;F1-1 13;2950,673;1,824;1,609;89,414;49,012;33;340;-0,258;Unnamedsequence_F1-12;#= 70;AGC TGG CGG CGC CGT AGA AAT TGT TGT CGG CGC GGA CTT CGT AGA TGT AGC CGA TGA AGT GGC CGG TGC C;21774,89;135,5080554;True;7;5;948,5563877;2,32;1
13;P13;06.03.2023 12:43;F1-1 14;2489,902;1,828;1,407;75,452;41,271;33;340;-0,111;Unnamedsequence_F1-13;#= 71;ACA ACA ATT TCT ACG GCG CCG CCA GCT CGT ACT TCG AAT ACG TCG ACA CTT ATG GCG ACA ATG CCG GCC GT;21743,93;114,5102104;True;9;4;1030,591894;2,53;1
14;A14;06.03.2023 12:44;F1-1 15;2355,382;1,818;1,531;71,375;39,258;33;340;-0,288;Unnamedsequence_F1-14;#= 57;CTG GTA GGT GGC CAG CGC GCC GGC GAG GAT ACG GCC GGC ATT GTC GCC ATA AGT GTC;17668,27;133,3114108;True;7;5;933,1798756;2,29;1
15;B14;06.03.2023 12:44;F1-1 16;2029,721;1,767;1,399;61,507;34,8;33;340;0,574;Unnamedsequence_F1-15;#= 54;CCG GCG CGC TGG CCA CCT ACC AGA GCG GTT ATC TGG CAC ACC GGC GCA TTC CGC;16506,54;122,9646552;True;7;5;860,7525866;2,11;1
16;C14;06.03.2023 12:45;F1-1 17;2512,409;1,863;1,563;76,134;40,868;33;340;-0,54;Unnamedsequence_F1-16;#= 60;TGA TAG ACC CGC GTT ACC CTG CGG ATG TTT TCG GGC GGA ATG CGC CGG TGT GCC AGA TAA;18563,87;135,3386444;True;7;5;947,3705106;2,32;1
17;D14;06.03.2023 12:46;F1-1 18;2854,895;1,883;1,314;86,512;45,937;33;340;-0,689;Unnamedsequence_F1-17;#= 72;ACA TCC GCA GGG TAA CGC GGG TCT ATC ACA ACG GCA TCA CCG GCG AGA CCA CGA CCA CGG AGT ATT CCA ACG;22135,19;128,9754007;True;7;5;902,827805;2,21;1
18;E14;06.03.2023 12:47;F1-1 19;2390,224;1,712;1,72;72,431;42,305;33;340;-1,032;Unnamedsequence_F1-18;#= 63;GGA TTG GCG CGA GTC TGC TGG CTG ACG TAG CGA GCG TTG GAA TAC TCC GTG GTC GTG GTC TCG;19589,48;122,0156941;True;9;4;1098,141247;2,69;1
19;F14;06.03.2023 12:47;F1-1 20;1939,497;1,737;1,334;58,773;33,827;33;340;-0,802;Unnamedsequence_F1-19;#= 60;GTC AGC CAG CAG ACT CGC GCC AAT CCC AAC CCC TAC ACA TCG CGA AGG TCC GTA GCG TCG;18305,73;105,950268;True;12;3;1271,403216;3,12;1
20;G14;06.03.2023 12:48;F1-1 21;2140,798;1,799;1,444;64,873;36,068;33;340;-0,667;Unnamedsequence_F1-20;#= 71;AAG CGC CAA TCA CCG GCG CCA TGC GCA CCA ATG TGC CGA CGA TCG ACG CTA CGG ACC TTC GCG ATG TGT AG;21819,96;98,11191221;True;12;3;1177,342947;2,89;1
21;H14;06.03.2023 12:49;F1-1 22;2056,493;1,83;1,571;62,318;34,05;33;340;-0,165;Unnamedsequence_F1-21;#= 49;GCA TGG CGC CGG TGA TTG GCG CTT GCA TGG CGC GGC AGG CCG AAA GCT C;15196,7;135,3249719;True;7;5;947,2748031;2,32;1
22;I14;06.03.2023 12:49;F1-1 23;2222,969;1,66;1,605;67,363;40,569;33;340;-0,225;Unnamedsequence_F1-22;#= 49;TTC GGA CCA GGC TGC CAT GGC CTC GGA GCT TTC GGC CTG CCG CGC CAT G;15018,58;148,0145926;True;5;7;740,072963;1,81;1
23;J14;06.03.2023 13:26;F1-1 24;1663,637;1,812;1,255;50,413;27,828;33;340;0,496;Unnamedsequence_F1-23;#= 71;CGA GGC CAT GGC AGC CTG GTC CGA ACG CGC CGG CGA GGC GAT GGT TCT CGT GTA CTA CGA AAG CAT CGC GT;21963,01;75,74722226;False;14;;1060,461112;2,6;1
24;K14;06.03.2023 13:27;F1-1 25;2707,059;1,887;1,365;82,032;43,463;33;340;-0,933;Unnamedsequence_F1-24;#= 71;GCT GTC ATA GCC GGA ATC CTG GCG TTC CAC TGC GAA CGA ATA CGC GAT GCT TTC GTA GTA CAC GAG AAC CA;21848;123,9042018;True;7;5;867,3294123;2,13;1
25;L14;06.03.2023 13:28;F1-1 26;2147,403;1,776;1,607;65,073;36,641;33;340;-0,219;Unnamedsequence_F1-25;#= 70;GGA ACG CCA GGA TTC CGG CTA TGA CAG CCT TGA TGG GGT GGG ATC GCG ATC GTT CTC GTT GGG CGA GGT G;21805,9;98,47807245;True;12;3;1181,736869;2,9;1
26;M14;06.03.2023 13:28;F1-1 27;2675,666;1,73;1,392;81,081;46,858;33;340;-0,149;Unnamedsequence_F1-26;#= 72;GCC GGG TCA TTT CCA GTT CCG CCG CTT CCA CGG CGG CCA TGT CGG ACA CCT CGC CCA ACG AGA ACG ATC GCG;22028,05;121,4663123;True;9;4;1093,19681;2,68;1
27;N14;06.03.2023 13:29;F1-1 28;2674,405;1,877;1,494;81,043;43,176;33;340;-0,253;Unnamedsequence_F1-27;#= 68;GCG GCG GAA CTG GAA ATG ACC CGG CAA GTC TTG CAC GCC GGG GCG CGG CAG GAC GAT GCC GAG CCG GG;21165,5;126,3568071;True;7;5;884,4976495;2,17;1
28;O14;06.03.2023 13:30;F1-1 29;2066,62;1,674;1,473;62,625;37,408;33;340;0,477;Unnamedsequence_F1-28;#= 48;CCA GTG CGC CGA CGC ACC GCT CAC GCC CGG CTC GGC ATC GTC CTG CCG;14589,3;141,6531293;True;7;5;991,5719054;2,43;1
29;P14;06.03.2023 13:31;F1-1 30;1244,525;1,794;1,587;37,713;21,026;33;340;0,306;Unnamedsequence_F1-29;#= 57;TGA GCG GTG CGT CGG CGC ACT GGG GGC AGC GGG CGC TGC AGG GCG CCC AGG CGG TGG;17832,32;69,79041426;False;15;;1046,856214;2,57;1
30;A15;06.03.2023 13:34;F1-1 31;1863,775;1,689;1,413;56,478;33,436;33;340;0,731;Unnamedsequence_F1-30;#= 66;TGC GTC ATC AGG GCA ATG GCA TGA ACC AGC CGC TGC GCC GCC GCC ACC GCC TGG GCG CCC TGC AGC;20224,89;92,15254076;True;18;2;1658,745734;4,07;1
31;B15;06.03.2023 13:35;F1-1 32;2298,056;1,765;1,433;69,638;39,45;33;340;-0,226;Unnamedsequence_F1-31;#= 62;TGG TTC ATG CCA TTG CCC TGA TGA CGC AAT TCG GCC GGG CCG GTT CCA CCA ACA CGC CGC AG;18992,14;121,0003717;True;9;4;1089,003346;2,67;1
32;C15;06.03.2023 13:36;F1-1 33;2060,54;1,804;1,538;62,441;34,618;33;340;-0,142;Unnamedsequence_F1-32;#= 52;ACA CGG CCG CCG ACA ACG AGG CCG CTT CCT GCG GCG TGT TGG TGG AAC CGG C;16033,23;128,5168366;True;7;5;899,6178562;2,2;1
33;D15;06.03.2023 13:36;F1-1 34;1427,701;1,791;1,493;43,264;24,15;33;340;0,504;Unnamedsequence_F1-33;#= 60;GGC CTC GTT GTC GGC GGC CGT GTT CGG CTT GGG CGA GGC CAG CAG CGC CGT GGC CGA AAC;18583,82;76,82494772;False;14;;1075,549268;2,64;1
34;E15;06.03.2023 13:37;F1-1 35;2524,303;1,792;1,375;76,494;42,691;33;340;-0,46;Unnamedsequence_F1-34;#= 68;AAA CCG CCG GCC CAG CGC GAA GAC CCG CGG AAA AAA CCG CTC ACG GTT TCG GCC ACG GCG CTG CTG GC;20893,35;120,8184901;True;9;4;1087,366411;2,67;1
35;F15;06.03.2023 13:37;F1-1 36;1854,144;1,777;1,774;56,186;31,623;33;340;0,599;Unnamedsequence_F1-35;#= 62;TCT TCG CGC TGG GCC GGC GGT TTC GGC GTG GCT GGC GGC GCG ATG GCG CTG GGA GGC GGC AT;19320,25;95,9689445;True;12;3;1151,627334;2,82;1
36;G15;06.03.2023 13:38;F1-1 37;1986,746;1,715;1,341;60,204;35,104;33;340;-1,155;Unnamedsequence_F1-36;#= 54;CAA CGA CAT CCC GGC GCC AAC GGC CGC GGC GAT GCC GCC TCC CAG CGC CAT CGC;16430,49;120,9182441;True;9;4;1088,264197;2,67;1
37;H15;06.03.2023 13:38;F1-1 38;1990,809;1,833;1,528;60,328;32,911;33;340;-1,004;Unnamedsequence_F1-37;#= 49;GCC GTT GGC GCC GGG ATG TCG TTG ACC GAT GAC GCG CCG GCC GGA CAG A;15181,69;131,1322389;True;7;5;917,9256723;2,25;1
38;I15;06.03.2023 14:22;F1-1 39;2474,763;1,698;1,612;74,993;44,174;33;340;-0,637;Unnamedsequence_F1-38;#= 68;TTC CAC CTG TCA ACT GCA GCG CGA TCT CGG CGC CGG CGG CGG CCT TCT GTC CGG CCG GCG CGT CAT CG;20822,23;118,8519673;True;9;4;1069,667706;2,62;1
39;J15;06.03.2023 14:23;F1-1 40;2119,579;1,695;1,628;64,23;37,884;33;340;-0,239;Unnamedsequence_F1-39;#= 67;GAG ATC GCG CTG CAG TTG ACA GGT GGA ACG GTC GAG CTG GCT TCT TCC ATC GCG TTG GCG CTG GCC G;20755,22;102,1226949;True;12;3;1225,472339;3;1
40;K15;06.03.2023 14:52;F1-1 41;2129,079;1,804;1,401;64,518;35,766;33;340;-0,457;Unnamedsequence_F1-40;#= 61;CCG GCC ACC TGC AAG CCG CTG GTC ACG CCG CGC GCC GCG GCC AGC GCC AAC GCG ATG GAA G;18718,93;113,7393537;True;12;3;1364,872244;3,35;1
41;L15;06.03.2023 14:52;F1-1 42;2627,134;1,813;1,558;79,61;43,92;33;340;-0,289;Unnamedsequence_F1-41;#= 85;ACC AGC GGC TTG CAG GTG GCC GGG GCG TCG GCC GGG GCG GCT GCC GGC GCA TTG GCC GCG GCG CTC AGT CCC ATG GAG ATT TAC G;26370,74;99,62306708;True;12;3;1195,476805;2,93;1
42;M15;06.03.2023 14:53;F1-1 43;1742,678;1,778;1,42;52,808;29,708;33;340;0,513;Unnamedsequence_F1-42;#= 39;CGT AAA TCT CCA TGG GAC TGA GCG CCG CGG CCA ATG CGC;11978,69;145,4815176;True;7;5;1018,370623;2,5;1
