128,C21,06.03.2023 16:03,F1-1 129,2569.449,1.877,1.422,77.862,41.473,33.0,340,-1.238,Unnamedsequence_F3-35,#= 54,ATC TAC GAA TCG GGC GGC GGC CAT GAC ACC ATC CGC ATC AAC GCG GGG GCG GAC,16652.66
129,D21,06.03.2023 16:03,F1-1 130,2270.427,1.737,1.538,68.801,39.608,33.0,340,-0.802,Unnamedsequence_F3-36,#= 51,CGT TGC CCT GGC GCG CGA ACC ACA GCT GGT CCG CCC CCG CGT TGA TGC GGA,15630.97
130,E21,06.03.2023 16:04,F1-1 131,2983.811,1.784,1.44,90.419,50.691,33.0,340,-0.519,Unnamedsequence_F3-37,#= 65,GTG GTT CGC GCG CCA GGG CAA CGA CCT GGA GAT CCG CAT TCT CGG CAC CGA CGA TGC ACT TAC CG,19988.77
131,F21,06.03.2023 16:04,F1-1 132,2036.127,1.826,1.492,61.701,33.794,33.0,340,-0.516,Unnamedsequence_F3-38,#= 69,GAT TTC CAC CCG GTG ATC GGC GTC GCG ATA CCA GTC GTG CAC GGT AAG TGC ATC GTC GGT GCC GAG AAT,21309.61
132,G21,06.03.2023 16:05,F1-1 133,2694.515,1.973,1.339,81.652,41.384,33.0,340,-0.063,Unnamedsequence_F3-39,#= 69,GCG ACG CCG ATC ACC GGG TGG AAA TCA TCC ATG CCG CCA ACC AGG CGG TAG ACC AGG CAG GCA TCG AAA,21293.64
133,H21,06.03.2023 16:05,F1-1 134,2960.614,1.601,1.51,89.716,56.023,33.0,340,-0.314,Unnamedsequence_F3-40,#= 56,CGG ATA CTG CGC CAT TGC CTC GAC CAG CTT TTC GAT GCC TGC CTG GTC TAC CGC CT,17045.88
134,I21,06.03.2023 16:06,F1-1 135,2065.403,1.736,1.576,62.588,36.047,33.0,340,-0.243,Unnamedsequence_F3-41,#= 50,CTG GTC GAG GCA ATG GCG CAG TAT CCG GAC CCC GGC GCG GCG GCG GCT GC,15471.86
135,J21,06.03.2023 16:06,F1-1 136,1571.928,1.718,1.547,47.634,27.719,33.0,340,0.468,Unnamedsequence_F3-42,#= 60,CTG CAT CAG CGT GTC CGG CAC GCG CGC CGC CGG CGG GGC AGC CGC CGC CGC GCC GGG GTC,18460.71
136,K21,06.03.2023 16:07,F1-1 137,2290.044,1.759,1.265,69.395,39.461,33.0,340,-0.426,Unnamedsequence_F3-43,#= 72,CGC GTG CCG GAC ACG CTG ATG CAG TCC CTG GCT GTC AAC TGG CGC CAC CAC CAC CAC CAC CAC TGA GGA TCC,21966.03
137,L21,06.03.2023 16:08,F1-1 138,1447.131,1.736,1.834,43.852,25.258,33.0,340,0.445,Unnamedsequence_F3-44,#= 35,GGA TCC TCA GTG GTG GTG GTG GTG GTG GCG CCA GT,10946.99
138,M21,06.03.2023 16:08,F1-1 139,1983.179,1.956,1.5,60.096,30.718,33.0,340,-0.793,Unnamedsequence_F1-F_(pTZ/F),#= 39,CGA CGG GCC CGG GAT CCG ATG GGA ATT GTG AGC GGA TAA,12162.81
139,N21,06.03.2023 16:09,F1-1 140,1853.01,1.832,1.427,56.152,30.643,33.0,340,-0.386,Unnamedsequence_F1-R_(pTZ/F),#= 40,CCT CGC GAA TGC ATC TAG ATC GTA AAT CTC CAT GGG ACT G,12255.9
140,O21,06.03.2023 16:09,F1-1 141,1795.824,1.818,1.456,54.419,29.936,33.0,340,-0.319,Unnamedsequence_F2-F_(pTZ/F),#= 40,CGA CGG GCC CGG GAT CCG ATT CAG TCC CAT GGA GAT TTA C,12297.9
141,P21,06.03.2023 16:10,F1-1 142,1887.404,1.802,1.459,57.194,31.744,33.0,340,0.26,Unnamedsequence_F2-R_(pTZ/F),#= 37,CCT CGC GAA TGC ATC TAG ATT CGA TGT CAT CGC TGA C,11300.28
142,A22,06.03.2023 16:10,F1-1 143,1637.783,1.791,1.445,49.63,27.707,33.0,340,0.638,Unnamedsequence_F3-F_(pTZ/F),#= 37,CGA CGG GCC CGG GAT CCG ATC GTC AGC GAT GAC ATC G,11401.32
143,B22,06.03.2023 16:11,F1-1 144,1961.444,1.806,1.597,59.438,32.919,33.0,340,0.796,Unnamedsequence_F3-R_(pTZ/F),#= 37,CCT CGC GAA TGC ATC TAG ATG GAT CCT CAG TGG TGG T,11396.32
